basepk,hid,speechdate,pid,opid,speakeroldname,speakerposition,maintopic,subtopic,subsubtopic,speechtext,speakerparty,speakerriding,speakername,speakerurl
4211364,ca.proc.d.2002-03-22.1987.115,2002-03-22,33fc6fb3-2ed8-4500-8aa0-30fe0fc13f01,285,"Mr. Greg Thompson (New Brunswick Southwest, PC/DR)",,Oral Question Period,Softwood Lumber,,"Mr. Speaker, aside from the government's botched efforts to secure a softwood lumber agreement we have yet another crisis in the lumber industry. I am referring to the government's refusal to approve the wood preservative CDA. Without this approval we will see our pressure treated lumber mills out of business.
We have had vague promises in reference to a conclusion to this issue, in other words approval of the chemical CDA, but that will not cut it. We cannot live on vague promises. When will that chemical preservative be approved by the government?",Progressive Conservative,New Brunswick Southwest,Greg Thompson,http://www.parl.gc.ca/parlinfo/Files/Parliamentarian.aspx?Item=33fc6fb3-2ed8-4500-8aa0-30fe0fc13f01&Language=E&Section=ALL
4211365,ca.proc.d.2002-03-22.1987.116,2002-03-22,b4f873bb-c866-426d-a0a9-2181f41cc46d,4303,"Mr. Jeannot Castonguay (Parliamentary Secretary to the Minister of Health, Lib.)",,Oral Question Period,Softwood Lumber,,"Mr. Speaker, I thank the hon. member for his question. In spite of his aggressive tone, he was kind enough to inform me that he would ask this question. This allowed me to get the necessary information.
The Pest Management Regulatory Agency also obtained information from the American agency EPA to speed up the certification process of the chemical preservative CDA. I am sure that we will have a positive reply for the hon. member in the near future.",Liberal,Madawaska--Restigouche,Jeannot Castonguay,http://www.parl.gc.ca/parlinfo/Files/Parliamentarian.aspx?Item=b4f873bb-c866-426d-a0a9-2181f41cc46d&Language=E&Section=ALL
4211366,ca.proc.d.2002-03-22.1987.117,2002-03-22,50a1dd6f-d8ba-4a22-969a-42cbf7c1d556,47,"Ms. Bonnie Brown (Oakville, Lib.)",,Oral Question Period,International Aid,,"Mr. Speaker, we are all aware of the international conference now being held in Mexico. Will the Minister for International Cooperation inform the House what steps the Government of Canada is taking to ensure that our commitments toward international development are met?",Liberal,Oakville,Bonnie Brown,http://www.parl.gc.ca/parlinfo/Files/Parliamentarian.aspx?Item=50a1dd6f-d8ba-4a22-969a-42cbf7c1d556&Language=E&Section=ALL
4211367,ca.proc.d.2002-03-22.1987.118,2002-03-22,3452c34f-d742-4572-b8c5-e2bbcb51a3d5,1435,"Hon. Susan Whelan (Minister for International Cooperation, Lib.)",,Oral Question Period,International Aid,,"Mr. Speaker, I just returned from the UN financing for development conference in Monterrey. I want to assure Canadians that the government will continue to fulfill its commitments on international aid.
The Prime Minister announced yesterday that Canada's aid budget will continue to increase in the coming years by 8% or better per year. Obviously this is great news and further proof that eliminating poverty will continue to be a high priority of the government.",Liberal,Essex,Susan Whelan,
4211368,ca.proc.d.2002-03-22.1987.119,2002-03-22,a52ac646-bd34-440f-b534-2474625065e9,175,"Mr. James Lunney (Nanaimo--Alberni, Canadian Alliance)",,Oral Question Period,Health,,"Mr. Speaker, the parliamentary secretary missed the point. There is a $100 million lawsuit involving Health Canada in the untimely death of 15 year old Vanessa Young. There are thousands of suspected deaths every year in Canada. For every reported death the FDA estimates 10 that go unreported.
When will the minister drop the double standard and require mandatory reporting of adverse reactions? Lives are at stake.",Canadian Alliance,Nanaimo--Alberni,James Lunney,http://www.parl.gc.ca/parlinfo/Files/Parliamentarian.aspx?Item=a52ac646-bd34-440f-b534-2474625065e9&Language=E&Section=ALL
4211369,ca.proc.d.2002-03-22.1987.120,2002-03-22,b4f873bb-c866-426d-a0a9-2181f41cc46d,4303,"Mr. Jeannot Castonguay (Madawaska--Restigouche, Lib.)",,Oral Question Period,Health,,"Mr. Speaker, earlier this week, the Minister of Health gave a response in this House indicating that steps have already been taken to improve the method of reporting adverse drug reactions and particularly to ensure that more would be done than just reporting them. Health workers need to have access to information in order to apply that information to their clinical practice, and this will really respond to the needs raised by the hon. member across the way.",Liberal,Madawaska--Restigouche,Jeannot Castonguay,http://www.parl.gc.ca/parlinfo/Files/Parliamentarian.aspx?Item=b4f873bb-c866-426d-a0a9-2181f41cc46d&Language=E&Section=ALL
4211370,ca.proc.d.2002-03-22.1987.121,2002-03-22,,,,,Oral Question Period,Presence in Gallery,,"I draw the attention of hon. members to the presence in the gallery of 12 boys and girls, the Children's Miracle Network 2002 Champions from across the country.
These youngsters have overcome life threatening illnesses or injuries and have been chosen to represent the two million children who are treated annually by the Children's Miracle Network hospitals and foundations across Canada.
These remarkable young people are true champions who have overcome major obstacles to be with us today.
I would invite everyone to join them at the reception that will follow in Room 216-N.",,,The Speaker,
4211371,ca.proc.d.2002-03-22.1987.122,2002-03-22,,,,intervention,Oral Question Period,Presence in Gallery,,"Hear, hear.",,,Some hon. members,
4211372,ca.proc.d.2002-03-22.1987.123,2002-03-22,,,,,Oral Question Period,Presence in Gallery,,"I also draw the attention of hon. members to the presence in the gallery of the hon. Steve Ashton, Minister of Highways and Government Services for the province of Manitoba.",,,The Speaker,
4211373,ca.proc.d.2002-03-22.1987.124,2002-03-22,,,,intervention,Oral Question Period,Presence in Gallery,,"Hear, hear.",,,Some hon. members,
4211374,ca.proc.d.2002-03-22.1987.125,2002-03-22,,,,,Oral Question Period,Privilege,,"I am now prepared to rule on the question of privilege raised by the hon. member for Ottawa—Vanier on March 18, 2002, concerning the selection of votable items by the Standing Committee on Procedure and House Affairs.
I thank the hon. member for Ottawa--Vanier for drawing this matter to the attention of the Chair, as well as the hon. member for Yorkton--Melville and the hon. government House leader for their contribution on this question.
The hon. member for Ottawa—Vanier in raising the matter argued that the bill he sponsored, Bill C-407, an act to amend the Canada Health Act (linguistic duality), should have been selected as votable since it met all the criteria (approved by the House) in order to be considered eligible for “votable” status.
The member expressed himself very clearly and conveyed a deep sense of dissatisfaction and frustration with the way that private members’ business currently operates, especially with the fact that he was not able to obtain an explanation as to why his bill was not selected as a votable item.
As all hon. members know, the Standing Committee on Procedure and House Affairs has the mandate to select votable items from the items placed on the order of precedence as the result of a draw. The committee must determine, in accordance with a set of criteria that it has adopted, the selection to be made.
I refer the House to a decision by Mr. Speaker Fraser on December 4, 1986 ( House of Commons Debates , p. 1759) with respect to the responsibility that the House has delegated to the procedure and house affairs committee relating to the selection of votable items.
He said:

—its decision in regard to the selection of items of business which must come to a vote cannot be challenged. When embodied in a report which is presented to the House, that report is deemed adopted by the House. The Committee, therefore, plays a very important role in safeguarding the rights of private members.
—It is not for the Chair to dictate to the Committee how it should take care of its responsibilities.

I want to emphasize that the Chair takes this matter very seriously even though, after careful examination, the case raised by the hon. member cannot be considered a question of privilege. It is a procedural matter which requires a procedural solution.
As hon. members know, several attempts at finding such a solution have been made and continue to be made. To begin with, a number of recommendations were made by members, in particular during the procedure debates in the House on March 21, 2001 and May 1, 2001.
These suggestions were taken into consideration by the Special Committee on the Modernization and Improvement of the Procedures of the House of Commons and there is a reference to the issue in the committee’s report as adopted by the House on October 4, 2001.
While acknowledging the dissatisfaction with private members’ business as it currently operates and recognizing the need for changes, the special committee could not find consensus on the nature of specific reforms.
Following the report of the special committee the Standing Committee on Procedure and House Affairs further considered the question of improving procedures for the consideration of private members' business and concluded in its report presented to the House on December 14, 2001, that:

--changes to the Standing Orders for the consideration of Private Members' Business, including a workable proposal allowing for all items to be votable, cannot be achieved at this time.

This leaves the door open for the committee to consider the matter once again in the future.
The hon. government House leader in his response to the hon. member for Ottawa—Vanier reflected the opinion of many members when he said that “this subject matter has expressed itself in frustration on all sides of the House of Commons” and that he thinks “that there is a general desire in the House to find a better way of dealing with these matters”.
I can only urge the hon. government House leader to follow up on his suggestion that an attempt be made to find another way of solving these issues to the satisfaction of all members so that our procedures may be improved in this regard. I am sure that, with the help of interested members, like the member for Ottawa—Vanier, the member for Yorkton—Melville and others, including the nembers of the Standing Committee on Procedure and House Affairs, a solution will be found.
I thank the hon. member for Ottawa—Vanier for having drawn this very important matter to the attention of the House.",,,The Speaker,
4211375,ca.proc.d.2002-03-22.1987.126,2002-03-22,0abdcb88-9105-41d9-8a1b-87e54e5efecb,144,"Mrs. Marlene Jennings (Parliamentary Secretary to the Minister for International Cooperation, Lib.)",,Routine Proceedings,Government Response to Petitions,,"Mr. Speaker, pursuant to Standing Order 36(8) I have the honour to table, in both official languages, the government's response to one petition.",Liberal,Notre-Dame-de-Grâce--Lachine,Marlene Jennings,http://www.parl.gc.ca/parlinfo/Files/Parliamentarian.aspx?Item=0abdcb88-9105-41d9-8a1b-87e54e5efecb&Language=E&Section=ALL
4211376,ca.proc.d.2002-03-22.1987.127,2002-03-22,6f01152f-cb24-42c1-957d-e494d896206d,2677,"Mr. Jacques Saada (Brossard--La Prairie, Lib.)",,Routine Proceedings,Committees of the House,,"Mr. Speaker, I have the honour to present the 50th report of the Standing Committee on Procedure and House Affairs, pursuant to the order of reference from the House of Commons dated February 7, 2002 regarding the accusation made against the Minister of National Defence of having misled the House.",Liberal,Brossard--La Prairie,Jacques Saada,http://www.parl.gc.ca/parlinfo/Files/Parliamentarian.aspx?Item=6f01152f-cb24-42c1-957d-e494d896206d&Language=E&Section=ALL
4211377,ca.proc.d.2002-03-22.1987.128,2002-03-22,ab143dd3-e5b4-43fc-bc61-1279f1c395e9,287,"Mr. Vic Toews (Provencher, Canadian Alliance)",,Routine Proceedings,Committees of the House,,"Mr. Speaker, pursuant to Standing Order 35(2) I have the following succinct explanation to make to the minority report filed by the Canadian Alliance to the report just tabled.
We dissented from the majority report for the following reasons. First, the evidence before the committee clearly indicated that the minister was thoroughly briefed on the matter of Canadian troops taking detainees in Afghanistan on January 21. The minister understood the matter and he did not seek further clarification contrary to his own testimony. We concluded from this evidence that the minister knew of the matter on January 21.
Second, it appeared that the minister misled the House. As the majority report will indicate one must examine the context of the relevant events around the minister's conduct in order to establish intent. In this case the context was the serious division within the ranks of the government members and the apparent need for the minister to avoid a confrontation with his own caucus on January 26 and January 27.
We concluded from this that the minister intended to demonstrate that he first knew of the incident on January 25 rather than January--",Canadian Alliance,Provencher,Vic Toews,http://www.parl.gc.ca/parlinfo/Files/Parliamentarian.aspx?Item=ab143dd3-e5b4-43fc-bc61-1279f1c395e9&Language=E&Section=ALL
4211378,ca.proc.d.2002-03-22.1987.129,2002-03-22,,,,,Routine Proceedings,Committees of the House,,"Order, please. The hon. member may think this is succinct but the Chair does not agree. There is allowance in the rules for a very succinct explanation. I hope he is about to draw to an immediate conclusion.",,,The Speaker,
4211379,ca.proc.d.2002-03-22.1987.130,2002-03-22,ab143dd3-e5b4-43fc-bc61-1279f1c395e9,287,Mr. Vic Toews,,Routine Proceedings,Committees of the House,,"Mr. Speaker, thank you for your definition of succinct. It is always relative I guess.
For the reasons set out in the report the official opposition must dissent from the majority report of the committee filed in the House today. We believe the minister should have provided a further explanation given the contrary explanation presented by his officials.",Canadian Alliance,Provencher,Vic Toews,http://www.parl.gc.ca/parlinfo/Files/Parliamentarian.aspx?Item=ab143dd3-e5b4-43fc-bc61-1279f1c395e9&Language=E&Section=ALL
4211380,ca.proc.d.2002-03-22.1987.131,2002-03-22,e18b4ce5-9e89-49bc-a939-94ad0ce63cf9,130,Mr. Michel Guimond,,Routine Proceedings,Committees of the House,,"Mr. Speaker, I rise on a point of order. I would like to make a brief comment regarding the report tabled by—",Bloc Québécois,Beauport--Montmorency--Côte-De- Beaupré--Île-D'Orléans,Michel Guimond,http://www.parl.gc.ca/parlinfo/Files/Parliamentarian.aspx?Item=e18b4ce5-9e89-49bc-a939-94ad0ce63cf9&Language=E&Section=ALL
4211381,ca.proc.d.2002-03-22.1987.132,2002-03-22,,,,,Routine Proceedings,Committees of the House,,"Mr. Speaker, I am sorry to interrupt the hon. member, but the standing orders only allow one representative from a political party to comment, unless there is unanimous consent from the House, as the member knows.
Is there unanimous consent of the House to allow the member to comment?",,,The Speaker,
4211382,ca.proc.d.2002-03-22.1987.133,2002-03-22,,,,intervention,Routine Proceedings,Committees of the House,,Agreed.,,,Some hon. members,
4211383,ca.proc.d.2002-03-22.1987.134,2002-03-22,,,,intervention,Routine Proceedings,Committees of the House,,No.,,,Some hon. members,
4211384,ca.proc.d.2002-03-22.1987.135,2002-03-22,a247d1d3-3b05-46ac-b9f3-6622ab25d695,3905,Right Hon. Joe Clark,,Routine Proceedings,Committees of the House,,"Mr. Speaker, I rise on a point of order. I would like to use the occasion of a point of order to indicate that the other opposition parties in the House are in agreement with the position of the official opposition on this issue.",Progressive Conservative,Calgary Centre,Joe Clark,http://www.parl.gc.ca/parlinfo/Files/Parliamentarian.aspx?Item=a247d1d3-3b05-46ac-b9f3-6622ab25d695&Language=E&Section=ALL
4211385,ca.proc.d.2002-03-22.1987.136,2002-03-22,,,,,Routine Proceedings,Committees of the House,,I think we are having too many phony points of order here. We had better move on.,,,The Speaker,
4211386,ca.proc.d.2002-03-22.1987.137,2002-03-22,b020e0ef-688c-42d0-9d8a-779fbe56ca77,4259,Mr. Howard Hilstrom,,Routine Proceedings,Committees of the House,,"Mr. Speaker, I would like to make the point that the leader of the Progressive Conservative Party does not speak for the Canadian Alliance.",Canadian Alliance,Selkirk--Interlake,Howard Hilstrom,http://www.parl.gc.ca/parlinfo/Files/Parliamentarian.aspx?Item=b020e0ef-688c-42d0-9d8a-779fbe56ca77&Language=E&Section=ALL
4211387,ca.proc.d.2002-03-22.1987.138,2002-03-22,,,,,Routine Proceedings,Committees of the House,,"These are not really points of order. I know we all appreciate the co-operation and everything, but perhaps we will move on.",,,The Speaker,
4211388,ca.proc.d.2002-03-22.1987.139,2002-03-22,b020e0ef-688c-42d0-9d8a-779fbe56ca77,4259,"Mr. Howard Hilstrom (Selkirk--Interlake, Canadian Alliance)",,Routine Proceedings,Canadian Wheat Board Act,,"
moved for leave to introduce Bill C-438, an act to amend the Canadian Wheat Board Act and the Access to Information Act.

Mr. Speaker, I bring this private member's bill forward because the situation in western Canada and the designated regions under the Canadian Wheat Board forces farmers into monopoly marketing of their wheat and barley.
If the bill were passed all directors would be elected and producers would have the option of whether they wanted to market through the wheat board or not. The auditor general would have the authority to audit the wheat board to see if it met its prime objective which would now be to secure the best possible financial return for farmers that want to be part of the Canadian Wheat Board.
(Motions deemed adopted, bill read the first time and printed)",Canadian Alliance,Selkirk--Interlake,Howard Hilstrom,http://www.parl.gc.ca/parlinfo/Files/Parliamentarian.aspx?Item=b020e0ef-688c-42d0-9d8a-779fbe56ca77&Language=E&Section=ALL
4211389,ca.proc.d.2002-03-22.1987.140,2002-03-22,f6d1f5af-95f2-4262-bc52-ce4406fd2a0d,238,"Mr. Marcel Proulx (Hull--Aylmer, Lib.)",,Routine Proceedings,Petitions,,"Mr. Speaker, I am presenting a petition containing close to 14,000 signatures. The petition opposes the creation of a golf course in Leamy Lake Park in the riding of Hull--Aylmer.
The petitioners believe that creating this type of golf course would have irreparable consequences on the wildlife and vegetation of the area and would privatize a major part of the park for the use of a minority. They are demanding that a review committee be struck by federal authorities.",Liberal,Hull--Aylmer,Marcel Proulx,http://www.parl.gc.ca/parlinfo/Files/Parliamentarian.aspx?Item=f6d1f5af-95f2-4262-bc52-ce4406fd2a0d&Language=E&Section=ALL
4211390,ca.proc.d.2002-03-22.1987.141,2002-03-22,d2532de4-9001-40c6-8c41-1ed8e6678fd5,3870,"Mr. Dick Proctor (Palliser, NDP)",,Routine Proceedings,Petitions,,"Mr. Speaker, I am pleased to present a petition from the residents of Pointe-Claire, Hudson, Dorval and Beaconsfield.
The petitioners point out that Canada is indivisible and that the boundaries of Canada, its provinces, territories and territorial waters may only be modified by ( a ) a free vote of all Canadian citizens as guaranteed by the Canadian Charter of Rights and Freedoms, or ( b ) through the amending formula stipulated in the Canadian Constitution.",New Democratic Party,Palliser,Dick Proctor,
4211391,ca.proc.d.2002-03-22.1987.142,2002-03-22,4ac38ab4-c480-4dde-8f12-a80ff2b4f215,185,"Mr. Pat Martin (Winnipeg Centre, NDP)",,Routine Proceedings,Petitions,,"Mr. Speaker, I am proud to rise today to present pursuant to Standing Order 36 a very substantial petition signed by thousands of first nations citizens in the province of Manitoba. These signatories reject the first nations' governance initiative as proposed by the Minister of Indian Affairs and Northern Development because they maintain that it is nothing more than a thinly veiled attempt to diminish or even extinguish their treaty rights.
The petitioners point out further that the minister's so-called consultation process has been a sham. They urge all members of parliament to scrap the first nations' governance initiative and replace it with a mutually acceptable piece of legislation that actually addresses the many pressing and urgent issues that they outline in their petition.
Finally, these citizens serve notice that this is the first of many such petitions that will in fact outnumber against the first nations' governance initiative any who have indicated support for the initiative.",New Democratic Party,Winnipeg Centre,Pat Martin,http://www.parl.gc.ca/parlinfo/Files/Parliamentarian.aspx?Item=4ac38ab4-c480-4dde-8f12-a80ff2b4f215&Language=E&Section=ALL
4211392,ca.proc.d.2002-03-22.1987.143,2002-03-22,a337def6-58fb-4668-92cf-9e4736da9220,3874,"Mr. Larry Spencer (Regina--Lumsden--Lake Centre, Canadian Alliance)",,Routine Proceedings,Petitions,,"Mr. Speaker, it is my privilege and duty to rise in the House today to table a petition from concerned citizens of Canada. The petitioners are concerned about the recently released report from CIHR surrounding stem cell research. They are concerned particularly about the graduated approach determining human value and life. In this petition they are calling upon the House to give human life the love, respect and dignity that it deserves at all stages of its existence.
It is an honour for me to be able to table this petition with the signatures of 180 of the fine constituents of Regina--Lumsden--Lake Centre.",Canadian Alliance,Regina--Lumsden--Lake Centre,Larry Spencer,
4211393,ca.proc.d.2002-03-22.1987.144,2002-03-22,3fb122bc-b9d7-45b4-935d-1c59749778cb,4641,"Mr. Tony Tirabassi (Niagara Centre, Lib.)",,Routine Proceedings,Petitions,,"Mr. Speaker, I have the honour to present a petition signed by the residents of my riding of Niagara Centre as well as other areas in Ontario asking that the criminal code be amended to ensure that corporate executives and directors are held properly accountable for workplace safety so that needless work related deaths, illnesses and injuries are prevented.
The petitioners also point out that a number of workplace deaths and work related permanent disabilities among Canadian youth is alarmingly high and unacceptable.",Liberal,Niagara Centre,Tony Tirabassi,http://www.parl.gc.ca/parlinfo/Files/Parliamentarian.aspx?Item=3fb122bc-b9d7-45b4-935d-1c59749778cb&Language=E&Section=ALL
4211394,ca.proc.d.2002-03-22.1987.145,2002-03-22,0abdcb88-9105-41d9-8a1b-87e54e5efecb,144,"Mrs. Marlene Jennings (Parliamentary Secretary to the Minister for International Cooperation, Lib.)",,Routine Proceedings,Questions on the Order Paper,,"Mr. Speaker, I ask that all questions be allowed to stand.",Liberal,Notre-Dame-de-Grâce--Lachine,Marlene Jennings,http://www.parl.gc.ca/parlinfo/Files/Parliamentarian.aspx?Item=0abdcb88-9105-41d9-8a1b-87e54e5efecb&Language=E&Section=ALL
4211395,ca.proc.d.2002-03-22.1987.146,2002-03-22,,,,,Routine Proceedings,Questions on the Order Paper,,Is that agreed?,,,The Speaker,
4211396,ca.proc.d.2002-03-22.1987.147,2002-03-22,,,,intervention,Routine Proceedings,Questions on the Order Paper,,Agreed.,,,Some hon. members,
4211397,ca.proc.d.2002-03-22.1987.148,2002-03-22,,,,stagedirection,,,,"The House resumed consideration of the motion that Bill C-50, an act to amend certain acts as a result of the accession of the People's Republic of China to the Agreement Establishing the World Trade Organization, be read the second time and referred to a committee.",,,,
