basepk,hid,speechdate,pid,opid,speakeroldname,speakerposition,maintopic,subtopic,subsubtopic,speechtext,speakerparty,speakerriding,speakername,speakerurl
3926142,ca.proc.d.1992-12-04.15.1.2,1992-12-04,a821d280-9b40-44e5-bae2-c039ce14a4c8,ca.m.5795,Mr. David Dingwall (Cape Breton-East Richmond):,Official Opposition House Leader; Liberal Party House Leader,GOVERNMENT ORDERS,"BUDGET IMPLEMENTATION (GOVERNMENT ORGANIZATIONS) ACT, 1992 MEASURE TO ENACT",,"Madam Speaker, I thought we might get unanimous consent to give me more time if necessary. I am sure the House would want to hear my remarks.
Government Orders
I want to thank members for their consent so that I may complete my remarks.
Earlier today, I raised questions with regard to the procedural acceptability of Bill C-93. I hope that before the day is out we will have a decision from the Chair in terms of the points I raised.
In my remarks I made reference to the fact that the Atlantic Canada Opportunities Agency, now in place, with great fanfare some time ago was announced with a budget of $1.05 billion over five years. Individuals on the government side rejoiced that this was going to be the panacea for creating economic development in Atlantic Canada. In point of fact they have pointed to it as the lead tool for economic development.
The budgetary provisions of that particular day require careful examination. The money has roughly been $200 million a year for four provinces equalling approximately $86.96 per resident of Atlantic Canada. At the same time, the Government of Canada was providing $1.2 billion for a space station, not to suggest that we are against that.
When one looks at the need for economic development in Atlantic Canada, however, that certainly has not been a sizeable expenditure for the needs of those particular residents.
I attempted in my remarks to lay out the history of the Cape Breton Development Corporation with its two divisions, its mandate, its own president, its own board of directors. I talked about Bill C-103, namely the Atlantic Canada Opportunities Agency, part I and part II which was Enterprise Cape Breton Corporation. For all practical purposes it was to usurp the role of the industrial development division of Devco and thereby be rolled into a separate and distinct Crown corporation.
My colleague in the upper house raised a number of questions with regard to the efficacy of that particular Crown corporation. I would like to repeat what my colleague, the Hon. Allan J. MacEachen, at that time leader of the opposition in the other House said on June 14, 1988. He was questioning the government House leader, Senator Murray. He said:
Would I be correct in concluding that, while ACOA, as a whole, will
not be involved in infrastructure, for example, or not involved directly
in assistance to farmers, the new Enterprise Cape Breton Corporation
will still be enabled to fund projects in the field of infrastructure, in the

December 4, 1992
Government Orders
field of agriculture, as has been presently done by the industrial development division of the Cape Breton Development Corporation?
The response of the government House leader in the Senate was:
Yes, honourable senators, those are valid examples of activities in which Enterprise Cape Breton Corporation -
-as my colleague from Cape Breton Highlands-Canso will want to note-
-as a continuation of IDD, could continue to be engaged and in which ACOA, generally speaking, is not engaged. Again, in answer to questions from our colleague, Senator Graham, I did discuss the quite worth-while activities of ACOA in encouraging economic activities and enterprises that are related to agriculture and fisheries. However, that is not what the honourable senator is asking. The short answer to his question is yes.
Senator Murray on June 14, 1988, page 3655, goes on to say:
Honourable senators, as 1 have stated previously, the generality of the case with regard to Enterprise Cape Breton Corporation is that ECBC will not be prevented from doing anything that the industrial development division of Devco is now doing.
Bill C-103 created ACOA and it created Enterprise Cape Breton Corporation in the words of the government House leader in the other place to do the duties of the industrial development division of what we now know as Devco.
That was back then. That is what they said in 1988. Senator Murray is on the record as saying the following. This is from page 3656 of the Senate debates of June 14, 1988:
Enterprise Cape Breton Corporation will be a Crown corporation. It has a mandate almost identical to that of the industrial development division of Devco. As a Crown corporation, it will have a board of directors which-and I make this as a general statement-will have the same mandate and powers in respect to ECBC as the board of directors of Devco has in respect of the IDD.
I put all of this on the record to show and to underline for those in the Chamber and those who may be viewing our proceedings the ultimate in hypocrisy of a government. It gutted the industrial development division of Devco and in its place it put the Enterprise Cape Breton Corporation, which was to assume its responsibilities. However, it has now come to Parliament to end Enterprise Cape Breton Corporation.
In the debate which went on in this House those in opposition were criticized because we as a national party
opposed the ACOA bill. The reason that we opposed the ACOA bill is that the Government of Canada was attempting to utilize it as a panacea for economic development in Atlantic Canada, to which we would not subscribe. In fact, we were the only national party to oppose that piece of legislation.
The Tbiy members opposite and members of the New Democratic Party supported ACOA. They supported the gutting of the industrial development division.
Today, we now see the results of that particular measure. We have a new bill before us which is gutting, terminating forever and ever, Enterprise Cape Breton Corporation which was to be the flagship of economic development on the island of Cape Breton.
We not only voted against Bill C-103 in this House, we had the other place forward amendments back to this Chamber. They happened to be amendments from our colleagues, our Liberal senators, which we supported, and which of course the New Democratic Party and the Tories opposite did not support.
So I want the record to be very clear that when it comes to economic development on the island of Cape Breton, we only have to look to the Tories and the NDP and examine the rhetoric. Examine the statements made in the press, but also look at the results and look at what is actually done.
This is a good example of a piece of legislation enacted some years ago which now in another form has come back before this institution and which we are going to do away with. That was the fear we anticipated back in 1987 and again in 1988 right until 1992.
Our worst dreams and our worst fears have now occurred. I am very sad that this has occurred. The reason I am sad is that people in my district in Nova Scotia believed Senator Murray when he said in the upper chamber, and these are his words: ""These, honourable senators, are nation-building measures. Bill C-103, an act to increase opportunity for economic development in Atlantic Canada, to establish the Atlantic Canada Opportunities Agency and Enterprise Cape Breton Corporation."" It is a nation-building measure. That is what he said on May 18, 1988 on page 3431 of Senate Hansard.

December 4, 1992

If that is not hypocrisy, I do not know what is. There is a senior minister of the Crown saying in Hansard that the need for Enterprise Cape Breton Corporation is because it is a nation-building measure. What do we have today? We have the likes of Bill C-93 which will gut, it will terminate Enterprise Cape Breton Corporation forever and a day thereby removing a nation-building measure.
I find it totally unacceptable that we in this Parliament would allow this government to get away with such mischief. It is mischief which has played on the hearts and the hopes of thousands of people residing in my
district.
The purpose of my intervention today is to retrace the history and the facts relating to Cape Breton Development Corporation, the history of the Enterprise Cape Breton Corporation as it relates to the Atlantic Canada Opportunities Agency and the facts. The facts are that we have been told one thing and the government is doing the opposite.
When I think of the concern and the anguish that the people of my island have to go through, I become angry. I am angry at the way in which they have been treated, angry at the way in which governments have played with their fears, their emotions and their hopes.
As we heard in Question Period and as I reported to the Minister of Finance, the unemployment rate in Cape Breton today is 20.9 per cent. On the very day that unemployment at 20.9 per cent is recorded, the Government of Canada spells the end of the Enterprise Cape Breton Corporation. That is something which it said several years ago was a nation-building measure. Is that fair? Is that just? Is that appropriate?
My colleagues, the hon. member for Cape Breton- The Sydneys and the hon. member for Cape Breton Highlands-Canso, will talk about what has happened in their districts.
Over the last number of years we have seen many destructive economic things happen on the island of Cape Breton. The radar base closed. A substantial amount of money was removed from the local economy. Positions at the coast guard college, the numbers are down. VIA Rail passenger service has been taken away. Air Canada jet service has been taken away. Just the other day, two fish plants in my district had to close as
Government Orders
did many more on the island, to which I am sure my colleague from Cape Breton Highlands-Canso will allude.
Cape Breton Development Corporation has seen its person-years reduced substantially. The Sydney Steel Corporation has also been downsized from 1,500 to approximately 600. It goes on and on and on.
In 1991 Nova Scotia had 2,184 consumer bankruptcies. There were also 662 business bankruptcies. In October 1992 the record will show that consumer bankruptcies equalled 1,617 and business bankruptcies so far this year are up at 712. Bankruptcies since 1991 have reached a total of 5,175. Yet the Government of Canada has chosen a pretty tough course by closing down Enterprise Cape Breton Corporation. Again I ask the Chamber and I ask the Chair: Is that fair, is that just?
The answer is that it is not fair. It is not generous. It is not becoming of any national government to do that in light of the economic carnage it has inflicted upon the people. No government should wilfully, as this government has done repeatedly over the last number of years, single out such a poor and devastated area of Canada as Cape Breton.
There are people there too. I think of the youth. I think of my son and my two daughters who live there as I do. They want to have an opportunity to grow, get an education, have a job and raise a family. What we find is a national government, aided and abetted by the way by a provincial government, whose incompetence is only exceeded by its arrogance and dislike for the people on that island.
Today in my district two coal mines are down. One is Lingan in New Waterford and the other is the Phalen colliery in New Waterford as well. A lot of miners, a lot of families, are directly affected and impacted. The problem is that water has come into the Lingan mine and they have had to evacuate that mine which was due to close in March. Approximately 350,000 to 400,000 tonnes of coal will not be mined as a result of that flooding. A lot of individuals have been displaced there and displaced at the Phalen colliery.
I do not know the cause of that flooding, but I have serious concerns as to why it has occurred. I have spoken with union representatives and I have spoken with management representatives. They have suggested that the water has come from another abandoned coal mine, No. 26-1B. There are two experts on site now examining the cause. It certainly has to reflect management practic-

December 4, 1992
Government Orders
es at that corporation and the directives given to it by the minister responsible.
I hope the Phalen mine will be up and running as soon as humanly possible, and I am sure the minister opposite would concur, but it had better be safe. Every expert, Labour Canada, CANMET and energy mines and resources, better spell out very clearly that it is safe. I will join with union representatives and their safety co-ordinator in saying that the men should not return to work if it is not proven conclusively that the mine is safe for miners to mine coal.
As we stand here today and debate the death of Enterprise Cape Breton Corporation, these people are worried about Christmas. They are worried about the new year. They are worried about getting back to work. I just want to put on record that I defy anyone in this Chamber to suggest or imply that those individuals associated and working at the Cape Breton Development Corporation are not industrious, hard working, determined men who wish to get back to work. There will be some who will try to paint the picture that all they want is unemployment insurance, a few benefits and that will be sufficient. That is not the case. Let no man or woman in this Chamber or outside this Chamber try to inflict that kind of gossip, that kind of big lie about the Cape Breton labour force. It is a very good labour force as studies have shown and as studies will indicate again and again.
These miners are worried about their lives and their families. They really are a special breed of people. They get up every morning, put their clothes on, go to the mine, get their lights and get on a little train. They are cramped in. They go down in the mine way underneath the ocean. They work, they get their pay and they come up. It is pretty scary for those individuals who do it, scary for their families, and particularly very scary for the children of miners.
I have made demands of the minister responsible in terms of unemployment insurance. I want to say on the record that I think the minister has attempted in good faith to be of some assistance. I want to thank him for that.
I have also urged the minister in a letter I have written to him that we have to do something for those miners who have been displaced at the Lingan colliery. We cannot just throw them adrift as if they are useless human beings. We need a package for those individuals. Some of them are not so old; some of them are a bit older. We need interim measures to provide assistance to those miners who are not without work and who have no idea as to when they will be able to return to full-time employment in the mines.
There is something else that the minister has not been overly positive about or co-operative about. That is the opening of the Donkin coal mine. At the present time at Devco in the coal division we have the Princess mine and the Phalen mine. Lingan looks like it is going to be closed. I hope not but it looks very much that way.
We have both domestic and international markets that must be supplied with coal. It only seems sensible, wise and prudent the Government of Canada, after spending in excess of $55 million on the Donkin mine project, will get it up, get it ready and proceed with economic development there too.
As much as I would like to vent my anger at the minister responsible for the Cape Breton Development Corporation, I have to say in all candour that the minister does not enjoy the support of the Government of Nova Scotia. The Government of Canada could proceed unilaterally but that is not the best way to proceed. It has to proceed with the co-operation and the financial support of the Government of Nova Scotia. That crowd in Nova Scotia led by the premier, Mr. Donald Cameron, is an absolute, unbelievable bunch of incompetent individuals.
They care that much for the coal industry, that much for the people of Cape Breton and that much for the miners who work in the coal industry, as evidenced by statements made by the premier, by his refusal to retract those statements, by his attitude and by his wanton disregard for the people of Cape Breton.
The Cape Breton Development Corporation was brought in under a federal statute by the Hon. Allan J. MacEachen who sits in the other House. The minister will know that it was supported at that time by the premier of the day, Robert Lome Stanfield. It was thereafter supported throughout the years by the successor to Mr. Stanfield, Mr. Regan, who served as premier
December 4, 1992

for eight years and thereafter supported by Senator John Buchanan.
But this premier has not shown the same compassion, the understanding or the willingness to support the Cape Breton Development Corporation in its operations. In point of fact he has done everything to discredit that Crown corporation and thereby discredit the minister who is opposite today. It is a shameful display by a first minister of a province to cut adrift an entire island of people who number about 170,000, as my colleague from Cape Breton Highlands-Canso will later bring to the attention of this House.
The Government of Canada needs the support of the Government of Nova Scotia to get the Donkin mine up and running. It needs the support of the Government of Nova Scotia with regard to coal contracts from the Nova Scotia Power Corporation. Yes, Devco sells coal, as the minister will attest. It sells coal to the Nova Scotia Power Corporation. However, it has been the miner who has been sacrificing his life, his family's life, in order to maintain power costs in the province of Nova Scotia. It is not Donald Cameron and those clowns in Halifax. It is high time the Government of Canada takes the gloves off and stops allowing this provincial premier to get away with wanton disregard and disrespect for a people who happen to reside on a disadvantaged island.
If I were the minister responsible I know what I would do. I would disclose the kinds of shenanigans, the way in which that premier has treated the Cape Breton Development Corporation. This premier has not only attacked the people of Cape Breton Island, the miners of Cape Breton Island, but he has also attacked the management.
Maybe there is ample room there for that, but to do so in the way he has done is something we shall never forget. I urge the minister responsible for the Cape Breton Development Corporation to continue to work to do the best he possibly can, show leadership and disclose what these clowns are all about in Halifax. The minister cannot say these things, but I can say them because I know the difficulties the minister is confronted with when trying to deal with that crowd in Halifax.
Government Orders
I urge him to get on with the Donkin mine. It makes sense. It will create jobs. It will put miners and their families in a much better framework. Where better is it needed than on the island of Cape Breton?
In the two minutes I have remaining, let me say this about Enterprise Cape Breton Corporation. With all the economic carnage on the island, how in the name of God could a federal government today, at 20.9 per cent UIC, terminate a flagship for economic development? I will tell the House how: It is done by the Government of Canada at the support and behest of the provincial government of one Donald Cameron, the good friend of the right hon. prime minister.
I would hope that members in this Chamber would understand exactly what is taking place. It is that those of us who come from small disadvantaged regions of the country are suffering greatly. We seek hope, economic justice and fairness. We do not want any special deals, but we want to have our special relationship that we have always enjoyed with the Government of Canada renewed and invigorated in order to provide hope to those individuals who reside on that island.
The conduct of this government by introducing such dastardly legislation will affect greatly, not only today but for years and years and years ahead, the economy of Cape Breton.
I say to all that I will continue to fight. I will take my place in this Chamber and, no matter how unpopular it may be in some circles, I will stand with the miner, I will stand with the fisherman, the persons who work in our forests, the people who work in our small businesses, the young people and the women, our aboriginals, all of those individuals in Cape Breton. I will stand with them and for them to bring economic justice and fairness to the people of Cape Breton.
I urge all members, regardless of political faith, to support the Official Opposition in condemning the provisions of Bill C-93 and in particular the amendments to gut Enterprise Cape Breton Corporation.

",Liberal,,David Charles Dingwall,http://www.parl.gc.ca/parlinfo/Files/Parliamentarian.aspx?Item=a821d280-9b40-44e5-bae2-c039ce14a4c8&Language=E&Section=ALL
