basepk,hid,speechdate,pid,opid,speakeroldname,speakerposition,maintopic,subtopic,subsubtopic,speechtext,speakerparty,speakerriding,speakername,speakerurl
3925216,ca.proc.d.1992-12-01.4.1.31,1992-12-01,65f64341-6e0c-46ae-8714-7a9e85e191fa,ca.m.4051,Mr. Riis:,N.D.P. House Leader,GOVERNMENT ORDERS,"ALLOTTED DAY, S. O. 81-TRADE",,"Is that free trade?

",New Democratic Party,,Nelson Andrew Riis,http://www.parl.gc.ca/parlinfo/Files/Parliamentarian.aspx?Item=65f64341-6e0c-46ae-8714-7a9e85e191fa&Language=E&Section=ALL
3925217,ca.proc.d.1992-12-01.4.1.32,1992-12-01,2aa8c3e9-f46e-4c78-b9ff-04bec0ed5050,ca.m.5241,Mr. Chretien:,Leader of the Official Opposition,GOVERNMENT ORDERS,"ALLOTTED DAY, S. O. 81-TRADE",,"Yes, it is free trade and nobody praises it more than your friend Bob White. We did not sell the store. We told the Americans it was good for them and it was good for us.

",Liberal,,Joseph Jacques Jean Chrétien,http://www.parl.gc.ca/parlinfo/Files/Parliamentarian.aspx?Item=2aa8c3e9-f46e-4c78-b9ff-04bec0ed5050&Language=E&Section=ALL
3925218,ca.proc.d.1992-12-01.4.1.33,1992-12-01,65f64341-6e0c-46ae-8714-7a9e85e191fa,ca.m.4051,Mr. Riis:,N.D.P. House Leader,GOVERNMENT ORDERS,"ALLOTTED DAY, S. O. 81-TRADE",,"It is not free trade though.

",New Democratic Party,,Nelson Andrew Riis,http://www.parl.gc.ca/parlinfo/Files/Parliamentarian.aspx?Item=65f64341-6e0c-46ae-8714-7a9e85e191fa&Language=E&Section=ALL
3925219,ca.proc.d.1992-12-01.4.1.34,1992-12-01,2aa8c3e9-f46e-4c78-b9ff-04bec0ed5050,ca.m.5241,Mr. Chretien:,Leader of the Official Opposition,GOVERNMENT ORDERS,"ALLOTTED DAY, S. O. 81-TRADE",,"Yes, it is free trade. There are no tariffs. You do not want a deal with anyone so you have to shut up and let me make my speech. We just wanted to show you how to negotiate when you are in government because I know you will never get there, but just in case. However, you may pass it on to Mr. Rae.
I said we wanted an agreement with the Americans. On the FTA, we told them we were not happy with the
Supply
agreement and we would have to renegotiate it. It is the same thing with the NAFTA. We are not happy with it. It is not a good deal. We need trade, but this is not a good deal. We know exactly what we want to renegotiate. We want to renegotiate, for example, the definition of a subsidy because we have to know.
Look at what is happening now in our trade relations with the Americans. Every time we try to do something in a Canadian way if the Americans do not like it they call it a subsidy. We have this problem in the production of softwood lumber. In Canada we have other ways of taxing corporations but the stumpage fee was not part of our policy. The Americans said we had to have the same rules as them. We said it was not a subsidy because in Canada we have climatic conditions that are different than in the United States and we have tax policies that are different. It is not for them to tell us how to tax our people; it is not for us to tell them how to tax their people.

",Liberal,,Joseph Jacques Jean Chrétien,http://www.parl.gc.ca/parlinfo/Files/Parliamentarian.aspx?Item=2aa8c3e9-f46e-4c78-b9ff-04bec0ed5050&Language=E&Section=ALL
3925220,ca.proc.d.1992-12-01.4.1.35,1992-12-01,intervention,,,,GOVERNMENT ORDERS,"ALLOTTED DAY, S. O. 81-TRADE",,"Hear, hear.

",,,Some hon. members:,
3925221,ca.proc.d.1992-12-01.4.1.36,1992-12-01,2aa8c3e9-f46e-4c78-b9ff-04bec0ed5050,ca.m.5241,Mr. Chretien:,Leader of the Official Opposition,GOVERNMENT ORDERS,"ALLOTTED DAY, S. O. 81-TRADE",,"If we let them do that, eventually they will claim that having medicare in Canada is unfair competition. It is not unfair competition because it is the best system in the world and, as Liberals, we will protect it.
Some will argue that because for every car built in the United States, compared to a car built in Canada, they save at least $1,000 or $900 because they manufacture it in Canada and we have a medicare system. But it is paid in another way. It is not paid by the company but by the taxpayer. It is the Canadian way of doing things.
We need a definition of subsidy and we say we will renegotiate that. Some say the Americans will not agree. They have to agree. It is part of the FTA agreement. They said that in the seven years after the enforcement of the FTA they would negotiate a definition of a subsidy so we will negotiate. We will have to negotiate what is dumping because it is related to what is a subsidy.
That is our policy and we want to clarify it. We will negotiate and we will renegotiate. That is clear, that is our clear position: first what we want to do in terms of subsidy and then dumping. There is a third thing we want to renegotiate. It is not very complicated.

December 1, 1992
Supply
The Americans signed an agreement with the Mexicans on energy that is different from the one the Americans signed with us. We want to make sure that in case of a major crisis we can keep some of our resources for Canadians first. There is nothing wrong with that.
The Americans have huge reserves for what they call ""national security"". They have built up reserves over the years that are owned by the states that will never be touched. They will never be available to Canadians or Mexicans. They are there for their national security.
We too need reserves for our national security but the Tories gave them away. What is unbelievable, because I have talked with some of the negotiators, is that the Americans were not asking to have a deal on energy. There was no problem for the Americans on energy. The problem was that we did not want to sell to them; it was never that they did not want to buy from us. There was no problem there. We had a policy that provided for reserves for our future. Security of supply, we called it.
The government gave it away. It is very reasonable to go back to the Americans and ask why they do not give us the same deal on energy as the Mexicans. The decided to keep control of their energy policy within the international context. There is an international agreement there, but there was no need to put it on the table in the free trade agreement.
Now there is another opportunity. The American administration is changing. We will have a president there who says ""what about labour conditions; what about environmental protection?"" Right on. It is what we were asking in this House for a long time.
The member for Davenport and the member for LaSalle-Emard have been asking these questions for a long time. The coming American administration is of the same view. So we have a great opportunity to renegotiate. The President-elect said he wants to renegotiate some aspects of NAFTA but the Tories want to sign right away and the NDP will not sign anything, ever.
There is a very solid, common sense position right in the middle of that. It is the Liberal position. For me, it is very important in this debate. I would offer a good
opportunity to members of the NDP because they blundered that so badly I feel a bit sorry.

",Liberal,,Joseph Jacques Jean Chrétien,http://www.parl.gc.ca/parlinfo/Files/Parliamentarian.aspx?Item=2aa8c3e9-f46e-4c78-b9ff-04bec0ed5050&Language=E&Section=ALL
3925222,ca.proc.d.1992-12-01.4.1.37,1992-12-01,intervention,,,,GOVERNMENT ORDERS,"ALLOTTED DAY, S. O. 81-TRADE",,"Don't be sorry.

",,,An hon. member:,
3925223,ca.proc.d.1992-12-01.4.1.38,1992-12-01,2aa8c3e9-f46e-4c78-b9ff-04bec0ed5050,ca.m.5241,Mr. Chretien:,Leader of the Official Opposition,GOVERNMENT ORDERS,"ALLOTTED DAY, S. O. 81-TRADE",,"They do not want me to be sorry. If they would just change one word and rather than say ""any agreement"" they should say ""this agreement"", we could vote with them because we do not like this agreement either. However to say ""any agreement"" I can see their embarrassment.

",Liberal,,Joseph Jacques Jean Chrétien,http://www.parl.gc.ca/parlinfo/Files/Parliamentarian.aspx?Item=2aa8c3e9-f46e-4c78-b9ff-04bec0ed5050&Language=E&Section=ALL
3925224,ca.proc.d.1992-12-01.4.1.39,1992-12-01,intervention,,,,GOVERNMENT ORDERS,"ALLOTTED DAY, S. O. 81-TRADE",,"Oh, oh.

",,,Some hon. members:,
3925225,ca.proc.d.1992-12-01.4.1.40,1992-12-01,2aa8c3e9-f46e-4c78-b9ff-04bec0ed5050,ca.m.5241,Mr. Chretien:,Leader of the Official Opposition,GOVERNMENT ORDERS,"ALLOTTED DAY, S. O. 81-TRADE",,"I think we have a very good position on this matter. We understand that trade is very important for Canada. As the member from Winnipeg and the member from Etobicoke were talking about, we need globalization in a way and we need international rules. That would be best.
We have to be careful as a nation that the world is not moving in big blocs. That could be very dangerous. If the common market is to become a big bloc that would be protectionist, if there were to be in North America a big bloc that would be protectionist and if there were to be in Asia another bloc that would be protectionist, it would be terrible for the world. It is the poor of the world who would pay the price of that type of protection. I am worried about it so I do think that we have quite a good position.
For that matter, I enjoyed very much some months ago the position of the NDP that likes to claim it is so solid it never ever changes its mind. The leader of that party, as reported in The Financial Post of October 28, 1991, said: ""If elected"", and that is a hell of a big if, ""we would sit down with the Americans and say how can we make this thing work? If not, we will give them six months notice"".
Never in my life have I seen anybody take a page from my book that quickly. It is exactly our position. We would renegotiate, and if the Americans were not reasonable we would abrogate.

Those who believe we can go back to square one are mistaken. When we take power, five years will have passed since this agreement was signed and some decisions cannot be changed then. Companies that moved to the United States will not come back to Canada just because we pass a bill in Parliament asking them to. That

is not how it works. But I can understand how naive the New Democrats are, as the premier of Ontario could not have shown more clearly when he said the problems of NDP governments across the country are due to inexperience and incompetence. To that, the people in my party say amen.

",Liberal,,Joseph Jacques Jean Chrétien,http://www.parl.gc.ca/parlinfo/Files/Parliamentarian.aspx?Item=2aa8c3e9-f46e-4c78-b9ff-04bec0ed5050&Language=E&Section=ALL
3925226,ca.proc.d.1992-12-01.4.1.41,1992-12-01,intervention,,,,GOVERNMENT ORDERS,"ALLOTTED DAY, S. O. 81-TRADE",,"Hear, hear.

",,,Some hon. members:,
3925227,ca.proc.d.1992-12-01.4.1.42,1992-12-01,65f64341-6e0c-46ae-8714-7a9e85e191fa,ca.m.4051,Mr. Nelson A. Riis (Kamloops):,N.D.P. House Leader,GOVERNMENT ORDERS,"ALLOTTED DAY, S. O. 81-TRADE",,"Mr. Speaker, it was interesting to listen to my hon. friend, the Leader of the Official Opposition clarify his party's position on the North American free trade agreement.
I have two questions. First, does the Leader of the Official Opposition believe that the auto pact is a good example of free trade? In other words, is that how he defines free trade, by the auto pact with all of its components? Second, is it the Liberal Party's position that with some renegotiation of the Mexico-U.S.-Cana-da agreement the Leader of the Opposition could see himself entering into a free trade deal with Mexico and the United States?

",New Democratic Party,,Nelson Andrew Riis,http://www.parl.gc.ca/parlinfo/Files/Parliamentarian.aspx?Item=65f64341-6e0c-46ae-8714-7a9e85e191fa&Language=E&Section=ALL
3925228,ca.proc.d.1992-12-01.4.1.43,1992-12-01,2aa8c3e9-f46e-4c78-b9ff-04bec0ed5050,ca.m.5241,Mr. Chretien:,Leader of the Official Opposition,GOVERNMENT ORDERS,"ALLOTTED DAY, S. O. 81-TRADE",,"Mr. Speaker, yes, because we have no tariffs between Canada and United States on cars and parts. That is free trade. We got some guarantees in that deal. That is the difference. We said we had to maintain jobs in Canada and the Americans said: ""Yes, you will have it"". When we look at the record over 25 years, we virtually had more work than we deserved. Sometimes it was pure luck; sometimes it was good management.
I remember when I was minister of trade and I sat down with Mr. Iaccoca of Chrysler. The member for Windsor West was there. We were negotiating with them. They wanted to put their van operations in Canada. I was not too keen on vans because they were nothing in those days. I told Lee Iaccoca he was perhaps giving us a bum rap. It turned out that vans became extremely popular and the big guzzling cars disappeared. We gained that way because we got the best part of the deal.
That is a form of free trade but with guarantees and mechanisms to repair it if it is not working. But it worked pretty well. What was the second question?
Supply

",Liberal,,Joseph Jacques Jean Chrétien,http://www.parl.gc.ca/parlinfo/Files/Parliamentarian.aspx?Item=2aa8c3e9-f46e-4c78-b9ff-04bec0ed5050&Language=E&Section=ALL
3925229,ca.proc.d.1992-12-01.4.1.44,1992-12-01,b584b209-262d-4ff7-afff-ad7b64ef8c69,ca.m.7278,Mr. MacLaren:,,GOVERNMENT ORDERS,"ALLOTTED DAY, S. O. 81-TRADE",,"If we improved the agreement, would you go with it?

",Liberal,,Roy MacLaren,http://www.parl.gc.ca/parlinfo/Files/Parliamentarian.aspx?Item=b584b209-262d-4ff7-afff-ad7b64ef8c69&Language=E&Section=ALL
3925230,ca.proc.d.1992-12-01.4.1.45,1992-12-01,2aa8c3e9-f46e-4c78-b9ff-04bec0ed5050,ca.m.5241,Mr. Chretien:,Leader of the Official Opposition,GOVERNMENT ORDERS,"ALLOTTED DAY, S. O. 81-TRADE",,"Of course we will improve it. If there is no possibility of improvement we can abrogate. I will do what the leader of the NDP said.

",Liberal,,Joseph Jacques Jean Chrétien,http://www.parl.gc.ca/parlinfo/Files/Parliamentarian.aspx?Item=2aa8c3e9-f46e-4c78-b9ff-04bec0ed5050&Language=E&Section=ALL
3925231,ca.proc.d.1992-12-01.4.1.46,1992-12-01,intervention,,,,GOVERNMENT ORDERS,"ALLOTTED DAY, S. O. 81-TRADE",,"Read it again.

",,,An hon. member:,
3925232,ca.proc.d.1992-12-01.4.1.47,1992-12-01,2aa8c3e9-f46e-4c78-b9ff-04bec0ed5050,ca.m.5241,Mr. Chretien:,Leader of the Official Opposition,GOVERNMENT ORDERS,"ALLOTTED DAY, S. O. 81-TRADE",,"I will read it again in case the member has not read it. In an interview in The Financial Post on October 28,1991 the Leader of the NDP said: ""If elected we would sit down with the Americans and say how can we make this thing work?""

",Liberal,,Joseph Jacques Jean Chrétien,http://www.parl.gc.ca/parlinfo/Files/Parliamentarian.aspx?Item=2aa8c3e9-f46e-4c78-b9ff-04bec0ed5050&Language=E&Section=ALL
3925233,ca.proc.d.1992-12-01.4.1.48,1992-12-01,efec68a7-e1fd-490f-8b6a-95313440440c,ca.m.3358,Mr. Boudria:,Deputy House Leader of the Official Opposition; Liberal Party Deputy House Leader,GOVERNMENT ORDERS,"ALLOTTED DAY, S. O. 81-TRADE",,"Who said that?

",Liberal,,Don Boudria,http://www.parl.gc.ca/parlinfo/Files/Parliamentarian.aspx?Item=efec68a7-e1fd-490f-8b6a-95313440440c&Language=E&Section=ALL
3925234,ca.proc.d.1992-12-01.4.1.49,1992-12-01,2aa8c3e9-f46e-4c78-b9ff-04bec0ed5050,ca.m.5241,Mr. Chretien:,Leader of the Official Opposition,GOVERNMENT ORDERS,"ALLOTTED DAY, S. O. 81-TRADE",,"The Leader of the NDP. ""If not, we will give them six months notice"". Who said that? The leader of the NDP and I.

",Liberal,,Joseph Jacques Jean Chrétien,http://www.parl.gc.ca/parlinfo/Files/Parliamentarian.aspx?Item=2aa8c3e9-f46e-4c78-b9ff-04bec0ed5050&Language=E&Section=ALL
3925235,ca.proc.d.1992-12-01.4.1.50,1992-12-01,a03c4e49-6a3d-4810-831e-4e694d169628,ca.m.7626,Mr. Dan Heap (THnity-Spadina):,,GOVERNMENT ORDERS,"ALLOTTED DAY, S. O. 81-TRADE",,"Mr. Speaker, I rise with pleasure to support our NDP motion:
That this House reject any North American free trade agreement.
First I wish to quote from today's papers to show the attitude of Canada's elite toward working people. The Globe and Mail banner headline says: ""Economy shows turtle-like advance"". What it emphasizes on this page is primarily the strong points: the total value of goods and services produced grew at 1.4 per cent; there was a 5.3 per cent increase excluding inflation in spending by Canadians as final domestic demand and so on.
In The Financial Post hidden away where working people are not likely to find it unless they get to ride an aeroplane in the morning: ""Employment outlook getting darker, says the study according to Manpower Temporary Services Limited. For the first time all 10 industry groups surveyed predict employment cutbacks and most industries are near or below the levels of the glum first quarter of 1982. The survey shows no end in sight for an employment drought that has lasted 3.5 years"".
In other words, for the elite of this country it does not matter if the workers are unemployed, it does not matter if workers starve, it does not matter if workers do not have a roof over their head. What matters is sales and profit and somebody, at least the rich, having money to spend. If the rich have money to spend then somebody will find things to sell them. That is an illustration of the attitude of the elite in Canada.
I want to illustrate something else that shows the attitude and practice of the elite in Mexico, the people

Supply
the Canadian elite want to join up with and with whom they want to share the Government of Canada.
In Mexico there has been violent suppression of workers, unions and opposition leaders for years and for decades. In the three to four years since President Salinas was elected-he was elected in an election that was criticized by the Organization of American States for its improprieties or irregularities or fraud-over 100 opposition leaders and 20 journalist have been assassinated in Mexico with almost no police investigation let alone trial. There is very little police action to curb that sort of thing.
We now have a former member of the Congress of Mexico who has been driven to find refugee status in Canada. Mario Rojas Alba was a congressman of the Mexican congress, the national congress. He was one of the leaders of the Party of Revolutionary Democracy led by Cuauhtemoc Cardenas. While he was a congressman he was many times over the years physically attacked or burgled by people who he found, by investigation, were criminals and drug traffickers under the protection of the justice officials of the state of Morelos which he was representing in the Mexican congress.
In fact in January 1992 Mario Rojas was continuing investigations of the killing of Jose Ramon Garcia, an opposition leader of his party, the DRP, in the state of Morelos, who had been killed three years before. He finally, on a tip, went and interviewed three prisoners in the Morelos penitentiary, former policemen with knowledge of the kidnapping and killing of Ramon.
The contents of the interview were reported by officials to the justice authorities of the state of Morelos, the same ones who had been protecting the criminals and drug traffickers that were attacking Rojas. There were then further threats and attempts immediately made on Rojas' life. He asked protection of the attorney general of Mexico who provided a protective escort and eventually in his own investigation ratified the results of Rojas' investigation which showed that the police and the state justice authorities of Morelos were implicated in the kidnapping and murder of Ramon.
The attorney general of Mexico then refused to proceed against the Morelos state officials who were responsible for that kidnapping and murder indirectly and he withdrew the protective escort from Rojas. When Rojas saw what was happening, with the help of friends
he had to escape from Mexico and he has now been accepted as a refugee in Canada.
Rojas will be here on Thursday to speak to members of Parliament who are interested to know what is happening in Mexico. His case illustrates once again what I saw in a small way when I was in Mexico a couple of years ago observing the state elections in Morelos. I observed that there were practically no voting booths at which there was any secrecy of the ballot. You do not need a secret ballot. Everybody accepts the fact that the policeman standing beside the table and all the other people standing around see how you mark your ballot. That is how unfree elections are in the state of Morelos in Mexico.
It also illustrates the state condones and even orchestrates violence against anybody who opposes the government. That includes anybody who opposes the government run trade union structure which dominates the majority of the unions in Mexico. Anybody within those unions who tries to change things is intimidated. Anybody who tries to start a new union is intimidated, and some of them have been killed by police without punishment to the police.
My point is that although we do not have anything approaching the state of violence in Canada at present that they have in Mexico, the attitude of the elite says that it is all right, as long as the economy is booming and there are profit figures and sales figures, we are selling more abroad and so on. It does not matter whether the majority of the people are growing poorer and becoming unemployed.
If we form any kind of North American so-called free trade agreement with Mexico, we begin to give up control, not only of our wage levels because our workers will have to meet the conditions of slave labour in Mexico and child labour by the millions, but we also have to begin to give up control over our natural resources, our investment policies, private and public, and our technological development, including the transfer of technology into our country.
It really means, at the bottom line, that we are inviting slave labour to dominate Canada if we sign this free trade agreement as this present government and the Liberals interpret a free trade agreement. They do not mean something like GATT. They do not mean what Adam Smith meant, simply a reduction of tariff barriers or the elimination of tariff barriers. What they mean is giving the multinational corporations total control, un-
December 1, 1992

limited by any government, over the resources, the investment, the technology and the working people of our country. That is why we are opposed to any North American free trade agreement.

",New Democratic Party,,Daniel James Macdonnell Heap,http://www.parl.gc.ca/parlinfo/Files/Parliamentarian.aspx?Item=a03c4e49-6a3d-4810-831e-4e694d169628&Language=E&Section=ALL
3925236,ca.proc.d.1992-12-01.4.1.51,1992-12-01,9117937f-b7bc-4454-8914-ddeecf186989,ca.m.7775,Mr. Ken James (Parliamentary Secretary to Minister of Labour):,Parliamentary Secretary to the Minister of Labour,GOVERNMENT ORDERS,"ALLOTTED DAY, S. O. 81-TRADE",,"Mr. Speaker, I listened with interest to the hon. member and the negative reaction from the NDP about the NAFTA.
I would like to cite for the hon. member something which ties into the environmental concerns which he has. I want to talk about Sarnia-Lambton, my riding, and what the free trade agreement has meant to my community. As we know, we had a five-year count down on the free trade agreement on tariffs in the petrochemical industry. As of January we will have no tariffs at all.
Ted Newall, the CEO of Nova, said that that has meant to them something in the area of $50 million in tariffs that they have not had to pay. Of course, for that company it has meant that it has been able to invest very heavily environmentally in our area to upgrade themselves in an environmental way as have Shell, Polysar, Dow Chemical and all the other companies that are located in Sarnia-Lambton. Nova, Esso, Suncor, Dupont, St. Clair Chemical and BASF and Polysar division of Bier, a German company, are all investing very heavily in environmental updates and decreasing to zero discharge into the St. Clair River.
That is because of their business stability and exports to the United States. Ted Newall the other day in a speech said something quite profound that maybe our friends who are against free trade should think about. He said a week or so ago that 50 per cent of what we use in Canada is imported and 50 per cent of what we produce in Canada is exported. That is the kind of environment that they were all in. We need agreements that will foster and help us maintain those kinds of export situations.
Again, I am somewhat surprised that the NDP is against the enhancement of Mexican people through their own business environment to upgrade themselves in a way where they will have meaningful jobs and bring themselves to a higher level of income and economic
Supply
stability by having good stable employment and by exporting products to other places in North America. I am very surprised that is not in the minds of members of the NDP party.

",Progressive Conservative,,Kenneth Albert James,http://www.parl.gc.ca/parlinfo/Files/Parliamentarian.aspx?Item=9117937f-b7bc-4454-8914-ddeecf186989&Language=E&Section=ALL
