basepk,hid,speechdate,pid,opid,speakeroldname,speakerposition,maintopic,subtopic,subsubtopic,speechtext,speakerparty,speakerriding,speakername,speakerurl
3924963,ca.proc.d.1992-12-01.1,1992-12-01,,,,topic,ROUTINE PROCEEDINGS,,,,,,,
3924964,ca.proc.d.1992-12-01.1.1,1992-12-01,,,,subtopic,ROUTINE PROCEEDINGS,"HEALTH AND WELFARE, SOCIAL AFFAIRS, SENIORS AND STATUS OF WOMEN FIFTH REPORT OF STANDING COMMITTEE",,,,,,
3924965,ca.proc.d.1992-12-01.1.1.1,1992-12-01,5627e87a-8a70-4c57-92d2-88ee2f2152d8,ca.m.522,Hon. Benoit Bouchard (Minister of National Health and Welfare):,Minister of National Health and Welfare,ROUTINE PROCEEDINGS,"HEALTH AND WELFARE, SOCIAL AFFAIRS, SENIORS AND STATUS OF WOMEN FIFTH REPORT OF STANDING COMMITTEE",,"Mr. Speaker, pursuant to Standing Order 109, I have the honour to table, in both official languages, the fifth report of the Standing Committee on Health and Welfare, Social Affairs, Seniors and the Status of Women, entitled ""Foetal Alcohol Syndrome: From Awareness to Prevention"".

",Progressive Conservative,,Benoît Bouchard,http://www.parl.gc.ca/parlinfo/Files/Parliamentarian.aspx?Item=5627e87a-8a70-4c57-92d2-88ee2f2152d8&Language=E&Section=ALL
3924966,ca.proc.d.1992-12-01.1.2,1992-12-01,,,,subtopic,ROUTINE PROCEEDINGS,WORLD AIDS DAY,,,,,,
3924967,ca.proc.d.1992-12-01.1.2.1,1992-12-01,5627e87a-8a70-4c57-92d2-88ee2f2152d8,ca.m.522,Hon. Benoit Bouchard (Minister of National Health and Welfare):,Minister of National Health and Welfare,ROUTINE PROCEEDINGS,WORLD AIDS DAY,,"Mr. Speaker, today is World Aids Day, an annual occasion when all countries and all the citizens of this world are asked to consider the impact of this terrible disease and co-ordinate their efforts in finding better ways to fight HIV infection and AIDS.
The World Health Organization has chosen community commitment as its theme this year, to emphasize how important it is for all communities to take action to fight AIDS, both nationally and internationally.
The HIV AIDS problem concerns health care authorities in particular. However there are also broad political, social, economic and legal implications, as well as some major consequences with respect to human rights and this applies to all countries.
According to the World Health Organization by the year 2000 as many as 40 million people will be infected by HIV and nearly 10 million people will be living with AIDS. Canada is fortunate to have certain resources and therefore has a duty to contribute to international efforts by working with other countries.
We have taken on that responsibility in a number of ways, in addition to our ongoing support for the WHO Global Control Program on AIDS.
Canadians have become leaders in the activities of international bodies such as the Global Control Program on AIDS and the WHO advisory council on HIV and AIDS.

The Canadian International Development Agency plays a key role in Canada's response to the AIDS pandemic. CIDA provides AIDS related assistance through contributions to the global program on AIDS and direct assistance to developing countries.
The International Development Research Council supports AIDS related research in developing countries. Canada also contributes to the global response to HIV AIDS through the expertise of our medical and scientific communities. One contribution that has received worldwide recognition is the development of a simple inexpensive test for the presence of HIV in infants. This test which is now used world-wide requires only a drop of dried blood to test for the presence of the virus.
Our expertise is also shared through the Laboratory Centre for Disease Control at Health and Welfare Canada which acts as a WHO collaborating centre for AIDS research.

We must not only continue to support international efforts but carry on the fight against AIDS in this country. AIDS is a preventable disease.

December 1, 1992
Routine Proceedings
The national AIDS strategy will give the government and its partners the resources to continue to provide Canadians with the information they need to make healthy decisions and adopt the kind of behaviour that will protect them against HIV and AIDS and protect others as well.
We must continue activities that focus on teenagers and pursue efforts to encourage behaviour that will reduce the risk of contracting or transmitting HIV. We must continue to ensure that people who are living with HIV or AIDS can count on the support and concern of the community.
[English ]
Canada's national AIDS strategy has emphasized the importance of partnerships and collaborative action at all levels in achieving our common aims. It has also recognized the importance of ensuring strong active communities in addressing HIV AIDS issues in Canada. The AIDS community action program of the National AIDS strategy funds community efforts in the areas of prevention, care and support.

This government has promised to renew the national AIDS strategy and I will make a public statement in this respect very shortly.

",Progressive Conservative,,Benoît Bouchard,http://www.parl.gc.ca/parlinfo/Files/Parliamentarian.aspx?Item=5627e87a-8a70-4c57-92d2-88ee2f2152d8&Language=E&Section=ALL
3924968,ca.proc.d.1992-12-01.1.2.2,1992-12-01,730cc9f5-da14-4fa5-88b2-156cec591f05,ca.m.3204,Mr. Rey Pagtakhan (Winnipeg North):,,ROUTINE PROCEEDINGS,WORLD AIDS DAY,,"Mr. Speaker, once more Canadians and citizens of the world dedicate today as World AIDS Day. It is right and proper that we make this dedication to continue to reflect on the continuing impact of this disease on people and how we can help.
In Canada alone AIDS had killed over 3,000 Canadians by early this year. One in every 10,000 Canadians is living with the disease and one in every 1,000 Canadians, that is nearly 30,000 Canadians, is infected with the virus.
Among the thousands of Canadians who have died from AIDS in the past 10 years is one man from British Columbia known as Dr. Peter. With a television camera he chronicled the courage it takes to live and die with this terminal illness, finally succumbing a few weeks ago. As television viewers we could share with him and his family the fear and horror of this disease, a scourge that is killing tens of thousands of people yearly throughout the world.
From this one Canadian we go to the dying in Africa, the epidemic proportions of the HIV infection in Asia, to the continuing tragedy in Canada or to the babies born throughout the world with HIV, with this hated virus.
The minister said: ""Canada's national AIDS strategy has emphasized the importance of partnerships and collaborative action at all levels for achieving our common aims. It has also recognized the importance of ensuring strong active communities in addressing HIV AIDS issues in Canada"". He also went on to say that he intended to make an announcement on renewal of the AIDS strategy soon.
I would like to remind the minister that only four months remain before the current funding commitment on the part of this government expires. The people who work for those infected and taken ill by AIDS remain in limbo. They do not know when to renew the leases on the premises they are using or what programs they have to commit to the people that they serve. Why does the minister hesitate?
I would like to remind the minister that on November 13 of this year the Canadian AIDS Society, the Canadian Association for HIV Research, the Canadian Haemophilia Society and the Canadian Public Health Association jointly brought to the attention of the minister their proposal on the need for a renewed federal commitment against AIDS.
They have asked for a commitment on the part of the government of slightly over $55 million per year for the next five years. A positive response on the part of the government to this proposal will be the ultimate test of federal leadership and commitment. It will be the ultimate measure of the government's dedication to World AIDS Day.

",Liberal,,Rey D. Pagtakhan,http://www.parl.gc.ca/parlinfo/Files/Parliamentarian.aspx?Item=730cc9f5-da14-4fa5-88b2-156cec591f05&Language=E&Section=ALL
3924969,ca.proc.d.1992-12-01.1.2.3,1992-12-01,7bac4375-0412-480f-923c-1b938132ecb5,ca.m.2111,Mr. Svend J. Robinson (Burnaby-Kingsway):,,ROUTINE PROCEEDINGS,WORLD AIDS DAY,,"Mr. Speaker, I too rise on this World AIDS Day to call upon the government to renew on behalf of all Canadians our commitment to fight this epidemic both in Canada and globally.
The figures on the impact of AIDS globally are staggering. Some 100,000 people a year die of AIDS, a toll which is expected to rise to over 400,000 by the end of this decade. It has been estimated that by the end of the decade some 40 million people will be living with HIV and some 10 million will be living with AIDS. Jon Gates of the Canadian Council on International Co-operation, himself a person living with AIDS, has pointed
December 1, 1992

out that this was one of the major challenges facing the global community, particularly in Africa and Asia.
In Canada over 30,000 people are living with HIV and according to the most recent figures over 4,000 people have died of AIDS. Today in art galleries, theatres and other cultural places around Canada we are commemorating a day without art to remember the tragic loss of so many cultural workers to AIDS.
We salute the families, the lovers and the friends of those who also feel the pain and helped to bear the crushing burden of this disease. We know as well that over 80 per cent of those who have died of AIDS in Canada to date have been gay men. For this reason I want to underline the importance of the unanimous recommendation of the Canadian AIDS Society, and indeed many others, to amend the Canadian Human Rights Act to prohibit discrimination based on sexual orientation so that in addition to the terrible pain of this disease the sting of discrimination does not have to be faced as well.
AIDS is a preventable disease and we desperately need funding to fight it. Its community organizations are on the front lines. Indeed people living with HIV and AIDS have been central in this struggle. As Don De-Gagne from the Vancouver Persons with AIDS Coalition has pointed out: ""We do not want to be anybody's patient or client. We have firsthand experience with cause and treatment of AIDS. We have to be involved at the highest level of research and decision making"".
As the Canadian AIDS Society, the Canadian Association for HIV Research, the Canadian Public Health Association and the Canadian Haemophilia Society have all pointed out, it is long overdue for this government to renew and increase its commitment to the battle against AIDS.
We have just learned today that the numbers are significantly higher than had previously been estimated. Perhaps as many as 11,000 people are now living with AIDS. It is essential that there be adequate resources to deal with this struggle. In fact the groups that are involved in the front lines have said it will cost some $55
Routine Proceedings
million per year. That is less than the cost of one helicopter.
I appeal to this government to recognize its moral responsibility, not only to those who are living with HIV and AIDS, their families and loved ones but to all Canadians and all those around the world suffering and living with AIDS. There has been too much pain and suffering.
It is time our government ensured the resources which are necessary are there. We need resources to support those who are on the front lines, in communities such as Thunder Bay, the AIDS Committee of Thunder Bay or in larger communities, la ville de Montreal, Vancouver, Winnipeg, Montreal and elsewhere. We must have the funds, and I appeal to this minister to not only renew but to increase the level of funding in this struggle against AIDS.

",New Democratic Party,,Svend Johannes Robinson,http://www.parl.gc.ca/parlinfo/Files/Parliamentarian.aspx?Item=7bac4375-0412-480f-923c-1b938132ecb5&Language=E&Section=ALL
3924970,ca.proc.d.1992-12-01.1.2.4,1992-12-01,dbac4553-6081-4c77-96d2-1b719e05965e,ca.m.7217,Mr. Howard Crosby (Halifax West):,,ROUTINE PROCEEDINGS,WORLD AIDS DAY,,"Mr. Speaker, I would like to have the co-operation of the House in making a brief comment which I am sure members will appreciate.

",Progressive Conservative,,Howard Edward Crosby,http://www.parl.gc.ca/parlinfo/Files/Parliamentarian.aspx?Item=dbac4553-6081-4c77-96d2-1b719e05965e&Language=E&Section=ALL
3924971,ca.proc.d.1992-12-01.1.2.5,1992-12-01,7b50d465-275c-40c4-aee8-6b8c3b99fca8,ca.m.8299,The Acting Speaker (Mr. DeBIois):,Assistant Deputy Chair of Committees of the Whole,ROUTINE PROCEEDINGS,WORLD AIDS DAY,,"Order, please. Is there unanimous consent to give the floor on this statement to the hon. member?

",Progressive Conservative,,Charles Deblois,http://www.parl.gc.ca/parlinfo/Files/Parliamentarian.aspx?Item=7b50d465-275c-40c4-aee8-6b8c3b99fca8&Language=E&Section=ALL
3924972,ca.proc.d.1992-12-01.1.2.6,1992-12-01,intervention,,,,ROUTINE PROCEEDINGS,WORLD AIDS DAY,,"Agreed.

",,,Some hon. members:,
3924973,ca.proc.d.1992-12-01.1.2.7,1992-12-01,dbac4553-6081-4c77-96d2-1b719e05965e,ca.m.7217,Mr. Crosby:,,ROUTINE PROCEEDINGS,WORLD AIDS DAY,,"The recognition of World AIDS Day by the House of Commons provides a unique opportunity to bring to national attention a particular case of a brave couple who are suffering.
Today in the Halifax Chronicle-Herald, as my colleague from Halifax will have noted, there was a disclosure by Randy Conners and his wife Janet Conners that they are victims of AIDS by virtue of his use of Factor 8.
I want to call members' attention to this. By making this disclosure publicly, by focusing attention on their case, Mr. and Mrs. Conners will help us overcome any animosity or any negative attitudes among Canadian people. Mr. Conners has discovered that by the use of a drug in a very innocent way to correct a medical condition, he contracted the HIV virus that has blossomed into AIDS. His wife now has the HIV factor and they face a very difficult and uncertain future.

December 1, 1992
Routine Proceedings
By sharing their difficulties with the public I know they will attract a great deal of support to the cause which hon. members have addressed today and help us overcome any difficulties that are obstacles in the way of resolution of this problem. We all ought to congratulate and honour Mr. and Mrs. Conners for their contribution to a successful campaign against AIDS.

",Progressive Conservative,,Howard Edward Crosby,http://www.parl.gc.ca/parlinfo/Files/Parliamentarian.aspx?Item=dbac4553-6081-4c77-96d2-1b719e05965e&Language=E&Section=ALL
3924974,ca.proc.d.1992-12-01.1.3,1992-12-01,,,,subtopic,ROUTINE PROCEEDINGS,VIOLENCE AGAINST WOMEN,,,,,,
3924975,ca.proc.d.1992-12-01.1.3.1.1,1992-12-01,29e3fa33-f542-476f-88d3-d7da7d2f2404,ca.m.8222,Hon. Mary Collins (Associate Minister of National Defence and Minister Responsible for Status of Women):,Minister responsible for the Status of Women; Associate Minister of National Defence,ROUTINE PROCEEDINGS,VIOLENCE AGAINST WOMEN,NATIONAL DAY OF REMEMBRANCE AND ACTION,"Mr. Speaker, I rise today to address a solemn matter of national importance.
This Sunday, December 6, will be the second year that Canadians will observe a national day of remembrance and action on violence against women. The date marks, as colleagues know, the third anniversary of the tragic death of 14 young women at L'Ecole Polytechnique in Montreal.
This terrible event shocked Canadians so profoundly that we have been transformed by its horror. We have looked violence against women in the face and we have been confronted by our own reflection.
In declaring December 6 as a national day of remembrance and action on violence against women, Parliament challenges Canadians not only to remember but to act to prevent violence against women.

Canadian men and women realize that violence against women is not only a cause but a consequence of women's inequality. Full and complete equality cannot be achieved if women are threatened with violence every day.

Thankfully Canadians are also acting to end such violence by charting a course for fundamental social change, building upon the many years of efforts by women's groups across this country, operating in small towns and large cities. Not only women but men are joining in this cause to make these changes.
In the House today a number of our colleagues are wearing white ribbons as part of the second annual campaign to publicly signal the concern of men against violence against women. I congratulate the organizers of the white ribbon campaign for their courage and their dedication in helping us achieve a common goal.
I am pleased also that so many of the provincial status of women ministers that I have been working with over these years are also joining in this concerted effort. They have been making various announcements and providing additional resources for shelters and sexual assault centres and counselling.
On behalf of all Canadians, the Government of Canada has also taken action. Our focus is on the area of education and prevention, and during 1992 a number of important initiatives have been undertaken. I cite specifically the work of the Canadian Panel on Violence Against Women. That panel has travelled across the country and heard from more than 4,000 individual Canadians representing 1,500 organizations. In its progress report published in August it reported that the magnitude of violence against women across the country is even worse than we have so far documented. It also recorded the strong desire of women for prevention become a priority.
In its very work the panel itself has been a catalyst for change. It has enabled women in many small communities to speak out for the first time on violence and for the communities to start to take action to deal with that violence. I anticipate receiving the panel's national action plan early in the new year. That plan will help all governments and organizations chart our course on this very important journey toward ending violence against women.
Another very important initiative which my colleague, the Minister of National Health and Welfare, announced recently, and I had the pleasure of joining in that announcement, is the establishment of five innovative federally-funded centres of excellence dealing with family violence and violence against women. These centres, which are based in British Columbia, Manitoba, Ontario, Quebec and New Brunswick, really bring a whole new focus. They bring together front line experience with research expertise to really answer some of the underlying questions, provide support to front line workers, and contribute to enduring solutions as well.
December 1, 1992

Legislative initiatives are also important. My colleague, the Minister of Justice, has brought forward two important initiatives this year, including the passage of stricter gun control legislation, the firearms amnesty, and the new sexual assault legislation which legally defines consent in sexual relations for the first time in Canada. This legislation really is a world leader.
Perhaps the most overlooked and under-valued part of the contribution of the federal government has been the $136 million family violence initiative. Many people are not aware of the tremendous range of activities that are being conducted as a result of these efforts that support front line workers in my own province. Mosaic Success, the B.C. Association of Transition Houses, helps them work on education and prevention projects at the grassroots level; work with immigrant and visible minority women; work to train women to actively support victims of wife assault, for example; work in a multi-disciplinary program at the Vancouver General Hospital to identify, treat, refer and provide follow up for battered women who visit the emergency department.
It is not only governments or organizations that can bring about the fundamental changes that are required. Individual actions by all of us are required. As the federal Minister responsible for the Status of Women I am calling on all Canadians to contribute to this change. As parents, educators, employers, community activists, and policy makers in this House each of us has both a role and a responsibility to prevent violence and change the attitudes and behaviours which give rise to the many forms of violence against women in our communities.
Let us honour the memories of all female victims of violence in Canada. Let us honour that memory by acting individually and collectively to put an end to violence against women in all its forms throughout Canadian society.

",Progressive Conservative,,Mary Collins,http://www.parl.gc.ca/parlinfo/Files/Parliamentarian.aspx?Item=29e3fa33-f542-476f-88d3-d7da7d2f2404&Language=E&Section=ALL
3924976,ca.proc.d.1992-12-01.1.3.1.2,1992-12-01,c8685cd7-76ff-41a0-b446-596e604bed66,ca.m.5806,Ms. Mary Clancy (Halifax):,,ROUTINE PROCEEDINGS,VIOLENCE AGAINST WOMEN,NATIONAL DAY OF REMEMBRANCE AND ACTION,"Mr. Speaker, it is three years ago next week since a gunmen killed 14 young women at L'Ecole Polytechnique in Montreal. We remember them, we grieve and we mourn, but most important we must maintain our anger. While it may be more comforting to dismiss this man's actions as those of a deranged individual acting at the margin of society, doing so only blurs the link between individual actions
Routine Proceedings
and societal values, between individual beliefs and societal responsibility.
We are angry and we must maintain that anger because three years later one in ten women is still battered by her male partner. We are angry because 40 per cent of assaulted women were beaten for the first time during their pregnancies, because one in four women will be sexually assaulted in their lifetimes, half of them before they reach the age of 17.
We are angry and we are frightened because 32 per cent of male American university students say they would rape a women if they thought they could get away with it. If the word rape is replaced with the words sexual assault the percentage increases to 50 per cent.
The daily eulogies in our newspapers are even more poignant reminders of unspeakable acts of violence. In my own province of Nova Scotia nine women have been murdered so far this year by men they once loved. Three of those women were murdered while peace bonds, unenforceable, were hanging over the heads allegedly of the men who killed them.
Violence against women in all forms, emotional and psychological abuse, sexual harassment or sexual assault, continues to be experienced daily by women precisely because for so long too few have spoken out against it.

Each one of us has a responsibility to address the issue of violence against women. We must unequivocally denounce sexual discrimination, harassment, violence and, even worse, murder.

Conjugal violence has been considered a domestic issue and all forms of violence against women were considered to be women's problems. This myth is not yet shattered but it must be. It is not enough only to state this; we must provide those engaged in the struggle the means to achieve this goal.
The actions we must take include the mandatory training of judges in our judicial system and a stronger enforcement of peace bonds. The actions we must take include providing money for shelters and counselling programs and harsher sentences to those convicted of violence against women.

December 1, 1992
Routine Proceedings
We must end the economic discrimination which leaves many women with few or no alternatives to ending an abusive relationship. Any solution to violence against women will be as multifaceted as the problem itself. The first step is to stand up and state one's opposition to violence in all its forms. The next step is to take one's convictions and act upon them. We have heard the statements made. It is now necessary to act.

We will remember.

Let there be no more symbols.

",Liberal,,Mary Catherine Clancy,http://www.parl.gc.ca/parlinfo/Files/Parliamentarian.aspx?Item=c8685cd7-76ff-41a0-b446-596e604bed66&Language=E&Section=ALL
