basepk,hid,speechdate,pid,opid,speakeroldname,speakerposition,maintopic,subtopic,subsubtopic,speechtext,speakerparty,speakerriding,speakername,speakerurl
3925038,ca.proc.d.1992-12-01.2.1.38,1992-12-01,b584b209-262d-4ff7-afff-ad7b64ef8c69,ca.m.7278,Mr. MacLaren:,,GOVERNMENT ORDERS,"ALLOTTED DAY, S. O. 81-TRADE",,"I have to think that the NDP has some vision of a golden age in the past when Canada benefited from its export of raw materials and seemingly benefited from the protectionism that was provided for branch plant manufacturing in Canada. That age is gone. If it ever was a golden age, it certainly is not here today.
What has happened in the world, what has happened everywhere is that change in technology has meant a global investment and trade marketplace. Global investment can move readily across the world; global trade is growing everywhere.
In the face of that the NDP would say scrap everything. Free trade is out. It does not want anything to do with anything.
The second thing that this resolution says, and it is quite evident from its tone, is that the NDP does not recognize the importance of trade to Canada. One-third of our Gross National Product arises directly from trade. The private sector is heavily dependent on exports. Canadian workers are heavily dependent on our ability to achieve secure and enhanced access to international markets.
Supply
It is for that reason that the leader of the Liberal Party said some time ago: ""In today's world protectionism is not right or left wing. It is simply passe. Globalism is not right or left wing. It is a fact of life"".
The federal NDP does not seem to recognize this. I am not sure, however, that the NDP provincial governments do not recognize it. Each of those three NDP governments, heavily saddled with their deficits, is seeking international markets, improved access to markets, scurrying about the world trying to drum up business for its products. I do not hear the premiers saying reject improved access, reject enhanced access to international markets as the federal NDP members are doing.
I would have thought that those two parts of the NDP would get together. I would also add that the trade critic of the NDP, who is not here today for this debate said recently that the NDP has no alternative trade policy. The NDP would first scrap the North American free trade agreement and then later announce what its policy is.
Surely the NDP does not think the Canadian people are quite that silly, to buy a pig in a poke.
What is the NDP telling us with this resolution? It is against all regional freer trade arrangements? Is it saying it is opposed in principle, for example, to the growth of the European Community or that it is opposed to the incipient regional arrangements in Asia? Is that what it means when it says it would scrap any North American free trade agreement because it violates its concept that we should put all our eggs in the multilateral basket, that is to say, into the GATT? That may be an argument if it wishes to pursue it, but let it say so clearly.
If it is going to adopt that as its trade policy, then would it answer the question of whether in turning its back on the freer access to a market of more than 360 million people, it will support the GATT, including the proposed international trade organization that is a central element in the Uruguay round now nearing completion? Is that its policy?
I do not know that it is. I do not think it is. One of its members in this House has called for the withdrawal of Canada from the GATT. The NDP would tear up not just this but any free trade agreement in North America and

December 1, 1992
Supply
at least one of its members thinks at the same time that Canada should withdraw from the GATT.
We cannot turn the clock back any more than we can turn our back on a North American market with improved and enhanced access.
Our view was from the beginning of the proposal to negotiate a North American free trade agreement that Canada had to be at the table.
We believed that Canada had to be at the table to protect our own interests in North American trade. Otherwise, among other things, if there were a U.S.-Mexico free trade arrangement and a U.S.-Canada free trade arrangement separately, only one country, the United States, would have access to the other two countries on a tariff free basis.
That hub and spoke arrangement was certainly unacceptable to us on this side of the House. For that reason, among others, we thought Canada had to be at the negotiating table. However, the result of Canada's negotiation of the North American free trade agreement is that we have an accord which is both incomplete and flawed.
I want to recall to the House that the leader of the Liberal party said some time ago with reference to the Canada-U.S. Free Trade Agreement: ""The free trade agreement must be modified. A Liberal government would go back to the negotiating table to achieve the necessary changes as well as to deal with the definition of subsidies. I have always said that we would rather renegotiate the free trade agreement than abrogate it. I would expect that our American partners will join us to find solutions. It is in their interest as well as ours"". That same thinking has now been transferred to the North American free trade agreement which is pending before the three countries.
More specifically we on this side of the House, in pointing out repeatedly that the agreement as negotiated is both incomplete and flawed, drew attention to the fact that it lacks a subsidy and anti-dumping code. There is no clear statement of subsidy definition. There is no subsidy definition at all or a parallel anti-dumping code in the proposed North American free trade agreement.
Second, we urged repeatedly that increased environmental protection and, perhaps more important, enforcement should be a central part of a North American free trade agreement. We looked for revised energy provisions, taking into account the varying commitments on behalf of Mexico and Canada. We sought in the context of the NAFTA negotiations improved labour standards, including the safety of workers.
We would seek, as my colleague from Ottawa South commented a few minutes ago, dispute procedures that would be more binding and effective. We have not seen that come out of the negotiations. Finally, it is a domestic issue, but we sought and have sought repeatedly on this side of the House that the government recognize that freer trade inevitably brings a degree of dislocation.
Therefore we sought and have repeatedly urged the government to match its commitment to freer trade with adjustment assistance to help Canadian workers and firms adapt to a greater trade liberalization globally. That commitment is still lacking and there is no evidence yet that this government is taking seriously the real need in Canada to provide that range of adjustment assistance to help Canadians become more competitive globally as well as in the context of the North American free trade agreement.
I have spoken for a moment or two about some of the changes that we thought NAFTA should include, but I want to draw to the attention of the House that the president-elect of the United States has been saying much the same sort of thing.
I want to quote Governor Clinton who in October stated: ""As president, I will seek to address the deficiencies of the North American free trade agreement through supplemental agreements with the Canadian and Mexican governments. I will not sign the legislation implementing the North American free trade agreement until we have reached additional agreements to protect environment and labour standards"".
There is the opportunity for us on this side of the House to realize our ambitions to see the North American Free Trade Agreement modified, improved, changed and renegotiated to provide for those provisions which the president-elect has in mind and the other provisions which I touched on a moment ago.

The real question is simply this: Beyond the North American free trade agreement there are forces at work. Basic issues have arisen that this facetious resolution of the NDP does not address. What are they talking about? They are going to scrap any freer trade agreement in North America. Yet, behind that movement to freer trade in North America are the same challenges that face Canadians on a global basis. What do they think we should be doing in Canada to render ourselves more competitive? I do not hear anything from the NDP about interprovincial trade barriers. Obviously we have to achieve a true common market within our own country, provide for the free movement of goods, people and services if we hope to compete effectively abroad. Are they deterred by the fact that they have three NDP provincial governments at loggerheads quite often with the federal NDP? Is that what their problem is? If it is, let them say it. Otherwise let them share with the Canadian people what their polity is, what domestic measures they think are required to make Canadians more competitive.
We on this side of the House have repeatedly shared with the Canadian people our commitment to improved education, to better training and retraining, to a greater commitment to research and development, to better science and technology support, and to the elimination of interprovincial trade barriers. These are a range of issues that are within our own mastery. They are our problems in Canada to deal with.
The motion fails to convey to the Canadian people what the NDP would do in the face of the global challenges that are everywhere evident.
For that and other reasons, I want to move:
That the motion be amended by removing all the words after the
word ""reject"" and replacing them with the following:
- all North American free trade agreements that fail to promote
Canadian workers and jobs, and fail to safeguard the environment.

",Liberal,,Roy MacLaren,http://www.parl.gc.ca/parlinfo/Files/Parliamentarian.aspx?Item=b584b209-262d-4ff7-afff-ad7b64ef8c69&Language=E&Section=ALL
3925039,ca.proc.d.1992-12-01.2.1.39,1992-12-01,65f64341-6e0c-46ae-8714-7a9e85e191fa,ca.m.4051,Mr. Nelson A. Riis (Kamloops):,N.D.P. House Leader,GOVERNMENT ORDERS,"ALLOTTED DAY, S. O. 81-TRADE",,"Mr. Speaker, I listened carefully to my hon. friend's comments. I want to thank him for clarifying the Liberal Party's position that it supports the notion of free trade with some changes
Supply
perhaps to the Mexico-United States-Canada agreement it would feel comfortable going along with that. That is what he wanted to clarify. I guess he is complimenting his colleague in British Columbia wherein they had a chance to vote on the Mexico-United States- Canada trade deal and voted in favour of it in its present form, which I thought was an interesting clarification because there has been mystification around the Liberal position.
I want to clarify for my hon. friend that while his party thinks that putting all of our export eggs into the American basket is a good idea-as a matter of fact in 1988 72.8 per cent of our exports went to the United States and this past year it was increased to 76.3 per cent-presumably as time goes on this trade deal will essentially make us completely and totally dependent upon the fortunes of the United States. I think that anybody who looks around at the world economy will realize that hanging our future onto the falling American star is probably not a good idea, at least that is not what we want.
I am reading from a publication from the Congress of the United States that has done a thorough analysis of the agreement. It had this to say, and I ask my hon. friend if he would concur with the United States Congress when it says the following:
The greatest danger of NAFTA is that it could bring out the worst in each country. Hade and investment liberalization could reinforce commitment to low-wage business strategies among U.S., Canadian, and Mexican firms; destabilize the attempt to foster less adversarial relations between labour and management; weaken the commitment of U.S. corporations to train less educated U.S. workers; reduce incentives for small and medium-sized U.S. firms to construct and participate in co-operative networks aimed at fostering innovation and technology diffusion;
It goes on to say:
The combined effect would be to encourage growing numbers of U.S. firms to pursue business strategies depending on or compatible with production in Mexico.
-a low-wage path would widen the gap between workers' aspirations and the jobs available to them. It would likewise widen the gap between the rich and the poor.

December 1, 1992
Supply
Those comments came out of the examination of the Congress of the United States. I wonder if my hon. friend who just spoke would agree with those sentiments.

",New Democratic Party,,Nelson Andrew Riis,http://www.parl.gc.ca/parlinfo/Files/Parliamentarian.aspx?Item=65f64341-6e0c-46ae-8714-7a9e85e191fa&Language=E&Section=ALL
3925040,ca.proc.d.1992-12-01.2.1.40,1992-12-01,b584b209-262d-4ff7-afff-ad7b64ef8c69,ca.m.7278,Mr. MacLaren:,,GOVERNMENT ORDERS,"ALLOTTED DAY, S. O. 81-TRADE",,"If the member had listened to what I said instead of attempting to put instructions on it he would have understood the policy of our party is to seek change to the proposed North American free trade agreement in the areas I enumerated earlier. We seek change in those areas. We do so in full recognition that only in that way can the agreement work to the benefit of all Canadians.
Second, we parallel that commitment with a commitment to global freer trade. We support the current Uruguay round of the GATT. We support the diversification of Canadian trade. We seek, unlike this present government with its continental obsessions, a broader base for our trade through much more active trade promotion and development in Asia and Europe. That might include the possibilities of new institutional arrangements between Canada and Asia or Canada and the European Community, but all would be directed to that diversification of our trade base which can only bring benefit to Canadians.
However, neither of these points do I hear from the NDP, nor is there any indication it recognizes those two parallel developments: changes in the proposed North American free trade agreement and a real commitment to diversification both through the GATT and bilaterally of our trade interest will ensure Canadians have a sound and sensible international trade policy.

",Liberal,,Roy MacLaren,http://www.parl.gc.ca/parlinfo/Files/Parliamentarian.aspx?Item=b584b209-262d-4ff7-afff-ad7b64ef8c69&Language=E&Section=ALL
3925041,ca.proc.d.1992-12-01.2.1.41,1992-12-01,ebe8c134-a268-4c7b-961f-586efaa243a1,ca.m.6261,Mr. Don Blenkarn (Mississauga South):,,GOVERNMENT ORDERS,"ALLOTTED DAY, S. O. 81-TRADE",,"I was wondering if the member who just spoke understands, if he listened to the minister, this debate today is on the North American free trade agreement and not on the GATT. The minister is heavily involved in the GATT and he knows that. This party and this government are 100 per cent in favour of expanding our trade to the world. To suggest we are only in the North American basket, as evidenced by the New Democratic Party is just so much drivel.
I wonder if the member would really come clean with us. Does his party like an agreement with Mexico or does it not like an agreement with Mexico? He says he has problems with certain parts. He wants certain parts of
the agreement renegotiated. The government has negotiated and negotiated and negotiated. The question is: Do you take the deal as it is or do you leave the deal up the river? The answer is this: You cannot unilaterally amend a negotiation. You negotiate and get what you can while protecting the interests you want to protect and maybe not getting all the things you would like.
The issue really is whether we keep the agreement or not. I think it is time the Liberal Party came clean.
After all, this is really a terrible agreement. We sell $500,000 million worth of goods to Mexico. It brings $1.5 billion worth of goods into Canada. The agreement is not going to hurt labour or hurt anybody in Canada. It will only open up markets.
Surely the Liberal Party has to come out in favour of an agreement that would open up markets for Canada. We have everything to gain from this agreement and nothing to lose. Why does he not come out and say the Liberal Party is in favour of an agreement? Sure we would like it to be better, but we are in favour of the agreement.

",Progressive Conservative,,Donald Alex Blenkarn,http://www.parl.gc.ca/parlinfo/Files/Parliamentarian.aspx?Item=ebe8c134-a268-4c7b-961f-586efaa243a1&Language=E&Section=ALL
3925042,ca.proc.d.1992-12-01.2.1.42,1992-12-01,b584b209-262d-4ff7-afff-ad7b64ef8c69,ca.m.7278,Mr. MacLaren:,,GOVERNMENT ORDERS,"ALLOTTED DAY, S. O. 81-TRADE",,"Mr. Speaker, I am afraid the hon. member for Mississauga South is unable to follow the argument which I have presented today. He seems to see things in very black and white, yes or no terms.
That is not the point. He must know it is not the point. He should listen when I say our policy is to seek change and improvement to the nature of a North American free trade agreement. Now who happens along with that same basic policy? No one else but the President-elect of the United States, who would disagree with the hon. member for Mississauga South.
The hon. member for Mississauga South says: ""The agreement is just fine the way it is. In fact, it is absolutely perfect the way it is."" That is a reckless course. It is as reckless as the NDP saying any agreement is out of the question, however it might benefit Canadians. Those are two reckless courses to pursue.
We are saying we will seek change and improvement in the proposed agreement. It is the very thing the President-elect of the United States has been saying about the provisions regarding environmental protection, worker safety and employment standards and their enforceability.
December 1, 1992

Those two major issues must be addressed. The President-elect of the United States has committed himself to not proceed with the signing of the legislation implementing the North American agreement until such improvements and changes are made.
We will be there too with our proposals and changes. I assure those on this side of the House when this party forms the government, we will deliver freer trade for Canadians matched by domestic commitments that will bring real benefits to every Canadian.

",Liberal,,Roy MacLaren,http://www.parl.gc.ca/parlinfo/Files/Parliamentarian.aspx?Item=b584b209-262d-4ff7-afff-ad7b64ef8c69&Language=E&Section=ALL
3925043,ca.proc.d.1992-12-01.2.1.43,1992-12-01,65f64341-6e0c-46ae-8714-7a9e85e191fa,ca.m.4051,Mr. Riis:,N.D.P. House Leader,GOVERNMENT ORDERS,"ALLOTTED DAY, S. O. 81-TRADE",,"Mr. Speaker, I listened carefully to my hon. friend and I think he inadvertently misled the House. I know he would want to clarify what he just said when he told us the New Democratic Party was opposed to any trade agreement.
We have always supported trade agreements like the auto pact which was in Canada's best interest.

",New Democratic Party,,Nelson Andrew Riis,http://www.parl.gc.ca/parlinfo/Files/Parliamentarian.aspx?Item=65f64341-6e0c-46ae-8714-7a9e85e191fa&Language=E&Section=ALL
3925044,ca.proc.d.1992-12-01.2.1.44,1992-12-01,ebe8c134-a268-4c7b-961f-586efaa243a1,ca.m.6261,Mr. Blenkarn:,,GOVERNMENT ORDERS,"ALLOTTED DAY, S. O. 81-TRADE",,"You didn't support that either.

",Progressive Conservative,,Donald Alex Blenkarn,http://www.parl.gc.ca/parlinfo/Files/Parliamentarian.aspx?Item=ebe8c134-a268-4c7b-961f-586efaa243a1&Language=E&Section=ALL
3925045,ca.proc.d.1992-12-01.2.1.45,1992-12-01,65f64341-6e0c-46ae-8714-7a9e85e191fa,ca.m.4051,Mr. Riis:,N.D.P. House Leader,GOVERNMENT ORDERS,"ALLOTTED DAY, S. O. 81-TRADE",,"A free trade agreement is what we oppose. That is a clarification.

",New Democratic Party,,Nelson Andrew Riis,http://www.parl.gc.ca/parlinfo/Files/Parliamentarian.aspx?Item=65f64341-6e0c-46ae-8714-7a9e85e191fa&Language=E&Section=ALL
3925046,ca.proc.d.1992-12-01.2.1.46,1992-12-01,7b50d465-275c-40c4-aee8-6b8c3b99fca8,ca.m.8299,The Acting Speaker (Mr. DeBlois):,Assistant Deputy Chair of Committees of the Whole,GOVERNMENT ORDERS,"ALLOTTED DAY, S. O. 81-TRADE",,"Order, please. I think the point raised by the hon. member is a matter of debate.
After consideration, I declare the amendment tabled by the hon. member for Etobicoke North in order.

",Progressive Conservative,,Charles Deblois,http://www.parl.gc.ca/parlinfo/Files/Parliamentarian.aspx?Item=7b50d465-275c-40c4-aee8-6b8c3b99fca8&Language=E&Section=ALL
