basepk,hid,speechdate,pid,opid,speakeroldname,speakerposition,maintopic,subtopic,subsubtopic,speechtext,speakerparty,speakerriding,speakername,speakerurl
3925126,ca.proc.d.1992-12-01.3.4.1,1992-12-01,1d08ba9e-539b-40c9-bee4-9df3fc8b36ee,ca.m.7699,Mr. Iain Angus (Thunder Bay-Atikokan):,Whip of the N.D.P.,ORAL QUESTIONS,AIRLINE INDUSTRY,,"Mr. Speaker, I have had the opportunity to review the letter signed by the Minister of Transport to Rhys Eyton, Chairman, President and CEO of PWA corporation, along with the government loan facility term sheet which outlines the conditions the government has demanded of Canadian in return for the initial $50 million assistance.
Through you, Mr. Speaker, to the Minister of State for Transport, this document seems to suggest a government that does not believe in intervention has intervened in a number of weird and wonderful ways, including a veto over the security of assets, sale of any equipment or assets and the amalgamation, merger or consolidation of the company with a non-partner. The one area the government did not ask for a veto on is the proposal by American Airlines to acquire 40 per cent of Canadian Airlines.
Why did the government choose not to ask for a say in this very important strategic decision by PWA?

",New Democratic Party,,Iain Francis Angus,http://www.parl.gc.ca/parlinfo/Files/Parliamentarian.aspx?Item=1d08ba9e-539b-40c9-bee4-9df3fc8b36ee&Language=E&Section=ALL
3925127,ca.proc.d.1992-12-01.3.4.2,1992-12-01,db5717d9-9a0a-4252-8107-5541dbd989e0,ca.m.1780,Hon. Shirley Martin (Minister of State (Transport)):,Minister of State (Transport),ORAL QUESTIONS,AIRLINE INDUSTRY,,"Mr. Speaker, indeed there were conditions along with the loan to make sure that we as a government protected the taxpayers' investment in this particular situation.
Oral Questions
As far as the agreement with AMR is concerned, anything that comes forward on that would first have to go to the National Transportation Agency to see whether or not it would be acceptable.

",Progressive Conservative,,Shirley Martin,http://www.parl.gc.ca/parlinfo/Files/Parliamentarian.aspx?Item=db5717d9-9a0a-4252-8107-5541dbd989e0&Language=E&Section=ALL
3925128,ca.proc.d.1992-12-01.3.4.3,1992-12-01,1d08ba9e-539b-40c9-bee4-9df3fc8b36ee,ca.m.7699,Mr. Iain Angus (Thunder Bay-Atikokan):,Whip of the N.D.P.,ORAL QUESTIONS,AIRLINE INDUSTRY,,"Mr. Speaker, I have a supplementary question. At some point in time the Government of Canada must take responsibility for the decisions or the future of the industry.
The other item that was included in this document makes it very clear that the Government of Canada wants Canadian Airlines and Air Canada to meet with the government to try to find a long-term solution to the crisis that affects the industry.
Has a date been set for that meeting? Could the minister explain to this House and to the people of Canada what proposal will be on the table from the Government of Canada to the two carriers for the rationalization of the industry?

",New Democratic Party,,Iain Francis Angus,http://www.parl.gc.ca/parlinfo/Files/Parliamentarian.aspx?Item=1d08ba9e-539b-40c9-bee4-9df3fc8b36ee&Language=E&Section=ALL
3925129,ca.proc.d.1992-12-01.3.4.4,1992-12-01,db5717d9-9a0a-4252-8107-5541dbd989e0,ca.m.1780,Hon. Shirley Martin (Minister of State (Transport)):,Minister of State (Transport),ORAL QUESTIONS,AIRLINE INDUSTRY,,"Mr. Speaker, no, a date has not been set on that particular meeting. The discussions that will take place will look for input from the airlines themselves to see what suggestions they have as far as the industry and the growth of it are concerned.

",Progressive Conservative,,Shirley Martin,http://www.parl.gc.ca/parlinfo/Files/Parliamentarian.aspx?Item=db5717d9-9a0a-4252-8107-5541dbd989e0&Language=E&Section=ALL
3925130,ca.proc.d.1992-12-01.3.5,1992-12-01,,,,subtopic,ORAL QUESTIONS,CANADIAN NATIONAL,,,,,,
3925131,ca.proc.d.1992-12-01.3.5.1,1992-12-01,c8685cd7-76ff-41a0-b446-596e604bed66,ca.m.5806,Ms. Mary Clancy (Halifax):,,ORAL QUESTIONS,CANADIAN NATIONAL,,"Mr. Speaker, CN has announced that it will lay off 10,000 workers. This means that 70 per cent of CN workers in Atlantic Canada will be walking the unemployment lines in the near future.
What if anything is the Prime Minister prepared to do to stop the haemorrhaging of jobs in Atlantic Canada?

",Liberal,,Mary Catherine Clancy,http://www.parl.gc.ca/parlinfo/Files/Parliamentarian.aspx?Item=c8685cd7-76ff-41a0-b446-596e604bed66&Language=E&Section=ALL
3925132,ca.proc.d.1992-12-01.3.5.2,1992-12-01,db5717d9-9a0a-4252-8107-5541dbd989e0,ca.m.1780,Hon. Shirley Martin (Minister of State (Transport)):,Minister of State (Transport),ORAL QUESTIONS,CANADIAN NATIONAL,,"Madam Speaker, the announcement of the loss of 10,000 jobs came from a discussion that CN has had with its employees.
CN is making decisions for their future. It is doing what any good management team should do, and that is discussing it with the employees first.

",Progressive Conservative,,Shirley Martin,http://www.parl.gc.ca/parlinfo/Files/Parliamentarian.aspx?Item=db5717d9-9a0a-4252-8107-5541dbd989e0&Language=E&Section=ALL
3925133,ca.proc.d.1992-12-01.3.5.3,1992-12-01,c8685cd7-76ff-41a0-b446-596e604bed66,ca.m.5806,Ms. Mary Clancy (Halifax):,,ORAL QUESTIONS,CANADIAN NATIONAL,,"Mr. Speaker, I am sure that CN's employees did not suggest that it cut 10,000 jobs. Maybe it is time for the government to make some suggestions in its place. These cuts are the result of recession and the results of unfair taxes.

December 1, 1992
Oral Questions
CP and CN Rail are taxed 54 per cent more than U.S. carriers. Deregulation has devastated the Atlantic region.
What specific fiscal and regulatory proposals is the Prime Minister prepared to make in order to level the playing field for once?

",Liberal,,Mary Catherine Clancy,http://www.parl.gc.ca/parlinfo/Files/Parliamentarian.aspx?Item=c8685cd7-76ff-41a0-b446-596e604bed66&Language=E&Section=ALL
3925134,ca.proc.d.1992-12-01.3.5.4,1992-12-01,db5717d9-9a0a-4252-8107-5541dbd989e0,ca.m.1780,Hon. Shirley Martin (Minister of State (Transport)):,Minister of State (Transport),ORAL QUESTIONS,CANADIAN NATIONAL,,"Mr. Speaker, work has been taking place to help level the playing field in the trucking industry, the air industry and the rail industry.
If the hon. member will look at the tax structure, she will find that there are far more taxes municipally and provincially than there are federally.

",Progressive Conservative,,Shirley Martin,http://www.parl.gc.ca/parlinfo/Files/Parliamentarian.aspx?Item=db5717d9-9a0a-4252-8107-5541dbd989e0&Language=E&Section=ALL
3925135,ca.proc.d.1992-12-01.3.6,1992-12-01,,,,subtopic,ORAL QUESTIONS,AIRLINE INDUSTRY,,,,,,
3925136,ca.proc.d.1992-12-01.3.6.1,1992-12-01,727ca7a8-0609-48eb-b6f3-01d086548302,ca.m.4682,Mr. John Manley (Ottawa South):,,ORAL QUESTIONS,AIRLINE INDUSTRY,,"Mr. Speaker, now that the media have made available to us a copy of the terms of the government financial assistance to Canadian Airlines, we know for a fact that the government sought and obtained the agreement of PWA not to seek any further financial assistance from the Government of Canada.
My question therefore is: Will the government now advise the House of the basis upon which the Minister of Justice last week promised employees of Canadian Airlines International that more loan guarantees may be forthcoming? What exactly is this government's airline policy?

",Liberal,,John Paul Manley,http://www.parl.gc.ca/parlinfo/Files/Parliamentarian.aspx?Item=727ca7a8-0609-48eb-b6f3-01d086548302&Language=E&Section=ALL
3925137,ca.proc.d.1992-12-01.3.6.2,1992-12-01,db5717d9-9a0a-4252-8107-5541dbd989e0,ca.m.1780,Hon. Shirley Martin (Minister of State (Transport)):,Minister of State (Transport),ORAL QUESTIONS,AIRLINE INDUSTRY,,"Mr. Speaker, PWA and its hard working employees would have a much easier time of making their company grow and be successful if they had more co-operation and less looking for nefarious plots on behalf of the work that is trying to be done to help the employees and the company.

",Progressive Conservative,,Shirley Martin,http://www.parl.gc.ca/parlinfo/Files/Parliamentarian.aspx?Item=db5717d9-9a0a-4252-8107-5541dbd989e0&Language=E&Section=ALL
3925138,ca.proc.d.1992-12-01.3.6.3,1992-12-01,727ca7a8-0609-48eb-b6f3-01d086548302,ca.m.4682,Mr. John Manley (Ottawa South):,,ORAL QUESTIONS,AIRLINE INDUSTRY,,"Mr. Speaker, the terms of the loan agreement also provide that the government will be entering into further discussions with the lender to consider alternatives to address financial difficulties on the part of PWA as well as the meetings with Air Canada that were previously referred to.
I would like the government to be clear on one thing. Is it that the Government of Canada believes the
possible merger of the two national airlines is the best solution to the airline problem that confronts Canadians?

",Liberal,,John Paul Manley,http://www.parl.gc.ca/parlinfo/Files/Parliamentarian.aspx?Item=727ca7a8-0609-48eb-b6f3-01d086548302&Language=E&Section=ALL
3925139,ca.proc.d.1992-12-01.3.6.4,1992-12-01,db5717d9-9a0a-4252-8107-5541dbd989e0,ca.m.1780,Hon. Shirley Martin (Minister of State (Transport)):,Minister of State (Transport),ORAL QUESTIONS,AIRLINE INDUSTRY,,"Mr. Speaker, the work that we are doing is to assist PWA and its employees who are trying to help the company. We are working at this time with PWA.

",Progressive Conservative,,Shirley Martin,http://www.parl.gc.ca/parlinfo/Files/Parliamentarian.aspx?Item=db5717d9-9a0a-4252-8107-5541dbd989e0&Language=E&Section=ALL
3925140,ca.proc.d.1992-12-01.3.7,1992-12-01,,,,subtopic,ORAL QUESTIONS,PEARSON INTERNATIONAL AIRPORT,,,,,,
3925141,ca.proc.d.1992-12-01.3.7.1,1992-12-01,ebe8c134-a268-4c7b-961f-586efaa243a1,ca.m.6261,Mr. Don Blenkarn (Mississauga South):,,ORAL QUESTIONS,PEARSON INTERNATIONAL AIRPORT,,"Mr. Speaker, my question is for the Minister of State for the Environment. The minister of state will know that over a year has passed since the environmental hearings concerning the expansion at Pearson International Airport.
The minister will know that the report has not been out. There is at least $1.6 billion worth of work in needed construction, with construction workers out of work in Toronto, that could be done now if that report was available.
Will the minister do something to get the report out as soon as possible? Will the minister, while she is at it, organize a new statute to alter the environmental rules so that environmental hearings can be heard and reports can be out from those hearings in a month after the hearings are complete?

",Progressive Conservative,,Donald Alex Blenkarn,http://www.parl.gc.ca/parlinfo/Files/Parliamentarian.aspx?Item=ebe8c134-a268-4c7b-961f-586efaa243a1&Language=E&Section=ALL
3925142,ca.proc.d.1992-12-01.3.7.2,1992-12-01,fe696a31-aed5-4b2a-87c5-cce81f2593c2,ca.m.9362,Hon. Pauline Browes (Minister of State (Environment)):,Minister of State (Environment),ORAL QUESTIONS,PEARSON INTERNATIONAL AIRPORT,,"Mr. Speaker, the environmental assessment process indeed is sometimes a long one in order to have a comprehensive review, to give the public an opportunity to make submissions and to allow for the gathering of information and the panel receives that information.
I am pleased to report to the member that the review on the Toronto international airport assessment is in our hands now. It is in the process of being translated and will be available to the member and to the House in the next few days.

",Progressive Conservative,,Pauline Browes,http://www.parl.gc.ca/parlinfo/Files/Parliamentarian.aspx?Item=fe696a31-aed5-4b2a-87c5-cce81f2593c2&Language=E&Section=ALL
3925143,ca.proc.d.1992-12-01.3.7.3,1992-12-01,7bac4375-0412-480f-923c-1b938132ecb5,ca.m.2111,Mr. Svend J. Robinson (Burnaby-Kingsway):,,ORAL QUESTIONS,PEARSON INTERNATIONAL AIRPORT,,"Mr. Speaker, my question is for the Minister of National Health and Welfare which follows up earlier questions today on World AIDS Day. It is less than four months until federal funding for AIDS runs out.
December 1, 1992

Unfortunately, the uncertainty about continued funding for AIDS is already having a very adverse impact, particularly on community-based groups funded under ACAP.
In view of the fact that we learned today that the number of people with HIV and AIDS is far higher than previously estimated, why has this government still not made a commitment, still not responded to the urgent call for $55 million a year over five years for the Canadian AIDS Society, the Canadian HIV Research Foundation, the Canadian Public Health Association and the Canadian Hemophilia Society? Why this silence when too often silence equals death?

",New Democratic Party,,Svend Johannes Robinson,http://www.parl.gc.ca/parlinfo/Files/Parliamentarian.aspx?Item=7bac4375-0412-480f-923c-1b938132ecb5&Language=E&Section=ALL
3925144,ca.proc.d.1992-12-01.3.7.4,1992-12-01,5627e87a-8a70-4c57-92d2-88ee2f2152d8,ca.m.522,Hon. Benoit Bouchard (Minister of National Health and Welfare):,Minister of National Health and Welfare,ORAL QUESTIONS,PEARSON INTERNATIONAL AIRPORT,,"Mr. Speaker, I said before and I say again that we will continue to support the national AIDS strategy after April 1. That has nothing to do with the problem we face today.
By the way, ACAP has been increased by $7 million to help community organizations to be able to fight against AIDS.
Canadians should be aware that it is a collective action by all Canadians against AIDS. We will once again support the strategy, but it has nothing to do in terms of what happens today because the strategy runs until April 1. The money is there and we are doing what was committed to be done.
I do not understand why the hon. member wants a commitment today about something which will run until April 1.

",Progressive Conservative,,Benoît Bouchard,http://www.parl.gc.ca/parlinfo/Files/Parliamentarian.aspx?Item=5627e87a-8a70-4c57-92d2-88ee2f2152d8&Language=E&Section=ALL
3925145,ca.proc.d.1992-12-01.3.8,1992-12-01,,,,subtopic,ORAL QUESTIONS,SEXUAL ORIENTATION,,,,,,
3925146,ca.proc.d.1992-12-01.3.8.1,1992-12-01,7bac4375-0412-480f-923c-1b938132ecb5,ca.m.2111,Mr. Svend J. Robinson (Burnaby-Kingsway):,,ORAL QUESTIONS,SEXUAL ORIENTATION,,"Mr. Speaker, Canadians are wondering about the morality of a government that can find $4 billion for attack helicopters but cannot find the basic funds necessary in the battle against AIDS.
My supplementary question is for the Minister of Justice. The minister will know that gay men living with AIDS have to confront not only HIV, but too often also the virus of discrimination, fear and violence.
Oral Questions
In light of this, and in light of the recent Ontario Court of Appeal decision in Haig and Birch, why has this minister and this government betrayed the promise that was made to amend the Canadian Human Rights Act to prohibit discrimination based on sexual orientation?

",New Democratic Party,,Svend Johannes Robinson,http://www.parl.gc.ca/parlinfo/Files/Parliamentarian.aspx?Item=7bac4375-0412-480f-923c-1b938132ecb5&Language=E&Section=ALL
3925147,ca.proc.d.1992-12-01.3.8.2,1992-12-01,10048127-35a6-4f46-8dda-e7afb7584c09,ca.m.4320,Hon. Kim Campbell (Minister of Justice and Attorney General of Canada):,Minister of Justice and Attorney General of Canada,ORAL QUESTIONS,SEXUAL ORIENTATION,,"Mr. Speaker, the commitment of the Government of Canada in 1986 was to do everything in its power to remove sexual orientation as grounds for discrimination in areas of federal jurisdiction.
That has in fact been accomplished, as a result of the decision in Haig, and it was our conscious decision not to appeal Haig, and the changes made in the policy of the Department of National Defence. I have every intention of moving ahead with this in terms of legislative changes. As a result of some of the events over the summer, in particular the Leshner decision in Ontario and Ontario's decision not to appeal it, I want to ensure that legislation I bring forward to this House will be consistent with the charter.
I believe there is a matter before the Supreme Court of Canada that will give the government the guidance it needs in order that I may be assured I have done my duty in terms of the legislation I bring forward.

",Progressive Conservative,,A. Kim Campbell,http://www.parl.gc.ca/parlinfo/Files/Parliamentarian.aspx?Item=10048127-35a6-4f46-8dda-e7afb7584c09&Language=E&Section=ALL
3925148,ca.proc.d.1992-12-01.3.9,1992-12-01,,,,subtopic,ORAL QUESTIONS,SMALL BUSINESS,,,,,,
3925149,ca.proc.d.1992-12-01.3.9.1,1992-12-01,unmatched,,,,ORAL QUESTIONS,SMALL BUSINESS,,"My question is directed to the minister responsible for small business.
It does not matter how low interest rates are or how much the government encourages small businesses to expand and create jobs if the country's banks will not make loans. Entrepreneurs in my riding are complaining bitterly that bankers will not take a risk on them. I think small business needs action now.
What is the government going to do to make the bankers get off their assets and make more loans to small business?
Hon. Tom Hockin (Minister of State (Small Businesses
and Tourism)): Mr. Speaker, if I thought it would help I would give the banks a swift kick in their assets. Instead, I have passed on the very message the hon. member passed on to the banks just two weeks ago.

December 1, 1992
Oral Questions
The Canadian Bankers Association and the heads of the major chartered banks reported to me that there is a slight increase in loans to small businesses and that they have frozen service charges. That is not enough. There has to be a major expansion of credit.
The Federal Business Development Bank has increased its loan levels by 16 per cent during this past year. We are going to bring in an improved Small Businesses Loans Act, as the House knows, to do our part. All of our regional agencies are also helping small businesses. Those include ACOA, WD, FEDNOR, the Aboriginal Economic Programs and our program in Quebec. We will continue to press forward with all of those programs.

",,,Mr. Garth  Ibmer@Halton-Peel,
3925150,ca.proc.d.1992-12-01.3.10,1992-12-01,,,,subtopic,ORAL QUESTIONS,WESTRAY MINE DISASTER,,,,,,
3925151,ca.proc.d.1992-12-01.3.10.1,1992-12-01,a821d280-9b40-44e5-bae2-c039ce14a4c8,ca.m.5795,Mr. David Dingwall (Cape Breton-East Richmond):,Official Opposition House Leader; Liberal Party House Leader,ORAL QUESTIONS,WESTRAY MINE DISASTER,,"Mr. Speaker, yesterday I tabled in the House a letter signed by a group of Westray draggermen and the executive committee of the families of the deceased Westray miners, personally appealing to the Prime Minister to establish a federal inquiry into the Westray mine disaster.
Will the Prime Minister today demonstrate compassion and a sense of justice and rise in this House to call for a parliamentary inquiry into the events that led to this tragic occurrence?

",Liberal,,David Charles Dingwall,http://www.parl.gc.ca/parlinfo/Files/Parliamentarian.aspx?Item=a821d280-9b40-44e5-bae2-c039ce14a4c8&Language=E&Section=ALL
3925152,ca.proc.d.1992-12-01.3.10.2,1992-12-01,52de9ac7-8303-4712-ade9-fccf8eebf833,ca.m.4696,Hon. Tom Hockin (Minister of State (Small Businesses and Tourism)):,Minister of State (Small Businesses and Tourism),ORAL QUESTIONS,WESTRAY MINE DISASTER,,"Mr. Speaker, the hon. member knows that this government is concerned with the plight of miners, not only those of Westray but also those of Devco.
We announced yesterday, by the way, an acceleration of the unemployment insurance payments to the Devco miners laid off because of the natural disaster there.
As for Westray, the standing committee on industry has taken this request and, as is its privilege and responsibility has made a decision on the hon. member's question.

",Progressive Conservative,,Thomas Hockin,http://www.parl.gc.ca/parlinfo/Files/Parliamentarian.aspx?Item=52de9ac7-8303-4712-ade9-fccf8eebf833&Language=E&Section=ALL
3925153,ca.proc.d.1992-12-01.3.10.3,1992-12-01,a821d280-9b40-44e5-bae2-c039ce14a4c8,ca.m.5795,Mr. David Dingwall (Cape Breton -East Richmond):,Official Opposition House Leader; Liberal Party House Leader,ORAL QUESTIONS,WESTRAY MINE DISASTER,,"My supplementary is to the Prime Minister.
I have in my hand, which I am prepared to table, a letter from the wife of a deceased miner, and it reads:
I was astounded to learn just how much financial involvement this government had in the whole affair, but, in retrospect, it explains why there has been such a deliberate attempt to quash any inquiry into the whole Westray disaster and the further decision not to investigate the financial hugger-mugger which took place.
I wish to table that, Mr. Speaker, for the House.
I ask the Prime Minister again, on the basis of compassion and fairness to those individuals, will he not do the honourable thing and order a parliamentary inquiry into this tragic occurrence?

",Liberal,,David Charles Dingwall,http://www.parl.gc.ca/parlinfo/Files/Parliamentarian.aspx?Item=a821d280-9b40-44e5-bae2-c039ce14a4c8&Language=E&Section=ALL
3925154,ca.proc.d.1992-12-01.3.10.4,1992-12-01,1335c5d9-2c4e-4ed4-b8d2-c85f1099e8d8,ca.m.8721,Right Hon. Brian Mulroney (Prime Minister):,Prime Minister,ORAL QUESTIONS,WESTRAY MINE DISASTER,,"Mr. Speaker, I know that my hon. friend will want to state to the extent that he has inadvertently misled the House, that the inquiry was quashed not by any degree of involvement by any political party or any government, but by the Nova Scotia Court of Appeal. As I understand it, the decision was rendered by the chief justice of the Nova Scotia Court of Appeal.
My hon. friend can correct me if I am in error, but that decision is now being appealed by the Nova Scotia government. To interfere in any way with this appellate decision would be a very serious violation of the judicial process and is not one to which this government would subscribe.
That being said, we of course want to work very closely with the Government of Nova Scotia and all appropriate authorities to ensure that the tragic circumstances that surrounded the deaths at Westray be brought to full public attention and examination by an appropriate judicial inquiry.
That has been our position from the very beginning and the position of this government will be to a full and complete co-operation with the public authorities in Nova Scotia in respect of the examination of this very important matter.

",Progressive Conservative,,Martin Brian Mulroney,http://www.parl.gc.ca/parlinfo/Files/Parliamentarian.aspx?Item=1335c5d9-2c4e-4ed4-b8d2-c85f1099e8d8&Language=E&Section=ALL
3925155,ca.proc.d.1992-12-01.3.10.5,1992-12-01,dbac4553-6081-4c77-96d2-1b719e05965e,ca.m.7217,Mr. Howard Crosby (Halifax West):,,ORAL QUESTIONS,WESTRAY MINE DISASTER,,"Mr. Speaker, my understanding of the decision of the Supreme Court of Canada and the constitutional proposition is that nobody, not the government in Nova Scotia and not the Government of Canada, has any right to put persons on trial in anything but a criminal law forum. That was the
December 1, 1992

thrust of the decision which the member brings to the attention of Parliament.
Is the Government of Canada willing to disclose to any vested authority in whatever forum is available its position on the matter of Westray mines, what our involvement was and what role we played? Have we anything to hide?

",Progressive Conservative,,Howard Edward Crosby,http://www.parl.gc.ca/parlinfo/Files/Parliamentarian.aspx?Item=dbac4553-6081-4c77-96d2-1b719e05965e&Language=E&Section=ALL
3925156,ca.proc.d.1992-12-01.3.10.6,1992-12-01,1335c5d9-2c4e-4ed4-b8d2-c85f1099e8d8,ca.m.8721,Right Hon. Brian Mulroney (Prime Minister):,Prime Minister,ORAL QUESTIONS,WESTRAY MINE DISASTER,,"Mr. Speaker, the answer to this very pertinent and important question by the hon. member for Halifax West is in the affirmative.

",Progressive Conservative,,Martin Brian Mulroney,http://www.parl.gc.ca/parlinfo/Files/Parliamentarian.aspx?Item=1335c5d9-2c4e-4ed4-b8d2-c85f1099e8d8&Language=E&Section=ALL
3925157,ca.proc.d.1992-12-01.3.11,1992-12-01,,,,subtopic,ORAL QUESTIONS,UNITED NATIONS PEACEKEEPING FORCES,,,,,,
3925158,ca.proc.d.1992-12-01.3.11.1,1992-12-01,19dd9722-bc3e-4711-ac9e-913b7fd56106,ca.m.5724,Hon. Lloyd Axworthy (Winnipeg South Centre):,,ORAL QUESTIONS,UNITED NATIONS PEACEKEEPING FORCES,,"Mr. Speaker, I have a question for the Prime Minister.
As he knows, tomorrow the UN Security Council will be considering a proposal by the secretary-general to authorize the use of force and combat forces in Somalia, including the possibility of some 30,000 U.S. combat personnel. This development raises serious questions about the mandate of existing UN forces and the state and condition of the NGOs in that area.
What is our own government's position in relation to these proposals to begin to use combat forces in Somalia? Do we envision that our own troops who are being sent this week to Somalia will be part of that combat force? Will the Prime Minister assure this House that there will be a full parliamentary debate before any decision of that kind is taken?

",Liberal,,Lloyd Axworthy,http://www.parl.gc.ca/parlinfo/Files/Parliamentarian.aspx?Item=19dd9722-bc3e-4711-ac9e-913b7fd56106&Language=E&Section=ALL
