basepk,hid,speechdate,pid,opid,speakeroldname,speakerposition,maintopic,subtopic,subsubtopic,speechtext,speakerparty,speakerriding,speakername,speakerurl
3926157,ca.proc.d.1992-12-04.15.1.17,1992-12-04,21f6871b-b8a2-4070-a717-be4eef4b3cbe,ca.m.5818,Mr. LeBlanc (Cape Breton Highlands -Canso):,,GOVERNMENT ORDERS,"BUDGET IMPLEMENTATION (GOVERNMENT ORGANIZATIONS) ACT, 1992 MEASURE TO ENACT",,"No
heckling from the other side. This is a serious matter. This legislation concerns a matter which is of great concern to all of the people of Cape Breton. We have always faced difficult circumstances economically in Cape Breton but in the recent years, it has been even worse. Recently, the news about the economy there is very bleak.
The central sources of employment, namely the mines and the steel mills in industrial Cape Breton, have been steadily declining in terms of the number of jobs that they have been able to support. As a result of recent activities facing two mines operated by Devco, nearly
1,000	miners could be facing permanent job loss. That being in a region where the unemployment rate is already alarmingly high is a serious cause for concern on Cape Breton Island.
The steel plant as well has been facing ongoing decline in employment. Despite a great deal of capital investment over the last two or three decades, the employment that facility is able to support is as low as it has ever been. Those who remain there have serious concern about whether the steel plant will enjoy the support of the provincial government and it will be able to stay open in the medium to long term. That steel plant is absolutely crucial to the economic future of Sydney in particular because no other alternatives have been developed.
Certainly nothing this government has done over the past eight years has given the people of that part of Cape Breton any reason to hope it has created some kind of

December 4, 1992
Government Orders
alternative economic future to which the residents can aspire.
In another very important sector of our economy, namely the fishery, we have recently discovered that fish stocks in the zones adjacent to the island are in serious decline. Scientists of the Department of Fisheries and Oceans came out a few weeks ago saying that in order to prevent a total collapse of those fish stocks there would have to be serious cuts in the quota. Already that has caused unemployment in fish plants around Cape Breton Island. There is every reason to expect that in the new year there will be major job losses in the fishing industry which is another very important sector for our local economy.
In the forestry industry which so far has remained a fairly solid pillar of the island economy the long-term prospects on a global basis are at most cloudy. The mill which sustains more than 2,000 workers either directly or indirectly is one of the most efficient and well managed corporations in the pulp and paper industry. However, in the last two or three years it has faced very difficult times because of the downturn in that industry. It also faces more long-term challenges because of the new environmental trends which go against some of the advantages the mill has enjoyed by its location on Cape Breton Island.
While we have many assets that can be developed, our economy remains dependent on industries whose futures remain troubled. We have needed and relied in the past, to develop the economic strengths on Cape Breton Island, on agencies that had the island economy at heart and had the future growth of the island's economy as their main preoccupation.
What was created in the 1960s under a Liberal government was the Cape Breton Development Corporation. It had as one arm the responsibility of managing the coal mines in industrial Cape Breton and as the other arm the industrial development division which had as its mandate the responsibility of promoting a more diverse economic development across Cape Breton Island. That division, working in tandem with the main arm of Devco over nearly 20 years, did a lot to strengthen the economic base of various parts of the island until the government, when it introduced ACOA, chose to sever the industrial development division and to create the Enterprise Cape Breton Corporation as a separate entity quite apart from the rest of Devco.
I was not in the House at that time, but I know that members representing us in the House of Commons and in the Senate were vigorously opposed to that part of the Atlantic Canada Opportunities Agency enabling legislation. They saw the writing on the wall in terms of the long-term intent of this government which was to end the mandate of the industrial development division in two stages. The first stage was to separate it from Devco and the second stage, as we saw in the budget earlier this year and in this legislation, was to shut down Enterprise Cape Breton Corporation completely.
With the exception of the Enterprise Cape Breton Corporation which is a branch office of ACOA working out of Halifax with a very limited mandate and with a very indirect preoccupation with the future of Cape Breton Island, this will leave no agency unique to Cape Breton, unique to that part of Canada, in place with the support of federal funds to work toward the development of a long-term viable industry to sustain the future of Cape Breton. This is at a time when the pillars of our economy-the coal industry, the steel industry, the forest industry, the pulp and paper industry, the fisheries industry and the tourist industry-are facing a future which is cloudy at best and perhaps in a long-term decline.
We in Cape Breton wonder what this government has in mind in terms of a vision, in terms of a commitment to our future in Cape Breton, when it would terminate the only agency that is in place with a mandate and a commitment to foster the economic development of Cape Breton Island.
Our situation in comparison to the rest of Canada is bad and is getting worse. The disparity on Cape Breton Island is increasing and our young people who are looking for work are finding no opportunities there. They are forced to leave. Our best resource, namely our young, educated labour force, is obliged to find work elsewhere because of lack of opportunity and lack of vision on the part of this government. That diminishes the capacity of Cape Breton to attract viable, forward looking, future oriented industries.
That is happening because we have no agency with a mandate to deal with the search for solutions on Cape Breton Island. The mandates of the Enterprise Cape Breton Corporation and Enterprise Cape Breton, two almost Bobbsey Twins in the programs offered by the government, have been confused and distracted. They have been preoccupied with nit-picking and with small
December 4. 1992

insignificant projects with no long-term economic vision for the island.
As a result the government has frittered away eight years of opportunity to do something to create a future for Cape Breton Island. After eight years the situation economically has never been more bleak. The people of Cape Breton have never been more discouraged by the absence of any real opportunity. In our main industries the future is downward and there is no apparent alternative out there for them. The government is taking away the resources needed to find a future opportunity.
That is what is at issue with this legislation. That is what is at issue with the decision by the government. It was anticipated a long time ago by our opposition in the House and by our opposition in the Senate that it was to close, to terminate, to end Enterprise Cape Breton Corporation.
As a passing note, the speech by the Minister of Finance on Wednesday, although I was not here and did not have a chance to study it thoroughly, does not appear to have offered any hope to Cape Breton. If anything, it has given Cape Breton more reason to distrust the motives of this government, to expect nothing from this government as far as understanding the local island economy, understanding the broader Atlantic Canada economy and understanding the need to work with the leadership in that area to find long-term viable sources of employment in Cape Breton.
If this government were serious, it would address itself directly to the some 27,000 people who are either unemployed or out of the labour force in Cape Breton at this time and would need to be employed in order for Cape Breton to be brought up to a level even broadly equal to the rest of the country in terms of its average level of employment and participation in the labour force. This government has absolutely no idea of how to do that.
This is the reason why the people of Cape Breton have lost any kind of hope in this federal government and why they want at the earliest opportunity an election to be called so that they and the rest of this country can throw this government out. Then we could have a government
Government Orders
which is fresh and which is less tired, fatigued and bankrupt of ideas in place to start dealing with real solutions for the people of Cape Breton and the rest of Canada. The government has demonstrably shown in its Economic and Fiscal Statement earlier this week and in this legislation that it is totally incapable of doing that.
For that reason I concur with my colleague from Mount Royal that this legislation, including the component on the Atlantic Canada Opportunities Agency, should not be returned for six months or, in other words, should be hoisted for hopefully an indefinite period of time. In the meantime perhaps we could have an election to set the slate anew.

",Liberal,,Francis G. LeBlanc,http://www.parl.gc.ca/parlinfo/Files/Parliamentarian.aspx?Item=21f6871b-b8a2-4070-a717-be4eef4b3cbe&Language=E&Section=ALL
3926158,ca.proc.d.1992-12-04.15.1.18,1992-12-04,761a9263-10e4-4b7c-848d-e7ba3a1f500e,ca.m.2746,Hon. Doug Lewis (Solicitor General of Canada):,Solicitor General of Canada,GOVERNMENT ORDERS,"BUDGET IMPLEMENTATION (GOVERNMENT ORGANIZATIONS) ACT, 1992 MEASURE TO ENACT",,"Mr. Speaker, I listened with great interest to my hon. friend's speech and I have two questions.
First, he is calling for an election. I would ask for the benefit of the House whether or not he intends to seek a nomination or an appointment in his riding. I will explain for the hon. member. A nomination meeting is an open democratic contest. An appointment from the Leader of the Official Opposition is where there might be a contest and he wants to avoid one.
Second, I would like to ask this question. The hon. member admitted he was not here for the finance minister's speech, admitted that he had not read the speech, and then went on to suggest in a number of allegations that the speech did nothing for Cape Breton. On what does he found his criticism?

",Progressive Conservative,,Douglas Grinslade Lewis,http://www.parl.gc.ca/parlinfo/Files/Parliamentarian.aspx?Item=761a9263-10e4-4b7c-848d-e7ba3a1f500e&Language=E&Section=ALL
3926159,ca.proc.d.1992-12-04.15.1.19,1992-12-04,21f6871b-b8a2-4070-a717-be4eef4b3cbe,ca.m.5818,Mr. LeBlanc (Cape Breton Highlands-Canso):,,GOVERNMENT ORDERS,"BUDGET IMPLEMENTATION (GOVERNMENT ORGANIZATIONS) ACT, 1992 MEASURE TO ENACT",,"The first question the minister asked had nothing to do with my remarks. It is quite irrelevant to the subject I was dealing with. I do intend to seek the nomination in Cape Breton Highlands-Canso at the appropriate time, to run again and to be elected again to this House as part of a Liberal government under our leader, the hon. member from Shawinigan.
As for the second part of the minister's question, I was on a parliamentary committee outside Ottawa on Wednesday when the minister gave his speech.
I have read summaries of the speech and portions of the economic address. I admitted that I had not as yet read the whole speech and I qualified my remarks by

Government Orders
saying that. What I did read gave me no reason to believe that there was very much in this speech for Cape Breton.
Perhaps after I have read the whole speech I will have a different point of view. If I do, at that point I will make those revised comments before this House but what I have read so far does not give me much reason for hope.

",Liberal,,Francis G. LeBlanc,http://www.parl.gc.ca/parlinfo/Files/Parliamentarian.aspx?Item=21f6871b-b8a2-4070-a717-be4eef4b3cbe&Language=E&Section=ALL
3926160,ca.proc.d.1992-12-04.15.1.20,1992-12-04,41be2641-cabd-44d4-9f19-d9f0a3c0dc2c,ca.m.2367,Mr. Bob Speller (Haldimand-Norfolk):,,GOVERNMENT ORDERS,"BUDGET IMPLEMENTATION (GOVERNMENT ORGANIZATIONS) ACT, 1992 MEASURE TO ENACT",,"Mr. Speaker, I comment to the hon. minister that there is a great Liberal fight in his riding to seek the nomination. I do not understand how that could be. I guess they figure it is an easy riding to win the next time. Do not worry, there will not be anybody appointed there.
My hon. friend is from an area of the country that has really been decimated by this Conservative government and its programs over the years. He gave a wonderful speech outlining some of the problems which have occurred not just in his riding but in all of Atlantic Canada because of the policies of this government.
I did read the majority of the speech on some of the economic background statements and I really found it lacking in any sort of direction for economic renewal in Atlantic Canada.
I know the hon. member spent a lot of time looking at this issue. He spent a lot of time reading about it and studying it. He talked to people in his own riding and throughout Atlantic Canada as to what some of the solutions would be.
Could the hon. member outline for us today some of the ideas he has that will help bring about economic growth in his area?

",Liberal,,Robert (Bob) Speller,http://www.parl.gc.ca/parlinfo/Files/Parliamentarian.aspx?Item=41be2641-cabd-44d4-9f19-d9f0a3c0dc2c&Language=E&Section=ALL
3926161,ca.proc.d.1992-12-04.15.1.21,1992-12-04,21f6871b-b8a2-4070-a717-be4eef4b3cbe,ca.m.5818,Mr. LeBlanc (Cape Breton Highlands-Canso):,,GOVERNMENT ORDERS,"BUDGET IMPLEMENTATION (GOVERNMENT ORGANIZATIONS) ACT, 1992 MEASURE TO ENACT",,"Mr. Speaker, we have to start working from our strengths on Cape Breton Island. That is the case in Atlantic Canada as it is across Canada.
We need some idea from the national government that its industrial policy and fiscal and monetary policies will be endeavouring to support the Canadian economy and economies in the various regions. The regions need to identify and develop their particular strengths particularly as they relate to the emerging North American and world-wide markets we face.
We have many strengths in Cape Breton. In addition to our work force we have the educational institutions. Many Cape Bretoners attend St. Francis Xavier University near Cape Breton. We have the University College of Cape Breton, the various trade schools and community colleges such as the Nova Scotia Community College at the Strait of Canso, the nautical school and other very qualified educational institutions.
We have natural resources in addition to coal and the forest industries. We have a tremendous super port in the Strait of Canso. We have a fabulous cultural richness and natural beauty across the island which is there to be developed with the support of government in partnership with the private sector in Cape Breton.
Agencies such as the industrial development division of Devco or the Enterprise Cape Breton Corporation which was another possibility that the government is trying to eliminate, as well as an agency in the Strait of Canso could promote the development of the strengths of that part of the island.
With some kind of vision we can produce a focused development effort on Cape Breton Island. We can lower the awful levels of unemployment on that island. We can better use both public and private funds than in the past toward a realistic objective that can empower the people of Cape Breton.
That is where we have to go. In eight years, this government has had absolutely no vision at all in dealing with Cape Breton. It has shown no real interest, aside from offering tax incentives and tax breaks and the odd program of interest buy down and assistance to small and medium sized businesses.
Without any focus, whatever efforts might have been achieved with the dollars, meagre as they were, that were made available to Atlantic Canada and to Cape Breton in particular have dissipated.
We need to focus and to work on our strengths in Cape Breton Island. We need to identify and develop those strengths with the resources, particularly the human resources we have all around us.
I want to thank the member for his very thoughtful question and for giving me the opportunity to speak positively about the future of our island.

",Liberal,,Francis G. LeBlanc,http://www.parl.gc.ca/parlinfo/Files/Parliamentarian.aspx?Item=21f6871b-b8a2-4070-a717-be4eef4b3cbe&Language=E&Section=ALL
