basepk,hid,speechdate,pid,opid,speakeroldname,speakerposition,maintopic,subtopic,subsubtopic,speechtext,speakerparty,speakerriding,speakername,speakerurl
3914948,ca.proc.d.1992-06-12.5.1.1.9,1992-06-12,7bd87e49-bca8-45fa-a451-7c1635f2748c,ca.m.6638,The Acting Speaker (Mr. Paproski):,Deputy Chair of Committees of the Whole,PRIVATE MEMBERS' BUSINESS,CRIMINAL CODE,MEASURE TO AMEND,"Is the House ready for the question?

",Progressive Conservative,,Steve Eugene Paproski,http://www.parl.gc.ca/parlinfo/Files/Parliamentarian.aspx?Item=7bd87e49-bca8-45fa-a451-7c1635f2748c&Language=E&Section=ALL
3914949,ca.proc.d.1992-06-12.5.1.1.10,1992-06-12,intervention,,,,PRIVATE MEMBERS' BUSINESS,CRIMINAL CODE,MEASURE TO AMEND,"Question.

",,,Some hon. members:,
3914950,ca.proc.d.1992-06-12.5.1.1.11,1992-06-12,7bd87e49-bca8-45fa-a451-7c1635f2748c,ca.m.6638,The Acting Speaker (Mr. Paproski):,Deputy Chair of Committees of the Whole,PRIVATE MEMBERS' BUSINESS,CRIMINAL CODE,MEASURE TO AMEND,"Is it the pleasure of the House to adopt the motion?

",Progressive Conservative,,Steve Eugene Paproski,http://www.parl.gc.ca/parlinfo/Files/Parliamentarian.aspx?Item=7bd87e49-bca8-45fa-a451-7c1635f2748c&Language=E&Section=ALL
3914951,ca.proc.d.1992-06-12.5.1.1.12,1992-06-12,intervention,,,,PRIVATE MEMBERS' BUSINESS,CRIMINAL CODE,MEASURE TO AMEND,"Agreed.

",,,Some hon. members:,
3914952,ca.proc.d.1992-06-12.5.1.1.13.1,1992-06-12,,,,stagedirection,,,,"Motion agreed to, bill read the second time and referred to a legislative committee in the Departmental envelope.",,,,
3914953,ca.proc.d.1992-06-12.6,1992-06-12,,,,topic,GOVERNMENT ORDERS,,,,,,,
3914954,ca.proc.d.1992-06-12.6.1,1992-06-12,,,,subtopic,GOVERNMENT ORDERS,PUBLIC SERVICE SUPERANNUATION ACT,,,,,,
3914955,ca.proc.d.1992-06-12.6.1.1.1.1,1992-06-12,,,,stagedirection,,,,"The House resumed consideration of Bill C-55, an act to amend certain acts in relation to pensions and to enact the Special Retirement Arrangements Act and the Pension Benefits Division Act, as reported (with amendments) from a legislative committee.",,,,
3914956,ca.proc.d.1992-06-12.6.1.1.2,1992-06-12,7bac4375-0412-480f-923c-1b938132ecb5,ca.m.2111,Mr. Svend J. Robinson (Burnaby-Kingsway):,,GOVERNMENT ORDERS,PUBLIC SERVICE SUPERANNUATION ACT,MEASURE TO AMEND,"Mr. Speaker, I am pleased to have an opportunity to rise to speak on the motions which are now put before the House by the hon. member for Don Valley East.
I want to commend the hon. member for Don Valley East for giving the House a long overdue opportunity to debate these important issues surrounding the pensions of members of Parliament. At the same time, I want to

point out that it was my own leader, the leader of the federal New Democratic Party, the member for Yukon, who first drew to the attention of Canadians in a very powerful speech on February 24 of this year the profound inequities which many Canadians believe exist in this pension plan.
I want to make it clear that in speaking today on these motions I am speaking personally. I am not speaking on behalf of my caucus colleagues, I am not speaking on behalf of my party. I am speaking personally and I am speaking as the member of Parliament for Burnaby- Kingsway.
I know my colleague for Victoria has strong feelings on this issue as well and he may very well be participating in the debate. Because of the intensity around this issue, it is a debate which transcends political considerations. I did want to make that very clear.
Certainly many of my constituents in Burnaby-Kingsway have raised concerns about the equity and the fairness of the members of Parliament's pension plan. As the member for Yukon, the leader of the New Democratic Party stated during her speech in February, we are accountable for the public trust. We are accountable to those who elected us to make sure that what we support is fair, not less, and that each and every one of us can stand before the electorate of Canada and say that we have put in place a fair system.
That is the benchmark which surely must guide us as we examine this pension system. As I look at the pension system today and as I looked at the pension system when I was first elected to this House some 13 years ago, it is clear to me that there are inequities in the system and that certainly this House should direct an independent review of those inequities.
On December 5, 1991 I tabled in this House the following motion: ""That in the opinion of this House the government should consider the advisability of establishing a non-partisan, independent commission to review all salaries, pensions and benefits of members of Parliament and particularly to identify inequities in the pension plan by holding public hearings and examining other jurisdictions within and outside Canada, and such commission to report within six months of its establishment.
Government Orders
I believed then and I believe now that kind of completely independent review of our pension plan is long overdue. The leader of the New Democratic Party, the member for Yukon, has said in her speech in February that it is long overdue that we raise the question of pensions of members of this House, pensions that at this time mean that after six years of service members of this House receive a pension regardless of age or whether they move on to employment elsewhere in the federal government.
That refers to the so-called double-dipping provisions and these are the two fundamental elements of the amendments which are proposed by the member for Don Valley East.
I welcome the opportunity provided by the motions of the hon. member for Don Valley East for a comprehensive and independent review of the pensions and benefits of members of this House.
I also want to take this opportunity to signal the fact that as a result of the leadership of the hon. member for Yukon, the President of the Treasury Board within the last 24 hours has signalled that at last he is prepared to put together an independent and ad hoc review of the pension scheme. It was in response to yet another letter from the hon. member for Yukon, a letter in which the leader of the New Democratic Party called upon the President of the Treasury Board to establish an independent committee, an arm's length committee, that would be able to examine and make recommendations on all aspects of MPs' pension plans and to report back to Parliament within six months of being struck.
In response to that letter, the President of the Treasury Board replied as follows: ""At this time, I am developing final proposals on the terms of reference for and composition of the ad hoc group which will undertake this review.
There is no question in my mind that all aspects of the Members of Parliament Retiring Allowances Act must be examined and that the study group should be made up of individuals with expertise and public credibility in the area of pensions and compensations"".
I would certainly hope that it would be a completely independent review body, separate and at arm's length from members of Parliament and from retired members of Parliament.

June 12, 1992
Government Orders
This does give us an opportunity to review these issues. Certainly the member's motions are not likely to be adopted by the House today. As I understand it, there is some considerable resistance to the amendments. Again, this does give us an opportunity to help spur that long overdue review of the area of MPs' pensions and benefits.
Whether that review will result in proposals for change identical to those made by the hon. member for Don Valley East, whether there will be other proposals, a combination of service and age, whether there will be other proposals with respect to double-dipping, the independent commission will have an opportunity to review.
Again and in conclusion, I want to signal the leadership of the hon. member for Yukon, the leader of the New Democratic Party, in flagging this issue. I know it was a rather sensitive subject because I was in the House the day that she spoke. I remember the hon. member for Glengariy-Prescott-Russell for the Liberal Party and members of the Conservative Party getting up and braying that this was sacred territory; do not touch members of Parliament's pensions, for God's sake.
It was that unholy alliance that coalesces every so often in this country too often for many of us between the Liberal Party and the Conservative Party.
I want to take this opportunity to commend the hon. member for Don Valley East for once again speaking out independently and in particular for underlining and re-enforcing the leadership and the courage of the hon. member for Yukon on this important issue of public concern.

",New Democratic Party,,Svend Johannes Robinson,http://www.parl.gc.ca/parlinfo/Files/Parliamentarian.aspx?Item=7bac4375-0412-480f-923c-1b938132ecb5&Language=E&Section=ALL
3914957,ca.proc.d.1992-06-12.6.1.1.3,1992-06-12,bccbfdd0-ffb7-4f38-87aa-5bdec982fd33,ca.m.7070,Mr. Guy H. Arseneault (Restigouche - Chaleur):,,GOVERNMENT ORDERS,PUBLIC SERVICE SUPERANNUATION ACT,MEASURE TO AMEND,"Mr. Speaker, I will not debate the point but for the record, those who are watching the proceedings should be aware of the position in committee of the members of that committee.
From day one, the members of that committee have asked for an independent review and that includes the members of the government. It was the government that has gone along and has agreed to that independent review. I do not see where the NDP leader should be the great one who decided that thanks to her we now have an independent review. I do not see why she should get all this credit.
It has been an agreed direction from day one. The members of the Liberal Party in committee asked for it and agreed with it. The member of the NDP who was there asked for it. Even the parliamentary secretary at one of the committee meetings put forth the point of view that he would support an independent review and would take that message to the minister.
Obviously the minister did listen to the hon. parliamentary secretary. It is not necessarily one member who should get the credit. If I recall well enough, when the hon. member for Yukon spoke here, the hon. member changed her position not too long after, publicly, a couple of days later. She did not seem to have the same position all of a sudden. I would not be too quick in saying the hon. member should deserve all the credit on this one.

",Liberal,,Guy H. Arseneault,http://www.parl.gc.ca/parlinfo/Files/Parliamentarian.aspx?Item=bccbfdd0-ffb7-4f38-87aa-5bdec982fd33&Language=E&Section=ALL
3914958,ca.proc.d.1992-06-12.6.1.1.4,1992-06-12,7bac4375-0412-480f-923c-1b938132ecb5,ca.m.2111,Mr. Robinson:,,GOVERNMENT ORDERS,PUBLIC SERVICE SUPERANNUATION ACT,MEASURE TO AMEND,"Mr. Speaker, on a point of order. Certainly if there is any uncertainty I would be very pleased to seek the consent of the House to table the exchange of correspondence between the leader of the New Democratic Party and the President of the Treasury Board. I would seek that consent.

",New Democratic Party,,Svend Johannes Robinson,http://www.parl.gc.ca/parlinfo/Files/Parliamentarian.aspx?Item=7bac4375-0412-480f-923c-1b938132ecb5&Language=E&Section=ALL
3914959,ca.proc.d.1992-06-12.6.1.1.5,1992-06-12,7bd87e49-bca8-45fa-a451-7c1635f2748c,ca.m.6638,The Acting Speaker (Mr. Paproski):,Deputy Chair of Committees of the Whole,GOVERNMENT ORDERS,PUBLIC SERVICE SUPERANNUATION ACT,MEASURE TO AMEND,"Is there consent?

",Progressive Conservative,,Steve Eugene Paproski,http://www.parl.gc.ca/parlinfo/Files/Parliamentarian.aspx?Item=7bd87e49-bca8-45fa-a451-7c1635f2748c&Language=E&Section=ALL
3914960,ca.proc.d.1992-06-12.6.1.1.6,1992-06-12,5104129f-e78f-41dd-8473-ef19e0628d4b,ca.m.6696,Mr. Sid Parker (Kootenay East):,,GOVERNMENT ORDERS,PUBLIC SERVICE SUPERANNUATION ACT,MEASURE TO AMEND,"Mr. Speaker, as the New Democratic Party critic who attended the committee meetings and sat before the minister when he came before the committee, that was the argument the New Democratic Party had put forward. Our leader made it very clear in the House as I remember and the record in Hansard will verify who took the leadership in this.
I want to speak to the amendment because I think I have a great deal of respect for the member for Don Valley East and I admire his courage in bringing this forward. I have a problem with his amendment and the reason I have a problem with it is that I am a former mayor of a city. I remember when we used to have to vote ourself an increase in the city and I found that appalling.
I find it appalling today that we should be putting amendments forward on our own pension schemes. I like the process of having some actuaries out there and look at the problems that members of Parliament have
June 12, 1992

because maybe we should not be dealing with those problems within a pension bill.
I came here in 1980 and in 1984 I was defeated. I stood up in this House and took on my company, CP Rail. I travelled across this country fighting against the Crow's Nest agreement. I stood up in this House and criticized the other place when the president of CP Rail was appointed as a Senator in that House and I had to go back and work for that company.
When you criticise such as we do in this party, criticize the banks, criticize the major industries on pollution and other things and try to seek employment after you leave here, there are some serious problems there.
That is why I admire the leader of the New Democratic Party when she asked for an independent inquiry to look at the situations with members of Parliament and what happens to them during that.
They cannot be impeded in any way. When you are elected to this House of Commons, the citizen's coalition can talk about comparative in employment. I want to tell you there is no comparative in employment opportunities when you are defeated after four years and you have those kinds of problems and you try to anchor back into the work force.
That is why with this independent inquiry we would be looking far over the pensions of NDP or members of Parliament and maybe at the situation of how we can address this problem.
The member who represented my riding prior to me, a government member, when he was defeated he was appointed to the Parole Board as a representative, getting an $80,000 a year job.
People on the opposition do not get that kind of opportunity. I would urge the members to support the amendment we have put forward. It is imperative that independent actuaries do the job of checking into the situation and come back with a full report.

",New Democratic Party,,Sidney James Parker,http://www.parl.gc.ca/parlinfo/Files/Parliamentarian.aspx?Item=5104129f-e78f-41dd-8473-ef19e0628d4b&Language=E&Section=ALL
3914961,ca.proc.d.1992-06-12.6.1.1.7,1992-06-12,efec68a7-e1fd-490f-8b6a-95313440440c,ca.m.3358,Mr. Don Boudria (Glengarry-Prescott-Russell):,Deputy House Leader of the Official Opposition; Liberal Party Deputy House Leader,GOVERNMENT ORDERS,PUBLIC SERVICE SUPERANNUATION ACT,MEASURE TO AMEND,"Mr. Speaker, I compliment the member who just spoke now. He gave some balance to what had been said previously and it is not easy. This is not an easy subject. I have tackled the critics of MPs' benefits and pensions probably more than anyone in this House, save the member perhaps from Mississauga South. I feel some-
Govemment Orders
what bruised by the process, but as they say, them's the breaks. I am not ashamed to be a member of Parliament. I think it is the greatest honour any Canadian can have. I started my working career on Parliament Hill as a busboy in the Parliamentary Restaurant on October 25, 1966. I looked in awe at members of Parliament, looking in awe at those people who had been chosen democratically by fellow citizens to represent them in this the highest court in the land.
Every election I would see new members come in, each one of them vested with this great honour, each one of them with every intention in their own way of best serving the people who sent them here. You sir, Mr. Speaker, will remember because you were one of the people who was here as an MP when I was a staffer here on Parliament Hill. Through much luck and probably some elbow grease, I ended up some 18 years after I first came here as a member of Parliament.
I do not mean to say this to describe my own political rags to riches story, although some others may have described it that way from time to time. I feel very proud of the fact that I am here, not for my own accomplishments, although I like to think that way from time to time but for the fact that we live in a country where it is possible for the Prime Minister to be an ex-truck driver and to eventually become Prime Minister of this country or for the busboy of the Parliamentary Restaurant to come back as an MP. There are not that many nations in the world where that could happen.
We live in one of them and I am proud of that. I work hard at it. Most mornings, hon. members will know, certainly the cleaning staff knows, I am here at 7.15 a.m. and many, many times particularly in winter, I go through days and nights without seeing daylight. I am not complaining because I enjoy my job. There is nothing else in the world that I would rather do and I am very proud of it.
I have some problems with organizations like the National Citizens Coalition, who for their own selfish interests of trying to raise funds for whoever they are, however many members they have if any, pretend that they are on a crusade against every member of this House and at the bottom of their little crusade block there is a little cut-out which says: ""Want us to do more of the same? Please send us your cash"". Cut this out and send it to David Somerville who will gladly take your

June 12, 1992
Government Orders
money to continue fighting more of this great stuff he is fighting now.

",Liberal,,Don Boudria,http://www.parl.gc.ca/parlinfo/Files/Parliamentarian.aspx?Item=efec68a7-e1fd-490f-8b6a-95313440440c&Language=E&Section=ALL
3914962,ca.proc.d.1992-06-12.6.1.1.8,1992-06-12,intervention,,,,GOVERNMENT ORDERS,PUBLIC SERVICE SUPERANNUATION ACT,MEASURE TO AMEND,"That is his income.

",,,An hon. member:,
3914963,ca.proc.d.1992-06-12.6.1.1.9,1992-06-12,efec68a7-e1fd-490f-8b6a-95313440440c,ca.m.3358,Mr. Boudria:,Deputy House Leader of the Official Opposition; Liberal Party Deputy House Leader,GOVERNMENT ORDERS,PUBLIC SERVICE SUPERANNUATION ACT,MEASURE TO AMEND,"Well, some other members have said it, that is his income, and we are catering to this. We as MPs are catering to this. I do not mean that our pensions are sacred or our salary is sacred or anything else. It is not. A recent study said that Canadian members of Parliament are paid the least of the G-7 nations. That is a fact. Maybe the pensions were 5 per cent more and the salaries 5 per cent less. Let us have that independent inquiry, that independent review the way the government has suggested. It was suggested in the heat of the night in correspondence between the government and the members in the New Democratic Party.
However, it does not matter how the process got started. The point is there is going to be that independent review. I welcome it because I am not ashamed of the salary I make or how I use the stationery I have in my office to correspond with my constituents or the photocopier or the fax machine or all other so-called perks we have to correspond with the people who sent us here to represent them to start with.
I am not ashamed of any of that. I am proud to have the opportunity to represent my constituents and I welcome that study. But let us not take off to please the National Citizens Coalition and adopt an amendment or two or three amendments just because we are afraid of the Reform Party or David Somerville or somebody else. Let us have a bit more backbone around this place for once. Let us do that independent study. I know right now what it is going to say. I can tell you that most members of Parliament work hard-not just me, not just the member for Ottawa Vanier, although he works very hard, too, but members across the way, on all sides of the House. We all work hard around here and it is time that we took pride ourselves in the greatest honour that was given to us by our constituents who sent us here to start with.

",Liberal,,Don Boudria,http://www.parl.gc.ca/parlinfo/Files/Parliamentarian.aspx?Item=efec68a7-e1fd-490f-8b6a-95313440440c&Language=E&Section=ALL
3914964,ca.proc.d.1992-06-12.6.1.1.10,1992-06-12,adccd8db-1a2a-4bce-a0eb-d0168689be80,ca.m.5345,Mr. John Brewin (Victoria):,,GOVERNMENT ORDERS,PUBLIC SERVICE SUPERANNUATION ACT,MEASURE TO AMEND,"Mr. Speaker, I strongly support the proposal for an independent inquiry into MPs' pensions, as proposed by the Leader of the New Democratic Party. It is an excellent initiative she has taken and it is long overdue.
The motion before this House from the member for Don Valley East I am afraid does not do the job because it is too rigid. I would think that the proposal he has put should go to this inquiry and be considered along with it. It does not have the necessary flexibility to cover some particular situations. Someone may be asked to do a short-term job. Someone may have a pension after six years which is minimal and which the member is entirely entitled to. That member ought to be free to accept some additional income.
The problem that the member's motion deals with and which I think is the public's concern is the person at full pension who is offered some full-time job in the public sector. That issue does need to be dealt with.
There are terrible inequities in this country in the whole pension field. Probably none is worse than the pensions of the captains of industry in this country who are paid grotesque pensions. We cannot do anything about those issues today in this bill. We can today deal with the issue of pensions of members of Parliament. It is incumbent upon us as members of Parliament to be prepared to have our pensions undergo the scrutiny of an independent inquiry.
We, too, may have to make sacrifices in this particular time of economic restraint in our country. Therefore, I welcome the initiative of the Leader of the New Democratic Party and I fully support the inquiry that she has proposed and has persuaded the government to implement.

",New Democratic Party,,John F. Brewin,http://www.parl.gc.ca/parlinfo/Files/Parliamentarian.aspx?Item=adccd8db-1a2a-4bce-a0eb-d0168689be80&Language=E&Section=ALL
