basepk,hid,speechdate,pid,opid,speakeroldname,speakerposition,maintopic,subtopic,subsubtopic,speechtext,speakerparty,speakerriding,speakername,speakerurl
3914618,ca.proc.d.1992-06-12.2.9.4,1992-06-12,a59b2ec7-63a6-4ab2-adc9-53f2dea03531,ca.m.3792,"Hon. Jake Epp (Minister of Energy, Mines and Resources):","Minister of Energy, Mines and Resources",ORAL QUESTION PERIOD,HIBERNIA,,"Madam Speaker, I would like to be as forthcoming as possible. I appreciate the member's sensitivity to the timing of this question.
I appreciate what he says about Newfoundland having difficulties in the fishery, the announcement that Hibernia had lost a partner on February 4 and the general state of the economy. It is that reality that has doubly motivated all of us to try to get a solution on Hibernia.
I have always said that Hibernia is important, but it is important in the larger context of Newfoundland being able to develop a resource. That is why I mentioned earlier today about offshore oil coming into Nova Scotia. I saw on Saturday the buoyancy in Nova Scotia. Again, it

June 12, 1992
Routine Proceedings
does not solve every problem in Nova Scotia but it does add to the buoyancy.
I can only say to the hon. member that I do not want to raise false hopes in Newfoundland because they have been dashed too many times. We are going to use this weekend to negotiate. In fact, starting tonight I will be involved personally as well as members of the Newfoundland government with a consortium and with potential investors. We will be dedicating this weekend in the hope that we can bring this to closer fruition.

",Progressive Conservative,,Arthur Jacob (Jake) Epp,http://www.parl.gc.ca/parlinfo/Files/Parliamentarian.aspx?Item=a59b2ec7-63a6-4ab2-adc9-53f2dea03531&Language=E&Section=ALL
3914619,ca.proc.d.1992-06-12.2.10,1992-06-12,,,,subtopic,ORAL QUESTION PERIOD,CHILDREN,,,,,,
3914620,ca.proc.d.1992-06-12.2.10.1,1992-06-12,4f96c1bc-512c-4a39-b653-da4a175e6426,ca.m.4675,Mr. Mac Harb (Ottawa Centre):,,ORAL QUESTION PERIOD,CHILDREN,,"Madam Speaker, following the conference on the rights of the child, the government put forward the child tax credit. In fact, this proposal will actually make children on welfare poorer, not better off.
If the government is really concerned about child poverty, will the minister promise to fully index the child tax credits to inflation?

",Liberal,,Mac Harb,http://www.parl.gc.ca/parlinfo/Files/Parliamentarian.aspx?Item=4f96c1bc-512c-4a39-b653-da4a175e6426&Language=E&Section=ALL
3914621,ca.proc.d.1992-06-12.2.10.2,1992-06-12,bfced3f1-af46-4ab2-9e2d-94b915dfb86a,ca.m.6196,Hon. Monique Vezina (Minister of State (Employment and Immigration) and Minister of State (Seniors)):,Minister of State (Seniors); Minister of State (Employment and Immigration),ORAL QUESTION PERIOD,CHILDREN,,"Madam Speaker, I have always maintained here in this House that the best way to ensure quality of life for families and children is to reduce the deficit, improve economic growth and create jobs, and that is what we are working on.

",Progressive Conservative,,Monique Vézina,http://www.parl.gc.ca/parlinfo/Files/Parliamentarian.aspx?Item=bfced3f1-af46-4ab2-9e2d-94b915dfb86a&Language=E&Section=ALL
3914622,ca.proc.d.1992-06-12.2.11,1992-06-12,,,,subtopic,ORAL QUESTION PERIOD,INDIAN AFFAIRS,,,,,,
3914623,ca.proc.d.1992-06-12.2.11.1,1992-06-12,0662e97c-31c7-492e-ba34-622d26c31084,ca.m.6453,Mr. Ray Skelly (North Island-Powell River):,,ORAL QUESTION PERIOD,INDIAN AFFAIRS,,"Madam Speaker, I know that the minister is aware of this question. We have had a discussion about it and his sympathies in the matter.
Is the minister prepared to meet with representatives of the Gwa'Sala-'Nakwaxda'xw council to discuss some of the problems that it has had over the last 30 years in terms of social disintegration? Also, is he prepared to meet with his colleagues to co-ordinate the response from the ministries of health, employment and aboriginal affairs in this very important matter?

",New Democratic Party,,Raymond John Skelly,http://www.parl.gc.ca/parlinfo/Files/Parliamentarian.aspx?Item=0662e97c-31c7-492e-ba34-622d26c31084&Language=E&Section=ALL
3914624,ca.proc.d.1992-06-12.2.11.2,1992-06-12,1babc9d3-8d8a-489e-99f2-d360a5ab621b,ca.m.8020,Hon. Thomas Siddon (Minister of Indian Affairs and Northern Development):,Minister of Indian Affairs and Northern Development,ORAL QUESTION PERIOD,INDIAN AFFAIRS,,"Madam Speaker, I certainly am prepared to meet with various First Nations chiefs and councils as I travel across the country.
I certainly would be prepared to meet the representatives of the Gwa'Sala-'Nakwaxda'xw council at an appropriate occasion when I am in British Columbia, which is almost weekly.
I should say that the department is reviewing a specific claim from this community on northern Vancouver Island, and we are undertaking a number of capital improvements within that community of which the member is well aware.
I thank the hon. member for bringing this matter to my attention.

",Progressive Conservative,,Thomas Edward Siddon,http://www.parl.gc.ca/parlinfo/Files/Parliamentarian.aspx?Item=1babc9d3-8d8a-489e-99f2-d360a5ab621b&Language=E&Section=ALL
3914625,ca.proc.d.1992-06-12.3,1992-06-12,,,,topic,ROUTINE PROCEEDINGS,,,,,,,
3914626,ca.proc.d.1992-06-12.3.1,1992-06-12,,,,subtopic,ROUTINE PROCEEDINGS,GOVERNOR IN COUNCIL APPOINTMENTS,,,,,,
3914627,ca.proc.d.1992-06-12.3.1.1.1,1992-06-12,fbce8351-5fec-45a8-9b6b-2514fa79811a,ca.m.8951,Hon. Harvie Andre (Minister of State and Leader of the Government in the House of Commons):,Minister of State (Without Portfolio); Leader of the Government in the House of Commons; Progressive Conservative Party House Leader,ROUTINE PROCEEDINGS,GOVERNOR IN COUNCIL APPOINTMENTS,REFERRAL TO STANDING COMMITTEES,"Madam Speaker, it gives me great pleasure to table today in the House, in both official languages, Orders in Council announcing appointments made recently by the government.
Pursuant to Standing Order 110(1), these Orders in Council are deemed to have been referred to the standing committees indicated in the appendix.

",Progressive Conservative,,Harvie Andre,http://www.parl.gc.ca/parlinfo/Files/Parliamentarian.aspx?Item=fbce8351-5fec-45a8-9b6b-2514fa79811a&Language=E&Section=ALL
3914628,ca.proc.d.1992-06-12.3.2,1992-06-12,,,,subtopic,ROUTINE PROCEEDINGS,CANADA'S SENIORS,,,,,,
3914629,ca.proc.d.1992-06-12.3.2.1,1992-06-12,bfced3f1-af46-4ab2-9e2d-94b915dfb86a,ca.m.6196,Hon. Monique Vezina (Minister of State (Employment and Immigration) and Minister of State (Seniors)):,Minister of State (Seniors); Minister of State (Employment and Immigration),ROUTINE PROCEEDINGS,CANADA'S SENIORS,,"Madam Speaker, as Minister of State for Seniors, I have the pleasure and honour to remind all of us assembled here that at this time of the year, seniors are honoured all across Canada.
From the end of May until the end of June, all provinces and territories have ongoing activities for seniors. These activities, organized at the community, municipal or provincial level, vary from social gatherings
June 12, 1992

to officially designated events, such as the Seniors Day in the Manitoba legislature.
I am particularly happy to take part in this tribute to our seniors. As you already know, the mandate the Prime Minister entrusted to me as Minister of State for Seniors is to give a voice to seniors in cabinet and to represent their interests in Parliament.
Very early in my mandate, I decided that one of the most important contributions I could make was to become a good listener. Consequently, I have spent many hours consulting with older Canadians from coast to coast and in our northern territories. I have also talked with those who represent seniors' organizations, with self-help groups and with individuals who work with older Canadians.
The government has also commissioned a number of studies to learn about seniors' views and we can now rely on the results of two interesting studies.
The first, conducted by Statistics Canada, explored issues affecting the independence of older Canadians. The topics addressed included: preparation for retirement, employment, physical and social activities, health and well-being, life experience, mobility and travel, accidents and safety, housing, income and finances, and satisfaction with life.
The second study, by Health and Welfare Canada, was a series of focus groups exploring the meaning of independence and quality of life for older Canadians. This research and my extensive contacts with seniors have enabled me to understand what seniors expect. They expect independence, equality and recognition as individuals.
For Canada's seniors, independence is both a state of living and a state of mind. Independence, for seniors, means being free to do what they want to do, being responsible for their own initiatives.
Aging is indeed a life long process which involves a series of changes from birth to death, but unfortunately many misconceptions and myths on this subject persist.

Canada's seniors expect to be integrated into society, not seen as a group apart. They want to be treated as equals. They want people to take their views into account, to listen to them and involve them in decision-
Routine Proceedings
making. They want to have the opportunity to participate directly in the design and implementation of programs that affect them. They want to be seen as contributors to society, not as yesterday's corporate leaders, retired teachers or mechanics.

Seniors also want to be recognized as individuals, as different from one another. They do not want to be viewed as a statistic, an age group. I find these expectations very reasonable. Canadian seniors vary in income, cultural and educational backgrounds, state of health, and life experiences. They have different aspirations and fulfil themselves in many different ways. While they have many common concerns, their priorities and opinions differ.
Administrators, health care workers and elected officials often ask themselves how they can best help seniors achieve and maintain this desired independence.
In Canada, we have a number of supports available to seniors. The first major program for older Canadians began in the late 1920s, when the federal government co-operated with various provinces to finance a joint old-age pension scheme. Today, our government's concern for seniors is reflected in the fact that Canada's ""elderly benefit system"" is now the largest program expenditure area within government.
The rapid increase in the senior population has stimulated the development of other federal programs and services for seniors in such areas as housing and health and social services.
Worthy of special mention is the Seniors Independence Program designed to help seniors improve their health, well-being and independence and to enhance their quality of life. This program encourages seniors to get involved in designing and carrying out projects which affect their quality of life and independence.
New Horizons is another program that has encouraged and supported projects planned and carried out by seniors themselves.

In concluding, I would like to build on our experience in developing a new strategy that also promotes improved co-operation between departments and in-

June 12, 1992
Routine Proceedings
creased partnerships with the various interest groups, including seniors themselves.
I think you will agree with me that in a world concerned with preserving the environment and making the best use of resources, it will be unacceptable to ignore the experience and knowledge of seniors.

Like many other cultures in the world, let us give our seniors the place they deserve.
I encourage hon. members to take part in Seniors Month and to respond to the aspirations of all of these people who have helped build our vast country.
[English)

",Progressive Conservative,,Monique Vézina,http://www.parl.gc.ca/parlinfo/Files/Parliamentarian.aspx?Item=bfced3f1-af46-4ab2-9e2d-94b915dfb86a&Language=E&Section=ALL
3914630,ca.proc.d.1992-06-12.3.2.2,1992-06-12,efec68a7-e1fd-490f-8b6a-95313440440c,ca.m.3358,Mr. Don Boudria (Glengarry-Prescott-Russell):,Deputy House Leader of the Official Opposition; Liberal Party Deputy House Leader,ROUTINE PROCEEDINGS,CANADA'S SENIORS,,"Madam Speaker, I am pleased to have the opportunity to respond briefly to the statement made by the minister.

Needless to say, we all listened attentively to what the minister had to say and we support the wishes that she expressed today.
Personally, I would have some things to add. This statement is off the cuff. I would like to tell the minister that I spent almost all my life with seniors, since I was raised by my grandmother, my grandparents. Every time I hear something like what the minister said, I remember those childhood years.

There is no doubt that for many of our seniors the greatest enemy, if I can refer to it that way, is solitude. To that extent, programs such as New Horizons and others have contributed to getting seniors together in order to counter that solitude that so often affects our senior citizens.
It is regrettable, though, that quite often those seniors we would want to make part of a group of other seniors are often the ones who are the hardest to approach. They live perhaps in more remote areas, not in our cities and towns, or they sometimes have lived alone for a long time and they are hesitant to join groups of other seniors.
Our golden age clubs, our seniors' clubs, have succeeded in large measure in bringing the seniors together and organizing good, sound recreational activities, both physical and otherwise, in order to occupy the time of many of our seniors who have retired, particularly those living alone.
One should not stereotype our senior citizens as people who have necessarily all retired and are living alone because that is not the case.

Many seniors, of course, live very productive lives and contribute to the labour force, directly or indirectly. I for one am glad to see that the old way of looking at things, of forcing seniors to retire at 65 or some other arbitrary age, is disappearing or observed less and less.
The time has come when Canadians must consider our seniors as people who are as much a part of society as those who are younger and, of course, we must consider them as full members because they contribute so much.

Another thing we should consider in all of this is the aging of our work force. We must ensure strong and meaningful participation for our people who have reached some of those milestone years in their lives. They are needed components of our work force and elsewhere.
In a study I participated in some years ago about skilled trades people in Canada we were noting that some of our skilled people, machinists, skilled people in other specialized areas, were all approaching that so-called age of retirement we use to talk about a lot.
If all those peoples did retire at that arbitrary age, which granted is disappearing now, their retirement would have meant that others would have lost their jobs because they were the team leaders, the organizers, the high-tech people, the machinists, the trades people on whom others depended.
Sometimes some will say, wrongly, that if so and so retired, that would make room for the rest of them to go up that ladder. Perhaps there are occasions when that may be so, not that it would make it a credible argument. In many cases the exact opposite is true.
June 12, 1992

{Translation]
The same thing is happening now in the academic field. Teachers at the secondary and post-secondary level who have doctorates are almost all approaching so-called retirement age. Fortunately, we are eliminating that arbitrary age limit.

In conclusion, I want to indicate the support of my colleagues of the minister's statement but I want to inform the government that we certainly do not want the episode that took place some years ago in which pensions were attacked to happen again in this House. It is my hope that not only that government but any government would have learned its lesson from the attacks of that particular time.
I do not want to end on a negative note. I want to conclude, though, by saying that we consider the message of the minister to be a very positive one, one which we support but again with the caution I have expressed earlier.

",Liberal,,Don Boudria,http://www.parl.gc.ca/parlinfo/Files/Parliamentarian.aspx?Item=efec68a7-e1fd-490f-8b6a-95313440440c&Language=E&Section=ALL
3914631,ca.proc.d.1992-06-12.3.2.3,1992-06-12,e7ce06f9-85e6-4a9d-8c01-94b3de52a6cb,ca.m.5850,Mr. Jack Whittaker (Okanagan -Similkameen-Merritt):,,ROUTINE PROCEEDINGS,CANADA'S SENIORS,,"Madam Speaker, it is my pleasure to rise today on this occasion on behalf of my party and our critic from Beaches-Woodbine, the seniors critic for our party, and express my congratulations to the minister on her statement today. It is my pleasure to be able to be part of a statement in the House of Commons, pointing out to the people of Canada and to anybody else watching the parliamentary channel the resource we have in Canada; namely, our golden agers, our seniors.
One of the things that has been brought out in the speech by the Minister of State for Seniors, and it is an important one, is the need for seniors to be and to feel they are independent.
Independence comes from a sense of economic wellbeing, a sense of security in the knowledge they are surrounded by friends, acquaintances, and that they have sufficient funds squirrelled away, if you will, to see them through their golden years.
When I look at the aspect of aging in the reports of Statistics Canada and others I see that 57 per cent of seniors, those over 65, are women. As it gets up into the higher age groups, those percentages increase. We look at the report of Statistics Canada and we see that women
Routine Proceedings
are more likely to be single, widowed and living alone and independently and that fewer women own homes than their male counterparts.
I also look at the recent study by Statistics Canada on aging and independence and see that in the ages 65 to 69, 18 per cent of males have incomes under $10,000. Of those females over the ages of 65 to 69, the figure is 48 per cent having incomes under $10,000 per year. When I speak of independence and the economic well-being that goes with independence, I point to those figures as an area that we as parliamentarians must look at carefully in deciding the course of our legislation and our thrust for seniors in the future. I know this minister has been one who has worked hard on behalf of seniors throughout the time I have been here and I have appreciated her forthrightness with me and others regarding seniors.
I want to point out that all has not been rosy throughout the time I have been here. As seniors critic for my party and as one who has been interested in the problems of seniors, I have noted health care cuts to various provinces, including my home province of British Columbia. Seniors tell me the GST has hurt them enormously in a number of ways that were not thought of when the GST was brought in. The clawback of old age security has hurt them.
One thing that has been brought out very graphically to me is that as people get older they need various other hygienic products. In one recent case, I am aware those particular products cost an elderly gentleman over $200 a month. There is no tax deduction and there is no way he can get these products under his pharma-care program. It is an out of pocket expense.
I know all of us as parliamentarians have had calls flooding into our offices since April 1 from seniors who get Canada pension, advising that their over all income has dropped by $8 or $9 a month.
For many of us who make reasonable salaries, $8 or $9 a month does not seem that significant. However, when you are receiving under $10,000 a year and you are scraping together enough money to be able to eat properly, $8 a month may make the difference between three full meals in a month. It can make the difference if you want to get out and see a friend that month. I want to highlight that.

June 12, 1992
Routine Proceedings
Although this is a time to celebrate with seniors and draw attention to seniors, I do not think we can turn our backs on the problems that seniors have. There are also other areas we must look at.
I have travelled across the country as the seniors critic. We speak about independent living. As medical breakthroughs come along, people are living longer, but we do not seem to have proper facilities for people that require them, the wandering confused, those with Alzheimers disease, those who have had strokes that have rendered them incapable of looking after themselves. We are just starting to be able to properly and adequately look after these people. When you speak to people who have experienced the trauma of having to place their loved one in a home, it is essential that we have those homes for people and make those facilities available.
I point to the Hardy View Lodge in Grand Forks which just celebrated its 10th anniversary as an example of one that has made a community effort out of this.
I want to mention in closing that I know the minister has worked hard and I know there are many things she would like to do that cannot be done. One thing I want to emphasize as we proceed with the celebration of Seniors Month, is that we have to ensure there is more research and development done in the area of aging, gerontology and the whole process of growing old. We know that it happens. However we must deal with some of the results of aging. I want to congratulate the minister. I want to congratulate the seniors for all of the things they are doing this month. It has been a pleasure to speak on behalf of my party in this celebratory month for seniors.

",New Democratic Party,,John R. (Jack) Whittaker,http://www.parl.gc.ca/parlinfo/Files/Parliamentarian.aspx?Item=e7ce06f9-85e6-4a9d-8c01-94b3de52a6cb&Language=E&Section=ALL
3914632,ca.proc.d.1992-06-12.3.3,1992-06-12,,,,subtopic,ROUTINE PROCEEDINGS,ELECTORAL DISTRICT OF TIMISKAMING,,,,,,
3914633,ca.proc.d.1992-06-12.3.3.1.1,1992-06-12,73f3f1af-58df-4cf2-95e5-958209b05366,ca.m.5429,Mr. John A. MacDougall (Timiskaming) moved,"Parliamentary Secretary to the Minister of Energy, Mines and Resources",ROUTINE PROCEEDINGS,ELECTORAL DISTRICT OF TIMISKAMING,MEASURE TO ENACT,"for leave to introduce Bill C-351, an act to change the name of the electoral district of Timiskaming.

",Progressive Conservative,,John Alexander Frances MacDougall,http://www.parl.gc.ca/parlinfo/Files/Parliamentarian.aspx?Item=73f3f1af-58df-4cf2-95e5-958209b05366&Language=E&Section=ALL
3914634,ca.proc.d.1992-06-12.3.3.1.2,1992-06-12,7a824290-468c-4107-9a12-75853a3733c3,ca.m.1956,Madam Deputy Speaker:,Deputy Speaker and Chair of Committees of the Whole of the House of Commons,ROUTINE PROCEEDINGS,ELECTORAL DISTRICT OF TIMISKAMING,MEASURE TO ENACT,"Pursuant to Standing Order 68(2), the motion is deemed adopted.

",Progressive Conservative,,Andrée  Champagne,http://www.parl.gc.ca/parlinfo/Files/Parliamentarian.aspx?Item=7a824290-468c-4107-9a12-75853a3733c3&Language=E&Section=ALL
3914635,ca.proc.d.1992-06-12.3.3.1.3,1992-06-12,73f3f1af-58df-4cf2-95e5-958209b05366,ca.m.5429,Mr. MacDougall:,"Parliamentary Secretary to the Minister of Energy, Mines and Resources",ROUTINE PROCEEDINGS,ELECTORAL DISTRICT OF TIMISKAMING,MEASURE TO ENACT,"Madam Speaker, on July 13, 1987 when the Electoral Boundary Readjustment Act came into effect, the riding of Timiskaming, which was noted as a north-south riding, was changed to more of a
north-south-east-west, taking in a large part of the Nickel Belt riding.
Communications in Timiskaming normally followed a north-south path, and in identifying the new part of our riding it was felt that the French River, which was the most southwest point of the riding, that we would be able to change the name to recognize the new portion of the riding and to rename it Timiskaming-French River.

",Progressive Conservative,,John Alexander Frances MacDougall,http://www.parl.gc.ca/parlinfo/Files/Parliamentarian.aspx?Item=73f3f1af-58df-4cf2-95e5-958209b05366&Language=E&Section=ALL
3914636,ca.proc.d.1992-06-12.3.3.1.4,1992-06-12,7a824290-468c-4107-9a12-75853a3733c3,ca.m.1956,Madam Deputy Speaker:,Deputy Speaker and Chair of Committees of the Whole of the House of Commons,ROUTINE PROCEEDINGS,ELECTORAL DISTRICT OF TIMISKAMING,MEASURE TO ENACT,"Mr. MacDougall moves that the bill be now read the first time and printed.
Pursuant to Standing Order 69(1), the motion is deemed carried.
Bill read the first time and printed.

",Progressive Conservative,,Andrée  Champagne,http://www.parl.gc.ca/parlinfo/Files/Parliamentarian.aspx?Item=7a824290-468c-4107-9a12-75853a3733c3&Language=E&Section=ALL
3914637,ca.proc.d.1992-06-12.3.4,1992-06-12,,,,subtopic,ROUTINE PROCEEDINGS,JUSTICE AND THE SOLICITOR GENERAL,,,,,,
3914638,ca.proc.d.1992-06-12.3.4.1.1,1992-06-12,e2215b82-92bb-4ad0-91fb-632ad9f53a1b,ca.m.2460,Mr. Jim Edwards (Parliamentary Secretary to Minister of State and Leader of the Government in the House of Commons):,Parliamentary Secretary to the Leader of the Government in the House of Commons,ROUTINE PROCEEDINGS,JUSTICE AND THE SOLICITOR GENERAL,AUTHORIZATION FOR COMMITTEE TO TRAVEL,"Madam Speaker, I think you will find there is unanimous consent for the following motion. I move:
That three members and one staff of the Standing Committee of
Justice and the Solicitor General be authorized to travel to Halifax,
Nova Scotia from August 22 to 27, 1992 to attend the annual
meeting of the Canadian Bar Association.

",Progressive Conservative,,James (Jim) Stewart Edwards,http://www.parl.gc.ca/parlinfo/Files/Parliamentarian.aspx?Item=e2215b82-92bb-4ad0-91fb-632ad9f53a1b&Language=E&Section=ALL
