basepk,hid,speechdate,pid,opid,speakeroldname,speakerposition,maintopic,subtopic,subsubtopic,speechtext,speakerparty,speakerriding,speakername,speakerurl
4511897,ca.proc.d.2012-02-27.2453.183,2012-02-27,1b175d0f-9278-4e04-9fa8-0368e591c5a5,69,"Mr. Joe Comartin (Windsor—Tecumseh, NDP)",,Oral Questions,Privilege,Alleged interference of Minister's ability to discharge responsibilities,"Mr. Speaker, it is difficult for us to get on our feet at this point and be at all sympathetic to some of the requests from the Minister of Public Safety. On the other hand, the vikileaks30 type of approach, that type of politics, is totally offensive to this side of the House and to my political party. I want to be on the record as saying that to the minister.
However, on February 10 the Minister of Foreign Affairs stood in the House and accused my party repeatedly and unequivocally, using offensive terminology and terms like “sleazy practices”, of exactly what we have now heard came from a staffer from the Liberal Party. We had nothing to do with that. 
On this question of privilege that I have to raise for my party, I have to ask you, Mr. Speaker, to compel the Minister of Foreign Affairs to come back into the House at the earliest opportunity and apologize to my party and the members of my caucus.",New Democratic Party,Windsor--Tecumseh,Joe Comartin,http://www.parl.gc.ca/parlinfo/Files/Parliamentarian.aspx?Item=1b175d0f-9278-4e04-9fa8-0368e591c5a5&Language=E&Section=ALL
4511898,ca.proc.d.2012-02-27.2453.184,2012-02-27,aa58e8f5-4a46-4c79-8e97-b9ebe28c9d9a,295,"Hon. Peter Van Loan (Leader of the Government in the House of Commons, CPC)",,Oral Questions,Privilege,Alleged interference of Minister's ability to discharge responsibilities,"Mr. Speaker, I rise in response to the comments just made by the opposition House leader. 
In setting out the terms of what the foreign affairs minister said the last Friday we were sitting, I added on a point of order afterwards that of course the reliance was on media reports that had indicated through their research that the source was obviously from the NDP or someone within the NDP in the House of Commons. Obviously that information was incorrect.
Based on the information today, I have every confidence that the Minister of Foreign Affairs will give his most fulsome and complete apology and withdraw those remarks from the last Friday that the House was sitting. I certainly would do the same on behalf of our government.
 I will leave it to the minister himself to deal with the apology that has been offered by the hon. member for Toronto Centre on behalf of the Liberal Party in taking responsibility for the actions in this case. I can assure the hon. member that on behalf of the government we withdraw those remarks.
I am sure that the Minister of Foreign Affairs would be prepared to do the same.",Conservative,York--Simcoe,Peter Van Loan,http://www.parl.gc.ca/parlinfo/Files/Parliamentarian.aspx?Item=aa58e8f5-4a46-4c79-8e97-b9ebe28c9d9a&Language=E&Section=ALL
4511899,ca.proc.d.2012-02-27.2453.185,2012-02-27,4b9cf7c8-d5db-4efa-a24e-c26afde48cc3,232,"Mr. Louis Plamondon (Bas-Richelieu—Nicolet—Bécancour, BQ)",,Oral Questions,Privilege,Alleged interference of Minister's ability to discharge responsibilities,"Mr. Speaker, as a member of the Bloc Québécois and also as dean of this House, I would like to pause to say how shocked we have been by the intrusion into the minister's private life. I believe it is one of the worst attacks I have seen in the 27 years that I have served this House.
We share the minister's indignation and we fully agree that the public and the private lives of a politician should be completely distinct.
In closing, I would like to say to the leader of the Liberal Party that I admire the honest, transparent and most appropriate statement that he gave a few minutes ago on this matter. ",Bloc Québécois,Bas-Richelieu--Nicolet--Bécancour,Louis Plamondon,http://www.parl.gc.ca/parlinfo/Files/Parliamentarian.aspx?Item=4b9cf7c8-d5db-4efa-a24e-c26afde48cc3&Language=E&Section=ALL
4511900,ca.proc.d.2012-02-27.2453.186,2012-02-27,ab143dd3-e5b4-43fc-bc61-1279f1c395e9,287,Hon. Vic Toews,Interjection,Oral Questions,Privilege,Alleged interference of Minister's ability to discharge responsibilities,"Mr. Speaker, I thank the members in the House for the comments that they have made.
I accept the personal apology from the hon. member for Toronto Centre. I think it is a heartfelt apology and is worthy of acceptance.
I would point out though, and this is something I will have to take under advisement, there were members of the Liberal Party who actively encouraged the use of the vikileaks30 website and continuously promoted the use of that website. Mr. Speaker, I think you have to look into that.
While I am prepared to take the member's comments at face value that he had nothing to do with it, I think the evidence on the public record is clear that there was at least one hon. member who advocated on a continuous basis the use of that website. Mr. Speaker, I would respectfully submit you need to take a look at that.",Conservative,Provencher,Vic Toews,http://www.parl.gc.ca/parlinfo/Files/Parliamentarian.aspx?Item=ab143dd3-e5b4-43fc-bc61-1279f1c395e9&Language=E&Section=ALL
4511901,ca.proc.d.2012-02-27.2453.187,2012-02-27,abeb1396-5319-4cef-8b3a-a2417c0f43ce,401,"Hon. John Baird (Minister of Foreign Affairs, CPC)",,Oral Questions,Privilege,Alleged interference of Minister's ability to discharge responsibilities,"Mr. Speaker, I saw the interventions by the hon. member from Windsor—Tecumseh and the government House leader.
At times emotions get strained in this House. I think they get particularly strained when one has a friend and colleague who is under attack. Sometimes one rushes to judgment and believes certain media reports.
I heard the comments from the opposition House leader. I want to unequivocally and unconditionally apologize and retract my comments to him and to anyone in the New Democratic Party who may have taken offence.
I think I went out of my way to not single anyone out, but I unconditionally retract those comments. I unconditionally apologize to the hon. member, his caucus and the members of his party who were offended.
Mr. Speaker, I would also like to retract the comments I made about the Liberal Party on the last Friday the House was sitting as well, in which I said I was not accusing it of anything.",Conservative,Ottawa West--Nepean,John Baird,http://www.parl.gc.ca/parlinfo/Files/Parliamentarian.aspx?Item=abeb1396-5319-4cef-8b3a-a2417c0f43ce&Language=E&Section=ALL
