basepk,hid,speechdate,pid,opid,speakeroldname,speakerposition,maintopic,subtopic,subsubtopic,speechtext,speakerparty,speakerriding,speakername,speakerurl
4511714,ca.proc.d.2012-02-27.2453.0,2012-02-27,,,,stagedirection,Private Members' Business,Criminal Code,,"The House resumed from November 28, 2011, consideration of the motion that Bill C-299, An Act to amend the Criminal Code (kidnapping of young person), be read the second time and referred to a committee.",,,,
4511715,ca.proc.d.2012-02-27.2453.1,2012-02-27,9afd15e3-d6df-4779-ba0f-5a305ebb77b5,268,"Mrs. Joy Smith (Kildonan—St. Paul, CPC)",,Private Members' Business,Criminal Code,,"Mr. Speaker, I am pleased to rise today to speak to Bill C-299. This bill was tabled by my colleague, the member for Kootenay—Columbia. I want to commend him for bringing forward such an important bill to strengthen Canada's legislation on kidnapping. As an RCMP officer for over 20 years, the member has been on the front lines protecting and serving many communities throughout B.C. My son is an RCMP officer. I thank the member for his service to our country.
The member has tabled a bill that I strongly support. Bill C-299 would amend the Criminal Code under subsection 279(1.1) to include a mandatory minimum sentence of five years imprisonment if the kidnapped victim is under 16 years of age. This would be an important amendment as it would recognize the grave implications of kidnapping a minor. I want to recognize that this legislation would focus on stranger abductions, which are abductions by someone other than a parent or legal guardian. 
Parents and families are put through devastating emotional trauma when their children are ripped away from them. They face significant anxiety not knowing the condition of their children or if they will ever be reunited. There is often deep guilt around whether they could have done anything different to prevent the kidnapping. There is also a general fear and anxiety placed on communities where the abduction has taken place. In Canada, numerous stranger abductions, abductions by someone other than a parent or legal guardian, occur every year. The Missing Children Society of Canada documented 56 stranger abductions in 2008. In 2009, based on CPIC data, this number is up significantly from 31 in 2004 and 30 in 2005.
The tragic result is that each year approximately 100 parents in Canada lose their children to an often violent and abusive predator. As we heard from the member for Kootenay—Columbia, not all parents get their children back. There is much debate around the use of mandatory minimum sentences. However, I believe that child abduction is a serious matter that requires serious penalties. It is the role of Parliament to ensure that the Criminal Code contains measures and sanctions that denounce egregious crimes such as kidnapping and the abduction of a minor.
In 2009, I brought forward legislation that proposed similar five year mandatory minimum sentences for child trafficking. This bill is now law and is being used across Canada. I believe that the mandatory minimum sentences in this bill are appropriate for this crime and reflect similar offences in the Criminal Code. 
The Supreme Court of Canada has affirmed the test for when a mandatory minimum sentence of imprisonment will constitute cruel and unusual punishment under section 12 of the Canadian Charter of Rights and Freedoms. In the unanimous reasons for judgment in Regina v. Ferguson, Chief Justice Beverley McLachlin stated:
 The test for whether a particular sentence constitutes cruel and unusual punishment is whether the sentence is grossly disproportionate... As this Court has repeatedly held, to be considered grossly disproportionate, the sentence must be more than merely excessive. 
I would argue that a five year minimum sentence for the crime of abducting a child from his or her parents would not be grossly disproportionate. Bill C-299 proposes a sentence that would reflect our society's denouncement of this horrid crime. I call on all members of the House to support this very important measure. It is well known that every day we see on TV and hear on the radio of children who disappear or are abducted. It is a very traumatic experience. In Canada, it behooves us to ensure that our most treasured and vulnerable children are protected and respected.",Conservative,Kildonan--St. Paul,Joy Smith,http://www.parl.gc.ca/parlinfo/Files/Parliamentarian.aspx?Item=9afd15e3-d6df-4779-ba0f-5a305ebb77b5&Language=E&Section=ALL
4511716,ca.proc.d.2012-02-27.2453.2,2012-02-27,288315ef-2fe8-48ad-8ae0-833ac097bac0,3658,"Mr. Philip Toone (Gaspésie—Îles-de-la-Madeleine, NDP)",,Private Members' Business,Criminal Code,,"Mr. Speaker, I am pleased to have this opportunity to speak to Bill C-299, which would prescribe a minimum punishment of five years when a kidnap victim is under 16 years of age. 
I am appealing to my Conservative colleagues' democratic values and asking them to take a close look at this bill, which has a number of faults that should be corrected. During the debate at second reading of this bill, members said that many children are kidnapped in Canada. The member who just spoke said that this is still a problem in Canada and that it happens often.
In Canada, children are rarely kidnapped by strangers. The RCMP, the Canadian Centre for Child Protection and other experts say that it is very rare. The last time a child was kidnapped by a stranger was 20 years ago. I have to wonder why we need a bill like this, which would impose a minimum sentence and prevent judges from exercising their discretion. This sentence would be imposed regardless of the circumstances of the kidnapping of a child.
Of course, nobody thinks that the kidnapping of a child is a good thing. That would be ridiculous. Parliament must send a clear message to Canadians and to the world that Canada will not tolerate the kidnapping of a child. The Criminal Code already states that the penalty can be as high as life in prison. Existing penalties are harsh enough; making them harsher would be pointless. It is up to judges to determine appropriate penalties in light of the circumstances. The government is using its legislative power to impose a five-year minimum penalty, thereby undermining judges' expertise and usurping their judicial authority. I do not think that this is a good way to legislate in Canada.
We know that strangers rarely kidnap children. At the beginning of this debate, the member for Kootenay—Columbia, who introduced this bill, said that relatives were not considered “strangers”. Several sections, including section 280 of the Criminal Code, already set out penalties for the kidnapping of a child by a relative, specifically a mother or father.
During the debate, we heard that the bill does not cover close relations; it covers only strangers. However, I would like to quote from a study published by the RCMP in 2003, which I have before me in English.
The Abduction of Children by Strangers in Canada: Nature and Scope , December 1, 2003, is a report that was often cited in the last hour of debate back in November. Certain elements of the study were not raised. I would like to raise them now.
If I could speak to the definition of stranger, I will quote a paragraph:
 To elaborate further, not only is the term “abduction” difficult to define, but also the term “stranger”. 
Boudreaux et al., 1999, define a stranger as:
 Someone who the victim has never come into contact with before the offense; anyone who is not part of the immediate family; and everything in between. Commonly referred to as a “non-family member” this person is someone who is not part of the family, such as a babysitter, family friend, acquaintance, boyfriend, and so on. 
I think that the next part of the quote is particularly revealing:
 The Royal Canadian Mounted Police's Canadian Police Information Centre (CPIC) operating data entry guidelines define a “stranger” as someone other than the parent or guardian of the victim. This includes siblings, aunts, uncles, grandparents, cousins, as well as the non-family members, neighbours and close friends. 
If I can continue the debate on the term “stranger”, the bill does not give a proper definition of the term. The member who introduced the bill gave us his definition of stranger, that is, someone whom the child does not know.
However, the people who will be mandated to enforce this piece of legislation are the RCMP or the police. According to the RCMP's definition, a stranger is not someone whom the child does not know, but rather someone whom the child knows very well. An uncle, a grandparent, a cousin—these are close relations. We have all experienced difficult situations within our families. In a family situation that might be very complicated, I have a serious problem with the fact that someone would remove a child, thinking they are protecting that child.
In such situations, judges are in the best position to determine the punishment, which should definitely apply. Only the parent or legal guardian should be allowed to take the child. However, we need to be aware that there are very difficult and emotional situations and that a minimum sentence completely ignores the reasons for removing a child. It is very important to keep in mind that the RCMP's definition is completely different than the definition the bill before us seems to propose.
The bill clearly needs to be amended. It should define the term “stranger”. One debate in the House is not enough. This needs to be clearly defined.
I would like to continue by addressing the issue raised by the Centre for Child Protection or missingkids.ca, which was mentioned in previous debates on this bill. The organization says that it is very rare for a child to be kidnapped by a stranger, which is defined here as a person whom the child does not know very well or at all. I have a problem with the fact that members are rising in the House and saying that this is a frequent occurrence. I would like to know how they are defining kidnapping by a stranger. In fact, from what I understand from organizations working in this field, such occurrences are rare.
A bill like this that will introduce such harsh sentences is completely intolerable. This bill should not be passed. Once again, this bill clearly needs to be amended. I would like the term “stranger” to be defined in the way that experts in the field define it, rather than in the way the legislator defines it, since the legislator, perhaps by omission, has left things vague and has left judges with the discretion to define the term. If the bill seeks to remove judges' discretion and then creates a situation in which it is impossible to define the term “stranger”, the legislator has truly missed the mark.
Most missing children are not necessarily kidnapped. Many of them, particularly teenagers, have run away from home. The bill, which pertains to children up to the age of 16, ignores the fact that 16-year-old children are not usually kidnapped. When a child is kidnapped by a stranger—someone the child does not know—there are serious consequences. Once again, no one will tolerate a child being kidnapped by anyone. We want kidnappers to be punished but we want the punishment to fit the crime.
One member rose as part of this debate and gave the history of the Magna Carta. I do not want to have to refer to the Magna Carta to explain the reason why I do not support the bill as it stands today; however, it is important to understand that mandatory minimum sentencing completely disregards the purpose of—",New Democratic Party,Gaspésie--Îles-de-la-Madeleine,Philip Toone,http://www.parl.gc.ca/parlinfo/Files/Parliamentarian.aspx?Item=288315ef-2fe8-48ad-8ae0-833ac097bac0&Language=E&Section=ALL
4511717,ca.proc.d.2012-02-27.2453.3,2012-02-27,43d98498-4000-43e4-b468-5f79352823ad,451,The Deputy Speaker,Interjection,Private Members' Business,Criminal Code,,"Order. I am sorry to interrupt the hon. member.
Resuming debate, the hon. member for Mount Royal.",New Democratic Party,Victoria,Denise Savoie,http://www.parl.gc.ca/parlinfo/Files/Parliamentarian.aspx?Item=43d98498-4000-43e4-b468-5f79352823ad&Language=E&Section=ALL
4511718,ca.proc.d.2012-02-27.2453.4,2012-02-27,0d8486f0-be42-41d4-ac82-c51a7f9c0fa9,72,"Hon. Irwin Cotler (Mount Royal, Lib.)",,Private Members' Business,Criminal Code,,"Madam Speaker, I am pleased to participate in the debate on Bill C-299. Let me state at the outset, I realize that as soon as one opposes a mandatory minimum sentence one is regarded as being soft on crime or worse. That has occurred here in the House. However, it is my submission that the issue really is how can one be smart and effective on crime. 
In that regard, mandatory minimums not only impugn the integrity of the legal process but they also are a failed criminal justice policy. Enhancing our Criminal Code with such mandatory minimums does nothing to reduce crime or improve public safety.
Moreover, the fact that this legislation is dealing with child kidnapping, a crime all of us abhor, is not a reason to suggest that a mandatory minimum that underlines it should be accepted without any form of reservation or critique. The abhorrence of the crime does not thereby validate the sentence.
Simply put, mandatory minimums do not advance the goal they purport to reach, that of crime prevention and of deterrence. This is not a personal conclusion. It is one that is anchored in studies the world over, from the United States, South Africa, from whence I have just come, which discussed and critiqued mandatory minimum sentences, New Zealand, and the like. That conclusion is found also in volumes of social science research and evidence.
Perhaps the strongest evidence against mandatory minimums comes from the United States where legal experts have increasingly critiqued their use. Indeed, just last week a coalition of American law enforcement officials, judges and prosecutors called upon the Senate of Canada to reconsider the mandatory minimum sentences in Bill C-10, concluding that such penalties “do not achieve their stated objectives”.
 Indeed, the signatories of the letter expressed great confusion over the current government's emphasis on mandatory minimums, as these mandatory minimum sentences have been repealed in various jurisdictions of the United States for precisely the reason of being a failed criminal justice policy. Moreover, the letter itself bluntly states:
 --we cannot understand why Canada's federal government and some provincial governments would embark down this road. 
Lest it be thought that there is no Canadian evidence on the matter, our own justice department published a study in December 1990 called “A Framework for Sentencing, Corrections and Conditional Release, Directions for Reform”, which on page 9 states:
 The evidence shows that long periods served in prison increase the chance that the offender will offend again. In the end, public security is diminished rather than increased if we “throw away the key”. 
The truth is that mandatory minimum sentences also have a disproportionate impact on those minority groups that already suffer from poverty and deprivation and disadvantage. For example, we have a situation right now where 34% of aboriginal women are in prison, which is a shocking datum. Mandatory minimums would not alleviate let alone address this problem. Rather, they would exacerbate it.
As well, mandatory minimums prejudice the integrity of the legal and judicial process. They unduly limit judicial and prosecutorial discretion. We know that in some cases prosecutors will leverage or avoid mandatory minimum charges so that offenders will plead to a lesser offence, even if they are innocent of that offence.
Similarly, if more offenders plead not guilty given the particular mandatory minimums, we are likely to further strain our scarce judicial resources, something from which nobody benefits. The Canadian Bar Association has gone so far as to warn that if the courts become clogged with persons contesting the minimum, it may be that the right trial in a reasonable period of time would be infringed and criminals would thereby be set free.
Moreover, mandatory minimums may invite a spectrum of constitutional challenges that further backlog the courts and take us away from principles of justice and fairness. If they are gross and disproportionate, they may violate the charter.
The Ontario Court ruling in the Smickle case several weeks ago is proof on this point. The judge struck down a mandatory minimum in that case saying that its imposition would be, ""fundamentally unfair, outrageous, abhorrent and intolerable"".
For a government that touts itself as being so concerned with cost cutting, it is surprising that it would embark on a criminal justice plan that would have it defending multiple charter claims at great expense to Canadian taxpayers without enhancing the integrity of our system and without serving as a deterrent or being fair in its application.
Further, as the U.S. Sentencing Commission and the Canadian Sentencing Commission pointed out, inequitable and inconsistent sentencing policies, and this can and very often does result from mandatory minimums as all of the evidence shows us, may foster disrespect for and lack of confidence in the federal criminal justice system. This is another consideration that we should be addressing in the debate on the bill.
At the end of the day, as all of the evidence demonstrates, relying on mandatory minimums would likely result in a situation where we would find ourselves incarcerating more people for longer periods of time and thereby also aggravating the existing problem of prison overcrowding. This in itself may raise a question of constitutional concern with regard to the question of cruel and unusual punishment as it has in the United States. We may find a similar concern being raised here in Canada.
These laws have helped to fill prisons but without increasing public safety. With respect to the subject matter of this bill, someone intent on kidnapping a child is not going to be deterred by the fact that there is a mandatory minimum sentence on the books. Odds are the individual is not even aware of the penalty. Unless we think criminals are using Google to look up the potential consequence of an offence, there is no deterrent value here. The evidence has shown that not only is there no deterrent value, but mandatory minimums end up also being unfair, injurious, grossly disproportionate, and the like.
Lest anyone be confused, the Liberal Party has a strong historical advocacy policy with respect to the protection of children. I might add that the first bill I introduced as minister of justice was exactly that, an act to protect children and other vulnerable persons, to help children who are the most vulnerable in Canadian society.
This is not about whether we do or do not protect children. We all agree that we must protect children. We all agree that the kidnapping of children is an abhorrent crime. The issue is about how we can effectively prevent and combat such a heinous criminal offence. 
We support concrete measures to make Canada's streets and communities safer, particularly when it comes to protecting our children, but we cannot support the imposition of mandatory minimum sentences which have been proven time and again to be ineffective, costly, unfair, injurious, prejudicial, disproportionate, and as all of the evidence has shown in all of the jurisdictions that I have cited, an utterly failed criminal justice policy.",Liberal,Mount Royal,Irwin Cotler,http://www.parl.gc.ca/parlinfo/Files/Parliamentarian.aspx?Item=0d8486f0-be42-41d4-ac82-c51a7f9c0fa9&Language=E&Section=ALL
