basepk,hid,speechdate,pid,opid,speakeroldname,speakerposition,maintopic,subtopic,subsubtopic,speechtext,speakerparty,speakerriding,speakername,speakerurl
4233384,ca.proc.d.2002-12-03.1708.130,2002-12-03,11e58957-eaed-4442-b284-2e18f91674d3,5142,"Hon. Martin Cauchon (Minister of Justice and Attorney General of Canada, Lib.)",,Oral Question Period,Firearms Registry,,"Mr. Speaker, we totally accept the Auditor General's recommendations. It is sound policy. The question is could we do more, could we do better? Yes, we can do better. We are firmly committed to do so.
With regard to the process, of course, there was a question of accountability and the question of the interpretation of the charter given to the justice department. We intend to ensure that in the future, in the main estimates, we provide Canadians with all the total numbers including those of other departments.",Liberal,Outremont,Martin Cauchon,http://www.parl.gc.ca/parlinfo/Files/Parliamentarian.aspx?Item=11e58957-eaed-4442-b284-2e18f91674d3&Language=E&Section=ALL
4233385,ca.proc.d.2002-12-03.1708.131,2002-12-03,3fdae7dd-2050-4a7b-a44f-0ef36124b8bd,43,"Mr. Garry Breitkreuz (Yorkton—Melville, Canadian Alliance)",,Oral Question Period,Firearms Registry,,"Mr. Speaker, he has not been accountable to Parliament yet. Why should we believe him now? The Auditor General said the issue is not gun control and not even the astronomical cost overruns. What is really inexcusable is that Parliament was kept in the dark.
Can the justice minister give Parliament one reason why we should believe a single word that comes out of his mouth now when we know that he has been spouting complete and utter nonsense? That includes the industry minister, the health minister, the former finance minister, the Deputy Prime Minister and the Prime Minister himself. They have all misled Parliament.
Why the cover-up?",Canadian Alliance,Yorkton--Melville,Garry Breitkreuz,http://www.parl.gc.ca/parlinfo/Files/Parliamentarian.aspx?Item=3fdae7dd-2050-4a7b-a44f-0ef36124b8bd&Language=E&Section=ALL
4233386,ca.proc.d.2002-12-03.1708.132,2002-12-03,,,,,Oral Question Period,Firearms Registry,,I think the hon. member will want to use caution in his words. The hon. Minister of Justice has the floor.,,,The Speaker,
4233387,ca.proc.d.2002-12-03.1708.133,2002-12-03,11e58957-eaed-4442-b284-2e18f91674d3,5142,"Hon. Martin Cauchon (Minister of Justice, Lib.)",,Oral Question Period,Firearms Registry,,"Mr. Speaker, what has been mentioned is simply not true. All the numbers regarding the gun control registry have been reported through Justice Canada and have been reported as well through other ministries that are involved in the program delivery.
There was some discussion regarding the way we should report, the justice department being the single point of accountability. It is more than a coordinating body. Therefore, in the future we will ensure that the report will be in the estimates, not only for Justice Canada but for all the other stakeholders involved in taking good--",Liberal,Outremont,Martin Cauchon,http://www.parl.gc.ca/parlinfo/Files/Parliamentarian.aspx?Item=11e58957-eaed-4442-b284-2e18f91674d3&Language=E&Section=ALL
4233388,ca.proc.d.2002-12-03.1708.134,2002-12-03,,,,,Oral Question Period,Firearms Registry,,The hon. member for Laurier--Sainte-Marie.,,,The Speaker,
4233389,ca.proc.d.2002-12-03.1708.135,2002-12-03,ed3d4160-8a5a-4efc-a0a6-d65deeb994d9,94,"Mr. Gilles Duceppe (Laurier—Sainte-Marie, BQ)",,Oral Question Period,Health,,"Mr. Speaker, the Premier of Quebec mentioned creating a health fund into which would be transferred all of the federal money the Romanow report said needed to put back into health care.
With a guarantee like the health fund, does the Prime Minister realize that the federal government does not need to impose conditions on Quebec to ensure that all of the money goes to patient care?",Bloc Québécois,Laurier--Sainte-Marie,Gilles Duceppe,http://www.parl.gc.ca/parlinfo/Files/Parliamentarian.aspx?Item=ed3d4160-8a5a-4efc-a0a6-d65deeb994d9&Language=E&Section=ALL
4233390,ca.proc.d.2002-12-03.1708.136,2002-12-03,2aa8c3e9-f46e-4c78-b9ff-04bec0ed5050,5241,"Right Hon. Jean Chrétien (Prime Minister, Lib.)",,Oral Question Period,Health,,"Mr. Speaker, we will meet with the premiers at the end of January or perhaps in early February. We will sit down with them and try to work together on finding a solution that will benefit health care services across Canada.
We managed to come up with an agreement in October 2000. I am confident that everyone will work in the interests of patients, medical service providers and all citizens and will do their best to avoid constitutional squabbles.",Liberal,Saint-Maurice,Jean Chrétien,http://www.parl.gc.ca/parlinfo/Files/Parliamentarian.aspx?Item=2aa8c3e9-f46e-4c78-b9ff-04bec0ed5050&Language=E&Section=ALL
4233391,ca.proc.d.2002-12-03.1708.137,2002-12-03,ed3d4160-8a5a-4efc-a0a6-d65deeb994d9,94,"Mr. Gilles Duceppe (Laurier—Sainte-Marie, BQ)",,Oral Question Period,Health,,"Mr. Speaker, I did not mention squabbles, but what other condition does he want on top of the Government of Quebec saying, “All of the money will go toward health care and will be used only for health care”?
What further condition does he want? Why would the federal government need to say exactly where the money will be spent, or even maybe administer it? Should it not be enough for us to say to the government “It will all go toward health care”? This would avoid any squabbles. If the government wants to avoid squabbles, that is the solution.",Bloc Québécois,Laurier--Sainte-Marie,Gilles Duceppe,http://www.parl.gc.ca/parlinfo/Files/Parliamentarian.aspx?Item=ed3d4160-8a5a-4efc-a0a6-d65deeb994d9&Language=E&Section=ALL
4233392,ca.proc.d.2002-12-03.1708.138,2002-12-03,2aa8c3e9-f46e-4c78-b9ff-04bec0ed5050,5241,"Right Hon. Jean Chrétien (Prime Minister, Lib.)",,Oral Question Period,Health,,"Mr. Speaker, sometimes the provinces have found it very useful to have funding earmarked for a specific purpose, such as the purchase of badly needed equipment. The money was earmarked for needed equipment and could not be used for collective bargaining.
Sometimes it is very useful to have funding that is earmarked for a very specific purpose, so that people can have needed equipment. This is what happened with the one billion dollars we provided at the time to help the provinces purchase new equipment.",Liberal,Saint-Maurice,Jean Chrétien,http://www.parl.gc.ca/parlinfo/Files/Parliamentarian.aspx?Item=2aa8c3e9-f46e-4c78-b9ff-04bec0ed5050&Language=E&Section=ALL
4233393,ca.proc.d.2002-12-03.1708.139,2002-12-03,595bcf3a-ea43-42d7-937e-1018bfde5547,198,"Mr. Réal Ménard (Hochelaga—Maisonneuve, BQ)",,Oral Question Period,Health,,"Mr. Speaker, in no way will it be acceptable for the federal government to take advantage of the needs that it itself created in health in order to become directly involved in an area outside its jurisdiction.
Does the Prime Minister not realize that his proposal to get the federal government involved in the planning of health care only adds yet another layer of officials who will make things even more complicated in the health care sector?",Bloc Québécois,Hochelaga--Maisonneuve,Réal Ménard,http://www.parl.gc.ca/parlinfo/Files/Parliamentarian.aspx?Item=595bcf3a-ea43-42d7-937e-1018bfde5547&Language=E&Section=ALL
4233394,ca.proc.d.2002-12-03.1708.140,2002-12-03,2aa8c3e9-f46e-4c78-b9ff-04bec0ed5050,5241,"Right Hon. Jean Chrétien (Prime Minister, Lib.)",,Oral Question Period,Health,,"Mr. Speaker, we still have not made any decision. We received the report of Mr. Romanow and that of Senator Kirby. There is Mr. Clair's report. There is the Mazankowski report. Many people have examined these issues. They will all meet. The ministers will meet this week and later in December and in January.
When we will hold our first ministers' meeting, then we will decide what is the best agreement that we can have. However, we will always act in the best interests of those who receive health care, and not with an eye to a future election.",Liberal,Saint-Maurice,Jean Chrétien,http://www.parl.gc.ca/parlinfo/Files/Parliamentarian.aspx?Item=2aa8c3e9-f46e-4c78-b9ff-04bec0ed5050&Language=E&Section=ALL
4233395,ca.proc.d.2002-12-03.1708.141,2002-12-03,595bcf3a-ea43-42d7-937e-1018bfde5547,198,"Mr. Réal Ménard (Hochelaga—Maisonneuve, BQ)",,Oral Question Period,Health,,"Mr. Speaker, the federal government dares to make provincial governments accountable to its officials for their management of health care.
Does the Prime Minister not realize that provincial governments are directly accountable to the public for their management of health care and that there is no question of their being accountable to federal officials, as proposed in the Romanow report?",Bloc Québécois,Hochelaga--Maisonneuve,Réal Ménard,http://www.parl.gc.ca/parlinfo/Files/Parliamentarian.aspx?Item=595bcf3a-ea43-42d7-937e-1018bfde5547&Language=E&Section=ALL
4233396,ca.proc.d.2002-12-03.1708.142,2002-12-03,2aa8c3e9-f46e-4c78-b9ff-04bec0ed5050,5241,"Right Hon. Jean Chrétien (Prime Minister, Lib.)",,Oral Question Period,Health,,"Mr. Speaker, the important thing is that they be accountable to everyone. If they are accountable to the federal government and to the public, it is somewhat the same thing. What the public needs to know is what these governments are doing.
Under the October 2000 agreement, we agreed on a mechanism to inform the public. This mechanism was acceptable to the federal and provincial governments. It was signed by all provincial and territorial governments, and by the federal government, in October 2000.",Liberal,Saint-Maurice,Jean Chrétien,http://www.parl.gc.ca/parlinfo/Files/Parliamentarian.aspx?Item=2aa8c3e9-f46e-4c78-b9ff-04bec0ed5050&Language=E&Section=ALL
4233397,ca.proc.d.2002-12-03.1708.143,2002-12-03,ca5bb188-7a33-44b8-8f38-e7249ac31ade,192,"Ms. Alexa McDonough (Halifax, NDP)",,Oral Question Period,Employment Insurance,,"Mr. Speaker, last week the Prime Minister showed his disdain for Parliament, but he is not the only one. The Auditor General has reminded us for the third time that the $100 million Parc Downsview Park Inc. was created behind Parliament's back, that the $1 billion cost of the firearms registry has been concealed from MPs, and that the EI surplus is $30 billion higher than necessary. Still the government refuses to disclose how premium rates are calculated.
Will the government finally comply with the Auditor General's recommendation for the third year in a row and table the formula used to set EI premiums?",New Democratic Party,Halifax,Alexa McDonough,http://www.parl.gc.ca/parlinfo/Files/Parliamentarian.aspx?Item=ca5bb188-7a33-44b8-8f38-e7249ac31ade&Language=E&Section=ALL
4233398,ca.proc.d.2002-12-03.1708.144,2002-12-03,727ca7a8-0609-48eb-b6f3-01d086548302,4682,"Hon. John Manley (Deputy Prime Minister and Minister of Finance, Lib.)",,Oral Question Period,Employment Insurance,,"Mr. Speaker, the hon. member will know that just last week we reduced the premium rate for the coming year by 10¢. That will save Canadian employers and employees more than $800 million next year alone. It is part of a $100 billion tax reduction package over five years that was introduced only two years ago. I do not really know what the hon. member is complaining about.",Liberal,Ottawa South,John Manley,http://www.parl.gc.ca/parlinfo/Files/Parliamentarian.aspx?Item=727ca7a8-0609-48eb-b6f3-01d086548302&Language=E&Section=ALL
4233399,ca.proc.d.2002-12-03.1708.145,2002-12-03,ca5bb188-7a33-44b8-8f38-e7249ac31ade,192,"Ms. Alexa McDonough (Halifax, NDP)",,Oral Question Period,Employment Insurance,,"Mr. Speaker, what I am complaining about, and I am not alone, is that the government has skimmed off $40 billion in the EI surplus belonging to workers and employers.
Simultaneously the government has failed to collect hundreds of millions of dollars in tax revenues because of lack of enforcement and loopholes. Canadians are anxious to know how the government plans to finance new investments desperately needed in health care.
Will the government go after tax cheats and tax havens, or will it continue to ignore Parliament and milk the inflated EI surplus? Which will it be?",New Democratic Party,Halifax,Alexa McDonough,http://www.parl.gc.ca/parlinfo/Files/Parliamentarian.aspx?Item=ca5bb188-7a33-44b8-8f38-e7249ac31ade&Language=E&Section=ALL
4233400,ca.proc.d.2002-12-03.1708.146,2002-12-03,727ca7a8-0609-48eb-b6f3-01d086548302,4682,"Hon. John Manley (Deputy Prime Minister and Minister of Finance, Lib.)",,Oral Question Period,Employment Insurance,,"Mr. Speaker, who does she think the some $800 million a year goes to except to employers and employees? They are the people who benefit. What about the other $100 billion in tax reductions? Who does it benefit? It benefits Canadians.
Of course we will do everything we can to enforce our tax laws and try to close any loopholes that exist to collect taxes that are owing. That is the duty of government. That is the job that we have to do, but let us not lose sight of the big picture. This is a government that has cut EI premiums and tax--",Liberal,Ottawa South,John Manley,http://www.parl.gc.ca/parlinfo/Files/Parliamentarian.aspx?Item=727ca7a8-0609-48eb-b6f3-01d086548302&Language=E&Section=ALL
4233401,ca.proc.d.2002-12-03.1708.147,2002-12-03,,,,,Oral Question Period,Employment Insurance,,The right hon. member for Calgary Centre.,,,The Speaker,
4233402,ca.proc.d.2002-12-03.1708.148,2002-12-03,a247d1d3-3b05-46ac-b9f3-6622ab25d695,3905,"Right Hon. Joe Clark (Calgary Centre, PC)",,Oral Question Period,Firearms Registry,,"Mr. Speaker, two years ago the Department of Justice told the justice committee that it had spent $327 million on the firearms registry. That same year the same department told the government the registry would cost $1 billion by fiscal year 2004-05. The government did not tell Parliament, a $700 million secret.
My question is to the Prime Minister, what minister in his government authorized the deliberate withholding of this information from Parliament?",Progressive Conservative,Calgary Centre,Joe Clark,http://www.parl.gc.ca/parlinfo/Files/Parliamentarian.aspx?Item=a247d1d3-3b05-46ac-b9f3-6622ab25d695&Language=E&Section=ALL
4233403,ca.proc.d.2002-12-03.1708.149,2002-12-03,11e58957-eaed-4442-b284-2e18f91674d3,5142,"Hon. Martin Cauchon (Minister of Justice and Attorney General of Canada, Lib.)",,Oral Question Period,Firearms Registry,,"Mr. Speaker, it is a question of accountability. Based on the charter of the program the justice department is accountable, not just for the justice department, but all other departments as well. We will ensure to do an audit, which has been demanded last November. We will be able to come forward with our books in a format that the Auditor General would like to have.
As I said, could we do better? Yes, we can do better, but we must also look at the benefit to society. When we look at the stats they actually show the benefits to society. We have a more secure society and we will keep going--",Liberal,Outremont,Martin Cauchon,http://www.parl.gc.ca/parlinfo/Files/Parliamentarian.aspx?Item=11e58957-eaed-4442-b284-2e18f91674d3&Language=E&Section=ALL
4233404,ca.proc.d.2002-12-03.1708.150,2002-12-03,,,,,Oral Question Period,Firearms Registry,,The right hon. member for Calgary Centre.,,,The Speaker,
4233405,ca.proc.d.2002-12-03.1708.151,2002-12-03,a247d1d3-3b05-46ac-b9f3-6622ab25d695,3905,"Right Hon. Joe Clark (Calgary Centre, PC)",,Oral Question Period,Firearms Registry,,"Mr. Speaker, the minister cannot get away with saying I am sorry. He broke the law of Parliament and so did his Prime Minister. They knew about a $700 million overspending. They had an obligation, as he said, to tell the House of Commons. They zipped their lips and did not tell the House of Commons the truth.
My question is to the smiling Prime Minister, who in his government authorized this breaking of the law of Parliament? Was it the Prime Minister himself?",Progressive Conservative,Calgary Centre,Joe Clark,http://www.parl.gc.ca/parlinfo/Files/Parliamentarian.aspx?Item=a247d1d3-3b05-46ac-b9f3-6622ab25d695&Language=E&Section=ALL
4233406,ca.proc.d.2002-12-03.1708.152,2002-12-03,11e58957-eaed-4442-b284-2e18f91674d3,5142,"Hon. Martin Cauchon (Minister of Justice and Attorney General of Canada, Lib.)",,Oral Question Period,Firearms Registry,,"Mr. Speaker, this is the first time that we were proceeding with such a program with regard to firearms. It has been a complex program. We started the infrastructure from scratch and we have been facing cost escalations.
For example, we went through a consultation process. We had to adjust the program based on the consultation. Some provinces opted out as well. We have been facing another challenge in terms of technology, but having said that, we are starting to see the benefits of the program. At this moment we are firmly committed--",Liberal,Outremont,Martin Cauchon,http://www.parl.gc.ca/parlinfo/Files/Parliamentarian.aspx?Item=11e58957-eaed-4442-b284-2e18f91674d3&Language=E&Section=ALL
4233407,ca.proc.d.2002-12-03.1708.153,2002-12-03,,,,,Oral Question Period,Firearms Registry,,The hon. member for St. Albert.,,,The Speaker,
4233408,ca.proc.d.2002-12-03.1708.154,2002-12-03,233caca3-acc5-4554-9c4f-4abf75950440,305,"Mr. John Williams (St. Albert, Canadian Alliance)",,Oral Question Period,Firearms Registry,,"Mr. Speaker, when the gun registry was introduced Canadians were told that its net cost would be $2 million, and that is million, not billion. Now the net cost of the registry is $1 billion and rising.
The Auditor General said today that the government has done everything in its power to hide the cost of the gun registry and its effectiveness, or lack thereof, from Canadian taxpayers while murders by firearms in Toronto continue unabated.
My question for the minister is, how can he justify spending on paperwork $1 billion which the Auditor General says should have gone to police forces to ensure--",Canadian Alliance,St. Albert,John Williams,http://www.parl.gc.ca/parlinfo/Files/Parliamentarian.aspx?Item=233caca3-acc5-4554-9c4f-4abf75950440&Language=E&Section=ALL
4233409,ca.proc.d.2002-12-03.1708.155,2002-12-03,,,,,Oral Question Period,Firearms Registry,,The hon. Minister of Justice.,,,The Speaker,
4233410,ca.proc.d.2002-12-03.1708.156,2002-12-03,11e58957-eaed-4442-b284-2e18f91674d3,5142,"Hon. Martin Cauchon (Minister of Justice and Attorney General of Canada, Lib.)",,Oral Question Period,Firearms Registry,,"Mr. Speaker, if we read the report of the Auditor General it seems clear to me that there is no wrongdoing at all. We have been facing what we call cost escalations and, as I said, it is because of the consultation process. As well, some provinces have opted out, and we have been facing a challenge in terms of technology.
If we look at the stats, for example, we will see that police agencies are accessing the firearms online registry 1,500 times daily. More than 7,000 firearms licences have been refused or revoked since the law came into effect. The--",Liberal,Outremont,Martin Cauchon,http://www.parl.gc.ca/parlinfo/Files/Parliamentarian.aspx?Item=11e58957-eaed-4442-b284-2e18f91674d3&Language=E&Section=ALL
4233411,ca.proc.d.2002-12-03.1708.157,2002-12-03,233caca3-acc5-4554-9c4f-4abf75950440,305,"Mr. John Williams (St. Albert, Canadian Alliance)",,Oral Question Period,Firearms Registry,,"Mr. Speaker, he is just quite wrong. The Auditor General says the government spends so much money on bureaucracy for the gun registry that it does not have the money to stop trafficking in firearms and no money to train police, customs or wildlife officers.
The RCMP has also admitted that its databases for gun crimes are inaccurate and obsolete. The justice minister is clearly more interested in pushing paper than in fighting crime and ensuring the safety of Canadians.
Why does the government insist on sacrificing the safety of Canadians on the altar of a bureaucratic, unworkable gun registry?",Canadian Alliance,St. Albert,John Williams,http://www.parl.gc.ca/parlinfo/Files/Parliamentarian.aspx?Item=233caca3-acc5-4554-9c4f-4abf75950440&Language=E&Section=ALL
4233412,ca.proc.d.2002-12-03.1708.158,2002-12-03,11e58957-eaed-4442-b284-2e18f91674d3,5142,"Hon. Martin Cauchon (Minister of Justice and Attorney General of Canada, Lib.)",,Oral Question Period,Firearms Registry,,"Mr. Speaker, the RCMP is aware of the concern about the databases. It has been acting on that. It has been very proactive. Of course we have to understand that the quality of the databases is directly linked to the question of technology. I am told that it has improved the system and it will keep doing that.
Look at what the registration system means. It means fewer firearms on the black market from break-ins. It reduces the unauthorized use of guns. It reduces heat of the moment use of firearms. It also reduces accidents, particularly involving children. These are not my words. These are the words of David Griffin, who represents 28,000--",Liberal,Outremont,Martin Cauchon,http://www.parl.gc.ca/parlinfo/Files/Parliamentarian.aspx?Item=11e58957-eaed-4442-b284-2e18f91674d3&Language=E&Section=ALL
4233413,ca.proc.d.2002-12-03.1708.159,2002-12-03,,,,,Oral Question Period,Firearms Registry,,The hon. member for Lotbinière--L'Érable.,,,The Speaker,
4233414,ca.proc.d.2002-12-03.1708.160,2002-12-03,31840941-1c1e-47a8-ae6c-c688d1a34ee3,2773,"Mr. Odina Desrochers (Lotbinière—L'Érable, BQ)",,Oral Question Period,Auditor General's Report,,"Mr. Speaker, the Auditor General's report confirms that the federal government no longer has any control over the international transactions of large corporations, depriving the government of millions of dollars in taxes, and that is to say nothing of observations of mismanagement in employment insurance, Indian Affairs, the firearms program, and more.
How dare the federal government interfere in the management of health care across Canada when it is not even able to properly manage what comes directly under its jurisdiction?",Bloc Québécois,Lotbinière--L'Érable,Odina Desrochers,http://www.parl.gc.ca/parlinfo/Files/Parliamentarian.aspx?Item=31840941-1c1e-47a8-ae6c-c688d1a34ee3&Language=E&Section=ALL
4233415,ca.proc.d.2002-12-03.1708.161,2002-12-03,727ca7a8-0609-48eb-b6f3-01d086548302,4682,"Hon. John Manley (Deputy Prime Minister and Minister of Finance, Lib.)",,Oral Question Period,Auditor General's Report,,"Mr. Speaker, if I understood the question correctly, some of the Auditor General's recommendations were very similar to the ones made in 1992.
I think that several measures have since been taken to change the procedure for determining sources of international income. I think that the comments should be reviewed; if changes are necessary, we can introduce them.",Liberal,Ottawa South,John Manley,http://www.parl.gc.ca/parlinfo/Files/Parliamentarian.aspx?Item=727ca7a8-0609-48eb-b6f3-01d086548302&Language=E&Section=ALL
4233416,ca.proc.d.2002-12-03.1708.162,2002-12-03,31840941-1c1e-47a8-ae6c-c688d1a34ee3,2773,"Mr. Odina Desrochers (Lotbinière—L'Érable, BQ)",,Oral Question Period,Auditor General's Report,,"Mr. Speaker, is the federal government's blatant incompetence in looking after its own affairs properly not proof that it is in no position to give lessons to anyone and that, instead of extending its reach into the health care system, it should focus on managing what comes under its responsibility?",Bloc Québécois,Lotbinière--L'Érable,Odina Desrochers,http://www.parl.gc.ca/parlinfo/Files/Parliamentarian.aspx?Item=31840941-1c1e-47a8-ae6c-c688d1a34ee3&Language=E&Section=ALL
4233417,ca.proc.d.2002-12-03.1708.163,2002-12-03,e059afdb-49fb-4515-975c-d4f1416e6020,1951,"Hon. Anne McLellan (Minister of Health, Lib.)",,Oral Question Period,Auditor General's Report,,"Mr. Speaker, as I and others on this side of the House have said on a number of occasions, we understand the fact that the provinces are the primary deliverers of health care. We have no intention on this side of the House of micromanaging health care, but what has been successful in this country is working in partnership, in collaboration, with the provinces and territories and front line health care workers. We are committed to continuing to do that.",Liberal,Edmonton West,Anne McLellan,http://www.parl.gc.ca/parlinfo/Files/Parliamentarian.aspx?Item=e059afdb-49fb-4515-975c-d4f1416e6020&Language=E&Section=ALL
4233418,ca.proc.d.2002-12-03.1708.164,2002-12-03,9b308a60-fe0f-49bd-9e0c-32461a51ce44,204,"Mr. Bob Mills (Red Deer, Canadian Alliance)",,Oral Question Period,Kyoto Protocol,,"Mr. Speaker, the government has failed to acknowledge that there are penalties when we fail to reach our Kyoto targets. The only way to pay these penalties is by buying carbon credits internationally.
Could the Prime Minister confirm that if we fail to meet our targets we will be forced to buy international carbon credits?",Canadian Alliance,Red Deer,Bob Mills,http://www.parl.gc.ca/parlinfo/Files/Parliamentarian.aspx?Item=9b308a60-fe0f-49bd-9e0c-32461a51ce44&Language=E&Section=ALL
