basepk,hid,speechdate,pid,opid,speakeroldname,speakerposition,maintopic,subtopic,subsubtopic,speechtext,speakerparty,speakerriding,speakername,speakerurl
4233486,ca.proc.d.2002-12-03.1708.232,2002-12-03,3176068f-62ee-4b2f-aacd-1131201c6db1,242,Mr. Geoff Regan,,Government Orders,Nuclear Safety and Control Act,,"Mr. Speaker, I rise on a point of order. Following consultations among the parties, I think you would find unanimous consent for the following: That members of the Special Committee on Non-medical Use of Drugs be authorized to travel to Vancouver, Montreal and Halifax from Sunday, December 8 to Monday, December 9 in relation to its mandate and to publicize the release of its interim report across the country, and that the necessary staff accompany the committee.",Liberal,Halifax West,Geoff Regan,http://www.parl.gc.ca/parlinfo/Files/Parliamentarian.aspx?Item=3176068f-62ee-4b2f-aacd-1131201c6db1&Language=E&Section=ALL
4233487,ca.proc.d.2002-12-03.1708.233,2002-12-03,7c68448c-8394-4a1b-a4f9-2c4c89b4af87,,,,Government Orders,Nuclear Safety and Control Act,,Is there unanimous consent to table the motion?,,,The Acting Speaker (Mr. Bélair),
4233488,ca.proc.d.2002-12-03.1708.234,2002-12-03,,,,intervention,Government Orders,Nuclear Safety and Control Act,,Agreed.,,,Some hon. members,
4233489,ca.proc.d.2002-12-03.1708.235,2002-12-03,,,,intervention,Government Orders,Nuclear Safety and Control Act,,No.,,,Some hon. members,
4233490,ca.proc.d.2002-12-03.1708.236,2002-12-03,7c68448c-8394-4a1b-a4f9-2c4c89b4af87,,,,Government Orders,Nuclear Safety and Control Act,,"It is my duty, pursuant to Standing Order 38, to inform the House that the questions to be raised tonight at the time of adjournment are as follows: the hon. member for Terrebonne—Blainville, Social Housing; the hon. member for Kamouraska—Rivière-du-Loup—Témiscouata—Les Basques, Ferries; and the hon. member for Acadie—Bathurst, the Environment.",,,The Acting Speaker (Mr. Bélair),
4233491,ca.proc.d.2002-12-03.1708.237,2002-12-03,7bac4375-0412-480f-923c-1b938132ecb5,2111,Mr. Svend Robinson,,Government Orders,Nuclear Safety and Control Act,,"Mr. Speaker, as I was saying, I want to congratulate the hon. member from the Bloc Quebecois for his excellent speech on Bill C-4. I am quite pleased that the Bloc Quebecois and the New Democratic Party oppose this bill.
The hon. member raised some very strong points against the bill. I am thinking in particular of his suggestion that an indepth study of the impact on industry be undertaken before further subsidies are granted.
It is important that we recognize the real objective of the bill as my colleague from Windsor--St. Clair has pointed out so eloquently in his interventions both in the House and in the standing committee on the environment.
The bill is effectively a gift to the Ontario Conservative government and it responds very specifically to the Bruce Power situation. It enhances the privatization of the nuclear industry. For that reason alone my colleagues and I in the New Democratic Party strongly oppose this amendment.
The objective of the amendment is effectively to narrow the scope of liability for those who are involved in the nuclear power industry. I would point out that under the provisions of the 1976 Nuclear Liability Act, that liability is already limited to $75 million. This is an industry that is already well protected by legislation. It needs tougher liability laws, not weaker ones.
I strongly support the work that is being done by Campaign for Nuclear Phase Out which is calling for a phase-out of the nuclear industry. I intend to speak to that later in my comments before the House.
I see the hon. member for Davenport in the chamber today. He is the very distinguished chair of the House of Commons Standing Committee on the Environment and Sustainable Development. I want to pay tribute to that member and to the vice-chair of the environment committee, the member for York North, as well as the hon. member for Churchill River and the hon. member for Lac-Saint-Louis.
Those members had the courage to stand up in the House a short time ago and vote against the bill at report stage. I want to salute them for their courage and for their continuing leadership on the fundamentally important issues of the protection of the environment. I certainly hope that upon reflection, the colleagues of my friend from Davenport, when it comes to the final vote on this bill, may see the light and will vote against the legislation as well.
The history of this legislation is deeply disturbing for many of us. In fact, there was an almost unprecedented action in the standing committee on the environment to shut down, muzzle and silence debate in a very shameful way on this issue.
My colleague from Windsor--St. Clair had the floor in the standing committee on the environment. I believe he was speaking to a motion that would have subpoenaed witnesses from the nuclear industry. It was essential that those witnesses be heard with respect to this important legislation.
My colleague from Windsor--St. Clair, our environment critic who has been doing such a fine job on this and other bills, was interrupted on a point of order by another member in that committee. At that point the chair of the committee indicated that he was prepared to put the question on a motion to shut down the member for Windsor--St. Clair and to call a vote. This was blatantly out of order and unprecedented. I deeply regret that the appeal that was made to the Speaker in this House to ensure that this kind of very dangerous precedent would not stand unfortunately was not successful.
That is some indication of what is happening with this legislation. Liberal members on the standing committee on the environment were prepared to shut down democratic debate which is the lifeblood of democracy in order to silence the member for Windsor--St. Clair and prevent him from speaking to a motion to hear from the industry.
While industry was not heard from during the course of those committee hearings, there were a number of very important witnesses. One of those witnesses was the Campaign for Nuclear Phase Out.
The Campaign for Nuclear Phase Out was founded in 1989. It is a broadly based Canadian coalition of organizations working to phase out nuclear energy in Canada. I might note parenthetically that a former colleague from Broadview--Greenwood, Lynn McDonald, for some time has been one of the driving forces in the Campaign for Nuclear Phase Out. She has been doing fine work on this issue. I only regret that she is not still with us in the House to continue speaking out on this.
During the 13 years the Campaign for Nuclear Phase Out has been in existence in Canada, it has done very important work. It has pointed out the tremendously obscene level of subsidies to the nuclear industry in Canada. It has worked on MOX shipments into Canada. It developed the first atomic map of Canada. It was never mapped before. It included all the nuclear sites in Canada.
The objective of the Campaign for Nuclear Phase Out is to phase out nuclear energy in Canada. It points out that across the world people are moving out of nuclear energy. I want to say very clearly that I strongly support the objectives of the Campaign for Nuclear Phase Out.
It is interesting to note that the Kyoto accord made absolutely no reference to nuclear energy as being a component of the drive to respond to the crisis of climate change in Canada and globally. Indeed, the draft implementation plan, Canada's federal draft plan for Kyoto, had not a word about nuclear energy as well.
In fact, I think it is essential that we recognize that the nuclear industry is a dinosaur industry. It is a dying industry which is on its way out. Within a very short time, it may very well be that the only location of that industry will be Ontario. I believe that in Quebec and in New Brunswick the industry is being phased out.
There is a web of subsidies and legislative crutches as the Campaign for Nuclear Phase Out pointed out that has held up the industry so far, without which it just would not be sustainable at all. In 2002 the subsidies for Atomic Energy of Canada Limited reached $210 million, the highest amount since 1987. The fact of the matter is that clearly this is an industry that has to be propped up by the federal government.
I note that my friend from Port Moody is in the House. I know that as a hardworking member of the Canadian Alliance, he would be deeply concerned about this kind of government handout to the nuclear industry. I know that he would want to rise in his place to speak out in anger and indignation against this handout to the dying nuclear industry in Canada.
The tragic irony is that the funding for renewable energy in 2000 was some 17 times less than the funding for nuclear energy. Those priorities are completely skewed.
We oppose the bill because we think that any attempt to limit the liability in this way, any kind of gift to the nuclear industry and to Bruce Power in Ontario, is completely unacceptable.
We have to ask as well, who exactly owns this company? Right now it appears that British Energy has the major stake in Bruce Power but guess who is looking at possibly buying it according to a news story today. Warren Buffett, the U.S. investment billionaire may be interested in buying a piece of Bruce Power. Of course, unless this legislation gets through, they say there may be some problem in financing this cozy little deal. We say that we want no part of this offensive transaction.
There has been a lot of bafflegab, distortion and misleading information about the real objectives of the bill.
I want to pay tribute to the work done on this issue by the Sierra Club of Canada, in particular its distinguished executive director, Elizabeth May. Miss May appeared before the standing committee on the environment. She pointed out that there were a lot of distortions about the bill. As she said, the bill does not create any kind of automatic liability for banks or other investors in the nuclear industry. This is what we are being told by the government; it is not fair to create this automatic liability.
The reality is very different, as she pointed out. The current Nuclear Safety and Control Act does not create any automatic liability nor does subsection 46(3) as rewritten to remove what are apparently offensive words. The offence is to the bankers and financiers. Let us be clear on what actually is the current state of the law.
The bill is a blatant attempt to make the nuclear industry even more immune from the impact of its actions. When we look at some of the very serious accidents, whether it is Chernobyl, Three Mile Island or elsewhere, we should be deeply concerned about any attempt to weaken the accountability, responsibility and liability of the nuclear industry. All we have to do is read the report of the environmental auditor about the terrible impact of abandoned nuclear mines in northern Saskatchewan and elsewhere to know that this is a problem.
Let us look at what this issue of liability is actually about. In fact, subsection 46(3) creates a discretion, not any kind of automatic obligation, it creates a discretion for the Canadian Nuclear Safety Commission, following a hearing, to file a notice. It may then order that the owner, or yet another level of discretion as the investors are again one step away, occupant or any other person with a right to or interest in the affected land, take prescribed measures to reduce the level of contamination.
It is obvious that this is not automatic in any way. It does not mean that everybody attached to the project is liable for millions and millions of dollars in potential financial commitment. They may have killed people or there may have been serious environmental impact on adjacent lands. It means that there is an obligation to clean up. The Canadian Nuclear Safety Commission may, it does not have to, but may, following a public hearing, decide that the clean up of the contaminated site and reducing the level of contamination requires actions by a number of people and within that current list, should this amendment not pass, are those who have a right to or interest in the land or place that requires cleaning up.
I also want to point out that far from moving ahead on this legislation, what we should be doing is having a comprehensive public inquiry and debate on the nuclear industry in Canada. There has never been any kind of a commission or debate or any kind of a public hearing on the desirability of having a nuclear industry.
Elizabeth May pointed out in the environment committee that there was one brief attempt by a former minister of energy, mines and resources, Ray Hnatyshyn, to move ahead on this but that of course did not go anywhere because that government did not last very long. However we certainly do not need to be moving in the direction of this particular proposed amendment.
What are the alternatives that we should be looking at? We should be looking at phasing out this industry and recognizing that nuclear waste is a major threat to human health and the environment.
As of 1992 Canada had accumulated over 200 million tonnes of low level radioactive tailings from uranium mining, over 1 million cubic metres of contaminated soil and 900,000 bundles of nuclear fuel waste, and nobody has any notion of what to do with these wastes at all. We are just passing them on to future generations.
There has been a huge increase in the annual production of nuclear waste in Canada. It grew by 76% between 1982 and 1998.
I see the Minister of Foreign Affairs in the House. I know he shares my concern about this staggering increase in the level of nuclear waste. I am sure he would share with me the concern that the Canadian public has a right to get at the truth about the nuclear industry and the extent to which it is so heavily subsidized by Canadian taxpayers. In fact, Canada today is the highest per capita user of nuclear energy in the world.
What should we be doing instead of handing out even more exemptions and extending the absence from any liability for the nuclear industry? We should be looking at alternatives, as my colleague from Windsor--St. Clair and witnesses who appeared before the committee pointed out.
We do not support Bill C-4 because it weakens the liability provisions of the Nuclear Safety and Control Act and it could facilitate an expansion of nuclear power production in Canada and its continued privatization. Privatization in this industry is the last thing we need, as we have seen from the disastrous example of the privatization of Ontario Hydro. Even the ultra right wing government in British Columbia of Gordon Campbell is now recognizing that this not the direction that it should be moving toward.
Far from strengthening our support for the nuclear industry, we should be looking at the example of nations like Germany and others, and phasing out nuclear power production and investing in alternative renewable energy resources.
We fall far behind in those sectors, particularly behind countries like Denmark. Denmark is currently meeting 16% of its electricity needs from wind. The Canadian Wind Energy Association has an excellent proposal that would see billions of dollars of capital investment in rural communities that would result in many quality jobs in Canada and the reduction of 15 million to 20 million tonnes of greenhouse gas emissions a year. It would be a tremendous contribution to meeting our Kyoto targets.
Instead of propping up this dying nuclear industry, why are we not putting far more resources into renewable energy, particularly into the kind of proposal that the Canadian Wind Energy Association is putting forward? If we were to accept its proposal we would achieve the goal of installing more than 10,000 megawatts of wind power capacity and would be providing 5% of our electricity from wind power by 2010. That is still far less than the proportion that Denmark is providing.
We have to do much more to level the playing field for renewable energy sources and expand efficiency and conservation programs. Important recommendations have been put forward by groups, such as the David Suzuki Foundation and the Pembina Institute, which called for the removal of unfair competitive advantages to fossil fuels and the nuclear industry. This includes removing royalty structures, capital cost subsidies and lax emission standards that favour coal-fired plants.
As well, we should be looking at legislating improved fuel efficiency standards for motor vehicles, increasing oxidation levels in gasoline and diesel fuel, and promoting the use of alternatives like ethanol and hybrid vehicles. With all of these we could significantly reduce our dependency on fossil fuels and the harmful emissions that they produce.
Those are real and achievable goals that our government could and should commit to for the benefit of all Canadians. Instead of expanding nuclear power, we should be moving in the opposite direction: phasing it out and investing in cleaner energy resources.
I am pleased to see my colleague, my friend from Lac-Saint-Louis in the House. I want to salute him for the leadership he has shown over the years on these issues, right up to as recently as just a few hours ago when he had the courage to speak out and to vote against this destructive piece of legislation, Bill C-4, along with, I believe, three of his colleagues, including the member for Davenport, the chair of the environment committee.
I would hope that if we are not prepared to reject the bill at third reading, which is the stage that we are at now, that we would at least be prepared to send the legislation back to the environment committee and ask it to give witnesses an opportunity to be heard as to why the legislation is so destructive.
We heard in the environment committee from the Sierra Club, from Energy Probe and a number of others. I think that before extending the exemptions from liability for this industry, far more background work needs to be done.
The bill is fundamentally about privatization. It is about facilitating the privatization of the nuclear industry and particularly in the context of Ontario and what is happening with Bruce Power.
As I said, this is an industry that far from being propped up through massive subsidies, which is the case so far, should be phased out. When one looks at the record of Candu reactors for example and the sales of Candu reactors, where have these reactors been sold? They have not been sold at all in recent years, but they have been sold to repressive dictatorships. They were sold to Ceausescu in Romania. They were sold to the dictators in South Korea. They were sold to the dictators in Argentina. However that surely is not the kind of energy that we should be promoting in Canada.",New Democratic Party,Burnaby--Douglas,Svend Robinson,http://www.parl.gc.ca/parlinfo/Files/Parliamentarian.aspx?Item=7bac4375-0412-480f-923c-1b938132ecb5&Language=E&Section=ALL
4233492,ca.proc.d.2002-12-03.1708.238,2002-12-03,3ac5f51b-2b78-4d2f-9bbc-09eda7eec8db,250,"Mr. Jean-Yves Roy (Matapédia—Matane, BQ)",,Government Orders,Nuclear Safety and Control Act,,"Madam Speaker, I want to thank my colleague from Sherbrooke for his speech which I found very well documented and excellent, as well as my colleague from the New Democratic Party who just spoke.
The NDP member talked about wind energy and investments in nuclear energy. I will remind him of a few numbers. The nuclear program alone accounts for investments on the order of $6 billion.
As for wind energy, the federal government is only committed to investing $17 million a year over 15 years, for a total of approximately $260 million. There is no comparison between investments in nuclear energy and those in clean energies such as wind energy.
I would just like to read to the member what the former Minister of Natural Resources said when this bill was introduced for the first time. It was then Bill C-57. In a press release the minister said:

These companies must have access to commercial credit to finance their needs—
This amendment will allow the nuclear industry to attract market capital and equity.

The minister went on and mentioned lenders. Previously, there were obligations regarding site remediation and the act made it possible to involve lenders in remedial actions.
The news release also said:

Lenders were faced with unknown financial obligations that might have exceeded by far their commercial interest.

The minister himself is stating that investment in nuclear energy is an unknown risk. Not only is it an unknown risk, but we know full well that we cannot get rid of nuclear waste.
Could my colleague explain to me how the government, which itself recognizes that nuclear energy is an unknown risk, can grant such a privilege to lenders. The government is saying: “We will not loan money to the nuclear sector because it cannot be trusted. Should a disaster occur, the risk is way too high for us”.
When the minister responsible makes such a statement, how can the government commit to investing in nuclear energy and granting privileges to lenders?",Bloc Québécois,Matapédia--Matane,Jean-Yves Roy,http://www.parl.gc.ca/parlinfo/Files/Parliamentarian.aspx?Item=3ac5f51b-2b78-4d2f-9bbc-09eda7eec8db&Language=E&Section=ALL
4233493,ca.proc.d.2002-12-03.1708.239,2002-12-03,7bac4375-0412-480f-923c-1b938132ecb5,2111,Mr. Svend Robinson,,Government Orders,Nuclear Safety and Control Act,,"Madam Speaker, it is an excellent question. Of course, there is no answer to that question. The lack of responsibility shown by the minister sponsoring this bill is unbelievable.
We do not know anything about the costs. We already know about the very serious impact of nuclear waste.
In a report prepared by the Commissioner of the Environment and Sustainable Development it was pointed out that Canada faced a toxic legacy of abandoned uranium mines in Saskatchewan and toxic waste sites on federal sites.
There is still no technology whatsoever to deal with the issue of nuclear waste. Some suggestions have been made that we can fire them into space or bury them deep in the Canadian shield, but that is simply irresponsible speculation. The fact is that we are leaving this legacy for our children and our children's children, without any assurance whatsoever as to the long term impact on their health or, indeed, on the environment.
As my colleague from the Bloc Quebecois has pointed out, we cannot even begin to know the costs of a potential accident and yet we are saying that will take the banks off the hook. This is a gift to the banks and to financial institutions to prop up the nuclear industry. It is like writing a blank cheque. It literally gives these people a cheque and says, “Okay, here you are. Even though we have no idea what the implications may be, we are prepared to absolve you of any responsibility for that”.
This is the worst kind of fiscal and environmental lack of responsibility and, for that reason alone, the legislation should be vigorously and strongly opposed.
The “Sortir du nucléaire” group appeared before the Standing Committee on the Environment. Its representatives spoke eloquently about the subsidies that have long been granted to the nuclear industry. In fact, this is a new handout to that industry.
We in the NDP say no to this measure, and I am glad to see that the Bloc Quebecois is also saying no. We think that there have been enough subsidies. We must stop subsidizing this industry and start supporting renewable energy sources.",New Democratic Party,Burnaby--Douglas,Svend Robinson,http://www.parl.gc.ca/parlinfo/Files/Parliamentarian.aspx?Item=7bac4375-0412-480f-923c-1b938132ecb5&Language=E&Section=ALL
4233494,ca.proc.d.2002-12-03.1708.240,2002-12-03,661a3062-86d1-4ba3-9e70-81c866aa2fc3,9,"Mr. David Anderson (Cypress Hills—Grasslands, Canadian Alliance)",,Government Orders,Nuclear Safety and Control Act,,"Madam Speaker, it has been a very interesting day as we have spoken about Kyoto first and now we are speaking about the bill to amend the Nuclear Safety and Control Act.
I guess from my perspective it has been a day of extremism. I am familiar with the environment. I farmed for 25 years. I live in a rural area. I live on the land. Today I have seen a new side of what I would call environmentalism, almost a religious fascination with the environment that goes far beyond what I would consider to be a practical or really sensible approach to it.
I find this bill particularly interesting because countries, like France, have 80% of their power that is being supplied by the nuclear industry. They have used that to begin to try to meet their Kyoto standards. If we are against nuclear power in this country that only leaves us a couple of other choices to find our power requirements. One of them is hydro energy. Often we hear that the same people who oppose nuclear energy are against hydroelectric dams as well because we cannot be damming our rivers. Then we are back to using coal powered generators and those kinds of things, back to greenhouse gas emissions and the problems that come with those.
The member talked a bit about some of the renewable energy sources, the bio-fuels. At this point in their development I really call those boutique energy sources. We are not able to rely on a major part of our energy from them. I live in an area where wind energy is being developed.
I heard what the member is against but I would like to hear what he is for in terms of a large scale power supply for our economy and for our country.",Canadian Alliance,Cypress Hills--Grasslands,David Anderson,http://www.parl.gc.ca/parlinfo/Files/Parliamentarian.aspx?Item=661a3062-86d1-4ba3-9e70-81c866aa2fc3&Language=E&Section=ALL
