basepk,hid,speechdate,pid,opid,speakeroldname,speakerposition,maintopic,subtopic,subsubtopic,speechtext,speakerparty,speakerriding,speakername,speakerurl
4518219,ca.proc.d.2012-04-02.3080.239,2012-04-02,b41c3b7e-c64f-4415-9f58-79d7462e5d8e,146,Mr. Peter Julian,,Government Orders,The Budget,Financial Statement of Minister of Finance," One might say that is absurd and that a Conservative MP would never do that. However, when we think back, a few years ago no one would have said there would be 102 strong NDP MPs representing constituents right across this country from coast to coast to coast. It was not impossible because we believed that we could get things done and represent our constituents strongly. 
When I started out, I was down in that far corner. There were only 19 of us back in 2004, but with Jack Layton we continued to progress. We moved across and then moved up. Now we are the official opposition and are poised to form government on October 20, 2015. People always said that would be impossible and I say nothing is impossible when one has fundamental Canadian values and when one strongly represents constituents. 
I do not believe it is impossible that some Conservatives on the other side will wake up after having read the budget and say they will not vote for it because it is bad for Canada and bad for Canadian families. Instead, they will vote for retirement security, for the type of retirement age that almost all OECD countries have, and they will vote for the types of things that the NDP brings forward, including sustainable, long-term funding for health care and services. They will vote against this budget and for something better. I do not believe that is impossible. I am hopeful that through the course of this debate, as we read letter after letter from constituents in Conservative-held ridings, that we will see the Conservatives waking up. We will see it one day. We will see members on the other side smile. The penny will drop, even if they are doing away with it, which we certainly support doing, but the penny will drop and they will say this is a penny-wise and pound foolish budget and they are not going to vote for it. We will see that and that is my hope in the coming days.
I will move on to another resident of a Conservative-held riding in London West. This constituent is writing to the NDP MP next door, the member of Parliament for London—Fanshawe, who is an extraordinary seniors and pension critic. 
She says, “I know I am not a resident of your riding, but my Conservative MP never seems to respond with anything but platitudes. I know you are doing the best you can for our community, so I wanted to tell you what this budget means for me. 
“I am a 50-year-old, unemployed single female. Finding a job is tough and this budget has nothing in it to help me and soon there won't even be anyone left to answer the phone. I am running out of blood pressure medication because I have no benefits, which wouldn't matter if I had a pharmacare program, but I saw nothing for me in the budget on that. I do, however, fall into the age category of the first few years' worth of senior citizens who will lose two years of OAS payments. I have been told my whole working life that while there was no pool of money, I was paying for the people who are retiring now and that younger people would be paying for me, and so on, this while my savings have been eaten up trying to find stable employment. 
“For me, this budget is a recipe for poverty, but the Chief Electoral Officer was the only officer of Parliament to face immediate funding cuts. It was a corrupt decision, cynical beyond belief. 
“I did notice that while the Conservatives claimed to be in favour of smaller government, the cabinet is huge, at 38, and there were no announced cuts to that burgeoning group nor to the Prime Minister's Office. I have seen money and tax breaks flung at corporations who then leave the country with them, leaving broken communities in their wake. I see valuable resources being depleted and value added offshore and these policies are anathema to job creation. This budget ignores these issues. A hold on yet another tax cut does nothing to reverse the effect of a financial crisis that was created by the tax cuts that went before. 
“First nations people are being treated horribly, and women are being ignored and yet, apparently, there is no end of money available to purchase jets, with no public process or even proper bidding procedures being followed. I guess I shouldn't be shocked by the government that couldn't even see its way clear to bringing a flag down to half mast when our soldiers died would not take care of the ones that returned home”.
That was from a woman in London West in Ontario, whom we thank for writing such heartfelt comments about the future of this country. We are going to make sure this country is run the way we would like it to be. We are not going to forget her, that is for sure.
I would like to move on to a letter from a constituent in another Conservative-held riding, Ottawa—Orléans. Here is another person writing in a very heartfelt way.
He states that, “I, too, have a Conservative MP, and just got a pamphlet about tax saving tips on the same day his government announced they will be laying off thousands of public servants. Many will be this MP's constituents.
“The problem with the excuse of people living longer as a reason to attack future OAS recipients is that the more well off a person is, the longer they can expect to live, and the poorer a person is, the shorter they will live. These are facts that are supported by Statistics Canada. All the Conservatives have done is ensure low-wage workers are available to take unglamorous jobs a few years longer. Some will never retire anyway, but now that number is guaranteed to increase.
“This budget is a disgrace. It has money for venture capitalists and further erodes good-paying jobs in our communities. If the Prime Minister wants to play Dragons' Den games, I encourage him to resign from his current job and show us what a brilliant, trained economist he is with his own money.
“Keep on speaking the truth in Parliament, we are watching and cheering”.
The comments from these Canadians, showing their courage and their vision of how this country ought to be and their profound belief that this country can be better, that those Canadian values can continue despite how meanspirited this budget is, encourage all of us in the official opposition NDP caucus to keep doing our work, to keep standing up for Canadians and to keep fighting for that day when we can have a progressive government in power in this country. That is what keeps us going and drives us forward.",New Democratic Party,Burnaby--New Westminster,Peter Julian,http://www.parl.gc.ca/parlinfo/Files/Parliamentarian.aspx?Item=b41c3b7e-c64f-4415-9f58-79d7462e5d8e&Language=E&Section=ALL
4518220,ca.proc.d.2012-04-02.3080.240,2012-04-02,,,,intervention,Government Orders,The Budget,Financial Statement of Minister of Finance," Oh, oh!",,,Some hon. members,
4518221,ca.proc.d.2012-04-02.3080.241,2012-04-02,b41c3b7e-c64f-4415-9f58-79d7462e5d8e,146,Mr. Peter Julian,,Government Orders,The Budget,Financial Statement of Minister of Finance," I cannot believe the energy of my colleagues. They are an amazing group of people.
I am going to move on now to another constituent in another Conservative-held riding, London North Centre. Again, this person does not feel well-represented by their local MP and has written to an NDP MP to pass on the information, and says: 
“I watched the federal budget today and I am very worried. I find the cuts particularly worrisome as they can result in damage that cannot be undone. Changes to the OAS and CPP could perhaps be addressed by future governments. The degradation of the environment and the slow dismantling of our culture and democratic safeguards are not so easily fixed.
“Except for the fossil fuel industry, I see no programs in support of job creation. Meanwhile, those who do benefit represent only one segment of the Canadian population while ignoring the rest. This segment, not surprisingly, lives where the Conservatives have their greatest political strength. 
“Instead of job creation, I see job losses, both in the public sector and in the private sector where the new loosening of restrictions on cross-border shopping will have a tremendous impact. Coincidentally, the areas most affected will probably be Ontario and Quebec where the Conservatives do not have their best showing. 
“There seems to be no focus or plan to this budget. There is no real nation-wide job creation incentive with only a possible debt reduction component. It ignores the concerns of Canadians about the debt, unemployment and widening income gap. Some budget cuts seem to be based more on ideology than economics, and they prove to be more expensive in the end”.
That is from a constituent in the Conservative-held riding of London North Centre. 
This tweet is directed to the member of Parliament for Sarnia—Lambton from a constituent saying “Don't vote for this budget”. 
We are starting to get constituents tweeting directly to Conservative members of Parliament. We certainly encourage that. People have been hearing the debate over the last day or two. They are saying they do not want their Conservative MPs to vote for this budget because of its attacks on retirement security, what it does to health care transfers, the gutting of services in so many different areas, the gutting of environmental protections and the tens of thousands of lost jobs. 
Given the energy that Canadians have, and the time and effort that they are putting in to make sure their reactions are heard on the floor of the House of Commons, we certainly encourage folks to write to their Conservative member of Parliament, to tweet, post on Facebook, send emails or give them a call. 
I know many seniors have been contacting their Conservative MPs in the last few weeks, since the Prime Minister went to Davos, Switzerland and announced in front of the world's billionaires that he was going to gut retirement security. 
We think that these tweets are very important steps. Preferably, they should copy their local NDP MP in their region. That helps us to know what they are sending on to their Conservative MP. 
Very clearly, there is a good, healthy reaction from Canadians from coast to coast to coast. We certainly encourage them to speak out. That is how we make Canada stronger, by Canadians who speak out and make their concerns known. 
We on this side of the House believe firmly in a democratic framework. We believe firmly that there is a place for all Canadians to express their points of view, and that is on the floor of the House of Commons. That is why these members of Parliament are here today. After hours, they are still full of vim and vigour, spit and polish, bright-eyed and bushy-tailed. I am not sure how many other metaphors I can use. However, they are just great and energetic. They believe that Canadian families deserve much better than this budget.",New Democratic Party,Burnaby--New Westminster,Peter Julian,http://www.parl.gc.ca/parlinfo/Files/Parliamentarian.aspx?Item=b41c3b7e-c64f-4415-9f58-79d7462e5d8e&Language=E&Section=ALL
4518222,ca.proc.d.2012-04-02.3080.242,2012-04-02,,,,intervention,Government Orders,The Budget,Financial Statement of Minister of Finance," Hear, hear!",,,Some hon. members,
4518223,ca.proc.d.2012-04-02.3080.243,2012-04-02,b41c3b7e-c64f-4415-9f58-79d7462e5d8e,146,Mr. Peter Julian,,Government Orders,The Budget,Financial Statement of Minister of Finance," I would like to move on to another Conservative-held riding. That is the riding of Perth—Wellington. 
If you do not mind, Mr. Speaker, I would be pleased to continue. Thank you for being very gracious. I certainly appreciate you giving me the opportunity to speak. 
This is from a young person. We have all been very excited by the young people who are letting their opinions be known. He says, “First of all, I want to say that I'm surprised and encouraged by your allowing Canadians direct participation in our government”. He is speaking of the NDP. “It's important that the opinions of Canadians are heard publicly. As a young person in the Perth—Wellington riding, I do not believe my MP would be willing to voice my opinion”. That is too bad, but hopefully maybe next time they'll have an NDP MP in his riding.
Specifically on the budget, he says, “More than the specific elements of the budget, I am concerned that the government continues to proceed, all the while refusing to analyze the potential impacts or benefits of their policies. They ignore expert opinions and scientists, and seem to forgo investigations of costs”. ",New Democratic Party,Burnaby--New Westminster,Peter Julian,http://www.parl.gc.ca/parlinfo/Files/Parliamentarian.aspx?Item=b41c3b7e-c64f-4415-9f58-79d7462e5d8e&Language=E&Section=ALL
4518224,ca.proc.d.2012-04-02.3080.244,2012-04-02,,,,intervention,Government Orders,The Budget,Financial Statement of Minister of Finance," They don’t just ignore them, they shut them down.",,,An hon. member,
4518225,ca.proc.d.2012-04-02.3080.245,2012-04-02,b41c3b7e-c64f-4415-9f58-79d7462e5d8e,146,Mr. Peter Julian,,Government Orders,The Budget,Financial Statement of Minister of Finance," Yes. He continues, “They seem to refuse to release the real information into public hands and instead play with the numbers to suggest their policies are the correct ones. As an example, the OAS changes. I have heard the numbers from the Conservatives many times. OAS costs were $38 billion in 2010, but will be $108 billion in 2030.”
This young person picks up on what no Conservative has picked up on in the House. He states, “The problem with this is that it is comparing apples to oranges, 2010 dollars versus 2030 dollars.” Mr. Speaker, this has been a bone of contention for some time. I really thank the writer for raising this because this is extremely important. We have been raising in the House for months, since the election of May 2, this idea that somehow we can compare current dollars to constant dollars. We have to make sure that we are comparing the constant dollar value of something.
If I have time later on this afternoon, if I am permitted to keep on speaking, I will address this issue of constant dollars and how it actually plays out in some of the trade agreements we have signed. We have heard the government say that it has signed all of these trade agreements to actually further exports. We have done a little research. It turns out that, in so many cases, in constant dollars our exports to those markets actually fall after we sign the trade agreements.
However, because the government does not seem to want to understand the distinction between constant dollars, those which have the same value over time, that are inflation adjusted, and current dollars which are completely different and which in 2012 are worth something completely different than in 1912, there is a fundamental difference. Everyone seems to understand that but the government. It consistently uses current dollars to try to justify some of its policies when very clearly what we are experiencing in the case of some of these trade agreements is a fall in exports, not a rise. 
The writer understood this. He says, “The problem with this is that it is comparing apples to oranges, 2010 dollars versus 2030 dollars. When you correct the figures, the real comparison should be $38 billion in 2010 and $69 billion in 2030, not nearly the same.” 
 He goes on to state, “I also took extreme offence at the finance minister badmouthing our province yet again on the world stage.” He is talking about the comments about Ontario. “As a representative of Canada and its provinces, it carries particular weight to investors when our own representative speaks badly of us. He should apologize.”
He further states, “Once again, he is misrepresenting the facts during his statements. He has ignored the Drummond Report, which lays much of the blame for Ontario’s fiscal situation on the federal government and suggests that Ontario is mismanaging its spending. Ontario actually spends less per capita than any other province. Canadians are intelligent. We should be allowed to have the facts of the situation and be able to judge policies based on these facts. By not doing so, our intelligence is being insulted. If their policies are as good as they are promoted to be, then those judgments should be possible.”
I thank the writer for sending in his comments.",New Democratic Party,Burnaby--New Westminster,Peter Julian,http://www.parl.gc.ca/parlinfo/Files/Parliamentarian.aspx?Item=b41c3b7e-c64f-4415-9f58-79d7462e5d8e&Language=E&Section=ALL
4518226,ca.proc.d.2012-04-02.3080.246,2012-04-02,,,,intervention,Government Orders,The Budget,Financial Statement of Minister of Finance, We should applaud him.,,,An hon. member,
4518227,ca.proc.d.2012-04-02.3080.247,2012-04-02,b41c3b7e-c64f-4415-9f58-79d7462e5d8e,146,Mr. Peter Julian,,Government Orders,The Budget,Financial Statement of Minister of Finance, Absolutely. We should applaud him because that is terrific.,New Democratic Party,Burnaby--New Westminster,Peter Julian,http://www.parl.gc.ca/parlinfo/Files/Parliamentarian.aspx?Item=b41c3b7e-c64f-4415-9f58-79d7462e5d8e&Language=E&Section=ALL
4518228,ca.proc.d.2012-04-02.3080.248,2012-04-02,,,,intervention,Government Orders,The Budget,Financial Statement of Minister of Finance, It is democracy in action.,,,An hon. member,
4518229,ca.proc.d.2012-04-02.3080.249,2012-04-02,b41c3b7e-c64f-4415-9f58-79d7462e5d8e,146,Mr. Peter Julian,Interjection,Government Orders,The Budget,Financial Statement of Minister of Finance," Democracy in action. I find difficult to grasp this very simple idea that Canadians understand that constant dollars and current dollars are two very different things and yet the government continually messes up on the difference between inflation adjusted dollars and non-inflation adjusted dollars. 
 We had a couple of breakthroughs in the Scarborough region. Two wonderful members from Scarborough have taken their places in Parliament. I cannot comment that one of them might be in the House now, and the other not. I would like to compliment the two members for Scarborough who are terrific members of Parliament. They are part of the class of 2011. ",New Democratic Party,Burnaby--New Westminster,Peter Julian,http://www.parl.gc.ca/parlinfo/Files/Parliamentarian.aspx?Item=b41c3b7e-c64f-4415-9f58-79d7462e5d8e&Language=E&Section=ALL
4518230,ca.proc.d.2012-04-02.3080.250,2012-04-02,de0591ef-9a02-4f97-9541-63de484c96e3,87,The Acting Speaker (Mr. Barry Devolin),,Government Orders,The Budget,Financial Statement of Minister of Finance,"I need to rise at this point briefly as it is my duty pursuant to Standing Order 38 to inform the House that the questions to be raised tonight at the time of adjournment are as follows: the hon. member for Etobicoke North, the Environment; the hon. member for Beaches—East York, National Defence.
Resuming debate. The hon. member for Burnaby--New Westminster.",Conservative,Haliburton--Kawartha Lakes--Brock,Barry Devolin,http://www.parl.gc.ca/parlinfo/Files/Parliamentarian.aspx?Item=de0591ef-9a02-4f97-9541-63de484c96e3&Language=E&Section=ALL
