basepk,hid,speechdate,pid,opid,speakeroldname,speakerposition,maintopic,subtopic,subsubtopic,speechtext,speakerparty,speakerriding,speakername,speakerurl
4518131,ca.proc.d.2012-04-02.3080.151,2012-04-02,13a21d52-bc44-4a96-a206-f18432ef9191,8606,"Mr. Romeo Saganash (Abitibi—Baie-James—Nunavik—Eeyou, NDP)",,Oral Questions,The Environment,,"Mr. Speaker, responsible resource development is based on environmental assessments that respect constitutional rights. Only a full consultation will allow everyone to benefit from major projects. The Conservatives want to set Canada back decades. I know that this is the perfect recipe for years of legal disputes and battles. This approach is irresponsible. 
Why is the government giving up on its legal obligations and ramming through these ill-conceived changes?",New Democratic Party,Abitibi--Baie-James--Nunavik--Eeyou,Romeo Saganash,http://www.parl.gc.ca/parlinfo/Files/Parliamentarian.aspx?Item=13a21d52-bc44-4a96-a206-f18432ef9191&Language=E&Section=ALL
4518132,ca.proc.d.2012-04-02.3080.152,2012-04-02,661a3062-86d1-4ba3-9e70-81c866aa2fc3,9,"Mr. David Anderson (Parliamentary Secretary to the Minister of Natural Resources and for the Canadian Wheat Board, CPC)",,Oral Questions,The Environment,,"Mr. Speaker, our process will focus on four major areas to streamline the review process itself. We will make the review process more predictable and timely. We will reduce duplication and regulatory burden. We will strengthen environmental protection and we will enhance consultations with the aboriginal peoples.
Why are the member and his party opposite so opposed to timely reviews, protecting the environment and consulting with aboriginal Canadians?",Conservative,Cypress Hills--Grasslands,David Anderson,http://www.parl.gc.ca/parlinfo/Files/Parliamentarian.aspx?Item=661a3062-86d1-4ba3-9e70-81c866aa2fc3&Language=E&Section=ALL
4518133,ca.proc.d.2012-04-02.3080.153,2012-04-02,dead179f-dfcc-4f4d-a76b-7d2e4792095c,445,"Ms. Peggy Nash (Parkdale—High Park, NDP)",,Oral Questions,Public Appointments Commission,,"Mr. Speaker, hidden in the budget, the Conservatives dismantled a key part of their own Federal Accountability Act. After spending $1 million a year on the Public Appointments Commission, they have ditched any hope of merit-based appointments. Six years later, are they still mad that Gwyn Morgan did not get the nod from committee?
The Conservatives said that they had come here to change Ottawa but it is Ottawa that has changed them. Why did they break their promise, waste millions and embrace Liberal style patronage appointments? Why did they do that?",New Democratic Party,Parkdale--High Park,Peggy Nash,http://www.parl.gc.ca/parlinfo/Files/Parliamentarian.aspx?Item=dead179f-dfcc-4f4d-a76b-7d2e4792095c&Language=E&Section=ALL
4518134,ca.proc.d.2012-04-02.3080.154,2012-04-02,f66407a4-934e-4c46-b524-b4dacd035ceb,613,"Mr. Andrew Saxton (Parliamentary Secretary to the President of the Treasury Board and for Western Economic Diversification, CPC)",,Oral Questions,Public Appointments Commission,,"Mr. Speaker, economic action plan 2012 is our plan for jobs, growth and long-term prosperity. We are eliminating the Public Appointments Commission. Our government has significantly strengthened the public appointments system, including advertising appointments and conducting open selection processes for leadership and full-time positions. Appointments will continue to be made based on merit. ",Conservative,North Vancouver,Andrew Saxton,http://www.parl.gc.ca/parlinfo/Files/Parliamentarian.aspx?Item=f66407a4-934e-4c46-b524-b4dacd035ceb&Language=E&Section=ALL
4518135,ca.proc.d.2012-04-02.3080.155,2012-04-02,3c3ee442-a873-4845-84d0-7da07a66ce61,939,"Mr. Alexandre Boulerice (Rosemont—La Petite-Patrie, NDP)",,Oral Questions,Public Appointments Commission,,"Mr. Speaker, it is no wonder people are becoming increasingly cynical when they hear such answers.
Millions of dollars were wasted and, today, the government is abolishing a phoney commission that has not been used for many years. Today, we are saying goodbye to a transparent appointment process and welcoming new partisan appointments. The Conservatives have broken yet another promise. Merit is no longer important. Now, we have to rely on their good judgment. After all, the Conservatives already know who contributed to their election war chest.
Is that why they now want to abolish the Public Appointments Commission? ",New Democratic Party,Rosemont--La Petite-Patrie,Alexandre Boulerice,http://www.parl.gc.ca/parlinfo/Files/Parliamentarian.aspx?Item=3c3ee442-a873-4845-84d0-7da07a66ce61&Language=E&Section=ALL
4518136,ca.proc.d.2012-04-02.3080.156,2012-04-02,f66407a4-934e-4c46-b524-b4dacd035ceb,613,"Mr. Andrew Saxton (Parliamentary Secretary to the President of the Treasury Board and for Western Economic Diversification, CPC)",,Oral Questions,Public Appointments Commission,,"Mr. Speaker, as the member opposite knows, we tried to appoint a public appointments commissioner but it was the opposition that chose to play partisan games and prevented that appointment from happening. Despite this, we have made the public appointments process more open, transparent and equitable. Job positions are now posted online for everyone to see and appointments will continue to be made based on merit.",Conservative,North Vancouver,Andrew Saxton,http://www.parl.gc.ca/parlinfo/Files/Parliamentarian.aspx?Item=f66407a4-934e-4c46-b524-b4dacd035ceb&Language=E&Section=ALL
4518137,ca.proc.d.2012-04-02.3080.157,2012-04-02,c5378648-5d94-4645-bc05-339090e1077b,577,"Ms. Kirsty Duncan (Etobicoke North, Lib.)",,Oral Questions,The Environment,,"Mr. Speaker, the government has eliminated the Canadian Environmental Network and the national round table, muzzled scientists, gutted Environment Canada and eliminated the Canadian Foundation for Climate and Atmospheric Sciences. Now it aims to quash dissent from environmental charities and seize control of the research agenda at universities.
Does the Prime Minister think that it is appropriate in a democracy to eliminate the accountability that independent science brings and to silence dissent?",Liberal,Etobicoke North,Kirsty Duncan,http://www.parl.gc.ca/parlinfo/Files/Parliamentarian.aspx?Item=c5378648-5d94-4645-bc05-339090e1077b&Language=E&Section=ALL
4518138,ca.proc.d.2012-04-02.3080.158,2012-04-02,0bd5970c-e4c2-4044-8344-8123b16d75bd,594,"Hon. Peter Kent (Minister of the Environment, CPC)",,Oral Questions,The Environment,,"Mr. Speaker, this budget demonstrates the Government of Canada's full commitment to a strong environmental agenda even as we take significant action to address fiscal issues and the deficit. We have renewed funding for a number of key environmental programs, the Canadian Environmental Assessment Act and the Species at Risk Act. We have renewed funding to clean up Lake Simcoe and Lake Winnipeg. 
Under this budget, EC continues to have all of the resources it needs to protect the Canadian environment.",Conservative,Thornhill,Peter Kent,http://www.parl.gc.ca/parlinfo/Files/Parliamentarian.aspx?Item=0bd5970c-e4c2-4044-8344-8123b16d75bd&Language=E&Section=ALL
4518139,ca.proc.d.2012-04-02.3080.159,2012-04-02,c5378648-5d94-4645-bc05-339090e1077b,577,"Ms. Kirsty Duncan (Etobicoke North, Lib.)",,Oral Questions,The Environment,,"Mr. Speaker, last week, the Minister of the Environment said, of the Round Table on the Environment and the Economy:
 It was created before the Internet, when there were few such sources of domestic, independent research and analysis on sustainable development. That is simply no longer the case. There are now any number of organizations and university based services that provide those services. 
Very well. Could the minister name these organizations and services?",Liberal,Etobicoke North,Kirsty Duncan,http://www.parl.gc.ca/parlinfo/Files/Parliamentarian.aspx?Item=c5378648-5d94-4645-bc05-339090e1077b&Language=E&Section=ALL
4518140,ca.proc.d.2012-04-02.3080.160,2012-04-02,0bd5970c-e4c2-4044-8344-8123b16d75bd,594,"Hon. Peter Kent (Minister of the Environment, CPC)",,Oral Questions,The Environment,,"Mr. Speaker, my colleague is quite correct in at least part of her quotation. I have expressed our government's appreciation and thanks to the round table for its service over the decades, but it was created a quarter century ago at a time, as my colleague reminded us, when there were very few and limited resources of policy advice on the environment and, in particular, those with regard to the environment and the economy.",Conservative,Thornhill,Peter Kent,http://www.parl.gc.ca/parlinfo/Files/Parliamentarian.aspx?Item=0bd5970c-e4c2-4044-8344-8123b16d75bd&Language=E&Section=ALL
4518141,ca.proc.d.2012-04-02.3080.161,2012-04-02,6f07c370-1b80-4b71-a801-e5e8e70cf1d4,593,"Mr. Glenn Thibeault (Sudbury, NDP)",,Oral Questions,Bell Canada,,"Mr. Speaker, for decades, Canadians paid the same rate across Canada to use a pay phone but then, just a few years ago, the charges doubled.
Seniors, low income and rural Canadians who do not have access to wireless services rely on pay phones to communicate.
Now, Bell is asking the government to allow it to increase the fees once again and again it wants to double them.
If this increase is accepted, the Conservatives' meagre GIS increase to seniors will be eaten by just one call a day.
Will the government finally stand up for consumers and reject this proposal?",New Democratic Party,Sudbury,Glenn Thibeault,http://www.parl.gc.ca/parlinfo/Files/Parliamentarian.aspx?Item=6f07c370-1b80-4b71-a801-e5e8e70cf1d4&Language=E&Section=ALL
4518142,ca.proc.d.2012-04-02.3080.162,2012-04-02,cb9e0f12-f78f-4892-bc54-361d23267631,448,"Hon. Christian Paradis (Minister of Industry and Minister of State (Agriculture), CPC)",,Oral Questions,Bell Canada,,"Mr. Speaker, this government has taken unprecedented measures to ensure that all Canadians have access to quality services. Moreover, just two or three weeks ago, with the spectrum auction, we ensured that all Canadians will have access to quality wireless services, at a reasonable cost, wherever they may be in Canada.
I encourage the NDP to support the government's future initiatives to ensure that quality service is available in every region of the country.",Conservative,Mégantic--L'Érable,Christian Paradis,http://www.parl.gc.ca/parlinfo/Files/Parliamentarian.aspx?Item=cb9e0f12-f78f-4892-bc54-361d23267631&Language=E&Section=ALL
4518143,ca.proc.d.2012-04-02.3080.163,2012-04-02,ac2f2b50-7b1e-44bd-9004-3f578be9c706,8646,"Mr. Pierre Dionne Labelle (Rivière-du-Nord, NDP)",,Oral Questions,Bell Canada,,"Mr. Speaker, the giant telephone companies want to double the cost of using public telephones.
Pay phones are used mainly by low-income people and seniors, and those are the people who will feel the full weight of this increase.
Will the minister work with us to prevent this unjustified increase, or will he stand once again with his friends, the telecom giants?
Why do the Conservatives never stand up for low-income Canadians, the people who cannot afford cell phones, decent housing or food on their tables? On this issue, it seems no one is going to answer the call for the Conservatives.",New Democratic Party,Rivière-du-Nord,Pierre Dionne Labelle,http://www.parl.gc.ca/parlinfo/Files/Parliamentarian.aspx?Item=ac2f2b50-7b1e-44bd-9004-3f578be9c706&Language=E&Section=ALL
4518144,ca.proc.d.2012-04-02.3080.164,2012-04-02,cb9e0f12-f78f-4892-bc54-361d23267631,448,"Hon. Christian Paradis (Minister of Industry and Minister of State (Agriculture), CPC)",,Oral Questions,Bell Canada,,"Mr. Speaker, once again, the CRTC is responsible for the regulations. We all know it is independent of the government. Measures have been put in place by the government, however, including the community broadband programs and the spectrum auction announced a few weeks ago, with the goal of ensuring that all Canadians have access to high-quality, well-priced services, wherever they live.
Therefore, I encourage the hon. member to support the government in taking the necessary measures to ensure that these goals are reached.",Conservative,Mégantic--L'Érable,Christian Paradis,http://www.parl.gc.ca/parlinfo/Files/Parliamentarian.aspx?Item=cb9e0f12-f78f-4892-bc54-361d23267631&Language=E&Section=ALL
4518145,ca.proc.d.2012-04-02.3080.165,2012-04-02,dbff5361-0aea-4fae-8d27-e857f4909772,398,"Mr. Mike Allen (Tobique—Mactaquac, CPC)",,Oral Questions,Foreign Affairs,,"Mr. Speaker, I am pleased and thankful that my constituent, Henk Tepper, was released from detention in Lebanon over the weekend and is now home in New Brunswick. I know first-hand how anxious and hopeful his family and home town were as they anticipated his return.
I want to thank the minister responsible for consular affairs and her team of dedicated officials for their tireless efforts to bring Henk home.
Could the Minister of State of Foreign Affairs, Americas and Consular Affairs please provide the House with an update on the efforts in Mr. Tepper's case?",Conservative,Tobique--Mactaquac,Mike Allen,http://www.parl.gc.ca/parlinfo/Files/Parliamentarian.aspx?Item=dbff5361-0aea-4fae-8d27-e857f4909772&Language=E&Section=ALL
4518146,ca.proc.d.2012-04-02.3080.166,2012-04-02,cae316dd-8887-4133-8389-1de7355a66d8,2,"Hon. Diane Ablonczy (Minister of State of Foreign Affairs (Americas and Consular Affairs), CPC)",,Oral Questions,Foreign Affairs,,"Mr. Speaker, in turn, I applaud my colleague for his unwavering and sincere care for Mr. Tepper and his family through this past difficult year. He truly is a credit to his riding.
I, too, am pleased that Mr. Henk Tepper has been released from detention and is safely home in Canada. Canadian officials worked very hard to help secure Mr. Tepper's release through diplomatic channels with dozens of representations to Lebanese officials. The Government of Canada also thanks our partners in Lebanon for their co-operation and responsiveness. ",Conservative,Calgary Nose Hill,Diane Ablonczy,http://www.parl.gc.ca/parlinfo/Files/Parliamentarian.aspx?Item=cae316dd-8887-4133-8389-1de7355a66d8&Language=E&Section=ALL
4518147,ca.proc.d.2012-04-02.3080.167,2012-04-02,669a6720-3704-48ff-a218-4035d05107a6,553,"Ms. Judy Foote (Random—Burin—St. George's, Lib.)",,Oral Questions,Search and Rescue,,"Mr. Speaker, for months, the government has been told that the amalgamation of the maritime rescue sub-centres in St. John's and Quebec with Halifax and Trenton is wrong. 
Now, Jason Hamilton, a former employee of the rescue centre in Halifax has written to the Minister of National Defence saying, “I consider these cuts to be irresponsible and dangerous. I hold you personally responsible for the repercussions if this amalgamation is allowed to continue”.
Will the Minister of National Defence reverse this dangerous decision before there are losses of lives?",Liberal,Random--Burin--St. George's,Judy Foote,http://www.parl.gc.ca/parlinfo/Files/Parliamentarian.aspx?Item=669a6720-3704-48ff-a218-4035d05107a6&Language=E&Section=ALL
4518148,ca.proc.d.2012-04-02.3080.168,2012-04-02,ccfa05f8-2114-48f1-9ff4-5434e3279acb,148,"Mr. Randy Kamp (Parliamentary Secretary to the Minister of Fisheries and Oceans and for the Asia-Pacific Gateway, CPC)",,Oral Questions,Search and Rescue,,"Mr. Speaker, I think what my colleague is not getting is that this change does not affect the availability of search and rescue resources. They will be out there where they are needed to do their business. In fact, we think they will be able to respond better because all of the people making the decisions will be jointly working in the same location. We think it is a positive change and we are continuing on with it.",Conservative,Pitt Meadows--Maple Ridge--Mission,Randy Kamp,http://www.parl.gc.ca/parlinfo/Files/Parliamentarian.aspx?Item=ccfa05f8-2114-48f1-9ff4-5434e3279acb&Language=E&Section=ALL
4518149,ca.proc.d.2012-04-02.3080.169,2012-04-02,e625ab0e-bcf7-4a97-8fb0-d75c73c3b78e,8664,"Mrs. Sadia Groguhé (Saint-Lambert, NDP)",,Oral Questions,Immigration,,"Mr. Speaker, the Conservatives have appointed three unilingual anglophones to the Immigration and Refugee Board in Montreal and Ottawa. Not only is this an insult to francophones, but according to La Presse, these members have a claim acceptance rate that is 50% lower than that of their colleagues.
Is this just coincidence? Is this because they have a poor understanding of the files, or are these board members obeying the government's instructions to stop legitimate refugees from entering the country?",New Democratic Party,Saint-Lambert,Sadia Groguhé,http://www.parl.gc.ca/parlinfo/Files/Parliamentarian.aspx?Item=e625ab0e-bcf7-4a97-8fb0-d75c73c3b78e&Language=E&Section=ALL
4518150,ca.proc.d.2012-04-02.3080.170,2012-04-02,e4fac630-d103-47ac-9170-4da50dd3aec8,423,"Mr. Rick Dykstra (Parliamentary Secretary to the Minister of Citizenship and Immigration, CPC)",,Oral Questions,Immigration,,"Mr. Speaker, the IRB judges go through a very rigorous process. It is arm's-length, merit based and administered by professional, highly trained civil servants. 
If the member is looking for numbers, there are currently 32 members in the refugee protection division; 21 are bilingual, 9 are unilingual French and 2 are unilingual English.
 If the member is asking us to dispose of nine unilingual French speaking judges in Quebec, I would ask her to explain why to the House of Commons.",Conservative,St. Catharines,Rick Dykstra,http://www.parl.gc.ca/parlinfo/Files/Parliamentarian.aspx?Item=e4fac630-d103-47ac-9170-4da50dd3aec8&Language=E&Section=ALL
4518151,ca.proc.d.2012-04-02.3080.171,2012-04-02,4cb0ba6b-f142-4b9d-921b-e1ee27d48e24,413,"Mr. Ron Cannan (Kelowna—Lake Country, CPC)",,Oral Questions,The Economy,,"Mr. Speaker, last week, the Minister of Finance tabled Canada's economic action plan 2012, a plan for jobs, growth and long-term prosperity. With Canada's economic plan 2012, we are working to secure Canada's economic successes now and for future generations. 
Could the hard-working Minister of State for Western Economic Diversification  please update the House on how our government's plan will help grow western Canada's economy?",Conservative,Kelowna--Lake Country,Ron Cannan,http://www.parl.gc.ca/parlinfo/Files/Parliamentarian.aspx?Item=4cb0ba6b-f142-4b9d-921b-e1ee27d48e24&Language=E&Section=ALL
4518152,ca.proc.d.2012-04-02.3080.172,2012-04-02,7d30ceff-1d85-4736-bbc8-293337c0423e,307,"Hon. Lynne Yelich (Minister of State (Western Economic Diversification), CPC)",,Oral Questions,The Economy,,"Mr. Speaker, I thank my hon. colleague for Kelowna—Lake Country for giving me the opportunity to highlight one of the many great items in our economic action plan for 2012.
My department, WD, will soon be unveiling the details on the western innovation program. It will be known as WINN. WINN will provide financial support to small and medium enterprises in western Canada and it will assist them in bringing their innovative ideas to market. 
Our government is focused and we are focused on what matters to Canadians. Our economic action plan 2012 will continue to get the job done in building a stronger west.",Conservative,Blackstrap,Lynne Yelich,http://www.parl.gc.ca/parlinfo/Files/Parliamentarian.aspx?Item=7d30ceff-1d85-4736-bbc8-293337c0423e&Language=E&Section=ALL
4518153,ca.proc.d.2012-04-02.3080.173,2012-04-02,cedf1659-ebb1-4f26-b723-5c7c5353988b,573,"Mrs. Carol Hughes (Algoma—Manitoulin—Kapuskasing, NDP)",,Oral Questions,National Council of Welfare,,"Mr. Speaker, the Conservatives are cutting the National Council of Welfare, the most important source of information on poverty and welfare income in Canada. 
Instead of solving the problem of poverty, the Conservatives are turning a blind eye, refusing to do anything about it. Most recently, the council advised that it would take less money to solve poverty than the government is spending to manage the symptoms. 
Does the government not realize how important this information is? Why does it continually want to hide the facts?",New Democratic Party,Algoma--Manitoulin--Kapuskasing,Carol Hughes,http://www.parl.gc.ca/parlinfo/Files/Parliamentarian.aspx?Item=cedf1659-ebb1-4f26-b723-5c7c5353988b&Language=E&Section=ALL
4518154,ca.proc.d.2012-04-02.3080.174,2012-04-02,3060b2f8-9254-4bba-8c6a-07906e591f1c,8918,"Ms. Kellie Leitch (Parliamentary Secretary to the Minister of Human Resources and Skills Development and to the Minister of Labour, CPC)",,Oral Questions,National Council of Welfare,,"Mr. Speaker, the best way to fight poverty is to ensure Canadians have a job, which is exactly what budget 2012 is doing.
With respect to the National Council of Welfare, we are putting our policy resources to best use and reducing duplication. Examples of high profile organizations, not for profit organizations that focus on this area are Campaign 2000 or Canada Without Poverty. 
We are focused on ensuring that we reduce duplication and that we are effective, but we also want to ensure that everyone understands that we are focused on poverty. We want to ensure that individuals in the country are well served but, most important, we want to ensure Canadians have a job.",Conservative,Simcoe--Grey,Kellie Leitch,http://www.parl.gc.ca/parlinfo/Files/Parliamentarian.aspx?Item=3060b2f8-9254-4bba-8c6a-07906e591f1c&Language=E&Section=ALL
4518155,ca.proc.d.2012-04-02.3080.175,2012-04-02,cfbb2e3f-a8fa-43c0-ad2a-1d2e4c7b865d,442,"Mrs. Maria Mourani (Ahuntsic, BQ)",,Oral Questions,Air Transportation,,"Mr. Speaker, in Neuville, unscrupulous private developers are using the fact that airport construction falls under federal jurisdiction to avoid complying with the environmental protection, public health and safety, and land use laws of Neuville, the Portneuf RCM and Quebec.
 Will the Minister of Transport, Infrastructure and Communities  ensure that all planned airfields and airports are subject to provincial and municipal environmental, safety and land use regulations so that this type of situation does not happen again in Neuville—",Bloc Québécois,Ahuntsic,Maria Mourani,http://www.parl.gc.ca/parlinfo/Files/Parliamentarian.aspx?Item=cfbb2e3f-a8fa-43c0-ad2a-1d2e4c7b865d&Language=E&Section=ALL
4518156,ca.proc.d.2012-04-02.3080.176,2012-04-02,6519cfba-0080-419d-baa9-8ae6e56d032f,256,The Speaker,,Oral Questions,Air Transportation,,"The hon. Minister of Transport, Infrastructure and Communities.",Conservative,Regina--Qu'Appelle,Andrew Scheer,http://www.parl.gc.ca/parlinfo/Files/Parliamentarian.aspx?Item=6519cfba-0080-419d-baa9-8ae6e56d032f&Language=E&Section=ALL
4518157,ca.proc.d.2012-04-02.3080.177,2012-04-02,655f75f0-7c4c-4dd1-b0d7-317be0595660,545,"Hon. Denis Lebel (Minister of Transport, Infrastructure and Communities and Minister of the Economic Development Agency of Canada for the Regions of Quebec, CPC)",,Oral Questions,Air Transportation,,"Mr. Speaker, the role of the federal transport minister is to ensure the development of a safe air transportation industry. We will not intervene in this matter because safety is not at issue. Furthermore, if the mayor was so opposed to the project, he would never have signed an agreement with the developer. We will continue to look at options for the future.",Conservative,Roberval--Lac-Saint-Jean,Denis Lebel,http://www.parl.gc.ca/parlinfo/Files/Parliamentarian.aspx?Item=655f75f0-7c4c-4dd1-b0d7-317be0595660&Language=E&Section=ALL
4518158,ca.proc.d.2012-04-02.3080.178,2012-04-02,6519cfba-0080-419d-baa9-8ae6e56d032f,256,The Speaker,,Routine Proceedings,Board of Internal Economy,,"I have the honour to lay upon the table the revised bylaws of the Board of Internal Economy adopted by the board on November 21 and December 5, 2011, and repealing the earlier version.
The revised bylaws went into effect on April 1, 2012. They are now available on the Parliament of Canada website.",Conservative,Regina--Qu'Appelle,Andrew Scheer,http://www.parl.gc.ca/parlinfo/Files/Parliamentarian.aspx?Item=6519cfba-0080-419d-baa9-8ae6e56d032f&Language=E&Section=ALL
4518159,ca.proc.d.2012-04-02.3080.179,2012-04-02,64baabef-e32d-4384-a8eb-ac38c91ed3a6,601,"Mrs. Shelly Glover (Parliamentary Secretary to the Minister of Finance, CPC)",,Routine Proceedings,Government Response to Petitions,,"Mr. Speaker, pursuant to Standing Order 36(8), I have the honour to table, in both official languages, the government’s responses to 12 petitions.",Conservative,Saint Boniface,Shelly Glover,http://www.parl.gc.ca/parlinfo/Files/Parliamentarian.aspx?Item=64baabef-e32d-4384-a8eb-ac38c91ed3a6&Language=E&Section=ALL
4518160,ca.proc.d.2012-04-02.3080.180,2012-04-02,33e7f16a-a1a5-405b-9c5e-8e6c095078ed,291,"Mr. Merv Tweed (Brandon—Souris, CPC)",,Routine Proceedings,Committees of the House,"Transport, Infrastructure and Communities","Mr. Speaker, I have to honour to present, in both official languages, the second report of the Standing Committee on Transport, Infrastructure and Communities in relation to the main estimates for 2012-13.",Conservative,Brandon--Souris,Merv Tweed,http://www.parl.gc.ca/parlinfo/Files/Parliamentarian.aspx?Item=33e7f16a-a1a5-405b-9c5e-8e6c095078ed&Language=E&Section=ALL
