basepk,hid,speechdate,pid,opid,speakeroldname,speakerposition,maintopic,subtopic,subsubtopic,speechtext,speakerparty,speakerriding,speakername,speakerurl
4514741,ca.proc.d.2012-03-12.2987.259,2012-03-12,ebbfc235-08c5-44f8-8c22-a60c671db398,461,"Mr. Chris Warkentin (Peace River, CPC)",,Government Orders,Business of the House,,"Mr. Speaker, I believe you will find support from all parties for the following motion. I move: 
 That, notwithstanding any Standing Order or usual practices of the House, during the debate tonight pursuant to Standing Order 52, no quorum calls, dilatory motions or requests for unanimous consent shall be received by the Chair. 
",Conservative,Peace River,Chris Warkentin,http://www.parl.gc.ca/parlinfo/Files/Parliamentarian.aspx?Item=ebbfc235-08c5-44f8-8c22-a60c671db398&Language=E&Section=ALL
4514742,ca.proc.d.2012-03-12.2987.260,2012-03-12,eaa6694f-1e20-4aae-ad3b-e694b0e12c59,9187,"Ms. Elizabeth May (Saanich—Gulf Islands, GP)",,Government Orders,Business of the House,,"Mr. Speaker, my office has been consulted by the Conservative Party on this motion. I do not wish to block the motion. I see that all the other parties are in favour. I gather this is more or less a routine procedure with respect to emergency debates to have a motion that says all parties consent that we really do not have to be here. I find it unfortunate, but I certainly will not block it.",Green,Saanich--Gulf Islands,Elizabeth May,http://www.parl.gc.ca/parlinfo/Files/Parliamentarian.aspx?Item=eaa6694f-1e20-4aae-ad3b-e694b0e12c59&Language=E&Section=ALL
4514743,ca.proc.d.2012-03-12.2987.261,2012-03-12,de0591ef-9a02-4f97-9541-63de484c96e3,87,The Acting Speaker (Mr. Barry Devolin),,Government Orders,Business of the House,,"The Chair appreciates the point raised by the member for Saanich—Gulf Islands.
Does the hon. member for Peace River have the unanimous consent of the House to move the motion? ",Conservative,Haliburton--Kawartha Lakes--Brock,Barry Devolin,http://www.parl.gc.ca/parlinfo/Files/Parliamentarian.aspx?Item=de0591ef-9a02-4f97-9541-63de484c96e3&Language=E&Section=ALL
4514744,ca.proc.d.2012-03-12.2987.262,2012-03-12,,,,intervention,Government Orders,Business of the House,, Agreed.,,,Some hon. members,
4514745,ca.proc.d.2012-03-12.2987.263,2012-03-12,de0591ef-9a02-4f97-9541-63de484c96e3,87,The Acting Speaker (Mr. Barry Devolin),,Government Orders,Business of the House,, The House has heard the terms of the motion. Is it the pleasure of the House to adopt the motion?,Conservative,Haliburton--Kawartha Lakes--Brock,Barry Devolin,http://www.parl.gc.ca/parlinfo/Files/Parliamentarian.aspx?Item=de0591ef-9a02-4f97-9541-63de484c96e3&Language=E&Section=ALL
4514746,ca.proc.d.2012-03-12.2987.264,2012-03-12,,,,intervention,Government Orders,Business of the House,, Agreed.,,,Some hon. members,
4514747,ca.proc.d.2012-03-12.2987.265,2012-03-12,de0591ef-9a02-4f97-9541-63de484c96e3,87,The Acting Speaker (Mr. Barry Devolin),,Government Orders,Business of the House,,(Motion agreed to),Conservative,Haliburton--Kawartha Lakes--Brock,Barry Devolin,http://www.parl.gc.ca/parlinfo/Files/Parliamentarian.aspx?Item=de0591ef-9a02-4f97-9541-63de484c96e3&Language=E&Section=ALL
4514748,ca.proc.d.2012-03-12.2987.266,2012-03-12,,,,stagedirection,Government Orders,Protecting Canada's Immigration System Act,,"The House resumed consideration of the motion that Bill C-31, An Act to amend the Immigration and Refugee Protection Act, the Balanced Refugee Reform Act, the Marine Transportation Security Act and the Department of Citizenship and Immigration Act, be read the second time and referred to a committee, and of the amendment.",,,,
4514749,ca.proc.d.2012-03-12.2987.267,2012-03-12,bfacb66c-68a3-4589-a5be-769e0614449e,8915,"Ms. Rathika Sitsabaiesan (Scarborough—Rouge River, NDP)",,Government Orders,Protecting Canada's Immigration System Act,,"Mr. Speaker, my colleague serves with me on the citizenship and immigration committee.
The Standing Committee on Citizenship and Immigration has been tasked with studying biometrics as an option for immigration, monitoring entry into and exit from the country, and yet before the committee has even finished the study and produced a report, the government is saying that this is going to become legislation. Does the government not respect the standing committees that are established in this Parliament?",New Democratic Party,Scarborough--Rouge River,Rathika Sitsabaiesan,http://www.parl.gc.ca/parlinfo/Files/Parliamentarian.aspx?Item=bfacb66c-68a3-4589-a5be-769e0614449e&Language=E&Section=ALL
4514750,ca.proc.d.2012-03-12.2987.268,2012-03-12,0bb713a8-19fa-4695-8f26-64a5420953dc,8896,Mr. Costas Menegakis,Interjection,Government Orders,Protecting Canada's Immigration System Act,,"Mr. Speaker, I do not necessarily accept the conclusion which the hon. member has come to, that the government does not respect the wish of the committee.
Certainly this legislation is the framework which gives the minister and the ministry the opportunity to pursue the good work they do to ensure that our borders are secure at all times. I know that the minister is waiting with much anticipation for the results of our very important study. We are studying the issue of security and biometrics, which will give an additional tool to officials to ensure that those who are seeking to come to Canada are indeed the people they claim to be, and that they are good, law-abiding citizens in the countries from which they come.",Conservative,Richmond Hill,Costas Menegakis,http://www.parl.gc.ca/parlinfo/Files/Parliamentarian.aspx?Item=0bb713a8-19fa-4695-8f26-64a5420953dc&Language=E&Section=ALL
4514751,ca.proc.d.2012-03-12.2987.269,2012-03-12,07cf5767-802c-406c-92a7-7dc92af79b40,4264,"Mr. Kevin Lamoureux (Winnipeg North, Lib.)",,Government Orders,Protecting Canada's Immigration System Act,,"Mr. Speaker, I wonder if the member could comment on the component where the minister can say that someone is an irregular arrival. He is referring more to arrivals by boat, but it also applies to individuals who would land at any of our airports.
Someone who is labelled as an irregular arrival could be detained for up to a year. After that detention there would be a five-year waiting period before the person would be able to sponsor someone. A 26-year-old man who has left a country where his life was threatened and has managed to escape that country would be waiting years. It would be five or six years before he could even put in an application to sponsor someone, his child, for example, which could then take another five or six years. His six-year-old child would be 17 or 18 years old by the time the child arrived here.
I wonder if the member could comment in terms of the fairness of that aspect of the legislation.",Liberal,Winnipeg North,Kevin Lamoureux,http://www.parl.gc.ca/parlinfo/Files/Parliamentarian.aspx?Item=07cf5767-802c-406c-92a7-7dc92af79b40&Language=E&Section=ALL
4514752,ca.proc.d.2012-03-12.2987.270,2012-03-12,0bb713a8-19fa-4695-8f26-64a5420953dc,8896,Mr. Costas Menegakis,Interjection,Government Orders,Protecting Canada's Immigration System Act,,"Mr. Speaker, let us talk about fairness. Without question, Canada has the most fair and generous immigration system in the world. However, Canadians, and we are hearing this every day in our ridings, have no tolerance for those who would abuse our generosity and would take unfair advantage of our country.
At some point we have to have a balance. We must take action to crack down on the abuse. Our government is committed to strengthening the integrity of Canada's immigration system.",Conservative,Richmond Hill,Costas Menegakis,http://www.parl.gc.ca/parlinfo/Files/Parliamentarian.aspx?Item=0bb713a8-19fa-4695-8f26-64a5420953dc&Language=E&Section=ALL
4514753,ca.proc.d.2012-03-12.2987.271,2012-03-12,7d30ceff-1d85-4736-bbc8-293337c0423e,307,"Hon. Lynne Yelich (Minister of State (Western Economic Diversification), CPC)",,Government Orders,Protecting Canada's Immigration System Act,,"Mr. Speaker, one of the changes that has been made to the bill from the previous human smuggling bill is the detaining of children under the age of 16.
Could the member comment on that specific change and how it strengthens the bill?",Conservative,Blackstrap,Lynne Yelich,http://www.parl.gc.ca/parlinfo/Files/Parliamentarian.aspx?Item=7d30ceff-1d85-4736-bbc8-293337c0423e&Language=E&Section=ALL
4514754,ca.proc.d.2012-03-12.2987.272,2012-03-12,0bb713a8-19fa-4695-8f26-64a5420953dc,8896,Mr. Costas Menegakis,Interjection,Government Orders,Protecting Canada's Immigration System Act,,"Mr. Speaker, the protecting Canada's immigration system act will make our refugee system faster and fairer for everyone. It will put a stop to foreign criminals, human smugglers and bogus refugees abusing our generous immigration system and receiving lucrative taxpayer-funded health and social benefits.
At the same time, the bill will provide protection more quickly to those who are truly in need.",Conservative,Richmond Hill,Costas Menegakis,http://www.parl.gc.ca/parlinfo/Files/Parliamentarian.aspx?Item=0bb713a8-19fa-4695-8f26-64a5420953dc&Language=E&Section=ALL
4514755,ca.proc.d.2012-03-12.2987.273,2012-03-12,bfacb66c-68a3-4589-a5be-769e0614449e,8915,"Ms. Rathika Sitsabaiesan (Scarborough—Rouge River, NDP)",,Government Orders,Protecting Canada's Immigration System Act,,"Mr. Speaker, I will be sharing my time with the member for Beaches—East York.
I rise today to add my strongest objection to Bill C-31, the Protecting Canada's Immigration System act. I find it ironic that the bill would be given this title. It would do anything but protect our immigration system. In fact, the bill would set out to dismantle our immigration system, damaging it legally, socially, morally and internationally. I find the omnibus nature of the bill very disturbing. 
This particular bill groups together two major pieces of legislation, Bill C-4, the Preventing Human Smugglers from Abusing Canada's Immigration System act, and C-11, the Balanced Refugee Reform act from the last Parliament. Then it introduces the mandatory collection of biometrics for temporary residents. These are three major issues that deserve adequate attention and debate.
I have already stood in the House and expressed my strong objection to C-4, yet components of the bill reappear here in C-31. The bill would attack refugees rather than human smugglers. By placing an overwhelming amount of power in the hands of the minister, the bill would allow the minister to designate a group of refugees as an irregular arrival. If the minister believed, for example, that examination for establishing identity could not be conducted in a timely manner, or if it were suspected that the people were being smuggled for profit, or a criminal organization or terrorist group was involved in the smuggling, designated claimants would then be subjected to a number of rules. They would be mandatorily detained on arrival, or on designation by the minister, with no review by the Immigration and Refugee Board for their detention for a year. Release would only be possible if they were found to be true refugees. If the Immigration and Refugee Board ordered their release within a year, even then the Immigration and Refugee Board could not release people if the government said their identities had not been established, or if the minister decided that there were exceptional circumstances. 
Decisions on claims by designated persons could not be appealed to the Refugee Appeal Division. A designated person could not make humanitarian and compassionate applications. A designated claimant could not apply for permanent residency for five years. If the person failed to comply with the conditions or reporting requirements, that five year suspension could be extended to six years. 
This raises a number of concerns. First, this is extremely discriminatory as it would create two classes of refugee claimants: real refugees and designated claimants. This is possibly a violation of the Canadian Charter of Human Rights and Freedoms' equality rights, as well as the refugee convention, which prohibits states from imposing penalties on refugees for illegal entry or presence. 
Second, detention without review is a clear violation of the charter rights. The Supreme Court already struck down mandatory detention without review on security certificates. This legislation would imply indefinite detention on the basis of identity with no possibility of release until the minister decided that identity had been established. Arbitrary detention is also a violation of a number of international treaties. 
Third, designated persons would have no access to the Refugee Appeal Division. This means that these claimants would not have the right to an appeal, thereby removing any system of checks and balances. 
Additionally, the mandatory five year delay in applying for permanent residency would further delay the family reunification process, forcing claimants to wait eight to ten years to be reunited with their spouse or child living overseas. Last, this legislation would create an undue barrier for humanitarian and compassionate claims. I am extremely concerned with the idea that the minister could name someone a designated claimant based on irregular arrival with no explanation of what constitutes an irregular arrival. 
If we look at the history of the legislation of this nature, introduced by this government, we can see that it has glaring resemblances to Bill C-49 in the last Parliament. 
Bill C-49 was hastily drafted by the government when Canadians witnessed the spectre of boats coming to the shores of British Columbia, carrying some of the most damaged and wounded people on earth. These were people fleeing, as the minister has rightly pointed out, one of the worst civil wars in the world, in Sri Lanka. Never ones to pass off a good photo op, the Minister of Citizenship, Immigration and Multiculturalism and the Minister of Public Safety were in British Columbia, holding news conferences where they publicly accused the people on these boats of being bogus refugees, harbouring terrorists and trying to jump the immigration queues. They called these people “queue jumpers”.
 I find this extremely confusing. The government seems to be speaking out of both sides of its mouth. On one hand, we have the Minister of Foreign Affairs referring to the Sri Lankan civil war as a great atrocity where numerous war crimes and crimes against humanity were committed. On the other hand, we have the Minister of Citizenship, Immigration and Multiculturalism and the Minister of Public Safety accusing people fleeing this very violence of being bogus. This is completely absurd. Which one is it?
Some of the refugee claimants and the refugees who arrived on the MV Sun Sea now live in my riding of Scarborough—Rouge River. Many of them have told me stories of their trip to Canada and their arrival in British Columbia. Many of them had UNHCR refugee cards. Upon their arrival, the people who greeted them gathered all of their refugee cards. When there was not the same number of cards as people, all the people aboard were told that they had not presented adequate identification and documentation when they came. Regardless of whether they had refugee cards, they were all detained. Thankfully, many of these people have now been released, but some are still in detention. Some of these people who had refugee cards are still being detained. 
I am going to go back to the idea of an irregular arrival. This concept is not defined in this legislation. Based on the history of this bill, it is easy to jump to the conclusion that irregular arrival means arrival by boat. This bill is essentially saying that people who arrive in an irregular fashion, or by boat, are not refugees but rather are criminals. This bill is saying that people who wish to flee war, conflict or persecution but do not have the means to pay for a plane ticket so instead risk their lives by throwing themselves onto a rickety cargo boat and spending months crossing an ocean are not real refugees. No, the government is saying they are criminals. They are not real asylum seekers. They are not really fleeing a horrible situation, leaving behind their homes, livelihood and families with hopes of creating a better life here in Canada. No, these people are criminals. This is what this bill and the government are telling us.
Furthermore, if they fail to provide adequate identification, they can be detained without review. Most refugees who come to Canada do not have documentation, regardless of which process is used to enter the country. When people flee their home nation, they leave everything behind. How can we expect people who have left a war-torn country to carry valid identification? This concept of queue jumping, as the minister likes to say, is completely bogus. These people still must go through the same immigration process as any other immigrant to Canada. When people are fleeing persecution or war, they cannot be called queue jumpers. For refugees, there is no queue to jump. There is no lineup for people who are in serious danger; people living through a civil war; or people being persecuted because of their gender, religion, sexual orientation, et cetera. When people's lives or the lives of their families are called into question, there is no line. These people must leave their country immediately. Once they are safely here in Canada, they must joint the same queue as everyone else who wants to gain some sort of status in our country.
The second part of this bill comprises of Bill C-11, from the last Parliament, and the calling of safe countries. In the 40th Parliament, after a lot of work and compromises, Bill C-11 passed this House with all-party support. It was scheduled to come into effect this spring. However, before the legislation that was passed by this House could even have a chance to come into effect, the members opposite have including the original legislation, Bill C-11, excluding any part of the amendments that were accepted by all parties, in this current omnibus bill. The government has not even given the original Bill C-11 from the last Parliament a chance to work.
The Conservatives are using fear-mongering and fear tactics to scare the current immigrants in Canada and current Canadians. They are pitting Canadians against immigrants and new immigrants against other newer immigrants. This type of fear tactics is absolutely wrong.",New Democratic Party,Scarborough--Rouge River,Rathika Sitsabaiesan,http://www.parl.gc.ca/parlinfo/Files/Parliamentarian.aspx?Item=bfacb66c-68a3-4589-a5be-769e0614449e&Language=E&Section=ALL
4514756,ca.proc.d.2012-03-12.2987.274,2012-03-12,075456c7-3cca-483c-b4f1-85006031ca09,8685,"Mr. Robert Aubin (Trois-Rivières, NDP)",,Government Orders,Protecting Canada's Immigration System Act,,"Mr. Speaker, I would like to thank the hon. member for her informed and enlightening speech.
When I was a teacher, I often told my students that it is impossible to find a simple solution to a complex problem. However, I get the impression that this has become the Conservatives' speciality. They present everything to us in black and white as though it were possible to cut right down the middle and say that there is a good side and a bad, black and white, when, in reality, life is full of grey areas to which we need to learn to adapt.
Is this bill not just another example of a black and white view of a problem? I would like the hon. member to provide some clarification in this regard.",New Democratic Party,Trois-Rivières,Robert Aubin,http://www.parl.gc.ca/parlinfo/Files/Parliamentarian.aspx?Item=075456c7-3cca-483c-b4f1-85006031ca09&Language=E&Section=ALL
4514757,ca.proc.d.2012-03-12.2987.275,2012-03-12,bfacb66c-68a3-4589-a5be-769e0614449e,8915,Ms. Rathika Sitsabaiesan,Interjection,Government Orders,Protecting Canada's Immigration System Act,,"Mr. Speaker, my colleague is absolutely right. The immigration system in Canada is very complex. Just saying that we are going to put a whole bunch of legislation together, that we are stopping debate on it and not letting the democratic process run itself out, that we are just going to make safe countries, that we are going to stop people who are coming by boat because there are fake refugees in our country and that we are going to now ignore the parliamentary processes that have been established by ignoring the committee and the work that the citizenship and immigration committee is going to be doing, or is doing, is absolutely another example of the government's black and white easy fix to every problem, “Let's just rewrite the law, because that's what we do”.",New Democratic Party,Scarborough--Rouge River,Rathika Sitsabaiesan,http://www.parl.gc.ca/parlinfo/Files/Parliamentarian.aspx?Item=bfacb66c-68a3-4589-a5be-769e0614449e&Language=E&Section=ALL
4514758,ca.proc.d.2012-03-12.2987.276,2012-03-12,07cf5767-802c-406c-92a7-7dc92af79b40,4264,"Mr. Kevin Lamoureux (Winnipeg North, Lib.)",,Government Orders,Protecting Canada's Immigration System Act,,"Mr. Speaker, I want to pick up on the point to which the member just made reference. I, too, sit on the citizenship and immigration committee. We are spending thousands of tax dollars to do a study on biometrics.
Like her, I was surprised that the government introduced a bill with regard to it. We are still in the midst of a study. I would argue that the minister is, once again, undermining the work of the citizenship and immigration committee.
Could she be clear and succinct on the point of the minister undermining the efforts of the committee?",Liberal,Winnipeg North,Kevin Lamoureux,http://www.parl.gc.ca/parlinfo/Files/Parliamentarian.aspx?Item=07cf5767-802c-406c-92a7-7dc92af79b40&Language=E&Section=ALL
4514759,ca.proc.d.2012-03-12.2987.277,2012-03-12,bfacb66c-68a3-4589-a5be-769e0614449e,8915,Ms. Rathika Sitsabaiesan,Interjection,Government Orders,Protecting Canada's Immigration System Act,,"Mr. Speaker, I absolutely agree with my colleague from Winnipeg. The minister is clearly undermining the processes of the citizenship and immigration committee. The committee has been tasked with the job of looking into whether biometrics would be a good way to go for the government and for our country to protect the safety and security of our borders. Yet, instead of waiting for the committee to hear expert witnesses and feedback from Canadians and then waiting for the report from the committee, the minister just goes ahead and says that he has made the decision and that he does not care what the committee says.
Once again, he is going ahead, undermining the committee and not respecting Parliament and the processes that we have in Parliament.",New Democratic Party,Scarborough--Rouge River,Rathika Sitsabaiesan,http://www.parl.gc.ca/parlinfo/Files/Parliamentarian.aspx?Item=bfacb66c-68a3-4589-a5be-769e0614449e&Language=E&Section=ALL
4514760,ca.proc.d.2012-03-12.2987.278,2012-03-12,e4fac630-d103-47ac-9170-4da50dd3aec8,423,"Mr. Rick Dykstra (Parliamentary Secretary to the Minister of Citizenship and Immigration, CPC)",,Government Orders,Protecting Canada's Immigration System Act,,"Mr. Speaker, I certainly appreciate the speech and the questions and answers between my colleagues who sit on the immigration committee. However, I want to tell members I have a completely different perspective on this, and that is the question I would like to put to the member.
We just completed a report on backlogs. One of the first things the minister did was listen to what we had said about the whole issue around super visas for parents and grandparents to come to this country in a much quicker manner. The committee made the recommendation. The committee discussed this for a number of weeks. The minister made the decision even before the committee had finished the work. There is not a minister who is listening more closely to his committee and to the reports that are coming forward than the Minister of Citizenship, Immigration and Multiculturalism.
Let me also point out that there is backlog upon backlog in the refugee system, an average of 55,000 per file. I would like to know why the member and her party will not support a process that would quicken this and ensure that refugees, true refugees, come to our country in the appropriate time and appropriate manner.",Conservative,St. Catharines,Rick Dykstra,http://www.parl.gc.ca/parlinfo/Files/Parliamentarian.aspx?Item=e4fac630-d103-47ac-9170-4da50dd3aec8&Language=E&Section=ALL
4514761,ca.proc.d.2012-03-12.2987.279,2012-03-12,bfacb66c-68a3-4589-a5be-769e0614449e,8915,Ms. Rathika Sitsabaiesan,Interjection,Government Orders,Protecting Canada's Immigration System Act,,"Mr. Speaker, it is funny that the day after the minister came to the committee, when we were contemplating looking at the possibility of super visas, he then went off and made an announcement. Was it suggested at the committee because he was ready to make an announcement?
The same thing happened here. A committee is looking at the potential of biometrics, but it has not even decided if biometrics is a good way to go. We are still listening to experts from Canada and around the world who are providing us with their expertise. The committee has not even made a report, yet the minister has already made his decision as to what he will do.
This is not a minister who waits for the report and study to come from a committee before making his decisions. This is a minister who makes decisions and then makes a suggestion to the committee that it should study this. It is really the opposite of what the parliamentary secretary is saying.",New Democratic Party,Scarborough--Rouge River,Rathika Sitsabaiesan,http://www.parl.gc.ca/parlinfo/Files/Parliamentarian.aspx?Item=bfacb66c-68a3-4589-a5be-769e0614449e&Language=E&Section=ALL
