basepk,hid,speechdate,pid,opid,speakeroldname,speakerposition,maintopic,subtopic,subsubtopic,speechtext,speakerparty,speakerriding,speakername,speakerurl
4514860,ca.proc.d.2012-03-12.2987.378,2012-03-12,9fb311fc-3875-4698-b13c-014f0d819393,55,"Mr. Colin Carrie (Parliamentary Secretary to the Minister of Health, CPC)",,Government Orders,Emergency Debate,Drug Shortages,"Mr. Speaker, I am sharing my time with the member for Kildonan—St. Paul.
I am pleased to be taking part in this important debate this evening. I believe that all members' constituents have expressed their concerns about the drug shortage by email, telephone and even fax.
Some have family or loved ones who worry about possible delays in needed surgery. They are unhappy about the scope of the shortage. Understandably, people want to know how this happened. They want to know what is being done to fix the problem.
This evening the government will address all aspects of this complex and frustrating situation. We have just heard the Minister of Health lay out the broad strokes of action she is taking to help address the shortage. I would like to express my deep appreciation for her, for the work she has done to make drug makers like Sandoz and drug purchasers live up to their responsibility to do better and to prepare better for shortages.
I know that she and her officials have worked 24/7 to help solve the drug shortage issue since suddenly learning about it a few weeks ago. Before we can understand the proper role of the federal government on drug shortages, I think it is important to understand the basics of drug approval and supply in Canada.
The federal government's main role is to ensure that drugs purchased or sold in Canada are safe, effective and of high quality. Once Health Canada has approved a drug, the manufacturers and buyers are free to enter into commercial contracts for its supply. The terms of these contracts—cost, quantity, rate of use, number of suppliers required, distribution and penalties for failure to supply—are all agreed to by the buyers and the suppliers. 
Provincial and territorial health authorities have set up bulk buying groups to buy drugs for patients. This model has worked for provinces and territories because it has maximized their purchasing power and price leverage over suppliers. It has worked for suppliers because it means they do not have to negotiate separate deals with each government, health authority or hospital.
The federal government has no involvement in or knowledge about the nature of these arrangements. Indeed, one would wonder how the provinces and territories would react if the federal government tried to dictate to them any terms of these private, commercial arrangements.
The most important consideration in any shortage situation is the needs of the patients. Doctors and pharmacists need enough advance notice of a shortage so that treatment plans for patients can be smoothly adjusted if needed. When production and distribution of medically necessary drugs is interrupted, a drug maker is the first to know that a shortage is about to happen. This means it will not be able to fulfill the terms of its supply contracts. The drug maker is responsible for advising its health care customers in advance what drugs are affected and how long they may be in shortage.
Drug makers must also identify alternative supplies that can make up the shortfall to customers. This may be found within their own operations or from other suppliers that make similar drugs in Canada or in other countries. The drug maker must also come up with a plan to solve the problem that caused the shortage in the first place. When supplies are interrupted, hospitals, clinics and health professionals must implement strategies to ensure the most efficient use of existing supplies and to minimize the impact on patients. They keep patients advised of the supply situation in each facility and community and adjust treatment schedules and procedures if required. If a shortage is significant and long in duration, alternative supplies may be sought from drug makers within Canada or in other countries.
Once we understand the basic facts of how drug purchasing and supply works, then the proper role of the federal government in any shortage situation is clear and logical. When there is a shortage, Health Canada, consistent with its mandate and authority, works closely with purchasers and suppliers to ensure any new supplies of needed drugs are safe, effective and of high quality. Health Canada has a variety of tools available to help do this. It works closely with companies so they can quickly resolve manufacturing, quality and distribution issues. It works with manufacturers to ensure alternative suppliers, changes in manufacturing processes or locations can be reviewed and market authorized on a priority basis. It ensures all necessary licensing requirements are met. It works with international counterparts, such as the U.S. Food and Drug Administration, to identify additional sources of supply and to share needed safety and quality information. It provides priority access to alternatives on an emergency basis.
Health Canada will use the right tool for the situation at hand. The time required for each will depend on the specific request, but Canadians can be assured that Health Canada responds on a priority basis.
Health Canada is expediting authorization processes during the ongoing Sandoz shortage, but safety will never be compromised. The last thing anyone wants is for patients to be harmed by unsafe drugs authorized in a rush to fill supply gaps. A team of departmental experts has been assigned to deal with shortage requests. They are providing fast, real-time guidance to purchasers so they have a clear understanding of the safety information needed when a new source of supply is found. Through the various networks supported by the health portfolio, Health Canada is bringing together purchasers and companies to exchange the latest supply information and to foster pan-Canadian coordination of the shortage response. Through co-operative relationships with other trusted regulators, such as the U.S. Food and Drug Administration and the European Medicines Agency, Health Canada has ready access to the wealth of information that will help expedite approval of foreign sources.
One of my colleagues will be addressing the recent and growing global nature and impact of drug shortages a little later on. Despite the ample evidence of this phenomenon, we have not seen a parallel increase in the systematic sharing of shortage information or advance contingency planning on the part of drug purchasers or suppliers. Purchasers express surprise and frustration at shortages that have appeared to have come up out of the blue. Rather than seeking multiple sources of product as a cushion against supply interruptions, we have seen a greater reliance by them on fewer suppliers. Sandoz, for instance, has been allowed to become the sole or dominant supplier of many critical medications. Producers do not appear to have done any real work to identify alternative sources in advance, even though they are fully aware of the global supply constraints.
I cannot say why this state of affairs has been allowed to develop, but the bottom line is that in a shortage situation there is no substitute for information. The right information needs to get in the right hands at the right time. This means doctors, pharmacists and patients getting enough advance notice from manufacturers so that treatment plans can be smoothly adjusted if needed and if possible. That is why the Minister of Health has been encouraging companies to fill information gaps around actual and potential drug shortages and make it a top priority.
Health Canada's collaborative work with industry has paid off. It has resulted in a commitment by Canada's research-based pharmaceutical companies and the Canadian Generic Pharmaceutical Association, of which Sandoz Canada is a member, to collect information from member companies on current and impending drug shortages. They have committed to communicating this information to Canadians on two existing public websites on drug shortages.
Industry, together with health professional associations, have also committed to the development of a national one stop drug shortage monitoring and reporting system in 2012. The minister commends companies that have stepped up to provide more information.
However, she is disappointed, and with good cause, that Sandoz Canada has not met this commitment in the current situation.
The government is disappointed with the lack of clear and timely information that Sandoz has provided to Canadians about this serious shortage. The company knew months ago that it was coming, but it did nothing to find other supplies until very recently and it only advised customers and Health Canada about the extent of the impending shortage a few weeks ago. I am cautiously optimistic that Sandoz has heard our concerns about information sharing and making information available as soon as possible to provinces, territories and medical professionals. 
While Health Canada officials were speaking with Sandoz about possible disruptions in light of the FDA warning letter, requests for specific details about which drugs would be affected were not responded to. Today the company has said that it is responding to the Minister of Health's concerns about transparency, committing to share information about potential future drug shortages 90 days in advance.
I want to encourage Sandoz by saying that if the company were to take this step, it would go a long way to rebuilding trust that patients need for the company to be successful in the long run.",Conservative,Oshawa,Colin Carrie,http://www.parl.gc.ca/parlinfo/Files/Parliamentarian.aspx?Item=9fb311fc-3875-4698-b13c-014f0d819393&Language=E&Section=ALL
4514861,ca.proc.d.2012-03-12.2987.379,2012-03-12,aa391262-e2bb-43aa-a00e-454730c269ef,8603,"Ms. Isabelle Morin (Notre-Dame-de-Grâce—Lachine, NDP)",,Government Orders,Emergency Debate,Drug Shortages,"Mr. Speaker, the parliamentary secretary spoke a great deal about the role of the federal government in all this, and he also bragged about what Health Canada is doing.
Health Canada currently has a voluntary reporting system. What we are asking for is that the system be mandatory in order to have drug producers tell us in advance if they are going to have a problem with certain drugs so that we can plan for it. It is not true to say that the federal government does not have a role to play in this.
I would like the member opposite to explain why he says that this is not the federal government's role. I do not know where he gets that idea, but imposing a mandatory system falls under our federal jurisdiction. I would like to hear what he has to say about that.",New Democratic Party,Notre-Dame-de-Grâce--Lachine,Isabelle Morin,http://www.parl.gc.ca/parlinfo/Files/Parliamentarian.aspx?Item=aa391262-e2bb-43aa-a00e-454730c269ef&Language=E&Section=ALL
4514862,ca.proc.d.2012-03-12.2987.380,2012-03-12,9fb311fc-3875-4698-b13c-014f0d819393,55,Mr. Colin Carrie,Interjection,Government Orders,Emergency Debate,Drug Shortages,"Mr. Speaker, the member's question is being asked by a lot of people. What she does not understand is it is the provinces and the territories that sign the contracts with the companies and the suppliers. Any of the details within those contracts are details between the provinces and the suppliers. As I said in my speech, even if we brought this forward, I doubt the provinces would want to give us that information. Frankly, the provinces, within their jurisdiction, could make these regulations.
I would encourage her to look at the jurisdictional issues and encourage her province, if it wants to take this step forward, to go ahead. I think it could do that. ",Conservative,Oshawa,Colin Carrie,http://www.parl.gc.ca/parlinfo/Files/Parliamentarian.aspx?Item=9fb311fc-3875-4698-b13c-014f0d819393&Language=E&Section=ALL
4514863,ca.proc.d.2012-03-12.2987.381,2012-03-12,9e8dc941-5170-448f-8b08-591892bb1d05,109,"Hon. Hedy Fry (Vancouver Centre, Lib.)",,Government Orders,Emergency Debate,Drug Shortages,"Mr. Speaker, I listened carefully to the hon. member make statements about what he saw as the federal role and what the federal jurisdiction was about. The member says that it is obviously the provinces that are at fault for sole sourcing. He said that Sandoz was at fault for not telling everybody on time.
The hon. member has pointed out why a voluntary system does not work, if the government does not get the warning on time. However, the hon. member also took responsibility as a federal government for the manufacturing, the quality control, the contamination, and all that occurs in the manufacturing plant.
I keep asking this question and I would really like to hear an answer. Given that the Food and Drug Administration in the United States pointed out the problem in 2009 and given that the Minister of Health passed the inspection of Sandoz just prior to the second letter from the FDA in 2011, why does the government continue to say that it did not know? If it did know, and it knew the provinces were sole sourcing, then why did it not warn the provinces back in November 2011?",Liberal,Vancouver Centre,Hedy Fry,http://www.parl.gc.ca/parlinfo/Files/Parliamentarian.aspx?Item=9e8dc941-5170-448f-8b08-591892bb1d05&Language=E&Section=ALL
4514864,ca.proc.d.2012-03-12.2987.382,2012-03-12,9fb311fc-3875-4698-b13c-014f0d819393,55,Mr. Colin Carrie,Interjection,Government Orders,Emergency Debate,Drug Shortages,"Mr. Speaker, if members listened to the question, it was quite convoluted. It went every which way. I am not sure if it takes me up to Nunavut and back again.
I would like to answer the question the member brought forward and, if she was paying attention, the minister did answer that in her speech.
The drug that was found in Sandoz manufacturing was manufactured for the American market. It was not a drug that was being sold on the Canadian market. Health Canada went into the plants and determined that the drugs made for the Canadian market were fine and it did not find any problems with them. 
The member is getting this mixed up between the American and Canadian markets. Some of the comments seem to be mixed up with the Canadian and American systems. 
We are very proud of the Canadian health care system and we are committed to working with the provinces and territories because it is within their jurisdiction. We want to help them come up with a good solution for Canadians.",Conservative,Oshawa,Colin Carrie,http://www.parl.gc.ca/parlinfo/Files/Parliamentarian.aspx?Item=9fb311fc-3875-4698-b13c-014f0d819393&Language=E&Section=ALL
4514865,ca.proc.d.2012-03-12.2987.383,2012-03-12,eaa6694f-1e20-4aae-ad3b-e694b0e12c59,9187,"Ms. Elizabeth May (Saanich—Gulf Islands, GP)",,Government Orders,Emergency Debate,Drug Shortages,"Mr. Speaker, I hope members will bear with me. I want to ask a question that goes above and beyond the current moment of crisis.
We seem to have a persistent problem of accessing painkilling drugs globally and we recognize that. However, there has been an idea that has been floated for a number of years with the Senlis Council relating to Afghanistan. The hon. member may know where I am going with this question now. 
There has been some very viable and impressive proposals to use poppies for medicine. In Afghanistan, there is an ongoing problem of development, poverty and conflict. A solution that makes sense to us in the Green Party is a system to develop painkillers from the poppy crops of Afghanistan. This industry would be legal and end the heroine trade, which is illegal and dangerous. It would provide painkilling opiates and the shura councils would be the local coordinators of this in Afghanistan.
I would add that this has been done in Turkey and it worked. It shut down the illegal opium trade by creating a safe, secure supply of painkilling drugs to the world, while also providing some sustainability to those farmers and that—",Green,Saanich--Gulf Islands,Elizabeth May,http://www.parl.gc.ca/parlinfo/Files/Parliamentarian.aspx?Item=eaa6694f-1e20-4aae-ad3b-e694b0e12c59&Language=E&Section=ALL
4514866,ca.proc.d.2012-03-12.2987.384,2012-03-12,6519cfba-0080-419d-baa9-8ae6e56d032f,256,The Speaker,,Government Orders,Emergency Debate,Drug Shortages,I have to stop the member there. The parliamentary secretary has about 30 seconds to respond.,Conservative,Regina--Qu'Appelle,Andrew Scheer,http://www.parl.gc.ca/parlinfo/Files/Parliamentarian.aspx?Item=6519cfba-0080-419d-baa9-8ae6e56d032f&Language=E&Section=ALL
4514867,ca.proc.d.2012-03-12.2987.385,2012-03-12,9fb311fc-3875-4698-b13c-014f0d819393,55,Mr. Colin Carrie,Interjection,Government Orders,Emergency Debate,Drug Shortages,"Mr. Speaker, I did see the newsreels today with this proposition brought forward. Unfortunately, at this stage of the game I have not had a chance to really look at what the report had to say, so I cannot make an educated comment on her question. I will try to look into it further and see if we can have a conversation later.",Conservative,Oshawa,Colin Carrie,http://www.parl.gc.ca/parlinfo/Files/Parliamentarian.aspx?Item=9fb311fc-3875-4698-b13c-014f0d819393&Language=E&Section=ALL
