basepk,hid,speechdate,pid,opid,speakeroldname,speakerposition,maintopic,subtopic,subsubtopic,speechtext,speakerparty,speakerriding,speakername,speakerurl
4514560,ca.proc.d.2012-03-12.2987.78,2012-03-12,0d8486f0-be42-41d4-ac82-c51a7f9c0fa9,72,"Hon. Irwin Cotler (Mount Royal, Lib.)",,Statements by Members,Town of Mount Royal,,"Mr. Speaker, I am honoured to rise today to commemorate the centenary of the Town of Mount Royal.
First conceived as a model city initiative of the Canadian Northern Railway, it is now home to a diverse and dynamic community, rich in history, culture, tradition and sports.
Indeed, this model city was designated a Canadian national historic site in 2008 because it is a “remarkable synthesis of urban renewal movements of the early 20th century.” 
Today, the Town of Mount Royal is a veritable green oasis, with 20,000 trees for 20,000 residents and an exceptional quality of life. A series of celebratory events is planned through the hard work and dedication of the Centennial Celebration Society.
 On this memorable occasion, I would like to commend the mayor, Philippe Roy, the municipal counsellors, volunteers and residents of Mount Royal.
Here is to the next 100 years.",Liberal,Mount Royal,Irwin Cotler,http://www.parl.gc.ca/parlinfo/Files/Parliamentarian.aspx?Item=0d8486f0-be42-41d4-ac82-c51a7f9c0fa9&Language=E&Section=ALL
4514561,ca.proc.d.2012-03-12.2987.79,2012-03-12,fe517b95-bc62-4fe8-96aa-998994aefd48,173,"Mr. Tom Lukiwski (Regina—Lumsden—Lake Centre, CPC)",,Statements by Members,41st General Election,,"Mr. Speaker, last week the Liberal interim leader denied the Liberals have the ability to conduct centralized calling. That is a shocking statement, because the Liberals have been using their U.S.-source Liberalist for exactly that purpose, including during the last election. We know that the opposition spent millions of dollars on hundreds of thousands of phone calls during the last election. 
We have also heard the shocking revelations that voters in Guelph were targeted by deceptive robocalls from the member for Guelph's campaign. Interestingly enough, Liberalist.ca shows that the Liberals were training their campaign workers to use robocalls on the afternoon of April 30, just hours before a Liberal campaign worker sent illegal, anonymous messages to voters using an assumed name, from a bogus phone number.
Why is the Liberal leader trying to cover up the existence of Liberalist? What kind of dirty tricks are the Liberals teaching their volunteers?",Conservative,Regina--Lumsden--Lake Centre,Tom Lukiwski,http://www.parl.gc.ca/parlinfo/Files/Parliamentarian.aspx?Item=fe517b95-bc62-4fe8-96aa-998994aefd48&Language=E&Section=ALL
4514562,ca.proc.d.2012-03-12.2987.80,2012-03-12,6da8653f-692f-4bbc-acb2-86e088f0d60d,8571,"Mr. Pierre Nantel (Longueuil—Pierre-Boucher, NDP)",,Statements by Members,41st General Election,,"Mr. Speaker, the Conservatives are so rude. The rogue Conservative who organized the fraudulent calls in Guelph hid behind a rather pathetic alias: Pierre Poutine from Separatist Street. Using that particular street name demonstrates just how much contempt and prejudice the Conservatives feel towards Quebeckers.
The Conservative fraudster needed a false Quebec identity and that was the best he could come up with. How disrespectful. This name, Pierre Poutine, perfectly illustrates all the scorn this government feels towards Quebec. It is unfortunate that Conservative members from Quebec are content to just read their little note cards word for word, because it would have been a good opportunity for them to stand up for us. Quebeckers already know that this government does not share their values. Now, with this Pierre Poutine business, they also know that it is playing tricks behind their backs and laughing at Quebec.",New Democratic Party,Longueuil--Pierre-Boucher,Pierre Nantel,http://www.parl.gc.ca/parlinfo/Files/Parliamentarian.aspx?Item=6da8653f-692f-4bbc-acb2-86e088f0d60d&Language=E&Section=ALL
4514563,ca.proc.d.2012-03-12.2987.81,2012-03-12,d34b2845-a4e3-457b-b0eb-e95ac232d51d,8337,"Mr. Scott Armstrong (Cumberland—Colchester—Musquodoboit Valley, CPC)",,Statements by Members,41st General Election,,"Mr. Speaker, on April 30, 2011, the Liberal Party's national campaign held a secret training session for Liberal campaign workers to teach them how to use robocalls. Hours later, the phones in Guelph were ringing off the hook with a Liberal dirty trick. Someone was calling residents with an anonymous and misleading message from a fictional character named Laurie MacDonald. These were fake Liberal calls from a fake phone number from a fake Liberal volunteer using a fake name.
The member for Guelph has admitted that he paid for these illegal and unethical phone calls to fight the NDP surge. If these calls were simply an “oversight”, why did he wait until he was about to get caught to come forward? It just does not add up.
We know the opposition spent millions of dollars on hundreds of thousands of phone calls during the last election. How many other Canadian households did it target with this illegal campaign?",Conservative,Cumberland--Colchester--Musquodoboit Valley,Scott Armstrong,http://www.parl.gc.ca/parlinfo/Files/Parliamentarian.aspx?Item=d34b2845-a4e3-457b-b0eb-e95ac232d51d&Language=E&Section=ALL
4514564,ca.proc.d.2012-03-12.2987.82,2012-03-12,000a129f-5449-40ed-94d2-7e21a262b0b1,8528,"Mrs. Nycole Turmel (Leader of the Opposition, NDP)",,Oral Questions,41st General Election,,"Mr. Speaker, today we learned that a Conservative will finally be blamed for the fraudulent calls in Guelph. Yet last week the Minister of National Defence said that the guilty party had been found. I have to say that this whole affair is very strange. 
Can the government tell us who the new scapegoat is in this Conservative scandal?",New Democratic Party,Hull--Aylmer,Nycole Turmel,http://www.parl.gc.ca/parlinfo/Files/Parliamentarian.aspx?Item=000a129f-5449-40ed-94d2-7e21a262b0b1&Language=E&Section=ALL
4514565,ca.proc.d.2012-03-12.2987.83,2012-03-12,ad4032f2-6bb1-497b-b146-f321cfb71ba9,233,"Mr. Pierre Poilievre (Parliamentary Secretary to the Minister of Transport, Infrastructure and Communities and for the Federal Economic Development Agency for Southern Ontario, CPC)",,Oral Questions,41st General Election,,"Mr. Speaker, we have learned a lot today. According to CRTC rules, part IV, section 4(d), “...telecommunications shall begin with a clear message identifying the person on whose behalf the telecommunication is made. This identification message shall include a mailing address and a local or toll-free telecommunications number...”.
The Liberal member for Guelph admitted to using fake names and numbers for his robocalls. He broke the law. He should stand up in the House, apologize and answer questions about his actions.",Conservative,Nepean--Carleton,Pierre Poilievre,http://www.parl.gc.ca/parlinfo/Files/Parliamentarian.aspx?Item=ad4032f2-6bb1-497b-b146-f321cfb71ba9&Language=E&Section=ALL
4514566,ca.proc.d.2012-03-12.2987.84,2012-03-12,000a129f-5449-40ed-94d2-7e21a262b0b1,8528,"Mrs. Nycole Turmel (Leader of the Opposition, NDP)",,Oral Questions,41st General Election,,"Mr. Speaker, the Conservatives' arrogance is truly astounding. They will not take responsibility for anything. 
Canadians want the Prime Minister to take this fraud seriously. People want to know who is behind this, which Conservative strategists are involved. 
If the Prime Minister has nothing to hide, then he should order a public inquiry. Let us clean up politics. Let us clean house. That is what people want.",New Democratic Party,Hull--Aylmer,Nycole Turmel,http://www.parl.gc.ca/parlinfo/Files/Parliamentarian.aspx?Item=000a129f-5449-40ed-94d2-7e21a262b0b1&Language=E&Section=ALL
4514567,ca.proc.d.2012-03-12.2987.85,2012-03-12,ad4032f2-6bb1-497b-b146-f321cfb71ba9,233,"Mr. Pierre Poilievre (Parliamentary Secretary to the Minister of Transport, Infrastructure and Communities and for the Federal Economic Development Agency for Southern Ontario, CPC)",,Oral Questions,41st General Election,,"Mr. Speaker, we support Elections Canada's efforts to find out what really happened in the riding of Guelph. What we do know is that the Liberal member for Guelph has admitted to making illegal calls and breaking the law.
Now we want to know what the Liberal leader and the Liberal Party knew about it. Those calls were dirty, illegal and Liberal.",Conservative,Nepean--Carleton,Pierre Poilievre,http://www.parl.gc.ca/parlinfo/Files/Parliamentarian.aspx?Item=ad4032f2-6bb1-497b-b146-f321cfb71ba9&Language=E&Section=ALL
4514568,ca.proc.d.2012-03-12.2987.86,2012-03-12,000a129f-5449-40ed-94d2-7e21a262b0b1,8528,"Mrs. Nycole Turmel (Leader of the Opposition, NDP)",,Oral Questions,41st General Election,,"Mr. Speaker, the President of the Treasury Board said that he wanted to change the culture of Ottawa. Changing the culture, like replacing Liberal scandals with Conservative scandals, a culture where people can rig elections, a culture where the Prime Minister does not answer questions, a culture with no accountability and no transparency, and a culture of denial and partisan attacks. 
If the Prime Minister wanted to change the culture, he must take responsibility. Will he?",New Democratic Party,Hull--Aylmer,Nycole Turmel,http://www.parl.gc.ca/parlinfo/Files/Parliamentarian.aspx?Item=000a129f-5449-40ed-94d2-7e21a262b0b1&Language=E&Section=ALL
4514569,ca.proc.d.2012-03-12.2987.87,2012-03-12,9889ef6e-9676-447b-86cd-647cb8efddb5,420,"Mr. Dean Del Mastro (Parliamentary Secretary to the Prime Minister and to the Minister of Intergovernmental Affairs, CPC)",,Oral Questions,41st General Election,,"Mr. Speaker, last week, the Liberal leader indicated that suggestions being brought forward by myself and this party were, indeed, wacko. Unfortunately, they have proven to be absolutely true because we now know that the member for Guelph paid for illegal robocalls that concealed the fact that the calls came from his Liberal campaign. The Liberals used a bogus number and a fictitious character. They broke the CRTC regulations. They broke Elections Canada laws. They have acted in a fashion that is disgraceful, deceptive and dishonest.",Conservative,Peterborough,Dean Del Mastro,http://www.parl.gc.ca/parlinfo/Files/Parliamentarian.aspx?Item=9889ef6e-9676-447b-86cd-647cb8efddb5&Language=E&Section=ALL
4514570,ca.proc.d.2012-03-12.2987.88,2012-03-12,50a18bf1-9be3-4563-b657-6af367453ba0,11,"Mr. Charlie Angus (Timmins—James Bay, NDP)",,Oral Questions,41st General Election,,"Mr. Speaker, Canadians want answers to the ever-widening pattern of voter suppression that happened under the Conservatives. Now we understand today that a Conservative will be coming forward to admit responsibility for his or her role in the voter fraud in Guelph. That is a good start, but who paid for those calls? Who provided the scripts and why are they the same scripts that are being used in other ridings? Is there something else the government would like to tell us about its role in this before it comes to a public inquiry?",New Democratic Party,Timmins--James Bay,Charlie Angus,http://www.parl.gc.ca/parlinfo/Files/Parliamentarian.aspx?Item=50a18bf1-9be3-4563-b657-6af367453ba0&Language=E&Section=ALL
4514571,ca.proc.d.2012-03-12.2987.89,2012-03-12,9889ef6e-9676-447b-86cd-647cb8efddb5,420,"Mr. Dean Del Mastro (Parliamentary Secretary to the Prime Minister and to the Minister of Intergovernmental Affairs, CPC)",,Oral Questions,41st General Election,,"Mr. Speaker, Elections Canada is the agency that is charged to deal with this.
However, what we have learned, and this is what the Liberal leader must respond to, is that the Liberal leader provided training sessions for Liberal members at one o'clock on Saturday, April 30. They trained them on Liberal robocalls. What the Liberal member for Guelph then did is conduct a phony robocall that broke the CRTC's regulations and broke the Elections Canada Act laws. Indeed, the Liberals have acted in a fashion that is disgraceful, deceptive and dishonest, and I will say it outside.",Conservative,Peterborough,Dean Del Mastro,http://www.parl.gc.ca/parlinfo/Files/Parliamentarian.aspx?Item=9889ef6e-9676-447b-86cd-647cb8efddb5&Language=E&Section=ALL
4514572,ca.proc.d.2012-03-12.2987.90,2012-03-12,50a18bf1-9be3-4563-b657-6af367453ba0,11,"Mr. Charlie Angus (Timmins—James Bay, NDP)",,Oral Questions,41st General Election,,"Mr. Speaker, the issue here is not the incompetence of the Liberals with their campaign. It is about voter fraud that happened under the Conservatives.
Now we have a Conservative who is coming forth and the government pretends that he acted alone. Who paid for those scripts? Who gave him the money to make those calls? Why did he have access to the national Conservative database? Do the Conservatives really think that Canadians will believe that the guy who named himself after cheese curds and gravy is behind this as though he is some kind of robofraud equivalent of Dr. Evil? When will the Conservatives come clean with their involvement in this coordinated campaign of voter harassment?",New Democratic Party,Timmins--James Bay,Charlie Angus,http://www.parl.gc.ca/parlinfo/Files/Parliamentarian.aspx?Item=50a18bf1-9be3-4563-b657-6af367453ba0&Language=E&Section=ALL
4514573,ca.proc.d.2012-03-12.2987.91,2012-03-12,9889ef6e-9676-447b-86cd-647cb8efddb5,420,"Mr. Dean Del Mastro (Parliamentary Secretary to the Prime Minister and to the Minister of Intergovernmental Affairs, CPC)",,Oral Questions,41st General Election,,"Mr. Speaker, once again, it is the unsubstantiated smear campaign of the NDP.
What we know and what we have evidence of is that at five o'clock on Saturday, April 30, in the riding of Guelph, the Liberal member for Guelph placed an illegal robocall. These deceptive robocalls used a phony number, a phony person and they attacked and suppressed votes in Guelph. That was the real intent behind them.
The Liberal candidate and the Liberal Party has acted in a fashion that is deceptive, disgraceful and dishonest.",Conservative,Peterborough,Dean Del Mastro,http://www.parl.gc.ca/parlinfo/Files/Parliamentarian.aspx?Item=9889ef6e-9676-447b-86cd-647cb8efddb5&Language=E&Section=ALL
4514574,ca.proc.d.2012-03-12.2987.92,2012-03-12,98af71e6-be2b-40e8-9501-4e5c27ebbbf5,551,"Hon. Bob Rae (Toronto Centre, Lib.)",,Oral Questions,41st General Election,,"Mr. Speaker, if the hon. member is so certain about his phony allegations, perhaps he would agree with me that the time has now come for a royal commission into what happened in the last election and what happened in previous elections to ensure that it never happens again.
I can assure the hon. member that nobody on this side has anything to fear from a royal commission. We ask for it, we demand it and the people of Canada require it. Is it willing to do it?",Liberal,Toronto Centre,Bob Rae,http://www.parl.gc.ca/parlinfo/Files/Parliamentarian.aspx?Item=98af71e6-be2b-40e8-9501-4e5c27ebbbf5&Language=E&Section=ALL
4514575,ca.proc.d.2012-03-12.2987.93,2012-03-12,,,,intervention,Oral Questions,41st General Election,," Oh, oh!",,,Some hon. members,
4514576,ca.proc.d.2012-03-12.2987.94,2012-03-12,6519cfba-0080-419d-baa9-8ae6e56d032f,256,The Speaker,,Oral Questions,41st General Election,,"Order, please. The hon. Parliamentary Secretary to the Prime Minister.",Conservative,Regina--Qu'Appelle,Andrew Scheer,http://www.parl.gc.ca/parlinfo/Files/Parliamentarian.aspx?Item=6519cfba-0080-419d-baa9-8ae6e56d032f&Language=E&Section=ALL
4514577,ca.proc.d.2012-03-12.2987.95,2012-03-12,9889ef6e-9676-447b-86cd-647cb8efddb5,420,"Mr. Dean Del Mastro (Parliamentary Secretary to the Prime Minister and to the Minister of Intergovernmental Affairs, CPC)",,Oral Questions,41st General Election,,"Or, Mr. Speaker, we could just go to liberalist.ca and we could observe on page 105 where it advises the Liberals that they should pick a caller ID for the robocall, that it must be a land line and should be a phone number that recipients can call to contact their team about the robocall.
However, that is not what the member for Guelph did. In fact, the member for Guelph used a completely bogus phone number with an exchange that does not exist.
The Liberal Party has acted in a disgraceful, deceptive and dishonest fashion. We know it made hundreds of thousands of these calls because the Liberal Party paid millions of dollars for these calls to be made right across the country.",Conservative,Peterborough,Dean Del Mastro,http://www.parl.gc.ca/parlinfo/Files/Parliamentarian.aspx?Item=9889ef6e-9676-447b-86cd-647cb8efddb5&Language=E&Section=ALL
4514578,ca.proc.d.2012-03-12.2987.96,2012-03-12,6bf8e46d-35db-462e-a769-ead3dc2d7f84,578,"Mr. Frank Valeriote (Guelph, Lib.)",,Oral Questions,41st General Election,,"Mr. Speaker, Elections Canada is fully aware of that voice drop. This was an issue-based call that could have easily been tracked back to our service provider. It was totally different from the fraudulent calls that came from Pierre Poutine on election day. It was included in my financial return and I disclosed it to Elections Canada. I have been fully open and co-operative with Elections Canada.
On the other hand, the deputy campaign manager in Guelph is running and hiding from Elections Canada. When will the Conservatives finally start co-operating with the election fraud investigation?",Liberal,Guelph,Frank Valeriote,http://www.parl.gc.ca/parlinfo/Files/Parliamentarian.aspx?Item=6bf8e46d-35db-462e-a769-ead3dc2d7f84&Language=E&Section=ALL
4514579,ca.proc.d.2012-03-12.2987.97,2012-03-12,9889ef6e-9676-447b-86cd-647cb8efddb5,420,"Mr. Dean Del Mastro (Parliamentary Secretary to the Prime Minister and to the Minister of Intergovernmental Affairs, CPC)",,Oral Questions,41st General Election,,"Mr. Speaker, it is not uncommon, when confronted by substantiated evidence, where folks will in fact confess when they have broken the law. That is what the member has done. He has confessed to the fact that he has broken the Elections Canada Act and broken CRTC regulations.
For the last number of weeks, that member has conducted an unsubstantiated smear campaign against this party and this Prime Minister but not once did he breathe a word to this House that he had conducted those illegal calls.",Conservative,Peterborough,Dean Del Mastro,http://www.parl.gc.ca/parlinfo/Files/Parliamentarian.aspx?Item=9889ef6e-9676-447b-86cd-647cb8efddb5&Language=E&Section=ALL
4514580,ca.proc.d.2012-03-12.2987.98,2012-03-12,98af71e6-be2b-40e8-9501-4e5c27ebbbf5,551,"Hon. Bob Rae (Toronto Centre, Lib.)",,Oral Questions,41st General Election,,"Mr. Speaker, we believe, as I am sure the New Democrats do too, that Canadians want a public inquiry, a royal commission. That is what we want. That is what we demand.
Is the government willing to create a royal commission? Clearly, Canadians want a public inquiry, a royal commission to get to the bottom of all of this.",Liberal,Toronto Centre,Bob Rae,http://www.parl.gc.ca/parlinfo/Files/Parliamentarian.aspx?Item=98af71e6-be2b-40e8-9501-4e5c27ebbbf5&Language=E&Section=ALL
4514581,ca.proc.d.2012-03-12.2987.99,2012-03-12,ad4032f2-6bb1-497b-b146-f321cfb71ba9,233,"Mr. Pierre Poilievre (Parliamentary Secretary to the Minister of Transport, Infrastructure and Communities and for the Federal Economic Development Agency for Southern Ontario, CPC)",,Oral Questions,41st General Election,,"Mr. Speaker, let us consider for a moment the hon. leader of the Liberal Party's audacity. Over the past few weeks, members of the Liberal Party have been rising in the House to conduct a smear campaign against our party, knowing full well that the Liberal Party and its members made illegal calls to voters in the riding of Guelph.
The leader of the Liberal Party should rise and apologize to all Canadians for his party's unlawful behaviour.",Conservative,Nepean--Carleton,Pierre Poilievre,http://www.parl.gc.ca/parlinfo/Files/Parliamentarian.aspx?Item=ad4032f2-6bb1-497b-b146-f321cfb71ba9&Language=E&Section=ALL
4514582,ca.proc.d.2012-03-12.2987.100,2012-03-12,3c3ee442-a873-4845-84d0-7da07a66ce61,939,"Mr. Alexandre Boulerice (Rosemont—La Petite-Patrie, NDP)",,Oral Questions,41st General Election,,"Mr. Speaker, in 2006, the Conservatives were caught red-handed conducting an in and out scheme. They recently decided not to appeal because they are guilty of violating the Canada Elections Act. And yet, during the last election campaign, we once again saw mystery cheques for $15,000 being given to RMG in a number of ridings across the country. Some candidates admitted that they paid $15,000 and did not receive any services in return. 
This is the 10th anniversary of the Liberal sponsorship scandal, and clearly nothing has changed in Ottawa. 
When will the Conservatives change the legislation to give Elections Canada more power?",New Democratic Party,Rosemont--La Petite-Patrie,Alexandre Boulerice,http://www.parl.gc.ca/parlinfo/Files/Parliamentarian.aspx?Item=3c3ee442-a873-4845-84d0-7da07a66ce61&Language=E&Section=ALL
4514583,ca.proc.d.2012-03-12.2987.101,2012-03-12,ad4032f2-6bb1-497b-b146-f321cfb71ba9,233,"Mr. Pierre Poilievre (Parliamentary Secretary to the Minister of Transport, Infrastructure and Communities and for the Federal Economic Development Agency for Southern Ontario, CPC)",,Oral Questions,41st General Election,,"Mr. Speaker, the hon. member is right in saying that the Liberal Party has not changed since the sponsorship scandal.
The problem is not a loophole in the legislation. The legislation is here. I have it in my hands. The problem is that the Liberal Party refuses to obey the law. The Liberal Party is breaking the law.
I am therefore calling upon the Liberal Party to rise and explain why it hid the fact that it broke the law during the election.",Conservative,Nepean--Carleton,Pierre Poilievre,http://www.parl.gc.ca/parlinfo/Files/Parliamentarian.aspx?Item=ad4032f2-6bb1-497b-b146-f321cfb71ba9&Language=E&Section=ALL
4514584,ca.proc.d.2012-03-12.2987.102,2012-03-12,3c3ee442-a873-4845-84d0-7da07a66ce61,939,"Mr. Alexandre Boulerice (Rosemont—La Petite-Patrie, NDP)",,Oral Questions,41st General Election,,"Mr. Speaker, in reality, we simply traded Liberal scandals for Conservative ones. It is the same old same old.
Let us talk about the facts and the connections that the Conservatives do not want to hear about. First, we know that a plan was put in place to interfere with the voting process. Second, we know that the person or persons responsible are connected to the Conservative Party. Third, we know that Elections Canada's investigation extends much further than the riding of Guelph.
If the Conservatives are not afraid of getting to the bottom of this matter, will they change the legislation to give Elections Canada more power and will they hold a public inquiry?",New Democratic Party,Rosemont--La Petite-Patrie,Alexandre Boulerice,http://www.parl.gc.ca/parlinfo/Files/Parliamentarian.aspx?Item=3c3ee442-a873-4845-84d0-7da07a66ce61&Language=E&Section=ALL
4514585,ca.proc.d.2012-03-12.2987.103,2012-03-12,ad4032f2-6bb1-497b-b146-f321cfb71ba9,233,"Mr. Pierre Poilievre (Parliamentary Secretary to the Minister of Transport, Infrastructure and Communities and for the Federal Economic Development Agency for Southern Ontario, CPC)",,Oral Questions,41st General Election,,"Mr. Speaker, the opposition told us that our allegations were completely ridiculous when we said that the Liberals had paid millions of dollars to make hundreds of thousands of calls and that some of the calls that may have resulted in complaints were made by the Liberal Party.
However, we now know that the hon. member for Guelph, a Liberal, broke the law. He has since admitted to doing so. So what we have been saying from the beginning is completely true. The Liberals should rise in the House and explain their unlawful behaviour.",Conservative,Nepean--Carleton,Pierre Poilievre,http://www.parl.gc.ca/parlinfo/Files/Parliamentarian.aspx?Item=ad4032f2-6bb1-497b-b146-f321cfb71ba9&Language=E&Section=ALL
4514586,ca.proc.d.2012-03-12.2987.104,2012-03-12,8826a32c-2e29-49be-b6e2-c1f10363639b,440,"Ms. Irene Mathyssen (London—Fanshawe, NDP)",,Oral Questions,41st General Election,,"Mr. Speaker, Canadians know there were dirty tricks on the last campaign and they want an inquiry. What are the Conservatives hiding? 
Elections Canada is now asking for the age of those who received the fraudulent calls and evidence suggests that an overwhelming number of those targeted were seniors. We are talking about seniors who are vulnerable to being misled and who were first identified as not supporting the Conservatives.
 How can the Conservatives be so underhanded that they would attempt to trick seniors out of their right to vote? Why did they target seniors?",New Democratic Party,London--Fanshawe,Irene Mathyssen,http://www.parl.gc.ca/parlinfo/Files/Parliamentarian.aspx?Item=8826a32c-2e29-49be-b6e2-c1f10363639b&Language=E&Section=ALL
