basepk,hid,speechdate,pid,opid,speakeroldname,speakerposition,maintopic,subtopic,subsubtopic,speechtext,speakerparty,speakerriding,speakername,speakerurl
4514482,ca.proc.d.2012-03-12.2987.0,2012-03-12,,,,stagedirection,Private Members' Business,Breast Density Awareness Act,,"The House proceeded to the consideration of Bill C-314, An Act respecting the awareness of screening among women with dense breast tissue, as reported (without amendment) from the committee.",,,,
4514483,ca.proc.d.2012-03-12.2987.1,2012-03-12,6519cfba-0080-419d-baa9-8ae6e56d032f,256,The Speaker,,Private Members' Business,Breast Density Awareness Act,Speaker's Ruling," There is one motion in amendment standing on the notice paper for the report stage of Bill C-314, standing in the name of the hon. member for Vancouver Centre. At first glance, it appears that this motion could have been presented in committee.
However, in submitting her motion for consideration at report stage, the member for Vancouver Centre provided the Chair with a written explanation in which she outlined her efforts to propose a similar amendment during the clause-by-clause study of the bill, and where she explained that her amendment was based on the testimony of witnesses who had appeared earlier in the meeting. As the committee desired to proceed with the clause-by-clause study of the bill immediately after hearing from the bill's sponsor and other witnesses, she did not have time to avail herself of the drafting services of the parliamentary counsel assigned to the bill.
Upon presentation of her amendment, the member was cautioned by the chair of the committee that there was some concern over certain legal terminology her amendment contained that might have had the undesired effect of infringing on the financial initiative of the Crown. In this case, there was not sufficient time for the chair of the committee to carry out the necessary consultations and provide a definitive ruling on admissibility. As a potential remedy to this unusual situation, the chair of the committee suggested to the member that she might wish to submit her amendment at the report stage instead.
Having received the committee's consent to withdraw the amendment, the member for Vancouver Centre explained that she was able to consult with parliamentary counsel and the legislative clerk assigned to the bill. She was thus able to prepare a motion for the report stage which she feels, and I agree, does not appear to infringe on the financial initiative of the Crown. Therefore, due to the exceptional circumstances outlined above, the Chair has selected for debate the motion submitted by the member for Vancouver Centre.
I shall now propose Motion No. 1 to the House.",Conservative,Regina--Qu'Appelle,Andrew Scheer,http://www.parl.gc.ca/parlinfo/Files/Parliamentarian.aspx?Item=6519cfba-0080-419d-baa9-8ae6e56d032f&Language=E&Section=ALL
4514484,ca.proc.d.2012-03-12.2987.2,2012-03-12,9e8dc941-5170-448f-8b08-591892bb1d05,109,"Hon. Hedy Fry (Vancouver Centre, Lib.)",,Private Members' Business,Breast Density Awareness Act,Motions in amendment," moved:
 Motion No. 1 
 That Bill C-314, in Clause 2, be amended by adding after line 20 on page 3 the following: 
 “(d) ensuring, through the Canadian Breast Cancer Screening Initiative, the collection, processing and distribution of information on best practices for the screening and detection of cancer in persons with dense breast tissue.” 
Mr. Speaker, this is a very simple amendment. It says that there is already a Canadian breast cancer screening initiative. This vehicle, without any extra cost or work whatsoever, can conduct the collection, processing and distribution of information on best practices for the screening and detection of cancer in persons with dense breast tissue. 
This is necessary because we listened to many witnesses who said that there are some places where this is being done well in Canada. There are other places that are doing some fairly remarkable innovative work in collecting this information. Witnesses felt it would be quick, easy and very valuable if other provinces and areas could use some of those best practices. Those provinces and areas would not have to reinvent the wheel because in many practices currently there is excellent work being done. It has been done for long enough now that there is evaluation that says this works very well.
There have been suggestions from the Canadian Cancer Society and cancer associations that in places like British Columbia the outcomes from breast cancer screening, treatment and surgery are by far the best in the country, by a really large percentage. We need to look at some of the areas which are doing good work, borrow it and use it without having to spend a lot of time reinventing the wheel, as I said before. This would be very beneficial. 
This is an excellent amendment that would really enhance the bill to a great extent.",Liberal,Vancouver Centre,Hedy Fry,http://www.parl.gc.ca/parlinfo/Files/Parliamentarian.aspx?Item=9e8dc941-5170-448f-8b08-591892bb1d05&Language=E&Section=ALL
4514485,ca.proc.d.2012-03-12.2987.3,2012-03-12,5ed59d21-f57e-4cbe-88f8-3f230eef1058,410,"Mr. Patrick Brown (Barrie, CPC)",,Private Members' Business,Breast Density Awareness Act,Motions in amendment,"Mr. Speaker, Bill C-314, An Act respecting the awareness of screening among women with dense breast tissue, is a piece of legislation that I have drafted because I truly want to make a difference. I want to ensure more women are aware of the impact of dense breast tissue on the analysis of a mammogram.
The bill would encourage the use of existing initiatives to increase awareness among women about the implication of dense breast tissue for breast cancer screening, and to assist women and their health care providers in making well-informed decisions regarding screening. It would recognize the work done by the provinces and territories and by many organizations in working towards these important goals. It outlines partnerships that our government has developed to enhance understanding of and to disseminate information about dense breast tissue during screening. I want to thank members from all parties for their support of this bill. I know full well that we are all anxious to ensure the bill passes as quickly as possible.
I would like to thank the hon. member for Vancouver Centre for her support and interest in this bill. She has expressed a desire to ensure best practices are disseminated. She has pointed out that Bill C-314 refers to sharing, through the Canadian breast cancer screening initiative, information related to the identification of dense breast tissue during screening and any follow-up procedures.
Indeed, the Canadian breast cancer screening initiative already helps us look at the best ways to raise awareness of dense breast tissue. The initiative also helps provide screening performance information and support evidence-based decisions.
 Launched in the early 1990s, the initiative fully respects the role that provincial and territorial programs play in the early detection of breast cancer in Canadian women and the importance of sharing information and exemplary practices. In fact, it enables provinces and territories to continually share information on their screening programs, and discuss what they are learning.
To ensure strong collaboration and to work in a collective fashion to assess breast cancer screening programs, the government established the federal, provincial and territorial national committee for the Canadian breast cancer screening initiative. The committee is instrumental in providing us with the opportunity to work with provincial and territorial governments to measure screening program performance throughout the country and to develop better screening approaches.
This committee also includes non-governmental organizations, medical professionals and stakeholders. This allows for more opportunities for dissemination of practices, as well as for sharing different views. The initiative is aimed at evaluating and improving the quality of organized breast cancer screening programs. By facilitating information sharing about breast cancer screening across Canada through governments, practitioners and stakeholders, it can achieve this goal.
The bill clearly outlines the need for the Government of Canada to “encourage the use of existing programs and other initiatives that are currently supported by” the entities that have a role in breast cancer screening, be it prevention, detection, treatment, monitoring, research or the provision of information. Collaboration amongst these entities is instrumental. 
Members will note that there is a great deal of good work under way through the Canadian breast cancer screening initiative. Jurisdictions are working together, sharing best practices and discussing questions that are important to them.
The amendment brought forward by the hon. member is consistent with the goals and approach of the initiative. The national committee has well-established partnerships to undertake identification and distribution of information on best practices. The committee can direct analysis on breast cancer screening, including best practices for dense breast tissue.
The dissemination of information and facilitation of use of best practices in screening in assessment are key objectives of the initiative. Provinces and territories can use this information for their respective breast cancer screening programs. The proposed amendment speaks to the need for collecting and processing information on best practices for breast cancer screening, and more specifically dense breast tissue. This is a fundamental part of the initiative. It is already enabling us, along with our provincial and territorial colleagues, to look at the best ways to raise awareness of dense breast tissue.
The Public Health Agency of Canada, through the Canadian breast cancer screening database, collects, synthesizes and distributes information on the breast density of women who are screened. It provides this information to provincial and territorial breast screening programs to support the development of best practices.
The concerns with the amendment are with regard to the word “ensuring” used in the proposed amendment. The work of the Canadian breast cancer screening initiative is not controlled by the Public Health Agency of Canada, and as such should not be ensuring the collection, processing and distribution of information or ensuring the identifying, synthesizing and distributing of information.
Therefore, while l appreciate the intention of the hon. member for Vancouver Centre, I do not see the need for this amendment. As we all want to get the bill through, I ask my fellow colleagues to continue to show support for the passage of the bill. Greater awareness and information about dense breast tissue will enable us to make a difference. It would help women and their doctors make well-informed decisions regarding breast cancer screening. 
Again, I want to thank the member for Vancouver Centre for bringing this issue up. I hope all my fellow colleagues can continue to support the bill.",Conservative,Barrie,Patrick Brown,http://www.parl.gc.ca/parlinfo/Files/Parliamentarian.aspx?Item=5ed59d21-f57e-4cbe-88f8-3f230eef1058&Language=E&Section=ALL
4514486,ca.proc.d.2012-03-12.2987.4,2012-03-12,8b25c8e3-9469-45c8-9995-ecdf3f119c0c,8461,"Ms. Rosane Doré Lefebvre (Alfred-Pellan, NDP)",,Private Members' Business,Breast Density Awareness Act,Motions in amendment,"Mr. Speaker, I am very pleased to rise in the House today to debate Bill C-314, An Act respecting the awareness of screening among women with dense breast tissue. As a young woman, I am aware that I am at risk of developing breast cancer. In fact, we all are, because breast cancer can affect anyone, both men and women, young and old.
According to the statistics, 23,400 Canadian women and 190 Canadian men were diagnosed with breast cancer in 2011. Age is an important factor. It is a fact that older women are at greater risk. In 2011, an estimated 80% of cases were diagnosed in women over the age of 50. Young women are also at risk. It is estimated that 3,500 new cases, or 14%, were reported in women between the ages of 30 and 49 years, and 965 cases, or 4% of cases diagnosed, were women 40 and under.
According to the Canadian Cancer Society, breast cancer starts in the cells of the breast. The breast tissue covers an area larger than just the breast. It extends up to the collarbone and from the armpit across to the breastbone in the centre of the chest. Each breast is made of mammary glands, milk ducts and fatty tissue. The breasts also contain lymph vessels and lymph nodes, which are part of the lymphatic system. The lymphatic system helps fight infections. Lymph vessels move lymph fluid to the lymph nodes. Lymph nodes trap bacteria, cancer cells and other harmful substances. There are groups of lymph nodes near the breast under the arm, near the collarbone and in the chest behind the breastbone. Cancer cells may start within the ducts or in the lobules. Ductal carcinoma is the most common type of breast cancer.
As a woman, I know the importance of mammography, which is a low-dose x-ray of the breast. Mammography pictures, or mammograms, show detailed images and views of the breast from different angles. The breast is placed between two plastic plates. The plates are then pressed together to flatten the breast. Compressing the breast tissue helps make the images clearer. Better quality mammography and increased participation in organized breast screening programs have led to more breast cancers being detected earlier, which means successful treatment is more likely. Unfortunately, this test does not always detect cancer, especially among women with dense breast tissue. In such cases, doctors may opt for scintimammography or an MRI. A biopsy is the only way to make a definitive diagnosis of cancer.
Breast density is a radiological concept, but it has a major impact on the accuracy of mammogram interpretation. Dense breast tissue is a concern for all radiologists, as well as epidemiologists and gynecologists. A dense breast appears white on a mammogram because it contains little fat. 
Breast tissue is quite variable. Changes in breast tissue are hormone driven and occur throughout an individual's lifetime. For example, young women typically have denser breasts than older women because breast tissue becomes less dense as women age. However, even though older women's breasts tend to contain more fat, women of any age can have dense breast tissue. 
Bill C-314 requires the Government of Canada to encourage the use of existing initiatives to increase awareness among women about the implications of heterogeneous or dense breast tissue for breast cancer screening, and to assist women and health care providers in making well-informed decisions regarding screening.
Although the purpose of this bill is to improve breast cancer screening for women with dense breast tissue, we believe that it should go further still. Why not institute accountability measures to shorten waiting lists and ensure that women have access to timely screening?
Any bill designed to improve breast cancer screening should include federal funding for national breast cancer screening programs for all women, which should be systematic, free and available without a doctor's referral, beginning at age 40.
Health care workers and women who are concerned about breast cancer need more than just encouragement in order to raise awareness and promote best practices.
 The government should put in place standards. Under these standards, all provincial programs would start screening women for breast cancer from age 40. The standards should include the regular and optimal use of digital mammography machines such as MRIs and ultrasounds for screening purposes. Lastly, screening standards should focus on the particular challenges of screening for breast cancer among women with dense or heterogeneous breast tissue. 
The Quebec breast cancer screening program is a good example of a screening program with very good results. Screening using a mammogram targets women aged 50 to 69 and is carried out, systematically, every two years. According to data from Quebec's health and social services department, the breast cancer mortality rate for women who are systematically screened dropped by at least 25% between 1996 and 2006. 
 It is high time that the federal government showed leadership by adopting a funding plan and implementing a real national strategy to improve breast cancer screening in Canada. That also means honouring the commitments made as part of the 2003 and 2004 health accords, including the commitment to reduce waiting times and increase the number of doctors and nurses to ensure that women at risk have access to primary care or specialists as quickly as possible.
 Experts and organizations fighting breast cancer are asking for more and agree that this project does not go far enough.
 The Canadian Breast Cancer Network does not believe that this bill will improve screening procedures for those women most at risk of developing breast cancer. Breast cancer survivors direct the network. It is a national link between all the groups and individuals concerned about breast cancer, and its members, partners and founders include the Canadian Cancer Society, the Canadian Breast Cancer Foundation and the Breast Cancer Society of Canada.
 The Canadian Cancer Society supports a bill that would improve cancer screening measures, particularly for patients with dense breast tissue. However, the society believes that this bill will not produce concrete results for patients living with breast cancer and their families.
 Lastly, Quebec's association of hematologists and oncologists says that while it is important to increase breast cancer screening, we cannot forget about other kinds of cancers. Improvements need to be made in the prevention of and screening for all cancers. We must not concentrate all our efforts on one single category of women or type of cancer.
 I wonder when this government will start to take this issue really seriously? The Conservative government introduced a bill that will in no way improve the lives of Canadian women. The government must start thinking more seriously about this issue in order to prevent even more women from developing this destructive disease. ",New Democratic Party,Alfred-Pellan,Rosane Doré Lefebvre,http://www.parl.gc.ca/parlinfo/Files/Parliamentarian.aspx?Item=8b25c8e3-9469-45c8-9995-ecdf3f119c0c&Language=E&Section=ALL
