basepk,hid,speechdate,pid,opid,speakeroldname,speakerposition,maintopic,subtopic,subsubtopic,speechtext,speakerparty,speakerriding,speakername,speakerurl
3909053,ca.proc.d.1992-05-14.2.1.1.12,1992-05-14,2181bb23-f976-4835-86a1-ad5324f54b8e,ca.m.3377,Mr. Stan Keyes (Hamilton West):,,GOVERNMENT ORDERS,CORRECTIONS AND CONDITIONAL RELEASE ACT,MEASURE TO ENACT,"I am pleased to rise in this, the highest court of the land, specifically on the third reading of Bill C-36 as put forward by the Solicitor General.
When announcing this legislation, the Solicitor General boasted that it was the most comprehensive parole reform we have seen in years. He also noted that through this legislation: ""Protection of society is the primary objective of this act. The bill reflects the government's determination to restore public confidence in the corrections system"".
These are noble words, but does the bill really take a strong stand in favour of protecting society? Does it tighten up day parole and temporary absences so that it meets the minister's own test: the protection of society and the restoration of public confidence in the system?

May 14, 1992
Government Orders
Or, as we have heard time and time again from this notion of sentencing in only an indirect way. This is what side of the House, is it merely window-dressing?	Canadians have been asking for some time now.
My constituents, many people from southern Ontario and across this land know too well the tragedies that have befallen too many area residents in the recent past. Their names are painfully familiar: Klaudusz, Mahaffy, de Villiers, Anderson, Edwards, French.
The provisions of Bill C-36 cover parole and temporary absences of all inmates. What Canadians are really concerned about are dangerous offenders being released from prison on day passes, escorted or unescorted temporary absence. There is ample evidence of persons who, while at large from a penitentiary, have committed various violent acts that could have been avoided by detaining inmates until the expiration of their sentences.
As I have stated before, not all inmates are in prison for violent crimes, nor will many be repeat offenders. However, this bill, Bill C-36, does not afford society the protection it deserves.
On June 29, 1987 a penitentiary inmate by the name of Daniel Gingras escaped an escorted temporary absence while visiting the West Edmonton Mall for the occasion of his birthday. What an ideal place to wander off and make good an escape. Daniel Gingras was later apprehended by the police but only after murdering two people, for which he was later convicted of first degree murder on both counts.
Members of this House may also remember Allan Legere, who terrorized the Miramichi region of New Brunswick after having escaped while on escorted temporary absence in Moncton, New Brunswick. Legere was eventually convicted of murder as a result of his attacks after having escaped.
There are other individuals who, while not murderers, have nonetheless been convicted of serious offences such as sexual assault, which society today is demanding it be protected from. Bill C-36 does not offer any consolation, nor does it protect society as the minister suggests.
Half of the question of the protection of society cannot even be addressed at this point because of the absence of corresponding sentencing legislation. By moving certain time periods for mandatory release and temporary absences upwards, the minister is trying to toy with the
They do not want dangerous offenders let loose on the streets on day passes. They do not want temporary absences and day parole made so readily available.
At the time the minister introduced this bill, he said the Minister of Justice would be bringing in some changes to sentencing. So far this House can only rely on the half-hearted measures contained in this bill.
The bill attempts to draw a line through first time non-violent offenders and repeat dangerous offenders. More clearly, the bill tries to distinguish offences such as break and enter, robbery, violent sexual assaults and murder. For the so-called first time offender, the bill creates a revolving door through which these classes of inmates will go.
My colleague from Scarborough, the critic for the Solicitor General Official Opposition described it best when he noted that first time non-violent offenders will be mandatorily paroled after serving one-third of their sentence even if the National Parole Board believes they will commit further non-violent offences. Thlk about a rubber stamp.
This measure of mandatory release for first time non-violent offenders is one of the major parts of this bill. I ask this House, does this measure promote public safety as the minister has repeatedly stated? They are non-violent offences, after all. We are talking about house break-ins, for example.
Let us turn our attention to this for a moment because more than one constituent in my riding of Hamilton West has put the following scenario to me. What happens when a thief is alone in the house and unexpectedly the homeowner returns after an evening out? What ensues? What could happen in the heat of the moment when the thief with the TV set or the stereo system under his or her arm encounters the homeowners? Would he drop it, politely say excuse me and walk out the door? Maybe a fight will occur and then the incident does become violent.
Obviously the minister is running the risk of an incident like this happening again because of releasing the inmate after only one-third of his or her sentence, thereby increasing the odds of a violent offence.
May 14, 1992

I want to congratulate my colleague from Scarborough West on one of his amendments relating to escorted temporary absences. In the bill, an inmate may seek an escorted temporary absence for medical, humanitarian and personal developmental reasons. My colleague rightly felt that personal development was too ambiguous a reason and moved an amendment which classified this last reason as personal development for rehabilitative reasons.
As my colleague also noted, there is an absence of legislation dealing with the rehabilitation of inmates. We are not helping those inmates who are within the prison walls. Much of the rehabilitation for inmates is done by sociologists and psychiatrists and other professionals.
There is another area in which the public wants action. It wants serious programs for inmates that will prepare those inmates for reintegration back into society after serving time in jail. That is an example of constructive results from programs on which you spend money.
In the past, parole devices such as escorted temporary absences and day parole were used to bring inmates back into society on a gradual basis. I can see there is some merit in that but I cannot ignore the danger signals.
I want to read into the record the information I have from the Canadian Centre for Justice Statistics, 1990. In that year there were 234,836 reported cases of violent offences in Canada. These offences ranged from aggravated sexual assault to assault with a weapon, to discharging a firearm with intent of harm. Approximately
100.000	persons were charged.
In 1990 there were 1,000 reported cases of abduction in Canada. Roughly 100 persons were charged. There were
28.000	cases of robbery, with about 14,000 of those incidents involving firearms.
What I am saying, and this is my own belief, is that for violent crimes, inmates should have no access to day parole or escorted temporary absences and certainly never, under any circumstances, unescorted temporary absences.
I have introduced a private members' bill, Bill C-330, which is coming up for second reading debate in this highest court of the land very shortly. For violent offences, my bill would totally prohibit day parole or escorted and unescorted temporary absences for inmates unless for rehabilitative, medical or humanitarian reasons.
The one important caveat would be that for these
Government Orders
reasons I just mentioned, permission would have to be sought from the Governor in Council, the federal cabinet. If dangerous offenders such as murderers desire a temporary, escorted absence, they would have to make that appeal to the ministers across the floor. They would decide whether to give permission.
This would be accountable responsibility and would remove that decision-making process from the National Parole Board and the corrections commissioner. Canadians are telling me in my constituency of Hamilton West-and I am sure in constituencies across this land that they demand accountability. Another aspect of that-bill which will shortly come to the floor of the House is that for first degree, premeditated murderers, life in prison would mean just that: life. There would be no chance for parole.
The bill before us today, Bill C-36, does not address any of that. It still allows for a judicial review after 15 years and eligibility for parole after 25 years. It is called the ""faint hope"" clause. It would be faint hope for the premeditated first degree murderer.
People say to err is human and after time in jail the person would be allowed the faint hope of returning to the outside world. My constituents are telling me that for the victims of that murder, the victims of that first degree premeditated, violent act and for their families, there is no faint hope.
Bill C-36 does not deal with that. I am reminded of the parable of the prodigal son. It is the story of the lost son who returns and is spumed by his brother because of the lavish feast set for his return. After bitterly disappointing his family for many years, the son who had been there for his dad demanded an answer. His father tells him that there will be more joy in heaven upon the redemption of one sinner than upon the 99 who need no redemption.
For those convicted criminals who have not committed what I see as the most serious crime of murder, these individuals must always be given the opportunity to redeem themselves and reintegrate themselves into society. There is no question of that. But for those who have committed first degree premeditated murder the redemption for them, I believe, is not to be found within society but within themselves.

May 14, 1992
Government Orders
This bill before us today will certainly not get support from this side of the House. There is the lack of funding for those programs that are truly essential to deal with the root cause, the problems in our society today, in order to prevent the creation of more people to feed into a criminal justice system.
I am sure everyone would take great delight in closing down a federal prison or a jail in any community because there were not enough people to put in it. Would it not be a marvellous day one day to be able to do that?
When you think about it for a moment, the only way we are going to be able to do that is if life or property or the values of your neighbour are respected so that of course that crime is not allowed to happen in the first place.
Where do we start? We start with our youth. We direct our love and our compassion and our concern and our aid and do everything we possibly can to ensure that that young individual does not have to turn to a life of crime.
Sometimes it is not because they have turned to the life of crime, for whatever reason. It is because they have grown up in an environment that has caused them to turn to a life of crime. Has this government ever come forward with the fiscal policies or monetary policies or the programs for the children who are in need of help today in order that we can prevent filing them in a line and sending them off through a judicial system because they, through virtually no fault of their own, have had to turn to that life of crime?
Is it because we do not help those who are unable to find a job, because we have cut back on programs and services and the opportunities for those people who want a job, who want to be able to feed their families, whose children sit at home and must end up after school, sometimes not even in school, at the comer shopping mall? Is it because their parents did not have the money to provide or give them the opportunity to participate in the extra-curricular activities?
This government has presented for me personally, for my constituents in Hamilton West, for this side of the House, example after example after example over the last three and a half years, closing in on four years, of neglect of our communities.
I have always said that I have tried to bring Hamilton to Ottawa. Unfortunately what I have seen this government do is bring Ottawa to Hamilton. Be in your communities. Talk to your people. Get a feeling and understanding of what the root causes are of this problem. The government created Bill C-36 which is nothing more than weak-kneed rubber-stamping and toothless.
We have a future and our future is with our young people. Let us direct our resources at the programs that can ensure that we have youth who will one day hopefully grow up in a society that will not see all the problems which have caused the government to create a judicial system that is neglectful and that does not answer the questions that my constituents and other constituents want answers to today.

",Liberal,,Stan Kazmierczak Keyes,http://www.parl.gc.ca/parlinfo/Files/Parliamentarian.aspx?Item=2181bb23-f976-4835-86a1-ad5324f54b8e&Language=E&Section=ALL
3909054,ca.proc.d.1992-05-14.2.1.1.13,1992-05-14,573c0758-57bf-4bcb-8ccf-b10290b5e0c9,ca.m.7521,Mr. Jesse Flis (Parkdale-High Park):,,GOVERNMENT ORDERS,CORRECTIONS AND CONDITIONAL RELEASE ACT,MEASURE TO ENACT,"Madam Speaker, I congratulate the member for Hamilton West and the previous speaker because both of them underlined looking at the causes of crime, something that this government is not doing.
My riding is in the Toronto area and his riding is in the Hamilton area. The bill says that the purpose of the bill is to contribute to a just, peaceful and safe society. It then says ""assisting the rehabilitation of offenders and their re-integration into the community as law-abiding citizens through the provision of programs in penitentiaries and in the community"".
The member has studied this bill quite closely. What is meant in this bill by community? If an offender from his riding, for example, commits a crime and then is rehabilitated back, would it be back to his community? The problem I am getting in my constituency is that people are being integrated back into the community, but the poor people of Parkdale-High Park are integrating former offenders from all over Ontario and from all over Canada.
Is it fair for the Parkdale community to be doing a job that other communities are supposed to be doing? Does the member have the same problem in Hamilton? How does he see the definition of community?
May 14, 1992

",Liberal,,Jesse Philip Flis,http://www.parl.gc.ca/parlinfo/Files/Parliamentarian.aspx?Item=573c0758-57bf-4bcb-8ccf-b10290b5e0c9&Language=E&Section=ALL
3909055,ca.proc.d.1992-05-14.2.1.1.14,1992-05-14,2181bb23-f976-4835-86a1-ad5324f54b8e,ca.m.3377,Mr. Keyes:,,GOVERNMENT ORDERS,CORRECTIONS AND CONDITIONAL RELEASE ACT,MEASURE TO ENACT,"Madam Speaker, I thank my colleague, the member for Parkdale-High Park, for that question.
I suppose we can break it down by looking at the big picture. The big picture is that we seem to have a bill that is building and building and building. It gets larger and it is being adjusted and readjusted and worked on from a root or from its original conceptions, which I believe are very different today than they were years ago when we first started to put a law like this together. Maybe what we have to do is just set this bill aside, set this type of legislation or this direction aside for a moment. Let us start fresh. Let us clear our heads for a second.
This leads me into the second side of this issue. If there is a criminal who performs a criminal act, and we can break it down into the non-violent and violent, et cetera, and he performs that criminal act within the community of Parkdale-High Park or Hamilton West then the community deserves the payback from that individual who did the injustice in that community.
The member is absolutely right about where these criminals are being rehabilitated and where the day passes and parole and the rest of it is being carried out. We all know that it boils down to the almighty buck again with this government because it says that it is going to be more convenient. Go to a city and create a building where we can put all these individuals in order for them to try to rehabilitate themselves. What we are doing is we are taking these individuals, again lumping them all together with all their problems, where they are together in one building or one area, and then hopefully instructing them with books and what have you to rehabilitate themselves in order for eventual release back into the community, not into the community where the offence occurred, but in the community where the government has deemed that it will put all its resources together at one spot in order for that individual to be part of the lump of individuals that are eventually going to have to be released into the community.

",Liberal,,Stan Kazmierczak Keyes,http://www.parl.gc.ca/parlinfo/Files/Parliamentarian.aspx?Item=2181bb23-f976-4835-86a1-ad5324f54b8e&Language=E&Section=ALL
3909056,ca.proc.d.1992-05-14.2.1.1.15,1992-05-14,573c0758-57bf-4bcb-8ccf-b10290b5e0c9,ca.m.7521,Mr. Flis:,,GOVERNMENT ORDERS,CORRECTIONS AND CONDITIONAL RELEASE ACT,MEASURE TO ENACT,"An abandoned liquor store in my riding.

",Liberal,,Jesse Philip Flis,http://www.parl.gc.ca/parlinfo/Files/Parliamentarian.aspx?Item=573c0758-57bf-4bcb-8ccf-b10290b5e0c9&Language=E&Section=ALL
3909057,ca.proc.d.1992-05-14.2.1.1.16,1992-05-14,2181bb23-f976-4835-86a1-ad5324f54b8e,ca.m.3377,Mr. Keyes:,,GOVERNMENT ORDERS,CORRECTIONS AND CONDITIONAL RELEASE ACT,MEASURE TO ENACT,"An abandoned liquor store in Parkdale- High Park, the member says. That is just terrific. Where is the rehabilitation, a cot in an abandoned liquor store?
Government Orders
This bill does not put the emphasis on prevention and how to help an individual who is rehabilitatable, who has not committed the offence a second time but a first time, a non-violent offence, and went wrong somewhere along the way. Maybe we can help him or her adjust with the situation that created that individual to carry out that particular crime. Maybe they are very rehabilitatable, but let us rehabilitate them back into their communities where they are very familiar, where the crime took place. Maybe they broke a window at a grocery store and now part of that rehabilitation is to work in that grocery store and repay that grocer who had to pay for his window to be fixed.
Maybe that is the kind of rehabilitation we need but in concert of course with the programs that would be provided by psychiatrists and psychologists and all the other professional people who would help that individual.
Is that part of this bill? Is prevention part of this bill? Is money being directed or spent or part of this legislation being created in order to help those individuals who are currently in jail, who are in our society headed toward jail? No. That is what makes this bill a toothless, pathetic response to our communities.

",Liberal,,Stan Kazmierczak Keyes,http://www.parl.gc.ca/parlinfo/Files/Parliamentarian.aspx?Item=2181bb23-f976-4835-86a1-ad5324f54b8e&Language=E&Section=ALL
