basepk,hid,speechdate,pid,opid,speakeroldname,speakerposition,maintopic,subtopic,subsubtopic,speechtext,speakerparty,speakerriding,speakername,speakerurl
3909228,ca.proc.d.1992-05-14.4.1.1.20,1992-05-14,9c8ce4b0-87b5-4ab6-9645-c4e81555e158,ca.m.4080,Mr. MacWilliam:,,GOVERNMENT ORDERS,CANADA POST CORPORATION ACT,MEASURE TO AMEND,"Mr. Speaker, as I was saying, my riding is in the interior of the province of British Columbia. I represent the Okanagan-Shuswap area.
Like many of the rural areas throughout not only my province but throughout this country, there are a number of small communities where the central post office has become very much a way of life of that community, people meeting each morning to pick up their mail and to pick up parcels. They use the opportunity on a daily basis and utilize the post office as a kind of community meeting place.
In that respect, the post offices in our rural communities are very much a part of the heartbeat of those communities. That is why it has been so damaging to see the impact of the government's strategy to close those post offices and to privatize the services. It has done irreparable harm to the lifestyle in many of our communities.
May 14, 1992

There is a community in my riding where the post office was one of the largest rural post offices that had been closed to that date. I speak of the community of Enderby. The impact in that community would have been quite dramatic had not the community itself taken some fairly aggressive measures and successfully, I might add, convinced the powers that be at Canada Post to at least consider rather than fragmenting the service and piecemealing it off to various parts of the community to at least maintain a central facility. At least the people still have, although it is a privatized retail outlet, a facility not far from where the original post office was located that is maintaining that very vital service to the community.
I might add that not all communities in Canada have been as fortunate as Enderby to have been able to at least maintain that centralized service. There are many communities throughout Canada and other parts of the Okanagan that have been less fortunate. For example, in the community of Westwold, which is in the riding of Kamloops held by my friend and colleague from the Kamloops area, the post office was closed. It was virtually the only outlet available in the area. People fought it, there was virtual insurrection, there were mass protests and yet the government remained absolutely opposed to any thought of reorganizing that postal outlet. It closed it and the community lost a very vital service.
Not long ago to the south of me in the community of Penticton, again a community that is in the riding of one of my friends and colleagues, the member for Okanagan-Similkameen-Merritt, that post office was also closed, again despite the very strong vocal protests from the many people in that community about the loss of that service.
The service was broken up, it was fragmented and was divied up piecemeal to other retail outlets. As I say, that has a very dramatic impact in those smaller communities throughout Canada. In many cases it does tend to fragment the community. As I said before, the post office is very much part and parcel of community life. It is part of the heartbeat of that community. In closing those offices, the government has done much harm to the lifestyle of rural Canadians.
Government Orders
This particular bill, as I mentioned, continues that process. The bill is supposedly to allow 10 per cent of Canada Post non-voting shares to be made available for purchase by Canada Post employees. Supposedly, according to the minister, the bill is to help eliminate the labour-management tension that currently exists at Canada Post.
I submit that that is a specious argument. The argument does not hold true to the reality of the situation faced by the employees at Canada Post and that is why we oppose the bill.
I think the argument can be made and has been made time and time again that this government's long-term agenda and this initiative falls hand in hand with its strategy of full privatization of Canada Post.
The bill will do nothing to promote labour management peace. The argument used by the minister that it will eliminate the labour-management tensions is simply a smoke-screen. It will do nothing to eliminate the problems that have existed for years at Canada Post, tensions that have developed because of poor management practices and a very poor management relationship with respect to the employees of that organization.
Canada Post has proven in the past that it cannot be trusted to stop harassing the workers. It cannot be trusted to stick to its word. This bill, I submit, does nothing to resolve that critical shortcoming in terms of the past management practices of this particular Crown corporation.
The bill does nothing to maintain or improve the service in our rural and urban postal outlets. It does nothing to address the inadequacies of what the government has proceeded with in terms of the closure of hundreds and hundreds of rural post offices across this country. It is well-known that the long-term strategy of this government is to close down virtually every rural outlet in Canada, to take that service and piecemeal it off into the retail sector.
I submit part of that strategy is simply a way of getting around the difficulties that this management structure has found in giving a fair deal to the workers and the union involved. It is much easier just to go around it, privatize it, and then it does not have to deal with the realities of union-labour and union-management negotiations.

May 14, 1992
Government Orders
Privatization has been a policy tool used by this government many times in the past. We have seen the government on one hand say it would never privatize Air Canada and lo and behold what do we see happening, the privatization of Air Canada. Again it is just proof in point that the government cannot be held to its word.
I just want to read into the record a comment made by the minister responsible for Canada Post. This is an article in The Ottawa Citizen dated May 1,1992. Here the minister insisted that the immediate privatization is not in the cards. But on the other hand, and I quote: ""He refused to rule out future privatization except to say nothing will happen until after the next election"".
That is a caveat you could drive a Mack truck through. I would suggest it is very much part of the minister's over-all plans that should this survive the next election -and that alone as we know is highly dubious indeed -but God forbid should it survive the next election, we can see very clearly in the minister's comments that are quoted in this May article in the The Ottawa Citizen that his strategy is to privatize Canada Post, sell it off to the retail sector, and to remove this government from yet another area of responsibility to the Canadian people.
This again is the minister responsible for Canada Post speaking and let me quote: ""If I had to bet I would bet that in the next couple of decades you will see post offices being privatized all over the world and I would not mind seeing Canada first"".
There it is in black and white. The minister is saying he not only wants to privatize the postal service in Canada, but he wants Canada to be a world leader in the privatization of our postal outlets.
That is not to say there are not incidents where utilizing postal services through retail outlets are in fact in many cases beneficial for the public, but that does not justify throwing the baby out with the bath water. That does not justify closing virtually every postal outlet that we now know, the rural outlets and I would submit many of the urban outlets when the time comes.
That does not justify cutting the heart out of the quality of service that people across Canada have come to expect and essentially, to reiterate my argument, cutting the heart out of those rural communities that
have come to rely on the post office as far more than just a post office, but as part and parcel of their community lifestyle.
The minister insists that this bill is designed only to make Canada Post employees feel proud to be a part of Canada's postal service. The problems that this corporation has had with respect to labour relations are not going to be eliminated by that. Those problems are deeply rooted in a long history of bitter labour-management distrust, a distrust that has been fostered, I submit, by years of mismanagement.
The company has rarely negotiated with its workers in good faith. Any concessions that have been gained by the workers have come as a result of hostile and often bitter negotiations. There are a litany of problems that hardly make Canada Post employees proud of their employer and proud of the situation they are in.
There are over 100,000 outstanding grievances currently registered at Canada Post. It has been over six months since the back-to-work legislation was passed regarding the operations of Canada Post. What has this government done? Absolutely nothing. It has sat back, cooled its heels and allowed the status quo to prevail. There is still no agreement, although the workers went back, albeit against their wishes, with the abiding faith that this government would keep its commitment to realize an agreement that would be satisfactory to both the corporation and the workers.
Is there any agreement or any movement toward that agreement? I suggest that is not the case. It demonstrates the reason for the lack of trust among the employees of Canada Post and among the employees throughout the Public Service Alliance of Canada. It demonstrates again why this government cannot be trusted and in the future will not be trusted.
The union did what it was asked to do. The employees went back to work. Canada Post did not do what it had agreed to do, namely, to come up with a reasonable contract to ensure the workers protection.
If the government and Canada Post wish to create an atmosphere of goodwill, they are not going to do it through this piece of legislation. They are going to do it if they could simply realize it by honouring their commitments and providing these workers with a collective agreement.
May 14, 1992

The end of July 1992 is going to mark the third year that postal workers have been without a collective agreement. This has not been for a lack of trying. It has been for a lack of commitment on the government's part to honour agreements which should be honoured.
We are not going to change that kind of distrust that develops as a result of the actions of this government through a 10 per cent share offering. This piece of legislation is not going to do the job it is intended to do. It is a smoke-screen. It is only one step further along the government's agenda to privatize Canada Post and to sell off the assets.
It is because of this that my colleagues and I cannot support this legislation. It is because of this that we remain vitally concerned about the future of other postal operations, not only in my region, in the Okanagan-Shu-swap, but right across Canada in the many rural communities. There are many outlets still which have not been closed but which we know have been targeted.
I am concerned about the rural outlets in my community and in the north of my riding in the Okanagan- Shuswap, the community of Canoe. It is my understanding that particular postal outlet has been targeted as well as other outlets in my own constituency.
We cannot continue with this process. We cannot continue with throwing people out of work, with cutting the heart and life-blood away from the communities that these post offices have served. This is a vital issue. It is an issue on which people in the interior of British Columbia, in the interior of Alberta, in the interior of Saskatchewan, of Manitoba, of Ontario and right across this country have said to the government that what it is doing is wrong.
There may be some reason, some rationalization, for the offering of retail services. For gosh sakes, let us not tear apart the community structures that have become very much a part and parcel of our Canadian way of life. This government does not understand rural Canada. It does not understand small-town Canada. The reason for that is that the people who are setting the agenda for this government are the corporate elite of this country. It is Bay Street that speaks for the corporate agenda of this country.
Government Orders
It does not understand what it means in a small community in the interior of British Columbia, in the community of Enderby, in the community of Penticton, in the community of Westwold, in the community of Canoe. It does not understand what it means to take a post office away from the people and divvy up the outlet to a store or another retail facility. It changes the nature of that community. People have said that time and time again and I wish that the government could understand the dynamics that take place when it does that to our small communities.
We looked at the same thing with the loss of services in the RCMP. Thank goodness we had 19 members of this caucus from the province of British Columbia who stood up and were accounted for and supported their communities in getting those RCMP services back into the communities where they belonged. It was only because of the strong voice of those committed members from British Columbia that we were able to convince this government to undo the damage it was about to do.
I only wish that we could convince this government of the same thing with respect to post offices. For gosh sakes, do not go any further. You have gone too far already, do not close any more urban or rural outlets, particularly the outlets in our smaller communities because it is cutting the heart out of those communities. That is why we cannot support this legislation.

",New Democratic Party,,Lyle Dean MacWilliam,http://www.parl.gc.ca/parlinfo/Files/Parliamentarian.aspx?Item=9c8ce4b0-87b5-4ab6-9645-c4e81555e158&Language=E&Section=ALL
3909229,ca.proc.d.1992-05-14.4.1.1.21,1992-05-14,def2b43b-d310-4b13-8261-d02c9b9afbff,ca.m.6985,Mr. Pat Sobeski (Cambridge):,,GOVERNMENT ORDERS,CANADA POST CORPORATION ACT,MEASURE TO AMEND,"Mr. Speaker, I would like to make a comment and then follow it up with a question.
I guess what this legislation does seems to be common sense. Some 10 years ago Canada Post drained each year about $600 million from taxpayers to support it. Over those 10 years there has been a turn around in which Canada Post is now paying a dividend. Other than this year, in which we have had a disruptive strike, there has been a turn around and it is now paying a dividend.
What was part of the reason for this turn around? I would suggest to the hon. member that it probably has a lot to do with the employees, both managers and the workers for Canada Post. If I were working for a company or a corporation that had that great a turn around, I would like to share in some of the profits. It

May 14, 1992
Government Orders
seems to be logical that if I am working for a company that has turned it around, I could do that.
It is clear that the federal NDP is opposed to this. I have here the Speech from the Throne from the NDP government of the province of Ontario. On April 6, on page 10, the throne speech said worker ownership legislation will come forward for a final debate. In Ontario the NDP government is saying it is supporting worker ownership legislation.
In November of 1991 the same Ontario NDP government, in its controversial Ontario Labour Relations Act, had a positive part in there and the suggestion was that it wanted to encourage worker investment and ownership in Ontario companies in a manner which recognized the benefits of worker participation in both labour and business.
I am standing here a little confused. The federal NDP is saying no to worker participation in the ownership of companies, but the Ontario NDP is saying yes.
Could the member please explain to me, talking out of both sides of his mouth, which is it? Are you in favour or not in favour?

",Progressive Conservative,,Patrick (Pat) Anthony Sobeski,http://www.parl.gc.ca/parlinfo/Files/Parliamentarian.aspx?Item=def2b43b-d310-4b13-8261-d02c9b9afbff&Language=E&Section=ALL
3909230,ca.proc.d.1992-05-14.4.1.1.22,1992-05-14,9c8ce4b0-87b5-4ab6-9645-c4e81555e158,ca.m.4080,Mr. MacWilliam:,,GOVERNMENT ORDERS,CANADA POST CORPORATION ACT,MEASURE TO AMEND,"I thank the member for his question. It certainly does not surprise me that the member is confused. However, I hope that I can go to some degree to clarify his long-standing confusion on this and other issues.
First of all, we already own Canada Post. You are trying to sell back essentially something that the workers themselves already own as being Canadians and voting members in this society.
We tried to do that out in British Columbia years ago when Mr. Bennett decided he would teach British Columbians a great lesson in capitalism and sell them something that they already owned. He created a massive enterprise called the B.C. Resources Investment Corporation, BRIC. It has become known, subsequent to that, as B.C.'s really incompetent incorporation; $10 shares are now selling at 49 cents. If that was Mr. Bennett's lesson in capitalism, I would certainly be sceptical of the lesson in capitalism of which this government is about to try to convince the workers of Canada Post that it wants to entertain.
That privatization scheme by Mr. Bennett out in British Columbia was an unmitigated disaster and it lost
millions and millions of dollars for the people of British Columbia. I submit that this hare-brained scheme that this government has with respect to selling back shares of a corporation that the workers themselves already own is just as hare-brained as Mr. Bennett's was.
The minister has said that the share offering is to placate the workers to make them feel good about Canada Post. I say to my hon. friend, how can the workers feel confident, comfortable and good about their Canada Post when they see in British Columbia and Yukon 104 offices that have been closed, when they see in Alberta and the Northwest Territories 170 offices closed? In Saskatchewan 235 offices have been closed. All of these total across Canada some 1,598 closures and planned closures.
How can you feel confident about your future, about your job, about your family when you might be next?

",New Democratic Party,,Lyle Dean MacWilliam,http://www.parl.gc.ca/parlinfo/Files/Parliamentarian.aspx?Item=9c8ce4b0-87b5-4ab6-9645-c4e81555e158&Language=E&Section=ALL
3909231,ca.proc.d.1992-05-14.4.1.1.23,1992-05-14,fb17fd75-1fee-4407-b7e5-35c4ce3f2652,ca.m.4233,Mr. John Harvard (Winnipeg-St. James):,,GOVERNMENT ORDERS,CANADA POST CORPORATION ACT,MEASURE TO AMEND,"Mr. Speaker, I want to say that I was a resident of British Columbia when those infamous BRIC shares were distributed to the people of British Columbia. At the time of their distribution they had a value of $6. Now I am told by my good friend from Shuswap that they are worth 49 cents. Somehow I always knew that I would never make a nickel out of those rotten BRIC shares.

",Liberal,,John Harvard,http://www.parl.gc.ca/parlinfo/Files/Parliamentarian.aspx?Item=fb17fd75-1fee-4407-b7e5-35c4ce3f2652&Language=E&Section=ALL
3909232,ca.proc.d.1992-05-14.4.1.1.24,1992-05-14,intervention,,,,GOVERNMENT ORDERS,CANADA POST CORPORATION ACT,MEASURE TO AMEND,"Neither did I.

",,,An hon. member:,
3909233,ca.proc.d.1992-05-14.4.1.1.25,1992-05-14,fb17fd75-1fee-4407-b7e5-35c4ce3f2652,ca.m.4233,Mr. Harvard:,,GOVERNMENT ORDERS,CANADA POST CORPORATION ACT,MEASURE TO AMEND,"My hon. friend from British Columbia has just confirmed it.
I want to make one comment and then a question with respect to the current debate. There is no doubt in my mind that through this particular bill the government is trying to plant a a seed which it hopes will some day produce full-blown privatization of Canada Post.
I am opposed to it, my party is opposed to it and if it ever came to reality in this country it would be a disaster.
Let me make this one observation. There is a tremendous amount of commercial business intercourse between Toronto and the nation's capital. Because of that business activity, there is naturally a lot of postal activity. One can imagine that if Canada Post were privatized, chances are that the level of service between Toronto and Ottawa would be very good and chances are that the price, compared to today, to the consumer would be very competitive. In an area of intense commercial activity between Toronto and Ottawa, I would not be surprised
May 14, 1992

that a privatized corporation like Canada Post might even produce a better price. That is just part of the story.
For example, the business activity between The Pas, Manitoba and Winnipeg is not so intense. Do you think that if Canada Post were privatized it would provide the same level of service at the same price between The Pas and Winnipeg as it would between Toronto and Ottawa?
In other words, what I am aiming at is if you privatize Canada Post, you wind up with several tiers of service and if you happen to live in a choice spot in Canada, you might get good service at a good price. If you live in the outer regions, in the hinterland of Canada, you will get poorer service at a much higher cost.
Therefore, my question is very simple. Would the previous speaker from British Columbia concur with my observation?

",Liberal,,John Harvard,http://www.parl.gc.ca/parlinfo/Files/Parliamentarian.aspx?Item=fb17fd75-1fee-4407-b7e5-35c4ce3f2652&Language=E&Section=ALL
3909234,ca.proc.d.1992-05-14.4.1.1.26,1992-05-14,9c8ce4b0-87b5-4ab6-9645-c4e81555e158,ca.m.4080,Mr. MacWilliam:,,GOVERNMENT ORDERS,CANADA POST CORPORATION ACT,MEASURE TO AMEND,"Mr. Speaker, to be short, I most wholeheartedly do concur with the observation. The arguments my hon. friend has put forward are quite to the point.
The fact is that this entire bill, as I said before, is really a smoke-screen. This entire process of privatization is not in the long-term interests of either the workers of Canada Post or of the public they serve. There may be situations, as I said before, in which the rationalization of services is cost-efficient, but in the long run what will happen should this entity be privatized and taken apart and the entrails scattered to the private sector, is that we will have a deterioration in the quality of service and a substantially higher cost to the taxpayer.

",New Democratic Party,,Lyle Dean MacWilliam,http://www.parl.gc.ca/parlinfo/Files/Parliamentarian.aspx?Item=9c8ce4b0-87b5-4ab6-9645-c4e81555e158&Language=E&Section=ALL
3909235,ca.proc.d.1992-05-14.4.1.1.27,1992-05-14,cda5dfb3-0c2c-477d-b67d-b9f1141c5e0c,ca.m.6274,Mr. Jim KarpofT (Surrey North):,,GOVERNMENT ORDERS,CANADA POST CORPORATION ACT,MEASURE TO AMEND,"Mr. Speaker, my hon. friend has been focusing mainly on the rural post office. I want to have him comment on the impact on the larger cities.
I represent Surrey, which is the fastest growing metropolitan area in Canada. Since the 1988 election my riding has increased by 10,000 households. By the turn of the century there will be 800,000 people south of the Fraser River. It will be bigger than the city of Vancouver. What is the post office planning to do? It is planning to close
Government Orders
the sorting services in Surrey and take all the mail into Vancouver and bring it back.
The Surrey municipal council is opposed to it. The total regional district, the GDRD that represents all the municipalities on the lower mainland, is opposed to it because it goes against the liveable, regional plan in which it wants people to be able to work in the areas where they live. It does not want to have all the businesses shifted downtown.
Do you think this first step in privatization, of issuing shares to a few employees, only 10 per cent, will in any way change the management style of the postal corporation so that it would then listen to the concerns of the municipal council, the GDRD and its employees who are located in Surrey and who easily have transportation to work without having to go 35 or 40 kilometres into a major city which takes hours of travelling? Do you think this is in any way going to stop the management simply burying its head in the sand and against all advice, against all economics, and deciding to close such a major postal service as the Surrey sorting plant and take that mail into Vancouver?

",New Democratic Party,,James Capsey (Jim) Karpoff,http://www.parl.gc.ca/parlinfo/Files/Parliamentarian.aspx?Item=cda5dfb3-0c2c-477d-b67d-b9f1141c5e0c&Language=E&Section=ALL
