basepk,hid,speechdate,pid,opid,speakeroldname,speakerposition,maintopic,subtopic,subsubtopic,speechtext,speakerparty,speakerriding,speakername,speakerurl
3904495,ca.proc.d.1992-04-08.5.1.1.10,1992-04-08,615f281f-2c98-4b52-a94d-3604494de29d,ca.m.7064,Mr. George S. Rideout (Moncton):,,GOVERNMENT ORDERS,CRIMINAL CODE,MEASURE TO AMEND,"Mr. Speaker, I am pleased to be able to stand in the House to talk about this particular bill and to congratulate the minister on bringing forward this legislation. In fact when the Supreme Court struck down what was called the rape shield law in its decision, I was one who said that it was necessary to bring legislation forward. It was not a situation which could remain within the common law, even though the Supreme Court had set out certain criteria and standards which had to be met before previous history could be utilized in court. I felt it was important that this place make a statement in this particular area and come forward with the criteria.

April 8, 1992
Government Orders
I was pleased to see the legislation. Of course we have to wait until the committee has a chance to consider it, but it seems on its face to have the right balance, to utilize the charter as it applies here, but also to utilize some protection for the victim.
The method that is used, which is not unique, but one that is not used that often, is a preamble. I think that is going to send the right message to the courts and to the systems particularly. If I can just read one part of the preamble, I think it drives home poignantly the point. It states:
AND WHEREAS the Parliament of Canada believes that at trials of sexual offences, evidence of the complainant's sexual history is rarely relevant and that its admission should be subject to particular scrutiny, bearing in mind the inherently prejudicial character of such evidence;
I think that sets the tone for this legislation and what we are trying to accomplish in this place. There is no question that an accused does have rights under the charter and that those have to be protected. At the same time, we have to go far enough to ensure that we are not victimizing the victims in these circumstances.
The bill provides three main elements. It provides for strict guidelines in determining admissibility of past sexual history. It clearly outlines the procedures that are to be followed and it defines a notion of consent.
All who have spoken today have said that no means no. It seems that a lot of people were functioning under the mistaken belief that no means something other than no and now we have a clear statement in the legislation that no does mean no. We are all pleased to see that come forward.
These defences of intoxication and the argument that what was said was not really meant, all of those sorts of things are now going by the by. In my view and in my party's view this is progress. This is moving the state of affairs between men and women one step closer to what they should be. There is still a long way to go but this is a positive start in that particular area.
I do have some concerns, and I want to point them out. I guess being a new member of Parliament, and only here for my first term, it is surprising when you look at legislation and you say it really looks to be pretty good and then once you get to committee and hear the different points of view and the different arguments from all sides, you start to think that well maybe you were a little stupid and did not really understand what was taking place and really missed some of the obvious holes in legislation. I am looking forward to this bill
coming to committee so that we can see exactly what is going on.
I do want to point out that there are some areas in the legislation that do cause me concern. One in particular is with respect to section 276(3)(h). It states:
(h) any other factor that the judge, provincial court judge or justice
considers relevant.
This is dealing with the areas of the criteria that the court should consider when deciding whether to admit evidence of previous history or not. What this can do, which is my worry and we are going to have to analyse it very closely, is put a discretion in the court and that discretion could be applied unequally across the country. It can create a major problem as to what a judge in, say, Newfoundland considers acceptable as to admissions on previous history, compared to what a judge in Victoria, B.C. may say.
We have to look at this paragraph to ensure that there are the protections, so that there is equality before the law throughout all of Canada and that there is not too large a discretion as to the admission of this type of evidence. Then I go back to what the preamble says which clearly states that this type of evidence is unusual and really is not relevant in most cases. While the Supreme Court has said that in some cases it can be introduced, I agree with my colleague in the NDP in wondering why it should be introduced at all. We cannot get around what the Supreme Court has said and so we will have to deal with it.
We have to ensure as well that the evidence, to a degree, is private. I know there are two sides to that coin. We have all seen the publicized trials in the United States; the Senate hearings in the Thomas case and also in the Kennedy case in Florida. We can see how publicity damages everyone and so I wonder where we can strike the balance in that regard. We will have to hear evidence with respect to this and bring it forward from the committee after we have had a chance to really study it in very close detail.
There is something else that we have to look at. It is a terrible anomaly that previous history of sexual conduct is still going to be introduced after a hearing, but the evidence of previous convictions of a rapist is not. One wonders why that inconsistency is there, particularly when you hear of cases like the Takahashi case out west in which there was not evidence, but an indication that perhaps 100 or 125 rapes had occurred even though he was only charged and convicted on four instances. None of those other cases could be introduced at trial. The accused is being well protected in that regard, but I am
April 8, 1992

not sure whether the victims are receiving the same type of protection.
As I say, we have to be careful not to victimize the victim. I do not think that became any more clear to me than on the justice and solicitor general's committee. I was before the victims of the Takahashi rape situation and at that time, the witnesses were testifying that they have all kinds of problems. They have the problems of what happens right at the instance because the first people they deal with are the police and the first thing they do is rush them off to the hospital and put them through further indignities.
One of the witnesses even went further to testify that after she had been raped in her own home, months afterward the police just dropped a bag off with the evidence of the soiled sheets without any consideration for the victim.
All of these systems seem to be set up to victimize the victim and that is what we have to worry about. I think that we have to take that extra precaution to make sure that we do not do that.
It seems to me, and it does not really fall within the jurisdiction of the Criminal Code, but when a rape case has occurred, it is absolutely essential that with the police should go some victim's assistance so that the victim is accommodated right from the outset.
As well, we have to spend some time with our court system, with the judges, and make them more aware of exactly what is going on so that there is assistance to the victim all the way through the process because we have seen it time and time again that we are going to victimize the victim if we do not.
The introduction of previous sexual history is, in my view, a victimization of the victim because of what earthly relevance does it have to the incident that would be before the courts?
It will be interesting to hear the different witnesses who come before the committee and get their balanced view. I know the civil libertarians are very concerned about this type of legislation as are a number of members of the bar concerned that there is some prejudice to the accused. But I do not think it hurts at all to exclude that type of evidence and that is why I am pleased to see this bill before us.
Government Orders
These are difficult issues. What we are seeing here today is the House of Commons functioning together and trying to come up with a just piece of legislation. The next process is for people outside this place to have then-input into the decision. The results, I hope, will be good legislation for women and good legislation for Canadians.

",Liberal,,George Saunders Rideout,http://www.parl.gc.ca/parlinfo/Files/Parliamentarian.aspx?Item=615f281f-2c98-4b52-a94d-3604494de29d&Language=E&Section=ALL
3904496,ca.proc.d.1992-04-08.5.1.1.11,1992-04-08,37b14340-0543-4dd1-86cd-0f5dfbe99332,ca.m.3465,Mrs. Marlene Catterall (Ottawa West):,,GOVERNMENT ORDERS,CRIMINAL CODE,MEASURE TO AMEND,"Mr. Speaker, I am pleased to have the opportunity to speak on this bill.
It is a bill about power because rape is always about power. More importantly it is about all the reasons why our laws tend to emphasize the powerlessness of women in society generally, and traditionally and historically before the courts as well.
I want to talk about the feeling of powerlessness that is every woman's from the time she becomes conscious of herself. I think it is vital to understanding why this bill is so important to us and why it is so important to a society that does not want decisions made on who is strongest and who is most powerful.
I realize it is extremely difficult for most men to understand what this means to women, but most men have grown up from little boys knowing that they will be big, they will be strong and they will have important jobs.
Most girls have grown up from the time they were less than two knowing that they would always be smaller and always be weaker and never be as important and never quite count as much. Neither would they have money of their own. They would always clean up after everybody else and they would always be good little girls, because ii you did not, daddy might get cross. Mommy might even get cross if you were not good and daddy did not like it.
This is why as we grow into women, every day and every minute of our lives is regulated by the fact that we are women, that we are smaller and that we are weaker. Every one of us knows the way in which we plan every day, where we can go, at what time of the day, alone or with somebody.
I doubt there is a man in the House who approaches his car at night in a parking lot with the fear that a woman does every day. It is important for all of us who have to deal with this bill here in the House and in committee to understand that that is why this is so important to women. That is why we need to find measures to equalize our treatment before the courts.

April 8, 1992
Government Orders
This feeling of being powerless, of always having to be just a little bit afraid, is partly what leads to the kind of violence that we have become so much more aware of only very recently. It is what leads to the exploitation of women in a number of different ways around the world.
It is what leads to the exploitation and abuse of power over women as a universal phenomenon. It is why women tend not to report crimes against themselves as easily or as readily. They know that that immediately places them in a situation where again they are powerless, others are in control and they can be hurt more. The question comes up of whether a woman's past behaviour has anything to do with the rights of the accused in court. Let me put the question this way: If I have given money to friends in the past, does that give them the right to walk into my home and steal money from me? If somebody uses their superior force to say to me ""Give me $50"" and I give it out of fear, does that mean I gave it willingly? No, it does not. If I happen to be the victim of a robbery while wearing an expensive suit and $600 shoes and therefore advertising the fact that I was wealthy and open to being robbed, does that excuse the person who robs me? Of course not.
Only women, in the case of sexual violence against them, come up against these arguments and have to, as the victim in a crime, defend against what they did to cause it, how they gave some man an excuse to violate them. It is that simple. That is what we are trying to deal with in this bill.
The accused is very carefully protected from having his history used in court to in any way suggest whether he is or is not likely to have committed this crime. Why does a woman, the innocent victim of a crime potentially, have to be subject to evidence that she may or may not have or is likely to have or is not likely to have caused this person to commit a crime against her, a crime so violent, so intrusive that the results are with her the rest of her life? I know that is a concept difficult for men to understand. If your car is smashed, what kind of anger do you feel? If you walk into your house and your television has been taken or your silver has been taken, what kind of anger
do you feel? You can replace a television set and you can buy a new car, but you cannot buy a new self. Rape forever changes who you are, how you feel about yourself and how you feel about the world.
This bill is so important because it is sort of the ultimate expression of women's powerlessness in society. There has just been a report out on why there are not women in engineering. I happen to be married to an engineer, I have a son-in-law who is an engineer and I have a son who is an engineer, so I know a fair bit about engineers and I know a fair bit about engineering faculties at universities. There is a whole culture there that is ugly and offensive to the very nature of women. It is so totally male macho culture that no woman is comfortable in it. There are things like the now-gone greased pole at Queens. Tell me what woman wants to be an engineer when part of your initiation process is to expose yourself to filth, and I mean that in the most vile terms, believe me.
Why are there not more women in politics? We will not have the kinds of laws that make it difficult for women to get justice when we have more women writing laws. That is not that I would write better laws than any of my male colleagues in this House. It is just that I bring a different perspective to it, a perspective I think is necessary to complete our humanity when we create laws in this House.
Bertha Wilson said it best when she talked about the difference between how men and women deal with laws, why the justice system is anathema to women. The whole idea of winning and losing that is fundamental to our justice system is a male concept. It is a concept that is promoted by those who are bigger and are more powerful. It is not a concept that women are comfortable with.
I am being very open and honest about my feelings because this bill is about feelings. It is about whether women feel that having been violated they can turn to the justice system that is supposed to be there to protect all of us and whether they can turn to that system and expect to be treated with dignity and as if they were the victims and not the accused. I suppose it is not a perfect bill, but I think it is a good starting point.
April 8, 1992

I congratulate and thank the Minister of Justice for acting so quickly in getting something to the House. I look forward to seeing if we can make it a little closer to perfect when we deal with it in committee.
I would just ask everybody in the House to bear in mind that we tend to put so much more importance in our legal system on property than we do on people. It does seem to me that we get more angry and react more violently if our property is harmed or taken from us than we do if another person is harmed.
I ask us to think about that in all the laws we make and as we look at the reports in the media in court cases. Look carefully at where the heavy sentences go. It is for crimes against property, not for crimes against little children or women.
I hope that will be taken into consideration as we go through this bill in committee. It should be as tough as it can possibly be. It should do as much as it can possibly do to overcome the automatic powerlessness that women feel. That is the only way we will start eradicating this particular crime against women and, hopefully, eventually violence against women in its entirety.

",Liberal,,Marlene Catterall,http://www.parl.gc.ca/parlinfo/Files/Parliamentarian.aspx?Item=37b14340-0543-4dd1-86cd-0f5dfbe99332&Language=E&Section=ALL
3904497,ca.proc.d.1992-04-08.5.1.1.12,1992-04-08,10048127-35a6-4f46-8dda-e7afb7584c09,ca.m.4320,Hon. Kim Campbell (Minister of Justice and Attorney General of Canada):,Minister of Justice and Attorney General of Canada,GOVERNMENT ORDERS,CRIMINAL CODE,MEASURE TO AMEND,"Mr. Speaker, I believe that concludes the debate, if I am not mistaken.
I just want to take the opportunity presented by questions and comments to say to all colleagues in this House who participated in this debate how grateful I am for their contributions. It has been an enormously valuable discussion. I think each individual has contributed; my colleague from Cape Breton-The Sydneys and my colleague from Port Moody-Coquitlam, who are the justice critics for their party, my colleague the Minister Responsible for the Status of Women, the member for New Westminister-Burnaby, the member for Ottawa West and several other members of the Liberal party who spoke.
I just want to say that I believe this is an historic debate. The record of this debate is something people will look back on years from now. It is the first time we have tried to create legislation that really reflects the reality of life as it is lived by women in a very explicit way and where, on all sides of the House, we have had people who recognize that, supported it, were comfortable with that. I believe that is a quantum leap for women. We
Government Orders
have much to do in terms of making progress. I know there is devotion to that goal on all sides of the House. I have seen this in the participation in programs on violence against women and in my colleague's blue ribbon panel on violence against women. There has been strong support for this all along.
I want simply to say that for me, as the minister, who had the opportunity to bring this bill forward it has been a moving and very touching experience and a very reassuring experience to hear the quality of this debate and to hear the candour and openness and the level of understanding that has characterized all of my colleagues, men and women, on this subject and I am very grateful for it.
This is a day that I for one will not forget for a long time. Thank you very much. I look forward very much to the work of the committee. I would be remiss if I did not say how much, as minister, I appreciate the work that members do in dealing with the nuts and bolts of legislation. I think members of the public often do not understand the kind of work that their members of Parliament do. It is not necessarily very glamorous, it does not necessarily get the headlines, but it is absolutely fundamental to making the kinds of changes that Canadians expect us to make.
I want to say in advance, thank you to all whom I know will participate in this and to express my respect and appreciation for you, and thank you for your support for the legislation.

",Progressive Conservative,,A. Kim Campbell,http://www.parl.gc.ca/parlinfo/Files/Parliamentarian.aspx?Item=10048127-35a6-4f46-8dda-e7afb7584c09&Language=E&Section=ALL
3904498,ca.proc.d.1992-04-08.5.1.1.13,1992-04-08,d5594fa9-aa97-41c2-ab74-a3a608aae6e9,ca.m.7122,Mr. Russell MacLellan (Cape Breton-The Sydneys):,,GOVERNMENT ORDERS,CRIMINAL CODE,MEASURE TO AMEND,"Mr. Speaker, I just want to echo what the minister has said and to congratulate the member for Ottawa West on her speech today. I found it very important.
I just cannot stress too much what is important in this bill and the importance that the women in Canadian society attach to this legislation. I would hope that we will get, as I have said earlier, the opportunity to fully discuss this bill, as the member for Ottawa West has said, to change any flaws that may be there and to make it a better bill. I thank the minister for bringing it forward. I ask the member for Ottawa West if she feels that there is anything that she knows of that can be improved in this legislation, now that it is ready to go to committee.

April 8, 1992
Government Orders

",Liberal,,Russell Gregoire MacLellan,http://www.parl.gc.ca/parlinfo/Files/Parliamentarian.aspx?Item=d5594fa9-aa97-41c2-ab74-a3a608aae6e9&Language=E&Section=ALL
3904499,ca.proc.d.1992-04-08.5.1.1.14,1992-04-08,37b14340-0543-4dd1-86cd-0f5dfbe99332,ca.m.3465,Mrs. Catterall:,,GOVERNMENT ORDERS,CRIMINAL CODE,MEASURE TO AMEND,"I would just comment at this point, Mr. Speaker, to say I will certainly be watching the committee debates very carefully and contributing in whatever way I can.
What is important to me is that things have not changed that much in my lifetime. For my daughters it is not even that much different, but I certainly hope for my granddaughters that they will at least be able to see a time when women will live without the kind of fear that many women do now. I look forward to the committee debate and I look forward to making some specific comments on the bill and how we can strengthen it.

",Liberal,,Marlene Catterall,http://www.parl.gc.ca/parlinfo/Files/Parliamentarian.aspx?Item=37b14340-0543-4dd1-86cd-0f5dfbe99332&Language=E&Section=ALL
3904500,ca.proc.d.1992-04-08.5.1.1.15,1992-04-08,53bb5c29-71f8-43bd-9fa4-d35154a120cb,ca.m.5267,Mr. Ian Waddell (Port Moody-Coquitlam):,,GOVERNMENT ORDERS,CRIMINAL CODE,MEASURE TO AMEND,"I would like to respond to the hon. member's speech, which was an excellent one, and also to what the Minister of Justice has just said.
I used to represent the riding of Vancouver-Kings-way. It was represented at one time before me by Grace Maclnnis. In 1968 she was the only woman in the House of Commons. She told me a little bit about what it was like being in the House, and what it was like for her in those days. This House has changed a lot. Canada has changed a lot in that period clearly. I am sure if Mrs. Maclnnis were alive today, she would applaud what the House has done today.
I am speaking on behalf of the member for New Westminister-Burnaby, myself and all the members of my party. We are prepared to now let the bill go through and go to committee and get a thorough and quick airing in committee.

",New Democratic Party,,Ian Gardiner Waddell,http://www.parl.gc.ca/parlinfo/Files/Parliamentarian.aspx?Item=53bb5c29-71f8-43bd-9fa4-d35154a120cb&Language=E&Section=ALL
3904501,ca.proc.d.1992-04-08.5.1.1.16,1992-04-08,2522c99d-47e6-4f5f-8d9d-2fde1146a3cd,ca.m.7524,Ms. Lynn Hunter (Saanich-Gulf Islands):,,GOVERNMENT ORDERS,CRIMINAL CODE,MEASURE TO AMEND,"Mr. Speaker, I would like also to make some comments on this historic day. As a woman who has had personal experience with this issue as well as the mother of a teenage daughter, I think that things have changed.
I know that my daughter's school has a program on date rape. No such program existed when I was in high school. I think that is a step forward. At least we are now talking about this issue. It is out in the public forum for debate.
I also will be following the committee's deliberations with great interest.

",New Democratic Party,,Lynn Hunter,http://www.parl.gc.ca/parlinfo/Files/Parliamentarian.aspx?Item=2522c99d-47e6-4f5f-8d9d-2fde1146a3cd&Language=E&Section=ALL
3904502,ca.proc.d.1992-04-08.5.1.1.17,1992-04-08,2181bb23-f976-4835-86a1-ad5324f54b8e,ca.m.3377,Mr. Stan Keyes (Hamilton West):,,GOVERNMENT ORDERS,CRIMINAL CODE,MEASURE TO AMEND,"Mr. Speaker, I want to take this opportunity to congratulate my colleague for Ottawa West on what was truly beyond an indication of her feelings on the bill. It was heartfelt. May I take a moment? It is an important issue to all of us partially due to the fact that in my particular case I have two daughters who are six and eight. Nothing would make me feel more secure in myself and for my daughters if some short time down the road they will be able to avail themselves of their very rights.
What I would like to do is ask the hon. member for Ottawa West if she could respond to this particular scenario which we have seen over the years where few women have come forward to bring their assailants to court.
In this particular bill I wonder if the member for Ottawa West could explain or tell this House and the constituents in our ridings if this bill is going to avail women a greater opportunity to do what must be done.

",Liberal,,Stan Kazmierczak Keyes,http://www.parl.gc.ca/parlinfo/Files/Parliamentarian.aspx?Item=2181bb23-f976-4835-86a1-ad5324f54b8e&Language=E&Section=ALL
