basepk,hid,speechdate,pid,opid,speakeroldname,speakerposition,maintopic,subtopic,subsubtopic,speechtext,speakerparty,speakerriding,speakername,speakerurl
3904310,ca.proc.d.1992-04-08.1,1992-04-08,,,,topic,STATEMENTS PURSUANT TO S. O. 31,,,,,,,
3904311,ca.proc.d.1992-04-08.1.1,1992-04-08,,,,subtopic,STATEMENTS PURSUANT TO S. O. 31,NATIONAL CITIZENSHIP WEEK,,,,,,
3904312,ca.proc.d.1992-04-08.1.1.1,1992-04-08,10aaf198-11a8-4b29-ad9b-0af748c50627,ca.m.3981,Ms. Barbara Greene (Don Valley North):,,STATEMENTS PURSUANT TO S. O. 31,NATIONAL CITIZENSHIP WEEK,,"Mr. Speaker, today the Minister of Multiculturalism and Citizenship and thousands of Canadians are launching National Citizenship Week with the reaffirmation ceremony called ""Committed to Canada"".
It is time for us all to reflect on what it means to be a good Canadian citizen. Although we are so diverse, we are unified on these values.
We believe in tolerance, respect and reasonable accommodation for others. We believe in freedom, human rights and equal opportunity for all. We are staunch supporters of peace, justice and law and order for all.
The good Canadian citizen also fights for these same values throughout the world. We fight not with sticks, stones, guns, intimidation and threats but with words and peaceful actions consistent with democratic law-abiding Canadian tradition.

",Progressive Conservative,,Barbara Greene,http://www.parl.gc.ca/parlinfo/Files/Parliamentarian.aspx?Item=10aaf198-11a8-4b29-ad9b-0af748c50627&Language=E&Section=ALL
3904313,ca.proc.d.1992-04-08.1.2,1992-04-08,,,,subtopic,STATEMENTS PURSUANT TO S. O. 31,WHYCOCOMAGH CONSOLIDATED SCHOOL,,,,,,
3904314,ca.proc.d.1992-04-08.1.2.1,1992-04-08,343f8a28-17d8-4230-9774-2805e41a7395,ca.m.167,Mr. Francis G. LeBIanc (Cape Breton Highlands- Canso):,,STATEMENTS PURSUANT TO S. O. 31,WHYCOCOMAGH CONSOLIDATED SCHOOL,,"Mr. Speaker, it is a truism that a sustainable world requires an environmentally aware citizenry and this begins first and foremost with education.
Environmental education is holistic. It begins with the child and carries through primary and secondary school
to the development of an environmental ethic as a natural code of behaviour.
Surprisingly, these self-evident principles have taken a long time to find their way into the curricula of our schools. This is changing with a bold, exciting and visionary proposal being developed in the community of Whycocomagh on Cape Breton Island.
Whycocomagh, which is Micmac for ""head of the waters"", is a small community nestled in the Bras d'Or lakes area. Faced with closure, the staff of Whycocomagh Consolidated School is reinventing its curriculum to become an environmental education centre where the principles and methods of holistic environmental education can be advanced and shared with the world.
This is an idea whose time has come. It is one which this government and all members of this House will want to support and encourage.

",Liberal,,Derek Vincent Lee,http://www.parl.gc.ca/parlinfo/Files/Parliamentarian.aspx?Item=343f8a28-17d8-4230-9774-2805e41a7395&Language=E&Section=ALL
3904315,ca.proc.d.1992-04-08.1.3,1992-04-08,,,,subtopic,STATEMENTS PURSUANT TO S. O. 31,OVERFISHING,,,,,,
3904316,ca.proc.d.1992-04-08.1.3.1,1992-04-08,3dca74f6-5eb5-4526-befa-b79d37632453,ca.m.5252,Hon. David MacDonald (Rosedale):,,STATEMENTS PURSUANT TO S. O. 31,OVERFISHING,,"Mr. Speaker, I rise with respect to the serious crisis that exists in the fishing industry off the coast of Newfoundland.
The members will be aware that yesterday the Minister of the Environment and the Minister of Fisheries in Newfoundland appeared in front of the environment committee on this issue.
Last week in New York at the fourth preparatory committee meeting leading up to the earth summit, a wide-ranging group of non-govemmental organizations and governments produced the New York declaration on high seas overfishing and protection of the commons.
They referred specifically to the implementation of article 116 of the Law of the Sea convention which clearly establishes that high seas fishing states have an obligation to conserve these stocks and to co-operate with adjacent coastal stocks that were given superior rights over straddling stocks.

April 8, 1992
This New York declaration calls for all states to reinforce the provisions of the Law of the Sea and to have an international conference to resolve these matters.
I would urge all hon. members to support this important resolution in order that we can safely and for the future of humanity conserve a very important resource off Canada's east coast.

",Progressive Conservative,,David Samuel Horne MacDonald,http://www.parl.gc.ca/parlinfo/Files/Parliamentarian.aspx?Item=3dca74f6-5eb5-4526-befa-b79d37632453&Language=E&Section=ALL
3904317,ca.proc.d.1992-04-08.1.3.2,1992-04-08,573c0758-57bf-4bcb-8ccf-b10290b5e0c9,ca.m.7521,Mr. Jesse Flis (Parkdale-High Park):,,STATEMENTS PURSUANT TO S. O. 31,OVERFISHING,,"Mr. Speaker, last week three members of this Chamber were in Washington to participate in the third annual PSEKA Conference concerning the precarious situation in Cyprus.
Lately there has been a great deal of concern about this troubled nation, particularly since Canada has maintained a UN peacekeeping presence there for 27 years and still no peaceful resolution exists on the horizon.
Last week, we heard conflicting reports from the external affairs minister and the associate defence minister disputing Canada's continued peacekeeping commitment on the island.
Certainly we all want to see a settlement in Cyprus which would be acceptable to both the Greek-Cypriot community and to the Turkish-Cypriot community.
I am concerned, however, that Canada might unilaterally and prematurely withdraw our UN forces without full consideration for the bloodshed that would surely follow.
I caution the minister of external affairs to treat the Cyprus question with better care and understanding than has been demonstrated thus far.

",Liberal,,Jesse Philip Flis,http://www.parl.gc.ca/parlinfo/Files/Parliamentarian.aspx?Item=573c0758-57bf-4bcb-8ccf-b10290b5e0c9&Language=E&Section=ALL
3904318,ca.proc.d.1992-04-08.1.4,1992-04-08,,,,subtopic,STATEMENTS PURSUANT TO S. O. 31,COMMUNICATIONS AND CULTURE,,,,,,
3904319,ca.proc.d.1992-04-08.1.4.1,1992-04-08,ed3d4160-8a5a-4efc-a0a6-d65deeb994d9,ca.m.94,Mr. Gilles Duceppe (Laurier-Sainte-Marie):,,STATEMENTS PURSUANT TO S. O. 31,COMMUNICATIONS AND CULTURE,,"Mr. Speaker, the Standing Committee on Communications and Culture tabled its report yesterday. The report advocates federal involvement in these areas. It was signed by the Conservatives, the Liberals and the NDP. All three parties also signed the Beaudoin-Dobbie
report which favoured Quebec's exclusive jurisdiction over culture. However, the Liberal Party disagreed with this recommendation. It is clear today that the NDP and Brian Mulroney's troops have closed ranks with Jean Chretien.
The Belanger-Campeau commission and the Allaire report advocated Quebec's exclusive jurisdiction over both culture and communications. Ottawa ignores and challenges Quebec's position, all of which is reflected in the report as well as in Bill C-62, which was condemned by Quebec Minister Lawrence Cannon. These two examples prove once again that Ottawa has been wilfully misleading Quebec. Quebecers will not tolerate this political manoeuvring, whose sole aim is to strengthen Ottawa's centralizing powers while giving the impression there will be a genuine opening up as regards the distribution of powers.

",Bloc Québécois,,Gilles Duceppe,http://www.parl.gc.ca/parlinfo/Files/Parliamentarian.aspx?Item=ed3d4160-8a5a-4efc-a0a6-d65deeb994d9&Language=E&Section=ALL
3904320,ca.proc.d.1992-04-08.1.5,1992-04-08,,,,subtopic,STATEMENTS PURSUANT TO S. O. 31,"SIGNS OF HOPE, SEA TO SEA",,,,,,
3904321,ca.proc.d.1992-04-08.1.5.1,1992-04-08,b7f39a72-55df-48bd-acff-73eeb8fe2318,ca.m.327,Mr. Stan Darling (Parry Sound -Muskoka):,,STATEMENTS PURSUANT TO S. O. 31,"SIGNS OF HOPE, SEA TO SEA",,"Mr. Speaker, I believe my constituents of Parry Sound- Muskoka are among the most environmentally responsible in Canada.
The prospect of a clean and safe environmental future rests with Canada's youth. Accordingly, elementary and secondary school students in my riding will be making a major contribution to Earth Day on April 22, 1992.
David Whiteside, a teacher at Muskoka Lake Secondary School, is the motivating force behind a student recording of an original song entitled Signs of Hope, Sea to Sea.
Over 14,000 cassette tapes have been mailed to every school in Canada so students from coast to coast can join together in a national chorus of environmentalism.
I encourage all members of the House to promote the playing of this song in the schools and on the radio stations in their own constituencies on Earth Day.
I know my fellow members join me in offering hearty congratulations to the dedicated students and teachers of Muskoka on their worthy endeavour.
I would like to thank the Minister of the Environment for a generous contribution of $8,000 to this project.
April 8, 1992

",Progressive Conservative,,Stan Darling,http://www.parl.gc.ca/parlinfo/Files/Parliamentarian.aspx?Item=b7f39a72-55df-48bd-acff-73eeb8fe2318&Language=E&Section=ALL
3904322,ca.proc.d.1992-04-08.1.6,1992-04-08,,,,subtopic,STATEMENTS PURSUANT TO S. O. 31,OVERFISHING,,,,,,
3904323,ca.proc.d.1992-04-08.1.6.1,1992-04-08,a23123f4-9e40-4b5a-8a6d-1cf81a56c4a8,ca.m.9679,Mr. Jim Fulton (Skeena):,,STATEMENTS PURSUANT TO S. O. 31,OVERFISHING,,"Mr. Speaker, diplomatic efforts to halt the overfishing on the nose and tail of the Grand Banks have failed. The European Community, in particular Portugal and Spain, are treating the fishery as a resource to be mined. Sadly, like the buffalo and the passenger pigeon, this slaughter of dwindling stocks is a crime against the environment.
The time has come for Canada to declare the establishment of a custodial management zone over the marine resources that straddle and extend beyond the 200-mile zone. It must be made absolutely clear to the world community that this declaration is for conservation purposes.
World opinion will treat harshly any nation that allows its fleet to poach within the boundaries of this new conservation zone.
I say shame on those who fearmonger to Canadians that this declaration would create a military confrontation with the fish pirates.
World opinion is overwhelming for the protection of endangered species and stocks and it is our responsibility to protect the dwindling stocks of the Grand Banks from destruction.
It may be diplomatically polite to wait until the stocks are extinct and the fleet goes elsewhere to fish but that is the politics of failure and stupidity.
The declaration must take effect no later than January 1, 1993.

",New Democratic Party,,James Ross Fulton,http://www.parl.gc.ca/parlinfo/Files/Parliamentarian.aspx?Item=a23123f4-9e40-4b5a-8a6d-1cf81a56c4a8&Language=E&Section=ALL
3904324,ca.proc.d.1992-04-08.1.7,1992-04-08,,,,subtopic,STATEMENTS PURSUANT TO S. O. 31,AEROSPACE INDUSTRY,,,,,,
3904325,ca.proc.d.1992-04-08.1.7.1,1992-04-08,6025d38f-3695-4037-8221-3f4cb652936b,ca.m.58,Mr. Bill Casey (Cumberland-Colchester):,,STATEMENTS PURSUANT TO S. O. 31,AEROSPACE INDUSTRY,,"Mr. Speaker, the Canadian Space Agency has a mandate to distribute 10 per cent of the government's space contracts to Atlantic Canada.
Atlantic Canada has a growing aerospace industry with many changes and developments in manufacturing, research and development and it is anxious to work with the Space Agency and with the Department of Industry, Science and Technology to achieve this 10 per cent goal.
Recent additions to the Atlantic aerospace industry include world-class CAD/CAM machining facilities, electrical harness plants, and a new fuselage components factory in Amherst.
The department and its officials, as well as the Canadian Space Agency must work with the industry in Atlantic Canada to identify areas where progress can be made toward achieving the regional mandate of the agency of having 10 per cent of the space contracts being done in Atlantic Canada.

",Progressive Conservative,,William D. (Bill) Casey,http://www.parl.gc.ca/parlinfo/Files/Parliamentarian.aspx?Item=6025d38f-3695-4037-8221-3f4cb652936b&Language=E&Section=ALL
3904326,ca.proc.d.1992-04-08.1.8,1992-04-08,,,,subtopic,STATEMENTS PURSUANT TO S. O. 31,LOBSTER FISHERY,,,,,,
3904327,ca.proc.d.1992-04-08.1.8.1,1992-04-08,dbbdd33a-8aa5-47b0-aedc-a5f00bbb2181,ca.m.194,Mr. Joe McGuire (Egmont):,,STATEMENTS PURSUANT TO S. O. 31,LOBSTER FISHERY,,"Mr. Speaker, I would like to raise two issues of concern to the province of Prince Edward Island lobster fishing industry.
The first involves lobster carapace size.
The P.E.I. legislative assembly has unanimously endorsed a resolution asking the Department of Fisheries and Oceans to freeze further scheduled carapace size increases and to carry out an impact study of the increases already in effect. These increases have lead to lower catches and decreased incomes for many of our fishermen.
As well, it has been established that there is a substantial world market for smaller lobster. DFO regulations are preventing our fishermen from sharing in this market.
It has also been scientifically established that conservation of the stocks is not a problem and does not require these measures.
Therefore I would urge the minister to react positively to this request and implement the freeze.
The second issue concerns the problem of poaching.
Our legitimate fishermen need to have their industry and themselves protected from poachers. The Department of Fisheries and Oceans at present is simply not doing the job.
If the department does not have the human or financial resources to do its job then it should ask the Department of National Defence for help. We need surveillance on both land and water if we hope to solve this problem.

April 8, 1992
With the season only three weeks away I urge the minister to act immediately.

",Liberal,,Joseph Blair (Joe) McGuire,http://www.parl.gc.ca/parlinfo/Files/Parliamentarian.aspx?Item=dbbdd33a-8aa5-47b0-aedc-a5f00bbb2181&Language=E&Section=ALL
3904328,ca.proc.d.1992-04-08.1.9,1992-04-08,,,,subtopic,STATEMENTS PURSUANT TO S. O. 31,ANTI-TAX MOVEMENTS,,,,,,
3904329,ca.proc.d.1992-04-08.1.9.1,1992-04-08,5f836f0f-8e82-4e2d-bc98-887b522140f2,ca.m.3750,Mr. Guy Saint-Julien (Abitibi):,,STATEMENTS PURSUANT TO S. O. 31,ANTI-TAX MOVEMENTS,,"Mr. Speaker, anti-tax movements are springing up all over Quebec, and I think we should remind them that what is happening today is the result of yesterday's negligence on the part of those who governed the country at the time. There is also the economic recession which turned out to be more serious than we thought, but we all know the economy goes through certain cycles. Whether we like it or not, we will have to pay our bills, because federal, provincial and municipal politicians cannot forgive debts once they have been incurred. We will have to be more reasonable in our demands for goods and services.
Pressure and protests from anti-tax movements are powerless against past overspending and the resulting debt. However, they can give politicians who are so anxious to give people what they want cause to reflect, advocate more responsible fiscal management and prevent them from making the situation even worse than it is now.

",Progressive Conservative,,Guy St-Julien,http://www.parl.gc.ca/parlinfo/Files/Parliamentarian.aspx?Item=5f836f0f-8e82-4e2d-bc98-887b522140f2&Language=E&Section=ALL
3904330,ca.proc.d.1992-04-08.1.10,1992-04-08,,,,subtopic,STATEMENTS PURSUANT TO S. O. 31,CHILD POVERTY,,,,,,
3904331,ca.proc.d.1992-04-08.1.10.1,1992-04-08,b440f91f-56f0-442a-a749-6ebea334c64e,ca.m.6054,Mrs. Christine Stewart (Northumberland):,,STATEMENTS PURSUANT TO S. O. 31,CHILD POVERTY,,"Mr. Speaker, according to the Vanier Institute of the Family one million Canadian children live below the poverty line. Child poverty is essentially family poverty.
The challenge is to respond appropriately to one very basic fact, poor children are the sons and daughters of poor parents.
The Canadian government must recognize the vast resources held in the outstretched hands and minds of our children and acknowledge the poverty of children and their families both in this country and around the world.
All children of all nations must be given the opportunity to develop to their full potential. Children are our nation's and the world's nations most important resource.
Governments of the developing world are devoting half of their expenditures to debt servicing and military spending. This unproductivity must end.
The Government of Canada must move toward a reallocation of resources for the development of our children and our future. Canada must link its Third World aid policies to the advancement of human rights and in recognition of the untapped resources held in the minds of their children, provide direct poverty alleviation in our aid program.

",Liberal,,Christine Susan Stewart,http://www.parl.gc.ca/parlinfo/Files/Parliamentarian.aspx?Item=b440f91f-56f0-442a-a749-6ebea334c64e&Language=E&Section=ALL
3904332,ca.proc.d.1992-04-08.1.11,1992-04-08,,,,subtopic,STATEMENTS PURSUANT TO S. O. 31,OZONE DEPLETION,,,,,,
3904333,ca.proc.d.1992-04-08.1.11.1,1992-04-08,2522c99d-47e6-4f5f-8d9d-2fde1146a3cd,ca.m.7524,Ms. Lynn Hunter (Saanich-Gulf Islands):,,STATEMENTS PURSUANT TO S. O. 31,OZONE DEPLETION,,"Mr. Speaker, mounting medical evidence confirms that ozone depletion is a threat to the continuation of life on earth. Yet the call to action on ozone depletion made by the environment committee in our report nearly two years ago received little attention. Belatedly the alarm bells are now ringing.
Canada's location in the northern hemisphere means we experience disproportionate effects of ozone depletion. The incidence of skin cancer, immune disorders and eye damage are rising at unprecedented rates.
We are not powerless against these threats. We will all have to learn to protect ourselves from ultraviolet radiation. This protection is particularly urgent for our children.
Government must bring in stiff, mandatory and uniform regulations against ozone depleting chemicals. We must also give urgent priority for technology to recapture, recycle and ultimately destroy these chemicals. In addition, we should have mandatory standards for sunscreens and protective sunglasses.
Finally, we must highlight the urgency of this issue at the upcoming earth summit in Brazil and at the renegotiations of the Montreal protocol.



April 8, 1992

",New Democratic Party,,Lynn Hunter,http://www.parl.gc.ca/parlinfo/Files/Parliamentarian.aspx?Item=2522c99d-47e6-4f5f-8d9d-2fde1146a3cd&Language=E&Section=ALL
3904334,ca.proc.d.1992-04-08.1.11.2,1992-04-08,19484d4b-ea72-419e-8a5f-7077c4906de5,ca.m.1156,Hon. Alan Redway (Don Valley East):,,STATEMENTS PURSUANT TO S. O. 31,OZONE DEPLETION,,"Mr. Speaker, in 1974 Turkish troops landed on Cyprus. Today, 18 years later, despite 24 United Nations resolutions calling upon Turkey to withdraw its troops, they continue to occupy almost one-half of that independent nation. For the past 27 years, Canada has been participating in a United Nations-Cyprus peacekeeping force. Five hundred and seventy-six Canadians make up one-quarter of the UN contingent at an ongoing annual cost to Canadian taxpayers of some $14 million.
Since 1964, 15 Canadians have lost their lives in peacekeeping duty on Cyprus. Recently, both the Secretary General of the United Nations and the President of the United States have attempted to negotiate a peaceful and a just settlement for Cyprus. Canada must also be actively involved in this effort.
This Friday, the United States Ambassador to Cyprus, Nelson Ledsky, will be in Ottawa for consultations on the issue. It is in Canada's best interest as well as in Cyprus' best interest that a just solution be found to this problem just as quickly as possible.

",Progressive Conservative,,Alan Redway,http://www.parl.gc.ca/parlinfo/Files/Parliamentarian.aspx?Item=19484d4b-ea72-419e-8a5f-7077c4906de5&Language=E&Section=ALL
3904335,ca.proc.d.1992-04-08.1.12,1992-04-08,,,,subtopic,STATEMENTS PURSUANT TO S. O. 31,NATIONAL CITIZENSHIP WEEK,,,,,,
3904336,ca.proc.d.1992-04-08.1.12.1,1992-04-08,83591801-6301-4a0c-84d0-c63366693159,ca.m.9976,Ms. Nicole Roy-Arcelin (Ahuntsic):,Parliamentary Secretary to the Minister of Communications,STATEMENTS PURSUANT TO S. O. 31,NATIONAL CITIZENSHIP WEEK,,"Mr. Speaker, today we highlight the launching of National Citizenship Week, which will be held from April 12 to 18 this year. To mark this special day, hundreds of young people will participate this afternoon in a ceremony reaffirming their citizenship.
They will thus express their pride in being Canadian and their deep faith in the future of our country. Later in the day, at a special ceremony on Parliament Hill, 25 people and organizations from across Canada will receive certificates of civic merit in recognition of their outstanding contributions to Canadian society.
I call on all members of this House to join me in paying tribute to these committed citizens who care about promoting freedom, equality and respect for diversity in
the community. Together we will build a country to match our aspirations.

",Progressive Conservative,,Nicole Roy-Arcelin,http://www.parl.gc.ca/parlinfo/Files/Parliamentarian.aspx?Item=83591801-6301-4a0c-84d0-c63366693159&Language=E&Section=ALL
3904337,ca.proc.d.1992-04-08.1.13,1992-04-08,,,,subtopic,STATEMENTS PURSUANT TO S. O. 31,EMBASSY OF IRAN,,,,,,
3904338,ca.proc.d.1992-04-08.1.13.1,1992-04-08,c14a576f-4677-40aa-9055-2e18a6132949,ca.m.107,Mr. Doug Fee (Red Deer):,,STATEMENTS PURSUANT TO S. O. 31,EMBASSY OF IRAN,,"Mr. Speaker, all responsible Canadians were incensed by the weekend attack on the Iranian embassy in Ottawa. This type of violence is not acceptable in this country. I would call on the legal authorities and the government to let those involved and any who are considering such actions know that Canada will not tolerate other nations' conflicts and violence on our soil.
Canadian citizenship is a privilege that is sought by thousands of people around the world. Last year alone we opened our borders to over 200,000. We need immigrants and a great majority of them have made positive contributions to this country, but we should not extend rights to those who refuse to accept the responsibility of abiding by our laws. We do not need thugs and hoodlums and we must not allow violence and strife from other nations to be transplanted here.

",Progressive Conservative,,Douglas Fee,http://www.parl.gc.ca/parlinfo/Files/Parliamentarian.aspx?Item=c14a576f-4677-40aa-9055-2e18a6132949&Language=E&Section=ALL
3904339,ca.proc.d.1992-04-08.1.14,1992-04-08,,,,subtopic,STATEMENTS PURSUANT TO S. O. 31,MUNICIPAL INFRASTRUCTURE,,,,,,
3904340,ca.proc.d.1992-04-08.1.14.1,1992-04-08,9215f31c-20f9-48ea-b0c0-7ecd25041e42,ca.m.8812,Mr. Steve Butland (Sault Ste. Marie):,,STATEMENTS PURSUANT TO S. O. 31,MUNICIPAL INFRASTRUCTURE,,"Mr. Speaker, there is a sense of urgency in this country. People are calling for some economic stimulus, some concrete job creation that will literally help put this country back on solid footing.
The one, and I emphasize only one, program that everyone does agree upon is the need to renew our infrastructure. Our bridges, roads, tunnels and sewer systems will not be able to support our new found prosperity after this government is turfed out of office. Who supports the Federation of Canadian Municipalities? There are 600 cities and towns across Canada that support it. The Canadian Federation of Independent Business supports it. The Canadian Labour Congress supports it. Two bank presidents support it, most provincial premiers support it, the Canadian Construction Association supports it, the Coalition to Renew Canada's Infrastructure supports it. Who is in the Coalition?

April 8, 1992
Oral Questions
There is Sears, Labatt's, Greyhound, Canadian Airlines, 3M Canada, Xerox Canada, Reinforcing Steel, institutes. They all support it. The New Democratic Party supports it. The only party that does not endorse the idea right now, a move that could put 63,000 people back to work, is the Government of Canada.

",New Democratic Party,,Steve Butland,http://www.parl.gc.ca/parlinfo/Files/Parliamentarian.aspx?Item=9215f31c-20f9-48ea-b0c0-7ecd25041e42&Language=E&Section=ALL
3904341,ca.proc.d.1992-04-08.2,1992-04-08,,,,topic,ORAL QUESTION PERIOD,,,,,,,
3904342,ca.proc.d.1992-04-08.2.1,1992-04-08,,,,subtopic,ORAL QUESTION PERIOD,THE ECONOMY,,,,,,
3904343,ca.proc.d.1992-04-08.2.1.1,1992-04-08,2aa8c3e9-f46e-4c78-b9ff-04bec0ed5050,ca.m.5241,Hon. Jean Chretien (Leader of the Opposition):,Leader of the Official Opposition,ORAL QUESTION PERIOD,THE ECONOMY,,"Mr. Speaker, I would like to direct my question to the Minister of Finance.
The Minister of Finance said many times that the economic recovery in Canada was based on exporting more of our products to western countries. Today, the International Monetary Fund lowered its forecasts of economic growth in the western world and at the same time, the OECD announced that it would reduce its predictions and release the exact figure on May 15.
I would like to know from the Minister of Finance whether he intends to stand in this House and, in light of these unfortunate developments, tell us that his predictions will be changed, and when he will do so.

",Liberal,,Joseph Jacques Jean Chrétien,http://www.parl.gc.ca/parlinfo/Files/Parliamentarian.aspx?Item=2aa8c3e9-f46e-4c78-b9ff-04bec0ed5050&Language=E&Section=ALL
