basepk,hid,speechdate,pid,opid,speakeroldname,speakerposition,maintopic,subtopic,subsubtopic,speechtext,speakerparty,speakerriding,speakername,speakerurl
3904490,ca.proc.d.1992-04-08.5.1.1.5,1992-04-08,29e3fa33-f542-476f-88d3-d7da7d2f2404,ca.m.8222,Hon. Mary Collins (Associate Minister of National Defence and Minister Responsible for Status of Women):,Minister responsible for the Status of Women; Associate Minister of National Defence,GOVERNMENT ORDERS,CRIMINAL CODE,MEASURE TO AMEND,"Mr. Speaker, it is certainly a great pleasure as the Minister responsible for the Status of Women to join in this debate and to enthusiastically support Bill C-49.
It is a very important day in this Parliament and it is a very important day in this country, particularly for women, to be debating this issue before us.
My hon. colleague from New Westminster-Burnaby was talking about the old sexual assault laws and how they were written at a time when it was predominantly men in this Chamber. The laws were written by men, reflecting a male perspective on the law. Fortunately much of that has changed.
We now have women holding responsible positions, such as my colleague the Minister of Justice, the first woman to hold that position, and myself as Minister responsible for the Status of Women and women throughout this Chamber who now can play a role to effect not only legislation but have the positive effect that I feel this will have on women's lives in Canada.
I would like to add my congratulations, not only to the Minister of Justice but to members of the opposition, men and women, who have supported this bill, and to the many organizations that were consulted in the development of this bill for the input and the thoughtful approach that they have taken to it.
I can recall some months ago when the Supreme Court of Canada struck down the rape shield law. It really was a surprise. Many of us working in this field had thought that it would not happen.
The women who worked in women's organizations were quite thunderstruck when that decision came down. There was a great sense of: ""My heavens, what are we going to do now?"" This was really going to be a very bad situation in Canada, if women would not have some protection about having to reveal past sexual activity or what is considered to be very private information about their background, and what could possibly be the relevance of that in certainly the majority of cases? I know in my meetings with women's groups and women's organizations there was a lot of anguish.
As other colleagues have said in this House, the issue of sexual assault is one that is unfortunately much more widespread than most people have recognized. The facts are coming out slowly, but even the statistics that we have now do not reflect the reality of what is going on in terms of so many women in this country who have been victimized.
In 1989 we had 12,970 cases reported, but that is only the tip of the iceberg. It is so difficult to really get a handle on it because it is primarily through anecdotal evidence, but I am sure all members of the House, and particularly women members who work with women across the country, have heard so many of the stories themselves. I know that I have.
In talking with women, and particularly young women, they feel almost a sense of resignation, a sense of what would be the point of reporting it, because all that would happen is that they would be dragged through a court, they would have information brought out about their background, they would feel as though they were on trial yourself.
How could they possibly put forward evidence that would hold up in a situation like that, and they would bring disgrace on not only themselves but their family and friends. I have heard this so often from so many young women. They feel really caught. They have often said that the only thing they can do is identify him among their friends. They know that guy, the guy in their class at school who behaves like this and really pushes women into sexual activity they do not want to be pushed into but they feel they do not have any way of dealing with it.
One of the most important parts of this legislation will be the message it will send to society, to men and women alike about the appropriate nature for sexual activity, the response that is going to be required of both parties, the clear definition of consent.
In many ways, at the time when the Supreme Court decision came out there was this feeling that this was a terrible time, but so often there is a silver lining in every cloud. I feel that this legislation is much better, much stronger and will be much more supportive of the reality of women's lives.
April 8, 1992

It is not only by being able to enunciate quite clearly the circumstances and the grounds when information about a woman's past sexual history may be relevant. I would expect it would be a very few times, but there may be times, as the Supreme Court has indicated, where there may be relevance and ensuring that can only be done in the most appropriate circumstances and that the discretion is provided by the judge.
This legislation then goes on to address another very fundamental concern which women have been talking about for some time but which had not been addressed in the previous legislation dealing with sexual assault, that is the definition of consent.
I wrote to the Minister of Justice and had discussions with her on this issue of consent. At that time it was not anticipated that this whole area of legislation might be opened up, but since it was being opened up it could be addressed.
The Minister of Justice has met with women's groups, heard their voices and has come forward with an approach respecting consent that very clearly changes the whole concept, very clearly sets out the parameters that there must be explicit consent.
We are talking primarily about men as was evidenced in 99 per cent of the cases. They can no longer say: ""Well I thought she consented. She smiled and she said no. But she really did not mean it. We all know what that means"". I am not joking. I hear this often. Or they say: ""Well, my friends told me she was really easy and just give her a few drinks and that would be all that would be necessary"".
The saddest things I have ever heard in working with disabled women are their stories about being sexually assaulted, sometimes by their own caregivers. It seems so astonishing to think that could happen, but it does happen. Depending on the degree of disability, they either cannot communicate or cannot physically take action to deal with that. They have felt so vulnerable and their world then becomes so narrow, so closed.
The other thing that is important to recognize as we discuss this issue of sexual assault is how it impacts on women's lives. I read something recently that said: ""Yes, the physical wounds of rape are mended, but the psychological wounds in many cases are never mended"".
Government Orders
Again, I know we can all speak from experience of women who have been through rape and other forms of sexual assault. It changes their lives in very dramatic ways. It takes away their sense of trust. It often confines them. In many cases, women deny it and find it very difficult to get on with their lives.
The recent report of the Canadian Advisory Council on the Status of Women Who is Listening, talked about young women. The statistics that were put forward in that report were quite shocking, about the number of young women who had been victims of sexual assault, some 18 per cent under the age of 15, 16 or 17 year olds and relating that to their sense of self-esteem and seeing the correlation and, indeed, seeing ever more dramatically that where young women had not reported the assault their self-esteem, their own sense of themselves, was even lower.
It is very important, if a woman is assaulted that she is able to report it and get the appropriate redress. She should have a sense of confidence in her community, in society and in the law that it is going to address the issue seriously. That is what this legislation does because it so very clearly sets out societal values around this issue. It will empower women to take control, in many ways, of their lives. It will have a very beneficial effect on men too.
I recall when the minister introduced the legislation and there were cartoons which had people having to sign documents before they engaged in sexual activity. That of course is not what we are talking about. That is carrying it to absolutely stupid extremes.
What I hope this legislation does is open up the dialogue between men and women so that they can frankly discuss their feelings for each other before they may engage in sexual activity and that young men are going to recognize that there is a very changed environment in which they live.
In the advisory council report there were some other, I found, very distressing statistics in the survey they had done with both young men and young women. The priorities of young men, and again we are talking about 15, 16 and 17 year olds, still relate to sexual activities. There were comments like: ""I want to have sex before I am 16"". A lot of their lives seem to revolve around that and that was what was important to them.

April 8, 1992
Government Orders
It was not a meaningful relationship with young women. It was just sort of physical sex without thinking about the implications of that with a partner. Obviously we have to address those issues. We know that people have hormones when they grow up, but how do they direct those kinds of virtues in fair and productive relationships between young men and women?
I am very pleased that the legislation is receiving support from all parties today. This really shows some tremendous advances for women, but also I think in terms of the whole legislative process.
I hope the bill will go to committee and have the appropriate in depth study that all legislation requires, but will be passed quickly so that we will have this law in place and then be able to work toward ensuring that it is implemented.
This legislation is but one step in the journey that we are all engaged in, in moving toward women's equality. Women's equality will not be achieved as long as so many women in our country and around the world live with the fear of violence, the reality of violence and, in many cases, that violence being in the form of sexual assaults.
There is much work that still needs to be done. Certainly my focus, as I address these issues, is ensuring we have the laws in place, ensuring we have the proper enforcement of those laws and the understanding of all the players that are involved: the prosecutors, the judges, the lawyers, the social workers and the court system.
My colleague, the Minister of Justice, is working very assiduously in that direction to provide that support. Beyond that, we then look at the whole area of education and prevention. How do we work with young people?
When we read the recent statistics on violent crime we see the incidents of sexual assaults as being a dominant form of violent crime among young people. This is an area that has to be addressed. How do you get at that? Through our educational facilities, through our schools, through organizations in the community and through the media.
I think all of us who have worked in this field have some very deep concerns about the kinds of messages which are constantly conveyed through the media with respect to violence, with respect to the roles of women and sexual relationships and how women are portrayed
so often in the media as being basically there for the pleasure of men. We have to work at changing some of those as well.
There is a lot of work to be done. Certainly the Canadian panel on Violence Against Women is one of the initiatives that this government has taken to address these issues. The broad issue is violence against women, but within that addressing violence within the home, public violence, sexual assault, abuse of women by those in trust, whether it is doctors or lawyers or in other situations. We are looking forward to their report and recommendations for what I hope will be a national strategy that can set out timetables, goals and actions that we, at the federal level, can be engaged in, along with our partners in provincial levels, in the community and the public at large.
We are not the only ones engaged in this. I met this morning with my colleague from Newfoundland. Newfoundland has just engaged in a new initiative relating to violence. The province of Ontario was announcing a program today dealing with violence and aboriginal women. The province of British Columbia just recently tabled the results of a very, very fine report that was done on violence against women. Many other jurisdictions are working on this and, as ministers together across the country, we are working as a result of the commitment we made two years ago at Lake Louise and reinforced last year in St. John's and will be working again at our meeting in Whitehorse coming up in the next couple of months.
Through the Family Violence Program of Health and Welfare there are a number of specific initiatives. There was one that was talked about in this morning's paper, a national study on date rape, an area in which again there has been a lot of discussion, but not a lot of objective study to really get at that issue. It really comes back to what I was talking about earlier, the problem of date rape where again so many young women are afraid to report it. They have been victimized in a dating situation, but often feel guilty themselves. They feel ""maybe I did something or I wasn't able to take action"". We are not only going to get a better understanding of that, but through this legislation we will be able to go out and talk to young men and women in their schools, in their colleges and say: ""This is the law. Now, how are you going to work with us to make sure that people understand it and there is that dialogue and discussion and
April 8, 1992

support for this law so we do not have people breaking the law?""
It is an important time. Again, I want to congratulate the minister and all of those who have been involved. There is so much more work to be done, but for me it is heartening when I see these major steps moving forward with the support of colleagues throughout this House and I know throughout the country. We can in fact be agents of change here in Parliament, working together in a unified fashion, agents of change for the betterment of women throughout our society, but really for the betterment of Canadian society as a whole. I look forward to working with colleagues, not only in moving forward with this legislation, but with all the other initiatives that are going to be required to ensure that indeed women are free from the reality of violence and sexual assault throughout Canadian society.

",Progressive Conservative,,Mary Collins,http://www.parl.gc.ca/parlinfo/Files/Parliamentarian.aspx?Item=29e3fa33-f542-476f-88d3-d7da7d2f2404&Language=E&Section=ALL
