basepk,hid,speechdate,pid,opid,speakeroldname,speakerposition,maintopic,subtopic,subsubtopic,speechtext,speakerparty,speakerriding,speakername,speakerurl
3920937,ca.proc.d.1992-11-17.3.3.49,1992-11-17,343f8a28-17d8-4230-9774-2805e41a7395,ca.m.167,Mr. Lee:,,GOVERNMENT ORDERS,MEASURE TO AMEND,,"I will be clear for the hon. member. I am not supporting this bill, but I know what would make me support it. I would support a PMPRB, a prices review board that had some teeth and could deal with entry level pricing as well as price increases of existing drugs. I would support it if it did not have retroactivity agreed to by a minister who did not have authority to agree to it-that is another thing-and if there were commitments or monitoring mechanisms within the bill to ensure that additional money put into the system was invested back into Canada for research and development and marketing. I would support it if those things were there, but they are not there.
Taking away compulsory licensing with nothing in return leaves Canadians with zero and in the hole. I do not support this bill.

",Liberal,,Derek Vincent Lee,http://www.parl.gc.ca/parlinfo/Files/Parliamentarian.aspx?Item=343f8a28-17d8-4230-9774-2805e41a7395&Language=E&Section=ALL
3920938,ca.proc.d.1992-11-17.3.3.50,1992-11-17,cda5dfb3-0c2c-477d-b67d-b9f1141c5e0c,ca.m.6274,Mr. KarpofT:,,GOVERNMENT ORDERS,MEASURE TO AMEND,,"You support the principle then. [Translation]

",New Democratic Party,,James Capsey (Jim) Karpoff,http://www.parl.gc.ca/parlinfo/Files/Parliamentarian.aspx?Item=cda5dfb3-0c2c-477d-b67d-b9f1141c5e0c&Language=E&Section=ALL
3920939,ca.proc.d.1992-11-17.3.3.51,1992-11-17,94b62454-efbb-4091-91dc-ef9e0d03042d,ca.m.2694,Mr. Vincent Della Noce (Parliamentary Secretary to Secretary of State of Canada and to Minister of Multi-culturalism and Citizenship):,Parliamentary Secretary to the Minister of Multiculturalism and Citizenship; Parliamentary Secretary to the Secretary of State of Canada,GOVERNMENT ORDERS,MEASURE TO AMEND,,"Mr. Speaker, I would first of all like to say that I too was in favour of Bill C-22 and I must rise in this House to speak for Bill C-91. After all I have heard here, especially when I see my Liberal colleague opposite give figures, I really wonder whether he even knows where he lives, with all the figures he just gave that are completely wrong.

November 17, 1992
Government Orders
Mr. Speaker, Bill C-91 is designed to encourage science and technology, to promote greater experience on the markets and to help our researchers meet the challenges which arise-

",Progressive Conservative,,Vincent Della Noce,http://www.parl.gc.ca/parlinfo/Files/Parliamentarian.aspx?Item=94b62454-efbb-4091-91dc-ef9e0d03042d&Language=E&Section=ALL
3920940,ca.proc.d.1992-11-17.3.3.52,1992-11-17,343f8a28-17d8-4230-9774-2805e41a7395,ca.m.167,Mr. Lee:,,GOVERNMENT ORDERS,MEASURE TO AMEND,,"Mr. Speaker, this borders on privilege. Lest we get off on the wrong foot here, I know the member has laid the groundwork for his speech but I would not want him to leave the impression that I had given false figures, false information, to the House. If he is saying I did that then I want him to withdraw it. If he is saying he takes issue and differs with the figures I have used, that is one thing; but the way he has said it may leave the impression-and I hope he will clarify it-that I have delivered false information to the House.

",Liberal,,Derek Vincent Lee,http://www.parl.gc.ca/parlinfo/Files/Parliamentarian.aspx?Item=343f8a28-17d8-4230-9774-2805e41a7395&Language=E&Section=ALL
3920941,ca.proc.d.1992-11-17.3.3.53,1992-11-17,94b62454-efbb-4091-91dc-ef9e0d03042d,ca.m.2694,Mr. Della Noce:,Parliamentary Secretary to the Minister of Multiculturalism and Citizenship; Parliamentary Secretary to the Secretary of State of Canada,GOVERNMENT ORDERS,MEASURE TO AMEND,,"Mr. Speaker, I hope that you will not take from me the time that the member spoke, but I must say that my hon. Liberal colleague has the wrong figures.
As I was saying before I was interrupted, our researchers must meet the challenges that arise in the international markets. Better patent protection will help us reach our objectives sooner and more effectively.
In our country, we have all it takes to be a leader in pharmaceutical research. Our medical profession is known for its excellence. Names like Banting, Penfield, Pinel and Selye have made us world famous. Our health care system is also the envy of the whole world.
Being from Laval, I personally knew Armand Frapp-ier, who invented the first penicillin vaccine.
We also have a skilled labour force. Our tax credits are among the most generous in the world. But we lack something essential, namely protection for intellectual property to match the protection offered by other industrialized countries, patent legislation that would let us be competitive in R and D investments.
Since 1984, the government has attached high priority to reforming Canada's intellectual property legislation. It is part of our efforts for economic renewal.
Nevertheless, the government has continually had to fight to update, simplify and, I would even say, standardize these laws. The complaints expressed by the hon. members of the opposition do not surprise me at all. I remember that we had many difficulties with Bill C-22 that were often due to partisan politics. Through all these years, they have done all they could to compromise the progress we wanted to achieve.
I heard opposition members say that the government was rushing through second reading. They seem to forget that we are talking about an investment of some $500 million. Innovative drug companies have said that they would invest such amounts after they heard the government say last January that it would strengthen patent protection for pharmaceutical products.
The investments that I am talking about here are of prime importance at a time when the pharmaceutical industry is restructuring world-wide. Make no mistake: many other countries would want to benefit from such investments. If Canada does not act quickly enough, the door that is open to us may close again, forever.
I represent Laval-Est, a riding in the city of Laval, and this bill will help us do wonderful things, which have already begun thanks to Bill C-22. You no doubt know that in our riding we have companies like Bio-Mega, Marion-Merrell, which has been bought by Merrell Dow Pharmaceuticals Inc., formerly Nordic Laboratories Inc. We also have Biochem Pharma Inc. I recently heard its president, Mr. Bellini, a wonderful man, not because he has an Italian name but because he has made quite substantial investments in Biochem in Laval. By the way, Biochem has the rights for a drug to treat AIDS called 3TC, which was developed by a Quebec researcher, Dr. Bernard Belleau of McGill University in Montreal. This vaccine will be a Quebec product and the research and manufacturing will be done in our riding, in Laval, Quebec.
If these laws can help these people to invest but, as my opposition colleague just said, prices rose, I would not agree. When prices did not rise, they said it was due to the recession. If prices had risen, it would have been someone else's fault. It is always someone's fault. For now, the price has not gone up-it must be due to the

recession. Personally, I think that even without the recession, prices would have stayed in line.
Bill C-91 also encourages companies to make drugs here in Canada for a North American and international market. It is very interesting to see how fast the investments are made.
I remember the debate on Bill C-22. We had demonstrations here on the Hill where unions, businessmen and all investors were on our side. Rarely is the government seen outside and photographed protesting with union people, but it happened with Bill C-22.
It happened. I would like to remind this House that the opposition has the very unenviable reputation of having delayed the patent reform beyond any reasonable deadline. In the last session, the opposition used every obstruction tactic imaginable in an effort to prevent or postpone the passage of this bill.
Remember that this bill passed first reading in the House on November 7, 1986. The Liberals and New Democrats, our colleagues opposite, obstructed the bill so much that it did not reach the other place until May 6, 1987, a delay of almost seven months. Then the ping-pong game began, as you may recall, the most incredible in all of Canada's parliamentary history. It acquainted us government members with the Senate because every evening we spent a few hours there watching the ping-pong game, the shouting matches, the vulgar language being used by those debating Bill C-22.
A month before they received the legislation, the senators created a special committee with a mandate to examine the prices of pharmaceutical products. The Liberal majority in the committee and the Senate managed to get amendments to Bill C-22 adopted by the Senate, and the bill was sent back to the House of Commons.
On September 1, 1987, we adopted a motion rejecting most of the amendments proposed by the Senate. Tvo days later, the Senate referred our motion to the Standing Committee on Banking, Trade and Commerce. On October 21, the committee tabled its report. Again, the Liberal majority favoured amendments that were likely to upset the balance of the legislation and jeopardize its strong points.
Government Orders
Again, we rejected the proposals, and the bill came back to us a third time. This was November 19, 1987. Today is November 17. Tvo days from now it will again be November 19.
One year and 12 days after being tabled in the other place, Bill C-22 was passed and finally received Royal Assent. I remember the mood in Quebec at the time. I remember people who had investments which had to be postponed because of the bill. Postponing investments means people have to wait that much longer for a job or to invest for their company.
My point is that we can no longer afford this kind of foolishness. It is imperative to adopt this bill as soon as possible.
What bothers me is that some of the arguments I heard today are similar to what was said in the Senate when that body tried to jeopardize the government's legislation. Nothing has changed. They are using figures to scare the public. We hear all kinds of arguments. Anything goes, and the people listening wonder who is right.
As in 1987, the Liberals maintain that amendments to the Patent Act will raise the price of drugs. We have heard this argument before, and we will hear it again. At this point, I would like to quote Liberal Senator Norbert Theriault. Listen to what he had to say. It is really extraordinary. ""By removing the competitive element provided by generic drugs in the industry, Bill C-22 will undoubtedly result in a huge price increase."" Debates of the Senate, June 25, 1987, at page 1403. Another Liberal, Senator Lome Bonnell, stated that we were encouraging research by the multinationals-we heard this again today-at the expense of Canadians, who would have to pay more for their drugs. Tb quote Mr. Bonnell: ""For goodness sake, don't take it off the backs of the sick, the hospitalized, the infirm, and the aged by increasing drug prices"". Debates of the Senate, August 13,1987, page 1744.
He also said that the Canadian industry would suffer the negative impact of this bill, in terms that would have made my grandmother tremble. We heard this again today. I do not know whether anyone mentioned his grandmother, but mine is still alive. She is 98, and Bill C-91 certainly does not bother her at all.

Government Orders
He said: ""When they pass Bill C-22,1 ask them not to forget that they are hurting not only the sick, the aged, the crippled and the poor, and provincial governments"". That is really too bad because the provincial governments asked us to pass this bill as soon as possible. ""They are also hurting the agriculture and fisheries industries because of the cost of drugs in chemicals.""
Similarly, Liberal Senator Buckwold raised the spectre of fear-which they are doing again today-by claiming that the legislation would hurt Canadians because it would increase the price of drugs. This is what he said.
""In my opinion, if we pass this bill we will be doing a great disservice to the people of Canada. We will be adding to the problem of health costs. We will be denying drugs to people who otherwise would have bought them, and who desperately need them."" Debates of the Senate, June 23, 1987, at page 1347.
That is what the Liberals had to say. Today, we know they were wrong because the reality is light years away from these gloomy predictions. In fact, between January 1987 and December 1991, prices of patented drugs increased by an average of only 2.9 per cent per year, well below the average inflation rate for the same period. The people who kept raising the spectre of fear for political reasons were wrong, and I named a few just now.
As for the promised investment in R and D, the industry reached its objectives five years before the 1996 deadline. I have a note here which I could give you, Mr. Speaker. They promised to double their ratio of R and D to sales and reach 10 per cent in 1996, in 10 years. Believe it or not, by 1991 those objectives had already been met. Even more important, they showed they were committed to reaching those objectives and they met their commitments. And they did that in five years, instead of ten. We have to trust people a little. As for investment in R and D, the industry met its objectives well in advance.
Bill C-91 also gives new powers to the Patented Medicine Prices Review Board created in 1987. It was said earlier today that prices might go up-the hon. member referred to this-but I think the review board can even put people in jail for excessive pricing, beyond what is normal in a competitive market.
The objective is above all for the review board to ensure that the prices of both new and existing patent drugs are not excessive. I am confident that the review board will be able to do so, thanks to the new powers it has under this bill.
These new powers will also enable the review board to examine initial prices for new patented drugs. This is not just about price increases. I think consumers can also get a new deal when a new product is launched at at an excessively high price, even if there are no further increases. That is something the review board must consider very seriously.
The board will also be able to order price reductions or impose fines retroactively and thus discourage the practice of charging excessive prices. As we said earlier, this could even mean a jail sentence. These new powers will give the board's rulings the same clout as a ruling by the Federal Court. As we said earlier, since it was created, the board has ensured that any increase in the price of patented drugs remained below the rate of inflation.
The hon. member said earlier that the reason prices did not go up was the recession. Of course, somebody always takes the credit for good news, while bad news is always the government's fault. In this case, inflation was down, no thanks to the board. It is too bad he forgot to mention that the board probably did something right. I agree that in the past we have had boards that were supposed to look after the consumer and were not always a success. In fact they were often a disaster, and I had to deal with a number of these boards, especially here in Ottawa. However, when the results are good, I think the board deserves some credit, although my Liberal colleague on the other side preferred to thinks it was due to the recession.
In its fourth report, the Patented Medicine Prices Review Board said that the ratio of R and D to sales by patent-holding companies since 1991 has been around
9.7	per cent. Last year, these companies spent $376.4 million on R&D, an increase of 23 per cent over 1990.
I must admit that we notice these increases in my riding. I must say how proud I was again this morning. Knowing that we would be discussing this bill, as I drove along the highway in Laval, I saw something big being built and when I saw the name I was very glad because once again the drug company Bio-Mega has decided to expand and invest in Laval. It is putting up a big building. It is not Esso, I must admit, but Bio-Mega, which makes
November 17, 1992

me very pleased, and it is now called Boehringer Ingel-heim.
Bill C-91 will be studied by the committee and I am sure that all members of this House will have constructive suggestions. Let us act promptly and send this bill to the committee for consideration. I must tell everyone here to stop frightening people. Investors want to have some return. No one in business invests without getting a return. With the laws and the board, I am sure that consumers will be well protected and I hope that the board will be very strict.
My colleagues in the opposition are against it. They are against everything. They will not help us build. It is not thanks to them that we have had investments in our riding; it is thanks to Bill C-22, and I hope that we will have more with Bill C-91.

",Progressive Conservative,,Vincent Della Noce,http://www.parl.gc.ca/parlinfo/Files/Parliamentarian.aspx?Item=94b62454-efbb-4091-91dc-ef9e0d03042d&Language=E&Section=ALL
3920942,ca.proc.d.1992-11-17.3.3.54,1992-11-17,206ef0b1-261c-4ea0-98c2-e8fae2209e2e,ca.m.203,Mr. Milliken:,Liberal Party Deputy House Leader,GOVERNMENT ORDERS,MEASURE TO AMEND,,"On a point of order, Mr. Speaker. I believe that you will find unanimous consent for the House to continue sitting between one and two o'clock this afternoon.

",Liberal,,Peter Andrew Stewart Milliken,http://www.parl.gc.ca/parlinfo/Files/Parliamentarian.aspx?Item=206ef0b1-261c-4ea0-98c2-e8fae2209e2e&Language=E&Section=ALL
3920943,ca.proc.d.1992-11-17.3.3.55,1992-11-17,7b50d465-275c-40c4-aee8-6b8c3b99fca8,ca.m.8299,The Acting Speaker (Mr. DeBlois):,Assistant Deputy Chair of Committees of the Whole,GOVERNMENT ORDERS,MEASURE TO AMEND,,"Is there unanimous consent for the House to continue sitting over lunch hour, from one to two o'clock?

",Progressive Conservative,,Charles Deblois,http://www.parl.gc.ca/parlinfo/Files/Parliamentarian.aspx?Item=7b50d465-275c-40c4-aee8-6b8c3b99fca8&Language=E&Section=ALL
3920944,ca.proc.d.1992-11-17.3.3.56,1992-11-17,intervention,,,,GOVERNMENT ORDERS,MEASURE TO AMEND,,"Agreed.

",,,Some hon. members:,
3920945,ca.proc.d.1992-11-17.3.3.57,1992-11-17,7b50d465-275c-40c4-aee8-6b8c3b99fca8,ca.m.8299,The Acting Speaker (Mr. DeBlois):,Assistant Deputy Chair of Committees of the Whole,GOVERNMENT ORDERS,MEASURE TO AMEND,,"I did not hear anyone say no, so it is agreed and accepted.

",Progressive Conservative,,Charles Deblois,http://www.parl.gc.ca/parlinfo/Files/Parliamentarian.aspx?Item=7b50d465-275c-40c4-aee8-6b8c3b99fca8&Language=E&Section=ALL
3920946,ca.proc.d.1992-11-17.3.3.58,1992-11-17,cda5dfb3-0c2c-477d-b67d-b9f1141c5e0c,ca.m.6274,Mr. Jim Karpoff (Surrey North):,,GOVERNMENT ORDERS,MEASURE TO AMEND,,"Mr. Speaker, I listened with a great deal of interest. I want to ask three specific questions.
I would like to point out something about this whole issue of pricing and research and development. First of all, looking at British Columbia, we have been promised $15 million over five years. However, it has already been documented that it is going to cost our provincial pharmacy program $40 million each and every year. On one drug alone that is caught in the pipeline, as they call it, that has been given a licence, it will be taken back because after December 1991 it will cost $146 million over the next 15 years.
Nobody in Canada believes the documentation of the Prices Review Board. It is simply because every other independent organization, like Green Shield, has docu-
Govemment Orders
mented that the average price increase of drugs already in existence was 6.4 per cent.
They did a study in B.C. which showed that the cost of drugs to the pharmacy program has increased 72 per cent. Out of that 17 per cent was because of additional usage, -47 per cent because of a reduction in dispensing fees-actually dispensing fee costs went down-and 133 per cent in average ingredient costs, in other words, the cost of the drugs to the pharmacy.
They talk about all of the wonderful research and development that has gone up to 10 per cent of sales. Compared to the rest of the world, the United States has a minimum mandatory 16 per cent, Germany has 16 per cent, the United Kingdom has 20.9 per cent and Sweden has 21.8 per cent. This is going back a couple of years. They have not even begun to catch up to the rate of research and development that takes place in other countries.
In addition, more than 50 per cent of our research is only clinical trials. It is not basic research.
Third, the Prices Review Board. The American drug companies made it very clear when the president of the pharmaceutical association, Gerald Mossinghoff, stated that the the members of the Pharmaceutical Manufacturers' Association in Washington would like to eliminate the Canadian government's price controls.
They want an extension of patent protection. Then they will eliminate the prices control. Lo and behold, what do you find? James MacPherson, the dean of Osgoode Hall Law School, said that there is no doubt that this legislation could be struck down on a constitutional challenge as it relates to price control.
What the Tories are saying is: ""We will pretend we are hiding behind this prices control knowing full well it is going to get struck down by the American Pharmaceutical Manufacturers Association which will challenge it in our courts"".
My three questions are: How can you justify it knowing that the legislation as it pertains to price control is probably unconstitutional? How do you justify a rate of research and development which is more than 50 per cent clinical trial, has nothing to do with basic research and is not anywhere near any industrial country? How do

Government Orders
you justify to Canadian taxpayers and Canadian patients a dramatic increase in drug costs over the last few years?

",New Democratic Party,,James Capsey (Jim) Karpoff,http://www.parl.gc.ca/parlinfo/Files/Parliamentarian.aspx?Item=cda5dfb3-0c2c-477d-b67d-b9f1141c5e0c&Language=E&Section=ALL
3920947,ca.proc.d.1992-11-17.3.3.59,1992-11-17,94b62454-efbb-4091-91dc-ef9e0d03042d,ca.m.2694,Mr. Della Noce:,Parliamentary Secretary to the Minister of Multiculturalism and Citizenship; Parliamentary Secretary to the Secretary of State of Canada,GOVERNMENT ORDERS,MEASURE TO AMEND,,"Mr. Speaker, I do not know if it was a question or a speech, but let me answer my hon. colleague. I wish all the numbers he gave were dollar bills in my bank account. I would be a millionaire. If I start to go into these numbers, I will need a preparation of at least five minutes to make sure that the numbers he gave were the correct numbers.
What I can say to my hon. colleague is when we control the prices, we control the patent drugs. We do not control the whole world with this bill. When we speak about the increase and rising, we are speaking of zero this year and 2 per cent by the year 2000.

",Progressive Conservative,,Vincent Della Noce,http://www.parl.gc.ca/parlinfo/Files/Parliamentarian.aspx?Item=94b62454-efbb-4091-91dc-ef9e0d03042d&Language=E&Section=ALL
3920948,ca.proc.d.1992-11-17.3.3.60,1992-11-17,cda5dfb3-0c2c-477d-b67d-b9f1141c5e0c,ca.m.6274,Mr. Karpoff:,,GOVERNMENT ORDERS,MEASURE TO AMEND,,"Baloney. Mulroney or baloney, it's about the same.

",New Democratic Party,,James Capsey (Jim) Karpoff,http://www.parl.gc.ca/parlinfo/Files/Parliamentarian.aspx?Item=cda5dfb3-0c2c-477d-b67d-b9f1141c5e0c&Language=E&Section=ALL
3920949,ca.proc.d.1992-11-17.3.3.61,1992-11-17,94b62454-efbb-4091-91dc-ef9e0d03042d,ca.m.2694,Mr. Della Noce:,Parliamentary Secretary to the Minister of Multiculturalism and Citizenship; Parliamentary Secretary to the Secretary of State of Canada,GOVERNMENT ORDERS,MEASURE TO AMEND,,"Well, if it is baloney I usually do not eat baloney. My hon. colleague says it is baloney. His numbers must be mortadella .When my hon. colleague asks questions, I wonder if he is not making a political speech to mix up people.
To answer regarding such big numbers is a little bit out of my context. People listening to us wonder if all these numbers can be retained in the memoiy. If they are really interested in these numbers, what is important is to protect the consumer. We have somebody there. We have a board and we have a control which did a good job this year. If they did a good job, we should not say it is because of the recession or inflation. If they did a good job, let us give them credit. If they did not do a good job, we will there to remind them.

",Progressive Conservative,,Vincent Della Noce,http://www.parl.gc.ca/parlinfo/Files/Parliamentarian.aspx?Item=94b62454-efbb-4091-91dc-ef9e0d03042d&Language=E&Section=ALL
3920950,ca.proc.d.1992-11-17.3.3.62,1992-11-17,cda5dfb3-0c2c-477d-b67d-b9f1141c5e0c,ca.m.6274,Mr. Karpoff:,,GOVERNMENT ORDERS,MEASURE TO AMEND,,"Well, get rid of them.

",New Democratic Party,,James Capsey (Jim) Karpoff,http://www.parl.gc.ca/parlinfo/Files/Parliamentarian.aspx?Item=cda5dfb3-0c2c-477d-b67d-b9f1141c5e0c&Language=E&Section=ALL
