basepk,hid,speechdate,pid,opid,speakeroldname,speakerposition,maintopic,subtopic,subsubtopic,speechtext,speakerparty,speakerriding,speakername,speakerurl
3921090,ca.proc.d.1992-11-17.5.1.1.7,1992-11-17,27d54edd-ee41-4a52-8c15-ec7dbb61ebf9,ca.m.7075,Mr. J. W. Bud Bird (Fredericton-York-Sunbury):,,GOVERNMENT ORDERS,PATENT ACT,MEASURE TO AMEND,"Mr. Speaker, I listened with great interest to the hon. member opposite and other hon. members speaking with such great disrespect about this bill.
I am quite pleased and proud, frankly, to rise in support of this bill and to say, among other things, this is not just a bill about patent protection and about pharmaceuticals. It is a bill about economic development and I will get to that in a moment.
We have been focusing in detail on the provisions of Bill C-91 and it has been a useful and a necessary exercise. This is complex legislation, as it must be, to achieve the balance we need. It is also very important as we do so that we do not lose sight of some of the basic aims and principles which underlie this legislation. I would like to touch on these now.
November 17, 1992

First of all, we want to strengthen patent protection for brand name pharmaceutical products. We want to eliminate compulsory licensing and we will be the last major industrial country to do so. We want to provide controls in pricing of both new and existing patented drug products. We want to introduce the principle of innovation and discovery and to demonstrate that it will bring value both in terms of costs and cures and in terms of medical treatment more assuredly than any protection process.
I would like to quote Dr. David Stewart. I am sure this is probably repetitious, but it bears repetition. He says:
Brand name companies develop new medications at tremendous expense. It now takes between $100-$250 million to develop a new drug and bring it to market. For every drug that is successfully marketed, there are large numbers of others that prove unworthy of further interest part way through their development.
The new drugs that do make it to market save lives and alleviate suffering. In the process of doing this, they can save society and individuals very large amounts of money-they are highly cost effective.
They bring into the realm of knowledge products that otherwise would not ever have been available. This debate is about innovation and its relationship to Canada's future. It is also about the special importance of new knowledge and new understanding in a particular field, modem health and medicine. Where pharmaceutical research is concerned, humanity simply does not have the option of staying put.
Scientific exploration has allowed us to defeat many diseases and to alleviate much suffering which has burdened past generations, but many deadly scourges such as cancer, AIDS and so on remain unconquered and present tremendous challenges to us to conquer.
My family in recent months has had experience with heart disease. It has been very surprising and gratifying to me to realize that just in recent years there have been advances in drug technology that, if the patient can get to the hospital in time, frankly save lives which otherwise would not have been possible. As Dr. Richard Gallop,
Government Orders
executive director of the Ontario Heart and Stroke Foundation said:
While we are concerned about the question of the cost of drugs, we nevertheless recognize that considerable savings have been achieved in the cardiac area, in recent years, because of the break-through in drug technology. This has resulted in a substantial lowering of death and disability from heart disease and stroke.
I can speak with firsthand family experience that that is so. Therefore, it is absolutely necessary to encourage this work of discovery.
The fact is that strong, innovative pharmaceutical industries do not grow full-fledged out of the ground. They rise from the ground up, one laboratory after another, until clusters form and eventually a strong sector emerges.
Between 1988 and 1991 basic pharmaceutical research, and let me underline basic research, has more than tripled; from about $30.2 million to $94.2 million. Today the innovative pharmaceutical sector leads all others in the funding of medical research.
There is another basic principle involved here and it is that protection for the innovator and the developer is consistent with consumer interest in knowledge-based industries. What does the record show? Five years ago the opposition predicted that increased protection of patents through Bill C-22 would produce an explosive increase in the price of drugs. It did not happen. Over those five years, according to the Patented Medicine Prices Review Board, the average rate of increase in the price of patented drugs was less than 3 per cent a year. That was lower than the rate of inflation for the basket of goods and services covered by the Consumer Price Index and lower than the rate of inflation.
This debate is also about staying in step with the times. It is about adapting our policies and our laws to match changing needs and priorities. This applies with particular force to the matter of compulsory licensing. Members on the other side have sought to move this argument back 30 years and to base their arguments on the priorities and challenges of that period.
In the late 1960s there was legitimate concern about the lack of competition in Canada's pharmaceutical industry. Compulsory licensing was introduced at that time to make it possible for a generic industry to get started in Canada. It was like planting and nursing a new tree. Compulsory licensing was needed to support the industry in its early growth. That was close to a quarter of a century ago and today we have an established generic industry in Canada and it is a strong industry.
Our innovative patented medicine industry is also well established and growing. It employs 18,000 people now

Government Orders
while the generic industry employs 2,600 people. What is significant is that in the five years since 1987 when Bill C-22 was introduced, the patented medicine industry has grown by 2,400 jobs or as much as the total generic industry as it exists today.
Study after study has come to the same conclusion: Our economic future depends on innovation and the encouragement of innovation. As the steering group on prosperity says: ""We need to invent our future"". To do that we have to think long term. We have to put in place the foundations for sustained growth and prosperity.
A debate about patented drugs today really is about the economy. Bill C-91 is a positive and powerful thrust pointing toward economic growth and it is one that we should all be supporting. This legislation will help us to build a strong, new sector of innovation into the Canadian economy. It will contribute to our competitiveness, it will contribute to jobs, to opportunity and to the improvement of our standards of living.
Throughout the world, pharmaceutical companies are investing huge amounts in research and development. In today's global market that money can go anywhere. By making the climate friendlier to innovation, we can ensure that much of it comes right here to Canada.
We need to move forward decisively on the economy and we need to move forward decisively on Bill C-91. For those reasons and for its great contribution to our medical research and our scientific knowledge, I urge the early passage of this bill with the support of all members of this House.

",Progressive Conservative,,John Williston (Bud) Bird,http://www.parl.gc.ca/parlinfo/Files/Parliamentarian.aspx?Item=27d54edd-ee41-4a52-8c15-ec7dbb61ebf9&Language=E&Section=ALL
3921091,ca.proc.d.1992-11-17.5.1.1.8,1992-11-17,a25e0e6b-f3fa-46c7-a795-ad60037fe56e,ca.m.176,Mr. Lawrence MacAulay (Cardigan):,,GOVERNMENT ORDERS,PATENT ACT,MEASURE TO AMEND,"Mr. Speaker, it is a pleasure for me to participate in this debate today. However, it is not pleasing to look at Bill C-91, combined with Bill C-22, which is leading us down the path of higher drug prices. It is very unfortunate for the Canadian consumer and the Canadian senior citizen on a fixed income is going to lose more dollars out of their pockets.
The issue of patent protection for prescription drugs is quite old, dating back to the 1960s. In 1967 the member for Vancouver Quadra, then the Liberal minister of consumer affairs, brought in a system of compulsory licensing to protect the Canadian consumer. That system remained in effect for 20 years. During that period people like senior citizens benefited from the development of the generic drug industry that lowered the cost of many medications.
The system was fair. It helped consumers through lower prices, it allowed generic manufacturers to grow and employ over 2,500 Canadians and it still allowed the multinational drug companies to thrive in terms of market share and profitability.
Like the old saying goes, all good things come to an end. The balance system ended in 1987 when the Conservatives forced through Bill C-22. Do not worry, the government said, it will not hurt a bit; we will create lots of new research and development jobs for our young Canadian scientists. Sadly, this is just another Tory promise to be broken.
Let us look at the cost of prescription drugs. The Conservatives promised that the price increases for drugs would not exceed the rate of inflation. The government set up the Patented Medicine Prices Review Board to review and enforce the regulations and price increases. However, the government's performance in this area was very poor.
The review board is just a toothless tiger, unable to force the multinationals to follow the rules. In its fourth report to Parliament the chairman of the review board said, and I quote: ""The high number of prices out of compliance (that is breaking the rules) suggests either that some patentees follow a strategy of setting high introductory drug prices so as to benefit from the temporary gain, or that they resist the board's guidelines"".
The government's hand-picked chairman is admitting that the major drug companies are either deliberately gouging Canadian consumers or they are deliberately ignoring the rules completely.
In August of this year the NDP government of Bob Rae made drastic cuts to the Ontario Drug Benefit Plan. The cost of running the program had increased an average of 18 per cent over the last 10 years, so the NDP dropped the knife. I wonder if Bob Rae has figured out how a senior scraping by on a fixed income is going to come up with the extra dollars to pay for drugs that are not covered by the drug plan.
They could buy extended health insurance to cover the cost of prescription drugs. Green Shield, one of the largest operators of drug plans, prepared a report for its clients explaining why its premiums have been increasing so much. In its report Green Shield said: ""The average cost of a prescription claim has risen at a rate in excess of
November 17, 1992

11 per cent compounded annually for the period 1987 through 1991, well above the CPI rate"".
That is not all the company report had to say. According to Green Shield the average cost per claim for new drugs introduced between 1988 and 1991 was more than double the average for drugs introduced before 1988. The key question through all of this is who is going to pay. Why are drug prices going through the roof and what can seniors and the general public expect in the future? For this question the president and CEO of Green Shield had to say: ""It is reasonable to suggest that any further extensions to patent life will result in continued high level of increase in drug costs"".
During the debate on Bill C-22 seniors groups and consumer advocates told the government that prices would increase if patent protection was extended. Now we have proof that the government did not know what it was getting into. Instead of admitting that Bill C-22 was one more of its mistakes, the government is pushing ahead with extending patent protection even further. The government is turning its back on the seniors and is walking down the garden path to higher drug prices.
The promise the government made in 1987 has not been fulfilled. While spending for research and development has increased, much of it has gone toward clinical testing of drugs and not for the leading-edge research for new beneficial medications. Despite promises of new jobs, the multinational drug companies have actually cut back on staff.
I think it is quite unfortunate when the chairperson of the Patented Medicine Prices Review Board in its report to Parliament indicated that drug prices have increased not below the rate of inflation, but well above the rate of inflation. For example, Green Shield increased by 11.4 per cent, Ontario Drug Benefit Plan by 13.2 per cent and Manitoba health insurance by 12.3 per cent. He also indicated that drug companies are totally ignoring the rules they agreed to five years ago. Unfortunately, there is no way to force them to follow the rules.
The people who are really getting walloped in this situation are the people on fixed income, the seniors of this country. One might say that seniors are only 11 per cent of the population, but they consume about 40 per cent of the drugs. What we are doing is taking and taking
Government Orders
from the senior citizens. They have no recourse. We tell them to buy more medical plans. The medical plans are going up in price. They are caught. Most likely some of the seniors unfortunately, the people who have made this nation what it is for you and me, are possibly caught in the situation that they cannot pay for the drug plan and when it comes time to get the drug, they just have to do without.
I call on the government to show some compassion, look at Bill C-91, think of the Canadian people and withdraw this legislation.

",Liberal,,Lawrence MacAulay,http://www.parl.gc.ca/parlinfo/Files/Parliamentarian.aspx?Item=a25e0e6b-f3fa-46c7-a795-ad60037fe56e&Language=E&Section=ALL
3921092,ca.proc.d.1992-11-17.5.1.1.9,1992-11-17,fbce8351-5fec-45a8-9b6b-2514fa79811a,ca.m.8951,Hon. Harvie Andre (Minister of State and Leader of the Government in the House of Commons):,Minister of State (Without Portfolio); Leader of the Government in the House of Commons; Progressive Conservative Party House Leader,GOVERNMENT ORDERS,PATENT ACT,MEASURE TO AMEND,"Mr. Speaker, I look forward to participating in this debate to correct some of the misinformation the previous speaker has just put on the record.
I will just mention a couple of figures that come to mind for example. He talked about an 11 per cent increase according to the Green Shield plan in drug prices. What he failed to mention was that includes all drugs, patented and non-patented. What he failed to mention is that patented drugs, which is what Bill C-91 deals with, represent 20 to 25 per cent of the total drugs. He fails to mention that prices for patented drugs over the last four years have increased less than the rate of inflation, less than the CPI, that the increases he is talking about are for the non-patented drugs which are not affected in any way, shape or form.
The concern about price rises in non-patented drugs lies totally within provincial jurisdiction. If the hon. member truly wanted to contribute to the understanding of Canadians, he would not confuse the two in the way he has done.
He talked about the increase in cost to the drug plan of the province of Ontario, for example. He fails to mention that is the total drugs prescribed within that plan including non-patented as well as patented.
He failed to take into account the number of people and the number of prescriptions. He failed to mention, as he could have, that the average senior citizen gets some 26 prescriptions per year in this country. There are many, many duplicates. Go into the medicine chests of a lot of senior citizens and you will see a lot of prescrip-

Government Orders
tions. Because of their age they do not feel well, they see doctor, and they get prescriptions.
The mere expedient of having a central registry so that physicians or pharmacists could check to see whether in fact this is duplication would save millions. In fact, reducing by one prescription per senior citizen would save more money than even the worst assumption in terms of what Bill C-91 would take into account. It is that kind of misinformation that makes it very difficult for the public to understand.
Figure three in the March 19, 1992 report of the Patented Medicine Prices Review Board shows very clearly in pictorial form since the introduction of Bill C-22 the prices of patented medicines-not all medicines, just patented because that is the only thing affected by this bill-rose less than the cost of inflation. In constant terms in fact the prices went down. They went down. That cannot be denied. It is incredible to me that that simple fact shown visually is ignored or distorted by opponents to this bill.
Look at the principle involved. The principle is very simple. It is a long-established principle. Creators have a right to exploit their creations. In terms of inventions the convention around the world is 17 to 20 years of exclusive right to market, to sell, to produce that which you invent and get the rewards for it. It is an absolutely essential ingredient in terms of promoting research, invention, creation.
Let me give an analogy. One of the significant costs of education is in textbooks, books for libraries, books for students. Those books are all copyrighted. The authors and the publishers have a copyright. You cannot duplicate the books. It is against the law. Why do we not save the education system money by having compulsory licensing of textbooks so that we could have generic copies? If there is a good book written, rather than paying the full price, we would allow somebody to produce a generic copy for the benefit of students and educational institutions. It would save hundreds of millions of dollars.
Who would support that in this House? Nobody. That is an affront to the author. It is an affront to the creative
skills of the author. We recognize that the author has the right to-

",Progressive Conservative,,Harvie Andre,http://www.parl.gc.ca/parlinfo/Files/Parliamentarian.aspx?Item=fbce8351-5fec-45a8-9b6b-2514fa79811a&Language=E&Section=ALL
3921093,ca.proc.d.1992-11-17.5.1.1.10,1992-11-17,a10911a7-55dd-4bb3-8f27-a1f6534327ed,ca.m.2500,Mr. Skelly (Comox-Alberni):,,GOVERNMENT ORDERS,PATENT ACT,MEASURE TO AMEND,"Bring in the bill.

",New Democratic Party,,Robert Evans Skelly,http://www.parl.gc.ca/parlinfo/Files/Parliamentarian.aspx?Item=a10911a7-55dd-4bb3-8f27-a1f6534327ed&Language=E&Section=ALL
3921094,ca.proc.d.1992-11-17.5.1.1.11,1992-11-17,fbce8351-5fec-45a8-9b6b-2514fa79811a,ca.m.8951,Mr. Andre:,Minister of State (Without Portfolio); Leader of the Government in the House of Commons; Progressive Conservative Party House Leader,GOVERNMENT ORDERS,PATENT ACT,MEASURE TO AMEND,"The hon. member from the New Democratic Party says bring in the bill. He would have generic copies of textbooks. That is an interesting policy. Maybe the NDP would like to propose that we should have a debate on that.
The reality is that in all modem societies we recognize something called intellectual property. If you create the product of your mind, just as the product of your hands is yours, it is immoral for governments to come along and say that the product of your mind belongs to the common good because what that does is it turns off minds.
In terms of the pharmaceutical industry what we had prior to Bill C-22 was the situation where it simply did not make sense to do research in Canada because you spent $150 million to $200 million to develop a new drug. You spend that money, you create a new drug. If it has any market at all, it is because it helps people with their illnesses. And then you say: ""But you, the creator, do not have the exclusive right to enjoy the fruits of invention; somebody else will enjoy them"".
Then what happens is that there is not much research in Canada. Indeed, prior to 1987 pharmaceutical companies operating in Canada spent about 6 per cent of their total sales on research versus a world average of 10, 11 or 12 per cent, in that order. We had about half the research.

",Progressive Conservative,,Harvie Andre,http://www.parl.gc.ca/parlinfo/Files/Parliamentarian.aspx?Item=fbce8351-5fec-45a8-9b6b-2514fa79811a&Language=E&Section=ALL
3921095,ca.proc.d.1992-11-17.5.1.1.12,1992-11-17,206ef0b1-261c-4ea0-98c2-e8fae2209e2e,ca.m.203,Mr. Milliken:,Liberal Party Deputy House Leader,GOVERNMENT ORDERS,PATENT ACT,MEASURE TO AMEND,"Where is it? Tell us where.

",Liberal,,Peter Andrew Stewart Milliken,http://www.parl.gc.ca/parlinfo/Files/Parliamentarian.aspx?Item=206ef0b1-261c-4ea0-98c2-e8fae2209e2e&Language=E&Section=ALL
3921096,ca.proc.d.1992-11-17.5.1.1.13,1992-11-17,fbce8351-5fec-45a8-9b6b-2514fa79811a,ca.m.8951,Mr. Andre:,Minister of State (Without Portfolio); Leader of the Government in the House of Commons; Progressive Conservative Party House Leader,GOVERNMENT ORDERS,PATENT ACT,MEASURE TO AMEND,"The hon. member from Kingston should listen rather than heckle from his seat.
What has happened now is that the pharmaceutical industry said to us in 1987 that if we passed Bill C-22 it would raise the level of R and D in Canada to international levels by 1996, 10 per cent by 1996. Well, what happened in 1991? It was 9.7 per cent. This year it has already exceeded what had been committed to by 1996. Why? Because once you provide some protection for the fruits of research you get research. Lo and behold, Canadian universities and medical establishments, Canadian laboratories have shown that they are very good. We
November 17, 1992

have some excellent people. Given the opportunity to pursue research and the opportunity to enjoy the fruits of that research, Canadians have responded.
The November 10 issue of The Globe and Mail on the report on health and pharmaceuticals says: ""Robust industry defies sick economy"". There are several pages about how robust the pharmaceutical industry is in Canada as a result of Bill C-22. What do we have? We have investments in research and development near international levels finally. We have a robust industry employing people and growing.
I will never forget the young man who stopped me on a street in Montreal and said: ""Thank you, Mr. Andre. I have been working in California since graduating with my Ph.D. in biochemistry. As a result of Bill C-221 have been able to come back to Canada and work in my home country doing research and development"". The member from the New Democratic Party over there chuckles about this. He thinks it is pretty funny that we provide an environment for Canadian scientists to work in Canada.
What was said about Bill C-22? Let me read you some quotes on Bill C-22, one by the now NDP leader, but not then: ""Estimates suggest that it will double or even triple the cost of prescription drugs in the country"". What happened? They actually went down in real terms. I think it was the member for Essex-Windsor: ""The bill will bring Canada dramatically higher drug prices and very little research"". Wrong on both counts. More research, lower prices. What did the then leader of the Liberal Party say? ""Consumers could wind up paying billions more under C-22."" Wrong, dead wrong.

",Progressive Conservative,,Harvie Andre,http://www.parl.gc.ca/parlinfo/Files/Parliamentarian.aspx?Item=fbce8351-5fec-45a8-9b6b-2514fa79811a&Language=E&Section=ALL
3921097,ca.proc.d.1992-11-17.5.1.1.14,1992-11-17,206ef0b1-261c-4ea0-98c2-e8fae2209e2e,ca.m.203,Mr. Milliken:,Liberal Party Deputy House Leader,GOVERNMENT ORDERS,PATENT ACT,MEASURE TO AMEND,"Where are the facts on this? Who says so?

",Liberal,,Peter Andrew Stewart Milliken,http://www.parl.gc.ca/parlinfo/Files/Parliamentarian.aspx?Item=206ef0b1-261c-4ea0-98c2-e8fae2209e2e&Language=E&Section=ALL
3921098,ca.proc.d.1992-11-17.5.1.1.15,1992-11-17,fbce8351-5fec-45a8-9b6b-2514fa79811a,ca.m.8951,Mr. Andre:,Minister of State (Without Portfolio); Leader of the Government in the House of Commons; Progressive Conservative Party House Leader,GOVERNMENT ORDERS,PATENT ACT,MEASURE TO AMEND,"The facts say so. The hon. member from Kingston can read. He should read the report and look at the chart.

",Progressive Conservative,,Harvie Andre,http://www.parl.gc.ca/parlinfo/Files/Parliamentarian.aspx?Item=fbce8351-5fec-45a8-9b6b-2514fa79811a&Language=E&Section=ALL
3921099,ca.proc.d.1992-11-17.5.1.1.16,1992-11-17,206ef0b1-261c-4ea0-98c2-e8fae2209e2e,ca.m.203,Mr. Milliken:,Liberal Party Deputy House Leader,GOVERNMENT ORDERS,PATENT ACT,MEASURE TO AMEND,"It went up 4 per cent a year.

",Liberal,,Peter Andrew Stewart Milliken,http://www.parl.gc.ca/parlinfo/Files/Parliamentarian.aspx?Item=206ef0b1-261c-4ea0-98c2-e8fae2209e2e&Language=E&Section=ALL
3921100,ca.proc.d.1992-11-17.5.1.1.17,1992-11-17,fbce8351-5fec-45a8-9b6b-2514fa79811a,ca.m.8951,Mr. Andre:,Minister of State (Without Portfolio); Leader of the Government in the House of Commons; Progressive Conservative Party House Leader,GOVERNMENT ORDERS,PATENT ACT,MEASURE TO AMEND,"And inflation was more than that. The hon. member should know.
There was Ed Broadbent who said that already prices for drugs were going up four times the rate of inflation. Then there was that great journalist, Don McGillivray, who said: ""The policy will not cause prices to rise, said
Government Orders
Harvie Andre. He must have been talking for the benefit of the people who believe in the tooth fairy"".

",Progressive Conservative,,Harvie Andre,http://www.parl.gc.ca/parlinfo/Files/Parliamentarian.aspx?Item=fbce8351-5fec-45a8-9b6b-2514fa79811a&Language=E&Section=ALL
