basepk,hid,speechdate,pid,opid,speakeroldname,speakerposition,maintopic,subtopic,subsubtopic,speechtext,speakerparty,speakerriding,speakername,speakerurl
3920997,ca.proc.d.1992-11-17.4.1.1,1992-11-17,2aa8c3e9-f46e-4c78-b9ff-04bec0ed5050,ca.m.5241,Hon. Jean Chretien (Leader of the Opposition):,Leader of the Official Opposition,ORAL QUESTION PERIOD,THE ECONOMY,,"Mr. Speaker, the member for Fredericton-York-Sunbury just made a remark that this Parliament should set an example and be a little bit less partisan. I would like in asking my question of the Prime Minister to note that yesterday the Official Opposition and the New Democratic Party asked this government for some answers on economic policies and there was no answer from the Prime Minister or the Minister of Finance.
November 17, 1992

The next thing we saw, and showing disrespect for this Parliament, the Prime Minister went out and made the announcement of his economic plan to a fund raising dinner at $500 a plate, neglecting to make that statement here in the House of Commons.
The Prime Minister announced a plan that was no plan at all because it will take its course. I would like to say to the Prime Minister that Campaign 2000, in a report on child poverty, said that one out of six children in Canada lives in poverty; that internationally we look terrible. It is shameful. The U.K., France, Holland, Germany and many others are ahead of us. We are barely above the United States. Everyone in this country knows that the best way to give pride and dignity to these children is to ensure that their parents have work in Canada.
I want to ask the Prime Minister if he will have a program soon to make sure that the fathers and mothers of these children will have some work so that they can give bread and dignity to their children.

",Liberal,,Joseph Jacques Jean Chrtien,http://www.parl.gc.ca/parlinfo/Files/Parliamentarian.aspx?Item=2aa8c3e9-f46e-4c78-b9ff-04bec0ed5050&Language=E&Section=ALL
3920998,ca.proc.d.1992-11-17.4.1.2,1992-11-17,5627e87a-8a70-4c57-92d2-88ee2f2152d8,ca.m.522,Hon. Benoit Bouchard (Minister of National Health and Welfare):,Minister of National Health and Welfare,ORAL QUESTION PERIOD,THE ECONOMY,,"Mr. Speaker, I am surprised the Leader of the Opposition failed to mention important measures the government has taken, especially this year, aimed at Canada's children.
Since the beginning of 1982, the government has invested around $3 billion, which includes the child tax benefit and the $500 million earmarked for children at risk, plus a number of projects concerning drugs and the environment, probably the largest amount of money invested by a Canadian government in the kind of situation we have today.
I believe that child poverty is something Canadians should never condone and that it will require a commensurate effort on the part of all governments and all Canadians.
I believe that considering the economic situation, to which he himself referred, the Leader of the Opposition should remember that what the government has done for Canada's children was done responsibly as part of our responsibility for managing the affairs of this country.
Oral Questions

",Progressive Conservative,,Benot Bouchard,http://www.parl.gc.ca/parlinfo/Files/Parliamentarian.aspx?Item=5627e87a-8a70-4c57-92d2-88ee2f2152d8&Language=E&Section=ALL
3920999,ca.proc.d.1992-11-17.4.1.3,1992-11-17,2aa8c3e9-f46e-4c78-b9ff-04bec0ed5050,ca.m.5241,Hon. Jean Chretien (Leader of the Opposition):,Leader of the Official Opposition,ORAL QUESTION PERIOD,THE ECONOMY,,"Mr. Speaker, we had a debate in this House and the problem was examined by a committee, but none of the experts supported the government's point of view. The government has introduced a program that will give cheques to children during the first six months of the 1993 election year, but subsequently they will lose those benefits. TWo years from now, they will be even worse off than they are today.
Instead of introducing these election gimmicks, could the minister perhaps talk to his colleagues and tell them that the best way to give these children some dignity and support is to ensure that their parents have jobs?
When will the government take the advice of the opposition, now supported by the New Democratic Party and even by the Bloc Quebecois, and introduce a program to finance infrastructures, with one third paid by the provinces, one third by the municipalities and one third by the federal government? This would put hundreds of people to work immediately.
Hon. Benoit Bouchard (Minister of National Health
and Welfare):Mr. Speaker, the Leader of the Opposition said that giving an additional $500 to every low-income family in Canada, especially those earning $10,000 or more, was a political ploy and an election gimmick. I think that calling any assistance we give to children an election gimmick reflects a lack of class and an outlook that is absolutely deplorable.

",Liberal,,Joseph Jacques Jean Chrtien,http://www.parl.gc.ca/parlinfo/Files/Parliamentarian.aspx?Item=2aa8c3e9-f46e-4c78-b9ff-04bec0ed5050&Language=E&Section=ALL
3921000,ca.proc.d.1992-11-17.4.1.4,1992-11-17,2aa8c3e9-f46e-4c78-b9ff-04bec0ed5050,ca.m.5241,Hon. Jean Chretien (Leader of the Opposition):,Leader of the Official Opposition,ORAL QUESTION PERIOD,THE ECONOMY,,"Mr. Speaker, when the minister appeared before the committee, he met the experts and everyone agreed that this was not a solution, or should I say it was a purely political solution to try and win votes-which they will not get in any event-during the first six months of 1993.
Is the minister prepared to go back and set up a long term program instead of this vote-winning gimmick?
Hon. Benoit Bouchard (Minister of National Health
and Welfare): Mr. Speaker, I will be very brief. The Leader of the Opposition may be concerned about the election, but I am concerned about the future of our children.

Oral Questions

",Liberal,,Joseph Jacques Jean Chrtien,http://www.parl.gc.ca/parlinfo/Files/Parliamentarian.aspx?Item=2aa8c3e9-f46e-4c78-b9ff-04bec0ed5050&Language=E&Section=ALL
3921001,ca.proc.d.1992-11-17.4.1.5,1992-11-17,9175bed8-a959-4325-98c1-a2a41dd4a2e4,ca.m.5704,Mr. David Walker (Winnipeg North Centre):,,ORAL QUESTION PERIOD,THE ECONOMY,,"Mr. Speaker, my question is for the Prime Minister.
The sad reality in consequence of this government's economic policy is that the only growth has been in the number of poor in this country.
Today Campaign 2000 announced that this year it is expected that 900,000 children in this country will be on social assistance. This is a 200,000 increase in numbers since the 1988 election.
I would like to ask the Prime Minister: How can this government defend its economic policy when so many families have been left in poverty?

",Liberal,,David Walker,http://www.parl.gc.ca/parlinfo/Files/Parliamentarian.aspx?Item=9175bed8-a959-4325-98c1-a2a41dd4a2e4&Language=E&Section=ALL
3921002,ca.proc.d.1992-11-17.4.1.6,1992-11-17,5627e87a-8a70-4c57-92d2-88ee2f2152d8,ca.m.522,Hon. Benoit Bouchard (Minister of National Health and Welfare):,Minister of National Health and Welfare,ORAL QUESTION PERIOD,THE ECONOMY,,"Mr. Speaker, I can just repeat in English what I said in French. In the last year, in light of the economic reality we face, the Government of Canada put out $3 billion for the children of Canada. Of course if we had the capacity to put up more we would, but we have to consider, as he said, the economic reality. A government such as ours which is able under these circumstances to put up that much money for poor children and children at risk should be commended by the member.

",Progressive Conservative,,Benot Bouchard,http://www.parl.gc.ca/parlinfo/Files/Parliamentarian.aspx?Item=5627e87a-8a70-4c57-92d2-88ee2f2152d8&Language=E&Section=ALL
3921003,ca.proc.d.1992-11-17.4.1.7,1992-11-17,9175bed8-a959-4325-98c1-a2a41dd4a2e4,ca.m.5704,Mr. David Walker (Winnipeg North Centre):,,ORAL QUESTION PERIOD,THE ECONOMY,,"Mr. Speaker, my supplementary is to the Prime Minister.
The Prime Minister knows full well that the problem of poverty is being created by his government's policies, that in fact the distribution of income between the rich and the poor is much worse since this government took power. There is now an unemployment rate of 30 per cent among families in poverty and 60 per cent in single parent families. When is this government going to present to the Canadian people an economic policy which will deal with this issue?

",Liberal,,David Walker,http://www.parl.gc.ca/parlinfo/Files/Parliamentarian.aspx?Item=9175bed8-a959-4325-98c1-a2a41dd4a2e4&Language=E&Section=ALL
3921004,ca.proc.d.1992-11-17.4.1.8,1992-11-17,5627e87a-8a70-4c57-92d2-88ee2f2152d8,ca.m.522,Hon. Benoit Bouchard (Minister of National Health and Welfare):,Minister of National Health and Welfare,ORAL QUESTION PERIOD,THE ECONOMY,,"Mr. Speaker, as the Prime Minister said yesterday, in due course the government will make those announcements.

",Progressive Conservative,,Benot Bouchard,http://www.parl.gc.ca/parlinfo/Files/Parliamentarian.aspx?Item=5627e87a-8a70-4c57-92d2-88ee2f2152d8&Language=E&Section=ALL
3921005,ca.proc.d.1992-11-17.4.1.9,1992-11-17,intervention,,,,ORAL QUESTION PERIOD,THE ECONOMY,,"Oh, oh.

",,,Some hon. members:,
3921006,ca.proc.d.1992-11-17.4.1.10,1992-11-17,402c56ca-0019-4905-903e-4ab16649e19b,ca.m.699,Mr. Speaker:,Speaker of the House of Commons,ORAL QUESTION PERIOD,THE ECONOMY,,"The hon. member has put his question and the minister is responding. I am sure the House will give the minister the courtesy to complete his answer.

",Progressive Conservative,,John Allen Fraser,http://www.parl.gc.ca/parlinfo/Files/Parliamentarian.aspx?Item=402c56ca-0019-4905-903e-4ab16649e19b&Language=E&Section=ALL
3921007,ca.proc.d.1992-11-17.4.1.11,1992-11-17,5627e87a-8a70-4c57-92d2-88ee2f2152d8,ca.m.522,Mr. Bouchard (Roberval):,Minister of National Health and Welfare,ORAL QUESTION PERIOD,THE ECONOMY,,"Once again, we are talking about poverty with children, families and so on. I listened to his question and I believe he should listen to the answer. It is fundamental to understand that in light of the realities we face. One of my friends said that we invented it. If we invented poverty for children, it was certainly not here in 1975 and 1981-82. Poverty is a fact of any society and as a government, as would any government in the world, we are tiying to deal with that, but as a responsible government we have to take into account all our realities.
Once again, this government gave $3 billion to poor people and particularly to the children in this country. We also put $15 billion a year into different departments for children. It is not enough. It is never enough for the children of Canada. But it is what we have the capacity to do, and it is what we will continue to do.

",Progressive Conservative,,Benot Bouchard,http://www.parl.gc.ca/parlinfo/Files/Parliamentarian.aspx?Item=5627e87a-8a70-4c57-92d2-88ee2f2152d8&Language=E&Section=ALL
3921008,ca.proc.d.1992-11-17.4.2,1992-11-17,,,,subtopic,ORAL QUESTION PERIOD,POVERTY,,,,,,
3921009,ca.proc.d.1992-11-17.4.2.1,1992-11-17,ddd3eb58-0d95-4736-a906-21e84c0692f6,ca.m.8188,Hon. Audrey McLaughlin (Yukon):,,ORAL QUESTION PERIOD,POVERTY,,"Mr. Speaker, the issue of child poverty in this country and poverty which is increasing is, I am sure, of concern to every Canadian because we are really talking about the future of Canada and the ability and investment in the future of Canada. With one in six children living in poverty, as the child poverty action group has said today, we have to realize that of course poor children have poor parents.
I would like to address my question to the Prime Minister. Last night the Prime Minister spoke of modernizing our social programs. Surely one of the best modem social programs would be to have a goal of full employment and economic policies which would address that goal. The Prime Minister was willing to commit to a goal of full employment in the recent constitutional document. I would like to ask him if he is willing to commit again today and to commit his government to pursue that goal of full employment and the policies that flow from that.

",New Democratic Party,,Audrey Marlene McLaughlin,http://www.parl.gc.ca/parlinfo/Files/Parliamentarian.aspx?Item=ddd3eb58-0d95-4736-a906-21e84c0692f6&Language=E&Section=ALL
3921010,ca.proc.d.1992-11-17.4.2.2,1992-11-17,1335c5d9-2c4e-4ed4-b8d2-c85f1099e8d8,ca.m.8721,Right Hon. Brian Mulroney (Prime Minister):,Prime Minister,ORAL QUESTION PERIOD,POVERTY,,"Mr. Speaker, the policies that we pursue are designed to increase employment and to eliminate to the extent humanly possible the problem of unemployment. It is a problem that affects all industrialized societies and it causes great damage to the social fabric of any nation. It causes great disappointment to families and it diminishes opportunities for our young people.
November 17, 1992

That is why the government, and governments, along with the private sector and the unions and all political parties, must have as their highest priority the intent to create new economic opportunities that translate into durable jobs for Canadians. That is the objective of all of our government policies. This is exactly what we are seeking to do, without affecting inflation negatively, while attracting foreign investment and creating a climate wherein this can be possible.

",Progressive Conservative,,Martin Brian Mulroney,http://www.parl.gc.ca/parlinfo/Files/Parliamentarian.aspx?Item=1335c5d9-2c4e-4ed4-b8d2-c85f1099e8d8&Language=E&Section=ALL
3921011,ca.proc.d.1992-11-17.4.2.3,1992-11-17,271b9d41-1d28-4ac0-8a43-39773260f1a0,ca.m.106,Mr. Fontana:,,ORAL QUESTION PERIOD,POVERTY,,"How come it's had the reverse effect?

",Liberal,,Joseph Frank (Joe) Fontana,http://www.parl.gc.ca/parlinfo/Files/Parliamentarian.aspx?Item=271b9d41-1d28-4ac0-8a43-39773260f1a0&Language=E&Section=ALL
3921012,ca.proc.d.1992-11-17.4.2.4,1992-11-17,1335c5d9-2c4e-4ed4-b8d2-c85f1099e8d8,ca.m.8721,Mr. Mulroney:,Prime Minister,ORAL QUESTION PERIOD,POVERTY,,"My hon. friend has a seatmate making remarks. I do not think I would have any quarrel with the objective articulated by my hon. friend; where we may have some disagreements is how we achieve it.

",Progressive Conservative,,Martin Brian Mulroney,http://www.parl.gc.ca/parlinfo/Files/Parliamentarian.aspx?Item=1335c5d9-2c4e-4ed4-b8d2-c85f1099e8d8&Language=E&Section=ALL
3921013,ca.proc.d.1992-11-17.4.2.5,1992-11-17,ddd3eb58-0d95-4736-a906-21e84c0692f6,ca.m.8188,Hon. Audrey McLaughlin (Yukon):,,ORAL QUESTION PERIOD,POVERTY,,"A supplementary to the Prime Minister, Mr. Speaker.
The reality is that we are not achieving it. In 1988 the Prime Minister promised jobs, jobs, jobs, and unemployment went up; the government promised to reduce the debt and the debt went up; the government has promised to reduce poverty in this country and poverty has simply increased in this country.
I want to say to the Prime Minister that Canada needs action now, not promise. We need economic policies, not the same ones and staying the course with those that have failed, but new economic policies that really address what is needed for the majority of Canadian people who now are looking forward to a future in poverty.
I say to the Prime Minister that the fundamentals are not working. Will the Prime Minister address that, admit that, and change the economic direction of this government to meet the very real needs of those Canadians who are suffering as a result of the policies of this government?

",New Democratic Party,,Audrey Marlene McLaughlin,http://www.parl.gc.ca/parlinfo/Files/Parliamentarian.aspx?Item=ddd3eb58-0d95-4736-a906-21e84c0692f6&Language=E&Section=ALL
3921014,ca.proc.d.1992-11-17.4.2.6,1992-11-17,1335c5d9-2c4e-4ed4-b8d2-c85f1099e8d8,ca.m.8721,Right Hon. Brian Mulroney (Prime Minister):,Prime Minister,ORAL QUESTION PERIOD,POVERTY,,"Mr. Speaker, the World Bank, the IMF and the OECD would disagree fundamentally with my hon. friend. It is their assessment that the fundamentals are working in Canada. They have stated that with an inflation rate of
1.3	per cent, Canada has now the lowest inflation rate in the industrialized world. They have stated as well that we will lead in terms of economic growth in the G-7 next
Oral Questions
year and that employment growth will be highest in Canada among any of the G-7 countries.
While we do have a serious problem, I think the general assessment around the world and nationally is that we have chosen the proper instruments to deal with it.
The alternative to what we are doing is printing money and spending borrowed money. If deficit financing and spending by governments were a solution, we would not have had the results that we had when the Liberals were there or when the Liberals were joined in a loose and affectionate alliance with the NDP. That did not work.
The fundamentals are in place and we hope to move it along even more.

",Progressive Conservative,,Martin Brian Mulroney,http://www.parl.gc.ca/parlinfo/Files/Parliamentarian.aspx?Item=1335c5d9-2c4e-4ed4-b8d2-c85f1099e8d8&Language=E&Section=ALL
3921015,ca.proc.d.1992-11-17.4.2.7,1992-11-17,ddd3eb58-0d95-4736-a906-21e84c0692f6,ca.m.8188,Hon. Audrey McLaughlin (Yukon):,,ORAL QUESTION PERIOD,POVERTY,,"Mr. Speaker, I have a supplementary question. The sad reality is that millions of Canadians are far more familiar with food banks than they are with the World Bank, and that is what we would like to change. We would like to see Canadians not so familiar with food banks.

In 1988, the Prime Minister said that the best social program was employment. He should tell that to his finance minister and the Governor of the Bank of Canada because yesterday interest rates rose again, which will raise the deficit and even more people will lose their jobs. The Conservative government's economic policies are undoubtedly a failure. Can the unemployed and welfare recipients find out what this government's alternative is?

",New Democratic Party,,Audrey Marlene McLaughlin,http://www.parl.gc.ca/parlinfo/Files/Parliamentarian.aspx?Item=ddd3eb58-0d95-4736-a906-21e84c0692f6&Language=E&Section=ALL
3921016,ca.proc.d.1992-11-17.4.2.8,1992-11-17,1335c5d9-2c4e-4ed4-b8d2-c85f1099e8d8,ca.m.8721,Right Hon. Brian Mulroney (Prime Minister):,Prime Minister,ORAL QUESTION PERIOD,POVERTY,,"Mr. Speaker, I can only repeat some of what I said a few moments ago in English; that despite the difficulties that the governments of all industrialized countries-Great Britain, France, Japan, Germany, the United States- are going through, the International Monetary Fund, the World Bank and the OECD have concluded that the foundation is now in place for what we hope will be a lasting recovery in Canada in the coming months and years.
All the signs are both significant and encouraging for Canada. While I recognize the reality of the problem

November 17, 1992
Oral Questions
raised by my friend, we must also admit that there are very encouraging signs for the future of Canada.

",Progressive Conservative,,Martin Brian Mulroney,http://www.parl.gc.ca/parlinfo/Files/Parliamentarian.aspx?Item=1335c5d9-2c4e-4ed4-b8d2-c85f1099e8d8&Language=E&Section=ALL
3921017,ca.proc.d.1992-11-17.4.2.9,1992-11-17,4e3a9e68-a6fb-4e24-9458-cfe2e836c8bc,ca.m.4873,Hon. Herb Gray (Windsor West):,,ORAL QUESTION PERIOD,POVERTY,,"Mr. Speaker, I have a question for the Minister of National Health and Welfare.
The Campaign 2000 report card on child poverty which has already been the subject of questions in this House today says with regard to the minister's new program, which includes an earned income supplement, ""almost half of all poor families will receive no earning supplement in 1993"".
In the light of this fact, how can the minister say that his program is doing anything worth while for poor families? Why will he not do something better to help poor children and their families all across this country?

",Liberal,,Herbert Eser (Herb) Gray,http://www.parl.gc.ca/parlinfo/Files/Parliamentarian.aspx?Item=4e3a9e68-a6fb-4e24-9458-cfe2e836c8bc&Language=E&Section=ALL
3921018,ca.proc.d.1992-11-17.4.2.10,1992-11-17,5627e87a-8a70-4c57-92d2-88ee2f2152d8,ca.m.522,Hon. Benoit Bouchard (Minister of National Health and Welfare):,Minister of National Health and Welfare,ORAL QUESTION PERIOD,POVERTY,,"Mr. Speaker, first of all I have not read the report. After I do, it will be easier for me to answer questions.
What I can say, however, is what we have always said about the tax benefit. We give $500 more per family to low income workers whose earnings average $10,000 to $20,000 as compared to those earning $50,000 to $60,000 a year. At that level there is a decreasing amount of money.
We continue to give more money than we did before. We consider factors such as the inflation rate, the cost of living and so on. These are applied to all families in Canada. For low income workers, the amount of money available today is greater than it was under the family allowance system.

",Progressive Conservative,,Benot Bouchard,http://www.parl.gc.ca/parlinfo/Files/Parliamentarian.aspx?Item=5627e87a-8a70-4c57-92d2-88ee2f2152d8&Language=E&Section=ALL
3921019,ca.proc.d.1992-11-17.4.2.11,1992-11-17,4e3a9e68-a6fb-4e24-9458-cfe2e836c8bc,ca.m.4873,Hon. Herb Gray (Windsor West):,,ORAL QUESTION PERIOD,POVERTY,,"Mr. Speaker, the report also says that ""it is estimated that only .7 per cent of single parent families will move above the poverty line due to this benefit in 1993 and only 1.6 per cent of poor couple families will do so"".
The report says: ""Moreover, these moderate increases will occur only if adequate jobs are available"".
In light of the continuing desperately high levels of unemployment, more than 1.5 million people continue out of work and this government has done nothing to
ensure that there will be adequate jobs, why has the government not come forward yet with a program to ensure that all Canadians have the jobs they require to provide a decent standard of living for themselves and their children?

Hon. Benoit Bouchard (Minister of National Health
and Welfare): Mr. Speaker, I never said that the program for children replaced the jobs that have always been the first objective for the government and all Canadians. It is very obvious that the government's first objective in our economic policies is to create jobs. These programs that we put in place help to mitigate the problems faced by poor children in particular.
Once again, I quite agree that the job creation efforts made by other departments remain the fundamental response to the problem of child poverty in Canada.

",Liberal,,Herbert Eser (Herb) Gray,http://www.parl.gc.ca/parlinfo/Files/Parliamentarian.aspx?Item=4e3a9e68-a6fb-4e24-9458-cfe2e836c8bc&Language=E&Section=ALL
3921020,ca.proc.d.1992-11-17.4.3,1992-11-17,,,,subtopic,ORAL QUESTION PERIOD,MONTREAL,,,,,,
3921021,ca.proc.d.1992-11-17.4.3.1,1992-11-17,2bfda398-5940-4d8f-8cfe-805b91dbdac1,ca.m.6410,Mrs. Sheila Finestone (Mount Royal):,,ORAL QUESTION PERIOD,MONTREAL,,"Mr. Speaker, almost one in five people in the city of Montreal are out of work. In this year alone 17,000 people have lost their jobs in manufacturing, 10,000 in retail and 9,000 more in the financial sector.
On top of these very sad unemployment statistics, today we learn that the city's bond credit rating has dropped from AA to A-plus.
Montreal is the economic heart and lungs of the province of Quebec. Why did the Minister of Finance let things get to this point and what action plan, if any, does he have to revive the economy of Montreal?
Hon. Don Mazankowski (Deputy Prime Minister and
Minister of Finance): Mr. Speaker, I understand the difficulties throughout the country. As I said yesterday, the Canadian economy is going through a difficult period because the world economy is going through a difficult period.
Markets are soft. Commodity prices are weak. There is a huge overhang and a burden of debt at the consumer, corporate and government levels. All of these things are having an effect on the slowness of the world economy.
November 17, 1992

Oral Questions AIRLINE INDUSTRY
It is expected that the G-7 countries will grow by something like 1.7 per cent this year. There has been an increase in the unemployment numbers in the G-7 countries of some five million over the last two years. That has had a direct impact upon the economy of Canada.
I remind the hon. member that notwithstanding all the difficulties, there are 12,240,000 Canadians who are working in this country. We would like to see fewer people unemployed. Some of the initiatives that were outlined by the Prime Minister last night are things that we are developing. We will build upon the budget initiatives we brought down in February which are indeed working and strengthening-

",Liberal,,Sheila Finestone,http://www.parl.gc.ca/parlinfo/Files/Parliamentarian.aspx?Item=2bfda398-5940-4d8f-8cfe-805b91dbdac1&Language=E&Section=ALL
3921022,ca.proc.d.1992-11-17.4.3.2,1992-11-17,402c56ca-0019-4905-903e-4ab16649e19b,ca.m.699,Mr. Speaker:,Speaker of the House of Commons,ORAL QUESTION PERIOD,MONTREAL,,"Perhaps the minister will be able to expand on the supplemental.

",Progressive Conservative,,John Allen Fraser,http://www.parl.gc.ca/parlinfo/Files/Parliamentarian.aspx?Item=402c56ca-0019-4905-903e-4ab16649e19b&Language=E&Section=ALL
